{"commit": "955a0eb", "primary_score": 0.0, "memory_gb": 0.0, "training_min": 0.0, "datasets": [], "status": "crash", "description": "exp-107: retry2 — longer contrastive 180min on 100K data (revert data to exp-104 baseline); exp-105/106 showed 200K data hurts STS/PairClass via dilution; hypothesis: more compute on same data improves without dilution tradeoff; baseline exp-104 primary=59.98", "task_scores": {}, "timestamp": "2026-03-20T14:51:30.474618+00:00", "config": {"base_model": "answerdotai/ModernBERT-base", "projection_dim": 768, "pooling": "cls", "max_seq_length": 256, "normalize_embeddings": true, "simclr_head": false, "stages": {"warmup": {"duration_minutes": 15, "data": "qqp_se_paraphrase", "loss": "infonce", "temperature": 0.1, "learning_rate": 0.0001, "lr_schedule": "linear_warmup_constant", "warmup_ratio": 0.1, "batch_size": 64, "negatives": "in_batch_only", "freeze_encoder_layers": 0, "false_neg_threshold": 0.0}, "contrastive": {"duration_minutes": 180, "data": "all_curated", "loss": "infonce", "temperature": 0.05, "temperature_end": 0.0, "learning_rate": 5e-05, "lr_schedule": "cosine_decay", "warmup_ratio": 0.05, "batch_size": 64, "negatives": "in_batch_plus_explicit", "source_stratification": true, "symmetric": true, "false_neg_threshold": 0.0}, "hard_neg_mining": {"duration_minutes": 5, "top_k": 7, "batch_size": 128, "min_similarity": 0.3}, "fine_tuning": {"duration_minutes": 5, "data": "all_curated_with_hard_negs", "loss": "infonce", "temperature": 0.05, "learning_rate": 1e-05, "lr_schedule": "cosine_decay", "warmup_ratio": 0.0, "batch_size": 64, "hard_neg_weight": 0.0, "false_neg_threshold": 0.0}}, "optimizer": {"type": "adamw", "betas": [0.9, 0.999], "eps": 1e-08, "weight_decay": 0.01, "llrd_decay": 1.0, "ema_decay": 0.0}, "data": {"max_rows_per_dataset": 100000}, "memory": {"max_peak_gb": 55, "gradient_accumulation_steps": 1, "gradient_checkpointing": false}}, "num_params_M": null, "decontam_removed": 0}
{"commit": "472dd7f", "primary_score": 65.1643, "memory_gb": 38.1, "training_min": 200.8, "datasets": ["ag_news", "sentence-transformers/natural-questions", "ms_marco", "sentence-transformers/reddit-title-body", "yahoo_answers_topics", "qiaojin/PubMedQA", "glue", "hotpot_qa", "fancyzhx/dbpedia_14", "sentence-transformers/s2orc", "stanfordnlp/snli", "sentence-transformers/stackexchange-duplicates"], "status": "keep", "description": "exp-107: retry4 — 180min contrastive on 100K data; baseline exp-104 primary=59.98", "task_scores": {"sts_bench": 78.93, "sick_r": 73.96, "twitter_url": 80.18, "sprint_dup": 85.7}, "timestamp": "2026-03-20T18:42:08.239663+00:00", "config": {"base_model": "answerdotai/ModernBERT-base", "projection_dim": 768, "pooling": "cls", "max_seq_length": 256, "normalize_embeddings": true, "simclr_head": false, "stages": {"warmup": {"duration_minutes": 15, "data": "qqp_se_paraphrase", "loss": "infonce", "temperature": 0.1, "learning_rate": 0.0001, "lr_schedule": "linear_warmup_constant", "warmup_ratio": 0.1, "batch_size": 64, "negatives": "in_batch_only", "freeze_encoder_layers": 0, "false_neg_threshold": 0.0}, "contrastive": {"duration_minutes": 180, "data": "all_curated", "loss": "infonce", "temperature": 0.05, "temperature_end": 0.0, "learning_rate": 5e-05, "lr_schedule": "cosine_decay", "warmup_ratio": 0.05, "batch_size": 64, "negatives": "in_batch_plus_explicit", "source_stratification": true, "symmetric": true, "false_neg_threshold": 0.0}, "hard_neg_mining": {"duration_minutes": 5, "top_k": 7, "batch_size": 128, "min_similarity": 0.3}, "fine_tuning": {"duration_minutes": 5, "data": "all_curated_with_hard_negs", "loss": "infonce", "temperature": 0.05, "learning_rate": 1e-05, "lr_schedule": "cosine_decay", "warmup_ratio": 0.0, "batch_size": 64, "hard_neg_weight": 0.0, "false_neg_threshold": 0.0}}, "optimizer": {"type": "adamw", "betas": [0.9, 0.999], "eps": 1e-08, "weight_decay": 0.01, "llrd_decay": 1.0, "ema_decay": 0.0}, "data": {"max_rows_per_dataset": 100000}, "memory": {"max_peak_gb": 55, "gradient_accumulation_steps": 1, "gradient_checkpointing": false}}, "num_params_M": 149.0, "decontam_removed": 0, "wandb_run_id": "s3wc7jnw"}
{"commit": "7949661", "primary_score": 58.3625, "memory_gb": 38.1, "training_min": 216.2, "datasets": ["sentence-transformers/natural-questions", "sentence-transformers/s2orc", "sentence-transformers/reddit-title-body", "sentence-transformers/stackexchange-duplicates", "hotpot_qa", "yahoo_answers_topics", "ms_marco", "stanfordnlp/snli", "ag_news", "glue", "qiaojin/PubMedQA", "fancyzhx/dbpedia_14"], "status": "discard", "description": "exp-108: skip fine-tuning (99% sat = wasted compute) + extend contrastive to 200min; fix nano retrieval score parsing (train split); exp-107 corrected baseline primary=62.29 (21-task); hypothesis: removing saturated fine-tuning prevents overfit while more contrastive improves all categories", "task_scores": {"sts_bench": 74.04, "sick_r": 73.72, "twitter_url": 71.11, "sprint_dup": 70.44}, "timestamp": "2026-03-20T22:41:29.433895+00:00", "config": {"base_model": "answerdotai/ModernBERT-base", "projection_dim": 768, "pooling": "cls", "max_seq_length": 256, "normalize_embeddings": true, "simclr_head": false, "stages": {"warmup": {"duration_minutes": 15, "data": "qqp_se_paraphrase", "loss": "infonce", "temperature": 0.1, "learning_rate": 0.0001, "lr_schedule": "linear_warmup_constant", "warmup_ratio": 0.1, "batch_size": 64, "negatives": "in_batch_only", "freeze_encoder_layers": 0, "false_neg_threshold": 0.0}, "contrastive": {"duration_minutes": 200, "data": "all_curated", "loss": "infonce", "temperature": 0.05, "temperature_end": 0.0, "learning_rate": 5e-05, "lr_schedule": "cosine_decay", "warmup_ratio": 0.05, "batch_size": 64, "negatives": "in_batch_plus_explicit", "source_stratification": true, "symmetric": true, "false_neg_threshold": 0.0}, "hard_neg_mining": {"duration_minutes": 5, "top_k": 7, "batch_size": 128, "min_similarity": 0.3}, "fine_tuning": {"duration_minutes": 0, "data": "all_curated_with_hard_negs", "loss": "infonce", "temperature": 0.05, "learning_rate": 1e-05, "lr_schedule": "cosine_decay", "warmup_ratio": 0.0, "batch_size": 64, "hard_neg_weight": 0.0, "false_neg_threshold": 0.0}}, "optimizer": {"type": "adamw", "betas": [0.9, 0.999], "eps": 1e-08, "weight_decay": 0.01, "llrd_decay": 1.0, "ema_decay": 0.0}, "data": {"max_rows_per_dataset": 100000}, "memory": {"max_peak_gb": 55, "gradient_accumulation_steps": 1, "gradient_checkpointing": false}}, "num_params_M": 149.0, "decontam_removed": 0, "wandb_run_id": "gnmoj4f2"}
{"commit": "74c53f9", "primary_score": 61.8713, "memory_gb": 35.6, "training_min": 201.2, "datasets": ["glue", "fancyzhx/dbpedia_14", "sentence-transformers/reddit-title-body", "ms_marco", "stanfordnlp/snli", "ag_news", "qiaojin/PubMedQA", "sentence-transformers/s2orc", "yahoo_answers_topics", "sentence-transformers/natural-questions", "hotpot_qa", "sentence-transformers/stackexchange-duplicates"], "status": "discard", "description": "exp-109: mean pooling instead of CLS (GTE/E5/all-MiniLM all use mean; exp-90 tested mean but only had 8-task eval; now with 21-task eval including 13 retrieval tasks); mean pools all tokens vs CLS which uses only one; hypothesis: mean pooling improves retrieval/clustering by using richer representation; baseline exp-107 corrected primary=62.29 (21-task)", "task_scores": {"sts_bench": 78.93, "sick_r": 72.47, "twitter_url": 81.31, "sprint_dup": 84.43}, "timestamp": "2026-03-21T02:25:11.159732+00:00", "config": {"base_model": "answerdotai/ModernBERT-base", "projection_dim": 768, "pooling": "mean", "max_seq_length": 256, "normalize_embeddings": true, "simclr_head": false, "stages": {"warmup": {"duration_minutes": 15, "data": "qqp_se_paraphrase", "loss": "infonce", "temperature": 0.1, "learning_rate": 0.0001, "lr_schedule": "linear_warmup_constant", "warmup_ratio": 0.1, "batch_size": 64, "negatives": "in_batch_only", "freeze_encoder_layers": 0, "false_neg_threshold": 0.0}, "contrastive": {"duration_minutes": 180, "data": "all_curated", "loss": "infonce", "temperature": 0.05, "temperature_end": 0.0, "learning_rate": 5e-05, "lr_schedule": "cosine_decay", "warmup_ratio": 0.05, "batch_size": 64, "negatives": "in_batch_plus_explicit", "source_stratification": true, "symmetric": true, "false_neg_threshold": 0.0}, "hard_neg_mining": {"duration_minutes": 5, "top_k": 7, "batch_size": 128, "min_similarity": 0.3}, "fine_tuning": {"duration_minutes": 5, "data": "all_curated_with_hard_negs", "loss": "infonce", "temperature": 0.05, "learning_rate": 1e-05, "lr_schedule": "cosine_decay", "warmup_ratio": 0.0, "batch_size": 64, "hard_neg_weight": 0.0, "false_neg_threshold": 0.0}}, "optimizer": {"type": "adamw", "betas": [0.9, 0.999], "eps": 1e-08, "weight_decay": 0.01, "llrd_decay": 1.0, "ema_decay": 0.0}, "data": {"max_rows_per_dataset": 100000}, "memory": {"max_peak_gb": 55, "gradient_accumulation_steps": 1, "gradient_checkpointing": false}}, "num_params_M": 149.0, "decontam_removed": 0, "wandb_run_id": "d1u9mjjd"}
{"commit": "85677ab", "primary_score": 0.0, "memory_gb": 0.0, "training_min": 0.0, "datasets": [], "status": "crash", "description": "exp-110: re-add FEVER claim-evidence pairs (copenlu/fever_gold_evidence, SUPPORTS only); exp-99/100 showed FEVER helps retrieval (SciFact +2.45) but hurt pair_class (-2.78 SprintDup); with 21-task eval (13 retrieval vs 2 pair_class), retrieval benefit should dominate; 190min contrastive (proportional to ~915K pairs); CLS pooling (exp-109 showed mean was flat); baseline exp-107 corrected primary=62.29 (21-task)", "task_scores": {}, "timestamp": "2026-03-21T05:59:11.544070+00:00", "config": {"base_model": "answerdotai/ModernBERT-base", "projection_dim": 768, "pooling": "cls", "max_seq_length": 256, "normalize_embeddings": true, "simclr_head": false, "stages": {"warmup": {"duration_minutes": 15, "data": "qqp_se_paraphrase", "loss": "infonce", "temperature": 0.1, "learning_rate": 0.0001, "lr_schedule": "linear_warmup_constant", "warmup_ratio": 0.1, "batch_size": 64, "negatives": "in_batch_only", "freeze_encoder_layers": 0, "false_neg_threshold": 0.0}, "contrastive": {"duration_minutes": 190, "data": "all_curated", "loss": "infonce", "temperature": 0.05, "temperature_end": 0.0, "learning_rate": 5e-05, "lr_schedule": "cosine_decay", "warmup_ratio": 0.05, "batch_size": 64, "negatives": "in_batch_plus_explicit", "source_stratification": true, "symmetric": true, "false_neg_threshold": 0.0}, "hard_neg_mining": {"duration_minutes": 5, "top_k": 7, "batch_size": 128, "min_similarity": 0.3}, "fine_tuning": {"duration_minutes": 5, "data": "all_curated_with_hard_negs", "loss": "infonce", "temperature": 0.05, "learning_rate": 1e-05, "lr_schedule": "cosine_decay", "warmup_ratio": 0.0, "batch_size": 64, "hard_neg_weight": 0.0, "false_neg_threshold": 0.0}}, "optimizer": {"type": "adamw", "betas": [0.9, 0.999], "eps": 1e-08, "weight_decay": 0.01, "llrd_decay": 1.0, "ema_decay": 0.0}, "data": {"max_rows_per_dataset": 100000}, "memory": {"max_peak_gb": 55, "gradient_accumulation_steps": 1, "gradient_checkpointing": false}}, "num_params_M": null, "decontam_removed": 0}
{"commit": "fd1dfb2", "primary_score": 61.8241, "memory_gb": 37.3, "training_min": 210.9, "datasets": ["sentence-transformers/stackexchange-duplicates", "sentence-transformers/natural-questions", "sentence-transformers/s2orc", "glue", "ag_news", "sentence-transformers/reddit-title-body", "stanfordnlp/snli", "qiaojin/PubMedQA", "copenlu/fever_gold_evidence", "fancyzhx/dbpedia_14", "yahoo_answers_topics", "ms_marco", "hotpot_qa"], "status": "discard", "description": "exp-110: retry — re-add FEVER claim-evidence pairs + 190min contrastive; previous run OOM'd during MTEB eval (training completed, STS=78.63 SICK-R=74.08 before crash); same config as commit 85677ab; baseline exp-107 corrected primary=62.29 (21-task)", "task_scores": {"sts_bench": 79.26, "sick_r": 74.18, "twitter_url": 80.68, "sprint_dup": 83.79}, "timestamp": "2026-03-21T09:50:44.611727+00:00", "config": {"base_model": "answerdotai/ModernBERT-base", "projection_dim": 768, "pooling": "cls", "max_seq_length": 256, "normalize_embeddings": true, "simclr_head": false, "stages": {"warmup": {"duration_minutes": 15, "data": "qqp_se_paraphrase", "loss": "infonce", "temperature": 0.1, "learning_rate": 0.0001, "lr_schedule": "linear_warmup_constant", "warmup_ratio": 0.1, "batch_size": 64, "negatives": "in_batch_only", "freeze_encoder_layers": 0, "false_neg_threshold": 0.0}, "contrastive": {"duration_minutes": 190, "data": "all_curated", "loss": "infonce", "temperature": 0.05, "temperature_end": 0.0, "learning_rate": 5e-05, "lr_schedule": "cosine_decay", "warmup_ratio": 0.05, "batch_size": 64, "negatives": "in_batch_plus_explicit", "source_stratification": true, "symmetric": true, "false_neg_threshold": 0.0}, "hard_neg_mining": {"duration_minutes": 5, "top_k": 7, "batch_size": 128, "min_similarity": 0.3}, "fine_tuning": {"duration_minutes": 5, "data": "all_curated_with_hard_negs", "loss": "infonce", "temperature": 0.05, "learning_rate": 1e-05, "lr_schedule": "cosine_decay", "warmup_ratio": 0.0, "batch_size": 64, "hard_neg_weight": 0.0, "false_neg_threshold": 0.0}}, "optimizer": {"type": "adamw", "betas": [0.9, 0.999], "eps": 1e-08, "weight_decay": 0.01, "llrd_decay": 1.0, "ema_decay": 0.0}, "data": {"max_rows_per_dataset": 100000}, "memory": {"max_peak_gb": 55, "gradient_accumulation_steps": 1, "gradient_checkpointing": false}}, "num_params_M": 149.0, "decontam_removed": 0, "wandb_run_id": "rp9neqao"}
{"commit": "24c4ec0", "primary_score": 62.4085, "memory_gb": 38.1, "training_min": 200.8, "datasets": ["fancyzhx/dbpedia_14", "ag_news", "sentence-transformers/reddit-title-body", "yahoo_answers_topics", "sentence-transformers/natural-questions", "sentence-transformers/stackexchange-duplicates", "hotpot_qa", "qiaojin/PubMedQA", "sentence-transformers/s2orc", "ms_marco", "stanfordnlp/snli", "glue"], "status": "discard", "description": "exp-111: lower contrastive temperature 0.03 (was 0.05); sharper similarity distribution should improve retrieval discrimination; revert FEVER (exp-110 showed it hurt retrieval -2.54); 180min contrastive, 12 datasets, CLS pooling — matches exp-107 config except temp; exp-107 non-retrieval primary=65.17 but retrieval OOM'd; exp-110 6-cat primary=61.82; hypothesis: lower temp specifically improves retrieval (weakest category at ~44-47)", "task_scores": {"sts_bench": 78.49, "sick_r": 73.9, "twitter_url": 80.11, "sprint_dup": 86.15}, "timestamp": "2026-03-21T13:28:40.999832+00:00", "config": {"base_model": "answerdotai/ModernBERT-base", "projection_dim": 768, "pooling": "cls", "max_seq_length": 256, "normalize_embeddings": true, "simclr_head": false, "stages": {"warmup": {"duration_minutes": 15, "data": "qqp_se_paraphrase", "loss": "infonce", "temperature": 0.1, "learning_rate": 0.0001, "lr_schedule": "linear_warmup_constant", "warmup_ratio": 0.1, "batch_size": 64, "negatives": "in_batch_only", "freeze_encoder_layers": 0, "false_neg_threshold": 0.0}, "contrastive": {"duration_minutes": 180, "data": "all_curated", "loss": "infonce", "temperature": 0.03, "temperature_end": 0.0, "learning_rate": 5e-05, "lr_schedule": "cosine_decay", "warmup_ratio": 0.05, "batch_size": 64, "negatives": "in_batch_plus_explicit", "source_stratification": true, "symmetric": true, "false_neg_threshold": 0.0}, "hard_neg_mining": {"duration_minutes": 5, "top_k": 7, "batch_size": 128, "min_similarity": 0.3}, "fine_tuning": {"duration_minutes": 5, "data": "all_curated_with_hard_negs", "loss": "infonce", "temperature": 0.05, "learning_rate": 1e-05, "lr_schedule": "cosine_decay", "warmup_ratio": 0.0, "batch_size": 64, "hard_neg_weight": 0.0, "false_neg_threshold": 0.0}}, "optimizer": {"type": "adamw", "betas": [0.9, 0.999], "eps": 1e-08, "weight_decay": 0.01, "llrd_decay": 1.0, "ema_decay": 0.0}, "data": {"max_rows_per_dataset": 100000}, "memory": {"max_peak_gb": 55, "gradient_accumulation_steps": 1, "gradient_checkpointing": false}}, "num_params_M": 149.0, "decontam_removed": 0, "wandb_run_id": "97ub3qdc"}
{"commit": "2cdc8c6", "primary_score": 61.7866, "memory_gb": 38.1, "training_min": 200.8, "datasets": ["ms_marco", "sentence-transformers/natural-questions", "ag_news", "stanfordnlp/snli", "sentence-transformers/s2orc", "sentence-transformers/stackexchange-duplicates", "glue", "sentence-transformers/reddit-title-body", "yahoo_answers_topics", "fancyzhx/dbpedia_14", "qiaojin/PubMedQA", "hotpot_qa"], "status": "discard", "description": "exp-112: even lower contrastive temperature 0.02 (exp-111 showed 0.03 improved retrieval +3.53 vs 0.05 at temp=0.05); sharper distribution for better discrimination; same 12 datasets, 180min, CLS pooling as exp-111; exp-111 primary=62.41 (6-cat best so far), retrieval=48.06; hypothesis: 0.02 pushes retrieval higher while maintaining other categories", "task_scores": {"sts_bench": 78.06, "sick_r": 75.02, "twitter_url": 81.69, "sprint_dup": 81.82}, "timestamp": "2026-03-21T17:09:05.760064+00:00", "config": {"base_model": "answerdotai/ModernBERT-base", "projection_dim": 768, "pooling": "cls", "max_seq_length": 256, "normalize_embeddings": true, "simclr_head": false, "stages": {"warmup": {"duration_minutes": 15, "data": "qqp_se_paraphrase", "loss": "infonce", "temperature": 0.1, "learning_rate": 0.0001, "lr_schedule": "linear_warmup_constant", "warmup_ratio": 0.1, "batch_size": 64, "negatives": "in_batch_only", "freeze_encoder_layers": 0, "false_neg_threshold": 0.0}, "contrastive": {"duration_minutes": 180, "data": "all_curated", "loss": "infonce", "temperature": 0.02, "temperature_end": 0.0, "learning_rate": 5e-05, "lr_schedule": "cosine_decay", "warmup_ratio": 0.05, "batch_size": 64, "negatives": "in_batch_plus_explicit", "source_stratification": true, "symmetric": true, "false_neg_threshold": 0.0}, "hard_neg_mining": {"duration_minutes": 5, "top_k": 7, "batch_size": 128, "min_similarity": 0.3}, "fine_tuning": {"duration_minutes": 5, "data": "all_curated_with_hard_negs", "loss": "infonce", "temperature": 0.05, "learning_rate": 1e-05, "lr_schedule": "cosine_decay", "warmup_ratio": 0.0, "batch_size": 64, "hard_neg_weight": 0.0, "false_neg_threshold": 0.0}}, "optimizer": {"type": "adamw", "betas": [0.9, 0.999], "eps": 1e-08, "weight_decay": 0.01, "llrd_decay": 1.0, "ema_decay": 0.0}, "data": {"max_rows_per_dataset": 100000}, "memory": {"max_peak_gb": 55, "gradient_accumulation_steps": 1, "gradient_checkpointing": false}}, "num_params_M": 149.0, "decontam_removed": 0, "wandb_run_id": "rui132p3"}
{"commit": "a4a88a6", "primary_score": 62.1618, "memory_gb": 61.1, "training_min": 200.5, "datasets": ["sentence-transformers/natural-questions", "fancyzhx/dbpedia_14", "sentence-transformers/reddit-title-body", "ag_news", "qiaojin/PubMedQA", "glue", "sentence-transformers/stackexchange-duplicates", "ms_marco", "hotpot_qa", "sentence-transformers/all-nli", "sentence-transformers/s2orc", "yahoo_answers_topics"], "status": "discard", "description": "exp-113: replace SNLI with AllNLI triplets (sentence-transformers/all-nli, triplet config) + revert temp to 0.03 (exp-112 showed 0.02 regressed -0.62 primary, -1.33 retrieval vs exp-111); AllNLI = SNLI+MNLI with explicit hard negatives (anchor/positive/negative); hard negs used during contrastive via triplet format; same 12 datasets, 180min, CLS pooling; baseline exp-111 primary=62.41 (6-cat best); hypothesis: hard negatives from AllNLI improve discrimination without temperature brittleness", "task_scores": {"sts_bench": 78.31, "sick_r": 79.15, "twitter_url": 80.59, "sprint_dup": 81.49}, "timestamp": "2026-03-21T21:24:08.013924+00:00", "config": {"base_model": "answerdotai/ModernBERT-base", "projection_dim": 768, "pooling": "cls", "max_seq_length": 256, "normalize_embeddings": true, "simclr_head": false, "stages": {"warmup": {"duration_minutes": 15, "data": "qqp_se_paraphrase", "loss": "infonce", "temperature": 0.1, "learning_rate": 0.0001, "lr_schedule": "linear_warmup_constant", "warmup_ratio": 0.1, "batch_size": 64, "negatives": "in_batch_only", "freeze_encoder_layers": 0, "false_neg_threshold": 0.0}, "contrastive": {"duration_minutes": 180, "data": "all_curated", "loss": "infonce", "temperature": 0.03, "temperature_end": 0.0, "learning_rate": 5e-05, "lr_schedule": "cosine_decay", "warmup_ratio": 0.05, "batch_size": 64, "negatives": "in_batch_plus_explicit", "source_stratification": true, "symmetric": true, "false_neg_threshold": 0.0}, "hard_neg_mining": {"duration_minutes": 5, "top_k": 7, "batch_size": 128, "min_similarity": 0.3}, "fine_tuning": {"duration_minutes": 5, "data": "all_curated_with_hard_negs", "loss": "infonce", "temperature": 0.05, "learning_rate": 1e-05, "lr_schedule": "cosine_decay", "warmup_ratio": 0.0, "batch_size": 64, "hard_neg_weight": 0.0, "false_neg_threshold": 0.0}}, "optimizer": {"type": "adamw", "betas": [0.9, 0.999], "eps": 1e-08, "weight_decay": 0.01, "llrd_decay": 1.0, "ema_decay": 0.0}, "data": {"max_rows_per_dataset": 100000}, "memory": {"max_peak_gb": 55, "gradient_accumulation_steps": 1, "gradient_checkpointing": false}}, "num_params_M": 149.0, "decontam_removed": 6721, "wandb_run_id": "g9m1hqlk"}
