{"commit": "529513d", "primary_score": 39.4396, "memory_gb": 37.0, "training_min": 105.3, "datasets": ["sentence-transformers/natural-questions", "ag_news", "ms_marco", "sentence-transformers/stackexchange-duplicates", "stanfordnlp/snli", "glue", "yahoo_answers_topics", "sentence-transformers/reddit-title-body", "fancyzhx/dbpedia_14"], "status": "discard", "description": "exp-30: contrastive temp 0.05\u21920.07 (softer contrastive loss); CLS pooling; std InfoNCE; target pair classification improvement while retaining STS/clustering/retrieval", "task_scores": {"sts_bench": 57.69, "sick_r": 60.46, "twitter_url": 70.81, "sprint_dup": 65.88, "20news": 18.34, "reddit_clust": 15.87, "scifact": 21.88, "nfcorpus": 8.96}, "timestamp": "2026-03-13T15:04:55.539404+00:00", "config": {"base_model": "answerdotai/ModernBERT-base", "embedding_dim": 768, "projection_dim": 768, "pooling": "cls", "max_seq_length": 512, "normalize_embeddings": true, "stages": {"warmup": {"duration_minutes": 15, "data": "qqp_se_paraphrase", "loss": "infonce", "temperature": 0.1, "learning_rate": 0.0001, "lr_schedule": "linear_warmup_constant", "warmup_ratio": 0.1, "batch_size": 64, "negatives": "in_batch_only", "freeze_encoder_layers": 0}, "contrastive": {"duration_minutes": 45, "data": "all_curated", "loss": "infonce", "temperature": 0.07, "learning_rate": 5e-05, "lr_schedule": "cosine_decay", "warmup_ratio": 0.05, "batch_size": 64, "negatives": "in_batch_plus_explicit", "source_stratification": true}, "hard_neg_mining": {"duration_minutes": 5, "top_k": 7, "batch_size": 128, "min_similarity": 0.3}, "fine_tuning": {"duration_minutes": 45, "data": "all_curated_with_hard_negs", "loss": "infonce", "temperature": 0.05, "learning_rate": 1e-05, "lr_schedule": "cosine_decay", "warmup_ratio": 0.0, "batch_size": 32, "hard_neg_weight": 2.0}}, "optimizer": {"type": "adamw", "betas": [0.9, 0.999], "eps": 1e-08, "weight_decay": 0.01}, "memory": {"max_peak_gb": 55, "gradient_accumulation_steps": 4}}, "num_params_M": 149.0, "decontam_removed": 0, "wandb_run_id": "z2b6hi8s"}
{"commit": "4425acd", "primary_score": 41.2979, "memory_gb": 37.0, "training_min": 105.3, "datasets": ["sentence-transformers/stackexchange-duplicates", "yahoo_answers_topics", "stanfordnlp/snli", "fancyzhx/dbpedia_14", "glue", "ms_marco", "sentence-transformers/reddit-title-body", "sentence-transformers/natural-questions", "ag_news"], "status": "discard", "description": "exp-31: increase hard neg top_k 7\u219210; CLS pooling; std InfoNCE; temp=0.05; target retrieval improvement SciFact>30 NFCorpus>15", "task_scores": {"sts_bench": 62.5, "sick_r": 61.57, "twitter_url": 70.44, "sprint_dup": 76.81, "20news": 14.06, "reddit_clust": 14.39, "scifact": 26.33, "nfcorpus": 7.79}, "timestamp": "2026-03-13T17:08:42.420549+00:00", "config": {"base_model": "answerdotai/ModernBERT-base", "embedding_dim": 768, "projection_dim": 768, "pooling": "cls", "max_seq_length": 512, "normalize_embeddings": true, "stages": {"warmup": {"duration_minutes": 15, "data": "qqp_se_paraphrase", "loss": "infonce", "temperature": 0.1, "learning_rate": 0.0001, "lr_schedule": "linear_warmup_constant", "warmup_ratio": 0.1, "batch_size": 64, "negatives": "in_batch_only", "freeze_encoder_layers": 0}, "contrastive": {"duration_minutes": 45, "data": "all_curated", "loss": "infonce", "temperature": 0.05, "learning_rate": 5e-05, "lr_schedule": "cosine_decay", "warmup_ratio": 0.05, "batch_size": 64, "negatives": "in_batch_plus_explicit", "source_stratification": true}, "hard_neg_mining": {"duration_minutes": 5, "top_k": 10, "batch_size": 128, "min_similarity": 0.3}, "fine_tuning": {"duration_minutes": 45, "data": "all_curated_with_hard_negs", "loss": "infonce", "temperature": 0.05, "learning_rate": 1e-05, "lr_schedule": "cosine_decay", "warmup_ratio": 0.0, "batch_size": 32, "hard_neg_weight": 2.0}}, "optimizer": {"type": "adamw", "betas": [0.9, 0.999], "eps": 1e-08, "weight_decay": 0.01}, "memory": {"max_peak_gb": 55, "gradient_accumulation_steps": 4}}, "num_params_M": 149.0, "decontam_removed": 0, "wandb_run_id": "8w1dktg6"}
{"commit": "3a5d519", "primary_score": 43.8352, "memory_gb": 37.0, "training_min": 105.3, "datasets": ["sentence-transformers/reddit-title-body", "yahoo_answers_topics", "stanfordnlp/snli", "glue", "sentence-transformers/natural-questions", "sentence-transformers/stackexchange-duplicates", "ag_news", "fancyzhx/dbpedia_14", "ms_marco"], "status": "keep", "description": "exp-32: reduce hard_neg_weight 2.0\u21921.5 in fine-tuning; CLS pooling; std InfoNCE; top_k=7; target clustering improvement while retaining retrieval", "task_scores": {"sts_bench": 62.45, "sick_r": 62.56, "twitter_url": 76.06, "sprint_dup": 83.61, "20news": 15.3, "reddit_clust": 18.07, "scifact": 28.34, "nfcorpus": 10.19}, "timestamp": "2026-03-13T19:11:04.471802+00:00", "config": {"base_model": "answerdotai/ModernBERT-base", "embedding_dim": 768, "projection_dim": 768, "pooling": "cls", "max_seq_length": 512, "normalize_embeddings": true, "stages": {"warmup": {"duration_minutes": 15, "data": "qqp_se_paraphrase", "loss": "infonce", "temperature": 0.1, "learning_rate": 0.0001, "lr_schedule": "linear_warmup_constant", "warmup_ratio": 0.1, "batch_size": 64, "negatives": "in_batch_only", "freeze_encoder_layers": 0}, "contrastive": {"duration_minutes": 45, "data": "all_curated", "loss": "infonce", "temperature": 0.05, "learning_rate": 5e-05, "lr_schedule": "cosine_decay", "warmup_ratio": 0.05, "batch_size": 64, "negatives": "in_batch_plus_explicit", "source_stratification": true}, "hard_neg_mining": {"duration_minutes": 5, "top_k": 7, "batch_size": 128, "min_similarity": 0.3}, "fine_tuning": {"duration_minutes": 45, "data": "all_curated_with_hard_negs", "loss": "infonce", "temperature": 0.05, "learning_rate": 1e-05, "lr_schedule": "cosine_decay", "warmup_ratio": 0.0, "batch_size": 32, "hard_neg_weight": 1.5}}, "optimizer": {"type": "adamw", "betas": [0.9, 0.999], "eps": 1e-08, "weight_decay": 0.01}, "memory": {"max_peak_gb": 55, "gradient_accumulation_steps": 4}}, "num_params_M": 149.0, "decontam_removed": 0, "wandb_run_id": "vrind08o"}
{"commit": "85bb1cf", "primary_score": 55.1634, "memory_gb": 37.0, "training_min": 105.3, "datasets": ["sentence-transformers/reddit-title-body", "fancyzhx/dbpedia_14", "glue", "yahoo_answers_topics", "sentence-transformers/stackexchange-duplicates", "ag_news", "stanfordnlp/snli", "sentence-transformers/natural-questions", "ms_marco"], "status": "keep", "description": "exp-33: reduce hard_neg_weight 1.5\u21921.0 in fine-tuning; CLS pooling; std InfoNCE; top_k=7; target further pair/STS improvement; new baseline exp-32 primary=43.84", "task_scores": {"sts_bench": 74.81, "sick_r": 71.05, "twitter_url": 77.46, "sprint_dup": 84.88, "20news": 35.24, "reddit_clust": 39.73, "scifact": 44.5, "nfcorpus": 19.19}, "timestamp": "2026-03-13T21:17:11.291713+00:00", "config": {"base_model": "answerdotai/ModernBERT-base", "embedding_dim": 768, "projection_dim": 768, "pooling": "cls", "max_seq_length": 512, "normalize_embeddings": true, "stages": {"warmup": {"duration_minutes": 15, "data": "qqp_se_paraphrase", "loss": "infonce", "temperature": 0.1, "learning_rate": 0.0001, "lr_schedule": "linear_warmup_constant", "warmup_ratio": 0.1, "batch_size": 64, "negatives": "in_batch_only", "freeze_encoder_layers": 0}, "contrastive": {"duration_minutes": 45, "data": "all_curated", "loss": "infonce", "temperature": 0.05, "learning_rate": 5e-05, "lr_schedule": "cosine_decay", "warmup_ratio": 0.05, "batch_size": 64, "negatives": "in_batch_plus_explicit", "source_stratification": true}, "hard_neg_mining": {"duration_minutes": 5, "top_k": 7, "batch_size": 128, "min_similarity": 0.3}, "fine_tuning": {"duration_minutes": 45, "data": "all_curated_with_hard_negs", "loss": "infonce", "temperature": 0.05, "learning_rate": 1e-05, "lr_schedule": "cosine_decay", "warmup_ratio": 0.0, "batch_size": 32, "hard_neg_weight": 1.0}}, "optimizer": {"type": "adamw", "betas": [0.9, 0.999], "eps": 1e-08, "weight_decay": 0.01}, "memory": {"max_peak_gb": 55, "gradient_accumulation_steps": 4}}, "num_params_M": 149.0, "decontam_removed": 0, "wandb_run_id": "g3mk6vf1"}
{"commit": "40c0a61", "primary_score": 53.4793, "memory_gb": 37.0, "training_min": 105.3, "datasets": ["sentence-transformers/natural-questions", "sentence-transformers/stackexchange-duplicates", "fancyzhx/dbpedia_14", "stanfordnlp/snli", "sentence-transformers/reddit-title-body", "glue", "ag_news", "yahoo_answers_topics", "ms_marco"], "status": "discard", "description": "exp-34: reduce hard_neg_weight 1.0\u21920.5; CLS pooling; std InfoNCE; top_k=7; test if in-batch negatives dominate further helps; new champion exp-33 primary=55.16", "task_scores": {"sts_bench": 75.84, "sick_r": 71.34, "twitter_url": 75.55, "sprint_dup": 80.87, "20news": 36.32, "reddit_clust": 40.9, "scifact": 36.93, "nfcorpus": 16.67}, "timestamp": "2026-03-13T23:26:35.068597+00:00", "config": {"base_model": "answerdotai/ModernBERT-base", "embedding_dim": 768, "projection_dim": 768, "pooling": "cls", "max_seq_length": 512, "normalize_embeddings": true, "stages": {"warmup": {"duration_minutes": 15, "data": "qqp_se_paraphrase", "loss": "infonce", "temperature": 0.1, "learning_rate": 0.0001, "lr_schedule": "linear_warmup_constant", "warmup_ratio": 0.1, "batch_size": 64, "negatives": "in_batch_only", "freeze_encoder_layers": 0}, "contrastive": {"duration_minutes": 45, "data": "all_curated", "loss": "infonce", "temperature": 0.05, "learning_rate": 5e-05, "lr_schedule": "cosine_decay", "warmup_ratio": 0.05, "batch_size": 64, "negatives": "in_batch_plus_explicit", "source_stratification": true}, "hard_neg_mining": {"duration_minutes": 5, "top_k": 7, "batch_size": 128, "min_similarity": 0.3}, "fine_tuning": {"duration_minutes": 45, "data": "all_curated_with_hard_negs", "loss": "infonce", "temperature": 0.05, "learning_rate": 1e-05, "lr_schedule": "cosine_decay", "warmup_ratio": 0.0, "batch_size": 32, "hard_neg_weight": 0.5}}, "optimizer": {"type": "adamw", "betas": [0.9, 0.999], "eps": 1e-08, "weight_decay": 0.01}, "memory": {"max_peak_gb": 55, "gradient_accumulation_steps": 4}}, "num_params_M": 149.0, "decontam_removed": 0, "wandb_run_id": "flme8h2h"}
{"commit": "a68d6c1", "primary_score": 54.2142, "memory_gb": 37.0, "training_min": 105.3, "datasets": ["glue", "sentence-transformers/natural-questions", "sentence-transformers/stackexchange-duplicates", "stanfordnlp/snli", "yahoo_answers_topics", "sentence-transformers/reddit-title-body", "ag_news", "ms_marco", "fancyzhx/dbpedia_14"], "status": "discard", "description": "exp-35: fine-tuning temp 0.05\u21920.03 (colder); hard_neg_weight=1.0; target retrieval boost from harder negatives; baseline exp-33 primary=55.16", "task_scores": {"sts_bench": 76.39, "sick_r": 74.25, "twitter_url": 77.75, "sprint_dup": 82.75, "20news": 35.13, "reddit_clust": 39.08, "scifact": 38.72, "nfcorpus": 15.6}, "timestamp": "2026-03-14T01:29:19.756991+00:00", "config": {"base_model": "answerdotai/ModernBERT-base", "embedding_dim": 768, "projection_dim": 768, "pooling": "cls", "max_seq_length": 512, "normalize_embeddings": true, "stages": {"warmup": {"duration_minutes": 15, "data": "qqp_se_paraphrase", "loss": "infonce", "temperature": 0.1, "learning_rate": 0.0001, "lr_schedule": "linear_warmup_constant", "warmup_ratio": 0.1, "batch_size": 64, "negatives": "in_batch_only", "freeze_encoder_layers": 0}, "contrastive": {"duration_minutes": 45, "data": "all_curated", "loss": "infonce", "temperature": 0.05, "learning_rate": 5e-05, "lr_schedule": "cosine_decay", "warmup_ratio": 0.05, "batch_size": 64, "negatives": "in_batch_plus_explicit", "source_stratification": true}, "hard_neg_mining": {"duration_minutes": 5, "top_k": 7, "batch_size": 128, "min_similarity": 0.3}, "fine_tuning": {"duration_minutes": 45, "data": "all_curated_with_hard_negs", "loss": "infonce", "temperature": 0.03, "learning_rate": 1e-05, "lr_schedule": "cosine_decay", "warmup_ratio": 0.0, "batch_size": 32, "hard_neg_weight": 1.0}}, "optimizer": {"type": "adamw", "betas": [0.9, 0.999], "eps": 1e-08, "weight_decay": 0.01}, "memory": {"max_peak_gb": 55, "gradient_accumulation_steps": 4}}, "num_params_M": 149.0, "decontam_removed": 0, "wandb_run_id": "5nde75pu"}
{"commit": "6905657", "primary_score": 53.7787, "memory_gb": 69.3, "training_min": 106.4, "datasets": ["sentence-transformers/stackexchange-duplicates", "ag_news", "yahoo_answers_topics", "fancyzhx/dbpedia_14", "ms_marco", "glue", "sentence-transformers/natural-questions", "sentence-transformers/reddit-title-body", "stanfordnlp/snli"], "status": "discard", "description": "exp-36: contrastive batch_size 64\u2192128 (2x in-batch negatives); hard_neg_weight=1.0; temp=0.05; target retrieval+clustering from denser negatives; baseline exp-33 primary=55.16", "task_scores": {"sts_bench": 75.54, "sick_r": 72.54, "twitter_url": 74.86, "sprint_dup": 80.89, "20news": 33.08, "reddit_clust": 38.28, "scifact": 41.43, "nfcorpus": 17.61}, "timestamp": "2026-03-14T03:42:34.208860+00:00", "config": {"base_model": "answerdotai/ModernBERT-base", "embedding_dim": 768, "projection_dim": 768, "pooling": "cls", "max_seq_length": 512, "normalize_embeddings": true, "stages": {"warmup": {"duration_minutes": 15, "data": "qqp_se_paraphrase", "loss": "infonce", "temperature": 0.1, "learning_rate": 0.0001, "lr_schedule": "linear_warmup_constant", "warmup_ratio": 0.1, "batch_size": 64, "negatives": "in_batch_only", "freeze_encoder_layers": 0}, "contrastive": {"duration_minutes": 45, "data": "all_curated", "loss": "infonce", "temperature": 0.05, "learning_rate": 5e-05, "lr_schedule": "cosine_decay", "warmup_ratio": 0.05, "batch_size": 128, "negatives": "in_batch_plus_explicit", "source_stratification": true}, "hard_neg_mining": {"duration_minutes": 5, "top_k": 7, "batch_size": 128, "min_similarity": 0.3}, "fine_tuning": {"duration_minutes": 45, "data": "all_curated_with_hard_negs", "loss": "infonce", "temperature": 0.05, "learning_rate": 1e-05, "lr_schedule": "cosine_decay", "warmup_ratio": 0.0, "batch_size": 32, "hard_neg_weight": 1.0}}, "optimizer": {"type": "adamw", "betas": [0.9, 0.999], "eps": 1e-08, "weight_decay": 0.01}, "memory": {"max_peak_gb": 55, "gradient_accumulation_steps": 4}}, "num_params_M": 149.0, "decontam_removed": 0, "wandb_run_id": "4h7ej6hs"}
{"commit": "df8b8e1", "primary_score": 53.8977, "memory_gb": 37.0, "training_min": 105.3, "datasets": ["ms_marco", "yahoo_answers_topics", "sentence-transformers/stackexchange-duplicates", "sentence-transformers/reddit-title-body", "ag_news", "sentence-transformers/natural-questions", "fancyzhx/dbpedia_14", "glue", "stanfordnlp/snli"], "status": "discard", "description": "exp-37: hard_neg_mining top_k 7\u219214 (2x hard negs per query); batch=64; hard_neg_weight=1.0; temp=0.05; target retrieval boost from more negatives; baseline exp-33 primary=55.16", "task_scores": {"sts_bench": 74.05, "sick_r": 72.31, "twitter_url": 74.38, "sprint_dup": 80.99, "20news": 34.16, "reddit_clust": 37.83, "scifact": 43.38, "nfcorpus": 18.01}, "timestamp": "2026-03-14T05:53:44.403158+00:00", "config": {"base_model": "answerdotai/ModernBERT-base", "embedding_dim": 768, "projection_dim": 768, "pooling": "cls", "max_seq_length": 512, "normalize_embeddings": true, "stages": {"warmup": {"duration_minutes": 15, "data": "qqp_se_paraphrase", "loss": "infonce", "temperature": 0.1, "learning_rate": 0.0001, "lr_schedule": "linear_warmup_constant", "warmup_ratio": 0.1, "batch_size": 64, "negatives": "in_batch_only", "freeze_encoder_layers": 0}, "contrastive": {"duration_minutes": 45, "data": "all_curated", "loss": "infonce", "temperature": 0.05, "learning_rate": 5e-05, "lr_schedule": "cosine_decay", "warmup_ratio": 0.05, "batch_size": 64, "negatives": "in_batch_plus_explicit", "source_stratification": true}, "hard_neg_mining": {"duration_minutes": 5, "top_k": 14, "batch_size": 128, "min_similarity": 0.3}, "fine_tuning": {"duration_minutes": 45, "data": "all_curated_with_hard_negs", "loss": "infonce", "temperature": 0.05, "learning_rate": 1e-05, "lr_schedule": "cosine_decay", "warmup_ratio": 0.0, "batch_size": 32, "hard_neg_weight": 1.0}}, "optimizer": {"type": "adamw", "betas": [0.9, 0.999], "eps": 1e-08, "weight_decay": 0.01}, "memory": {"max_peak_gb": 55, "gradient_accumulation_steps": 4}}, "num_params_M": 149.0, "decontam_removed": 0, "wandb_run_id": "cdxkv6op"}
{"commit": "a100b4b", "primary_score": 50.5887, "memory_gb": 37.0, "training_min": 105.3, "datasets": ["sentence-transformers/natural-questions", "sentence-transformers/reddit-title-body", "sentence-transformers/stackexchange-duplicates", "ag_news", "glue", "ms_marco", "yahoo_answers_topics", "fancyzhx/dbpedia_14", "stanfordnlp/snli"], "status": "discard", "description": "exp-38: fine-tuning LR 1e-5\u21923e-5 (3x); hard_neg_weight=1.0; top_k=7; temp=0.05; target better optimization in fine-tuning; baseline exp-33 primary=55.16", "task_scores": {"sts_bench": 74.32, "sick_r": 70.16, "twitter_url": 78.91, "sprint_dup": 83.36, "20news": 29.22, "reddit_clust": 34.51, "scifact": 30.18, "nfcorpus": 11.93}, "timestamp": "2026-03-14T08:05:37.048467+00:00", "config": {"base_model": "answerdotai/ModernBERT-base", "embedding_dim": 768, "projection_dim": 768, "pooling": "cls", "max_seq_length": 512, "normalize_embeddings": true, "stages": {"warmup": {"duration_minutes": 15, "data": "qqp_se_paraphrase", "loss": "infonce", "temperature": 0.1, "learning_rate": 0.0001, "lr_schedule": "linear_warmup_constant", "warmup_ratio": 0.1, "batch_size": 64, "negatives": "in_batch_only", "freeze_encoder_layers": 0}, "contrastive": {"duration_minutes": 45, "data": "all_curated", "loss": "infonce", "temperature": 0.05, "learning_rate": 5e-05, "lr_schedule": "cosine_decay", "warmup_ratio": 0.05, "batch_size": 64, "negatives": "in_batch_plus_explicit", "source_stratification": true}, "hard_neg_mining": {"duration_minutes": 5, "top_k": 7, "batch_size": 128, "min_similarity": 0.3}, "fine_tuning": {"duration_minutes": 45, "data": "all_curated_with_hard_negs", "loss": "infonce", "temperature": 0.05, "learning_rate": 3e-05, "lr_schedule": "cosine_decay", "warmup_ratio": 0.0, "batch_size": 32, "hard_neg_weight": 1.0}}, "optimizer": {"type": "adamw", "betas": [0.9, 0.999], "eps": 1e-08, "weight_decay": 0.01}, "memory": {"max_peak_gb": 55, "gradient_accumulation_steps": 4}}, "num_params_M": 149.0, "decontam_removed": 0, "wandb_run_id": "yz6pqjqq"}
{"commit": "560237d", "primary_score": 53.151, "memory_gb": 37.0, "training_min": 120.3, "datasets": ["stanfordnlp/snli", "ms_marco", "glue", "yahoo_answers_topics", "fancyzhx/dbpedia_14", "sentence-transformers/reddit-title-body", "sentence-transformers/natural-questions", "sentence-transformers/stackexchange-duplicates", "ag_news"], "status": "discard", "description": "exp-39: contrastive duration 45\u219260 min (+33% contrastive training); hard_neg_weight=1.0; LR=1e-5; top_k=7; target retrieval+clustering from better representations; baseline exp-33 primary=55.16", "task_scores": {"sts_bench": 72.81, "sick_r": 71.23, "twitter_url": 74.98, "sprint_dup": 78.0, "20news": 35.79, "reddit_clust": 39.28, "scifact": 42.13, "nfcorpus": 16.13}, "timestamp": "2026-03-14T10:32:46.201108+00:00", "config": {"base_model": "answerdotai/ModernBERT-base", "embedding_dim": 768, "projection_dim": 768, "pooling": "cls", "max_seq_length": 512, "normalize_embeddings": true, "stages": {"warmup": {"duration_minutes": 15, "data": "qqp_se_paraphrase", "loss": "infonce", "temperature": 0.1, "learning_rate": 0.0001, "lr_schedule": "linear_warmup_constant", "warmup_ratio": 0.1, "batch_size": 64, "negatives": "in_batch_only", "freeze_encoder_layers": 0}, "contrastive": {"duration_minutes": 60, "data": "all_curated", "loss": "infonce", "temperature": 0.05, "learning_rate": 5e-05, "lr_schedule": "cosine_decay", "warmup_ratio": 0.05, "batch_size": 64, "negatives": "in_batch_plus_explicit", "source_stratification": true}, "hard_neg_mining": {"duration_minutes": 5, "top_k": 7, "batch_size": 128, "min_similarity": 0.3}, "fine_tuning": {"duration_minutes": 45, "data": "all_curated_with_hard_negs", "loss": "infonce", "temperature": 0.05, "learning_rate": 1e-05, "lr_schedule": "cosine_decay", "warmup_ratio": 0.0, "batch_size": 32, "hard_neg_weight": 1.0}}, "optimizer": {"type": "adamw", "betas": [0.9, 0.999], "eps": 1e-08, "weight_decay": 0.01}, "memory": {"max_peak_gb": 55, "gradient_accumulation_steps": 4}}, "num_params_M": 149.0, "decontam_removed": 0, "wandb_run_id": "h4gg9sbj"}
