commit	primary_score	memory_gb	training_min	datasets	status	description
d24b573	45.76	84.6	51.5	snli;mnli;all-nli	contaminated	baseline ModernBERT-base 4-stage; snli/mnli overlap with SICK-R(2.9%) and STSBench(3.0%)
a3fa28a	43.34	71.3	51.5	all-nli;quora;msmarco	contaminated	remove snli/mnli but all-nli still has Flickr overlap SICK-R(2.0%) STSBench(1.9%)
e0931b1	27.20	75.3	51.5	se-dups;nq;msmarco	keep	exp-3 first clean baseline: SE+NQ+MSMARCO, contamination PASS (0% all tasks)
892d982	33.80	79.5	51.5	mrpc;qqp;mnli-nonpic	contaminated	MRPC news text overlaps STSBenchmark (2.95%)
8136ecc	32.69	78.4	50.8	glue;ms_marco;multi_nli;sentence-transformers/all-nli;sentence-transformers/stackexchange-duplicates	discard	test: verify wrapper pipeline with MPS optimizations
1e3d2d1	0.00	0.0	0.0		crash	exp-8: projection_dim=768 + reddit diversity; targeting clustering(9%→fix) and retrieval(3%→fix)
e1724f2	0.00	0.0	0.0		crash	exp-9: fix OOM - reduce batch sizes (256→128 warmup/contrastive, 128→64 finetune); same proj_dim=768 + reddit
d19b9dc	0.00	0.0	0.0		crash	exp-10: fix OOM - batch_size 64/64/32 (9GB/step); proj_dim=768 + reddit; baseline for larger batches
4ad1e87	32.67	32.5	75.5	sentence-transformers/reddit-title-body;ms_marco;sentence-transformers/natural-questions;sentence-transformers/stackexchange-duplicates;glue	keep	exp-11: fix hard-neg mining OOM - reduce to 8K docs + batch_size=32; same proj_dim=768 + reddit + 64/64/32 batches
64cea21	34.66	34.7	75.3	glue;sentence-transformers/stackexchange-duplicates;sentence-transformers/natural-questions;sentence-transformers/reddit-title-body;ms_marco;ag_news	keep	exp-12: add ag_news same-label pairs for clustering + finetune temp 0.02→0.05; target clustering(9%→15%)
7a8f211	38.44	37.8	75.3	sentence-transformers/reddit-title-body;ag_news;fancyzhx/dbpedia_14;ms_marco;glue;sentence-transformers/natural-questions;yahoo_answers_topics;sentence-transformers/stackexchange-duplicates	keep	exp-13: add DBpedia-14 (14 classes) + Yahoo Answers (10 classes) for finer clustering; target 20News/Reddit cluster improvement
1537540	38.84	37.0	75.3	sentence-transformers/stackexchange-duplicates;sentence-transformers/reddit-title-body;glue;ag_news;yahoo_answers_topics;fancyzhx/dbpedia_14;stanfordnlp/snli;sentence-transformers/natural-questions;ms_marco	keep	exp-14: add SNLI entailment pairs for STS signal; DBpedia+Yahoo+SNLI; target STS>65, primary>40
b557dad	36.88	35.3	75.3	glue;hotpot_qa;sentence-transformers/stackexchange-duplicates;ag_news;nyu-mll/multi_nli;ms_marco;fancyzhx/dbpedia_14;sentence-transformers/reddit-title-body;sentence-transformers/natural-questions;yahoo_answers_topics;stanfordnlp/snli	discard	exp-15: add MultiNLI + HotpotQA for more NLI diversity and retrieval signal; target SciFact recovery + primary>40
81f881a	40.97	37.0	105.3	sentence-transformers/reddit-title-body;ms_marco;fancyzhx/dbpedia_14;stanfordnlp/snli;ag_news;sentence-transformers/stackexchange-duplicates;yahoo_answers_topics;glue;sentence-transformers/natural-questions	keep	exp-16: extend training 30→45min (contrastive+finetune); same exp-14 data (SNLI+DBpedia+Yahoo); target primary>40
2c1dc30	36.24	37.0	135.7	fancyzhx/dbpedia_14;yahoo_answers_topics;sentence-transformers/natural-questions;ag_news;sentence-transformers/reddit-title-body;ms_marco;stanfordnlp/snli;sentence-transformers/stackexchange-duplicates;glue	discard	exp-17: extend to 60min (contrastive+finetune) + 16K mining set (was 8K); target primary>42
bb845eb	42.05	37.0	105.3	sentence-transformers/reddit-title-body;yahoo_answers_topics;glue;ag_news;fancyzhx/dbpedia_14;sentence-transformers/stackexchange-duplicates;stanfordnlp/snli;ms_marco;sentence-transformers/natural-questions	keep	exp-18: CLS pooling instead of mean pooling; 45+45min; exp-14 data; target SciFact+STS improvement
29710c9	28.11	37.2	105.3	yahoo_answers_topics;ms_marco;sentence-transformers/natural-questions;sentence-transformers/stackexchange-duplicates;ag_news;stanfordnlp/snli;glue;sentence-transformers/reddit-title-body;fancyzhx/dbpedia_14	discard	exp-19: cls_mean pooling (CLS+mean concat→project) for best of both; 45+45min; target SprintDup recovery + STS/clustering retention
2ffcdff	38.19	39.7	105.3	stanfordnlp/snli;sentence-transformers/natural-questions;google-research-datasets/paws;glue;ag_news;sentence-transformers/stackexchange-duplicates;yahoo_answers_topics;ms_marco;sentence-transformers/reddit-title-body;fancyzhx/dbpedia_14	discard	exp-20: CLS pooling + PAWS paraphrase pairs for SprintDup/Twitter recovery; 45+45min; target primary>43
cf430a0	41.10	37.0	120.3	fancyzhx/dbpedia_14;ms_marco;ag_news;sentence-transformers/reddit-title-body;sentence-transformers/stackexchange-duplicates;stanfordnlp/snli;yahoo_answers_topics;glue;sentence-transformers/natural-questions	discard	exp-21: CLS pooling + 30min warmup (vs 15min); 45+45min contrastive/fine-tune; better CLS init; target primary>43
3e019c1	40.52	37.0	105.3	yahoo_answers_topics;ms_marco;ag_news;glue;fancyzhx/dbpedia_14;stanfordnlp/snli;sentence-transformers/natural-questions;sentence-transformers/reddit-title-body;sentence-transformers/stackexchange-duplicates	discard	exp-22: CLS pooling + lower finetune temp 0.05→0.03 (harder retrieval training); 15+45+45min; target SciFact>30 NFCorpus>15
bff05d5	41.31	37.0	105.3	sentence-transformers/stackexchange-duplicates;ag_news;ms_marco;sentence-transformers/natural-questions;fancyzhx/dbpedia_14;stanfordnlp/snli;sentence-transformers/reddit-title-body;yahoo_answers_topics;glue	discard	exp-24: symmetric InfoNCE clean test (temp=0.05 all stages) + CLS pooling; 15+45+45min; target primary>42.05 vs exp-18
1655705	38.98	36.4	105.5	ag_news;stanfordnlp/snli;hotpot_qa;yahoo_answers_topics;ms_marco;sentence-transformers/stackexchange-duplicates;sentence-transformers/natural-questions;glue;sentence-transformers/reddit-title-body;fancyzhx/dbpedia_14	discard	exp-25: add HotpotQA retrieval pairs + 12K mining (vs 8K); CLS pooling; std InfoNCE; target SciFact>30 NFCorpus>15
f4dfb5d	26.07	38.1	105.3	yahoo_answers_topics;sentence-transformers/quora-duplicates;sentence-transformers/stackexchange-duplicates;sentence-transformers/natural-questions;ms_marco;fancyzhx/dbpedia_14;sentence-transformers/reddit-title-body;ag_news;glue;stanfordnlp/snli	discard	exp-26: add Quora duplicate question pairs (30K); CLS pooling; std InfoNCE; target pair classification Sprint>65 Twitter>65
3413b89	34.73	37.0	105.3	sentence-transformers/stackexchange-duplicates;ag_news;stanfordnlp/snli;ms_marco;yahoo_answers_topics;sentence-transformers/reddit-title-body;fancyzhx/dbpedia_14;glue;sentence-transformers/natural-questions	discard	exp-27: increase hard_neg_weight 2.0→3.0 in fine-tuning; CLS pooling; std InfoNCE; 8K mining; target SciFact>32 NFCorpus>15
512e72b	21.52	42.0	105.6	fancyzhx/dbpedia_14;ag_news;sentence-transformers/reddit-title-body;sentence-transformers/natural-questions;glue;stanfordnlp/snli;sentence-transformers/stackexchange-duplicates;ms_marco;yahoo_answers_topics	discard	exp-28: ModernBERT-large (1024-dim, 28 layers, 395M params); CLS pooling; std InfoNCE; batch 32/32/16; target primary>45
529513d	39.44	37.0	105.3	sentence-transformers/natural-questions;ag_news;ms_marco;sentence-transformers/stackexchange-duplicates;stanfordnlp/snli;glue;yahoo_answers_topics;sentence-transformers/reddit-title-body;fancyzhx/dbpedia_14	discard	exp-30: contrastive temp 0.05→0.07 (softer contrastive loss); CLS pooling; std InfoNCE; target pair classification improvement while retaining STS/clustering/retrieval
4425acd	41.30	37.0	105.3	sentence-transformers/stackexchange-duplicates;yahoo_answers_topics;stanfordnlp/snli;fancyzhx/dbpedia_14;glue;ms_marco;sentence-transformers/reddit-title-body;sentence-transformers/natural-questions;ag_news	discard	exp-31: increase hard neg top_k 7→10; CLS pooling; std InfoNCE; temp=0.05; target retrieval improvement SciFact>30 NFCorpus>15
3a5d519	43.84	37.0	105.3	sentence-transformers/reddit-title-body;yahoo_answers_topics;stanfordnlp/snli;glue;sentence-transformers/natural-questions;sentence-transformers/stackexchange-duplicates;ag_news;fancyzhx/dbpedia_14;ms_marco	keep	exp-32: reduce hard_neg_weight 2.0→1.5 in fine-tuning; CLS pooling; std InfoNCE; top_k=7; target clustering improvement while retaining retrieval
85bb1cf	55.16	37.0	105.3	sentence-transformers/reddit-title-body;fancyzhx/dbpedia_14;glue;yahoo_answers_topics;sentence-transformers/stackexchange-duplicates;ag_news;stanfordnlp/snli;sentence-transformers/natural-questions;ms_marco	keep	exp-33: reduce hard_neg_weight 1.5→1.0 in fine-tuning; CLS pooling; std InfoNCE; top_k=7; target further pair/STS improvement; new baseline exp-32 primary=43.84
40c0a61	53.48	37.0	105.3	sentence-transformers/natural-questions;sentence-transformers/stackexchange-duplicates;fancyzhx/dbpedia_14;stanfordnlp/snli;sentence-transformers/reddit-title-body;glue;ag_news;yahoo_answers_topics;ms_marco	discard	exp-34: reduce hard_neg_weight 1.0→0.5; CLS pooling; std InfoNCE; top_k=7; test if in-batch negatives dominate further helps; new champion exp-33 primary=55.16
a68d6c1	54.21	37.0	105.3	glue;sentence-transformers/natural-questions;sentence-transformers/stackexchange-duplicates;stanfordnlp/snli;yahoo_answers_topics;sentence-transformers/reddit-title-body;ag_news;ms_marco;fancyzhx/dbpedia_14	discard	exp-35: fine-tuning temp 0.05→0.03 (colder); hard_neg_weight=1.0; target retrieval boost from harder negatives; baseline exp-33 primary=55.16
6905657	53.78	69.3	106.4	sentence-transformers/stackexchange-duplicates;ag_news;yahoo_answers_topics;fancyzhx/dbpedia_14;ms_marco;glue;sentence-transformers/natural-questions;sentence-transformers/reddit-title-body;stanfordnlp/snli	discard	exp-36: contrastive batch_size 64→128 (2x in-batch negatives); hard_neg_weight=1.0; temp=0.05; target retrieval+clustering from denser negatives; baseline exp-33 primary=55.16
df8b8e1	53.90	37.0	105.3	ms_marco;yahoo_answers_topics;sentence-transformers/stackexchange-duplicates;sentence-transformers/reddit-title-body;ag_news;sentence-transformers/natural-questions;fancyzhx/dbpedia_14;glue;stanfordnlp/snli	discard	exp-37: hard_neg_mining top_k 7→14 (2x hard negs per query); batch=64; hard_neg_weight=1.0; temp=0.05; target retrieval boost from more negatives; baseline exp-33 primary=55.16
a100b4b	50.59	37.0	105.3	sentence-transformers/natural-questions;sentence-transformers/reddit-title-body;sentence-transformers/stackexchange-duplicates;ag_news;glue;ms_marco;yahoo_answers_topics;fancyzhx/dbpedia_14;stanfordnlp/snli	discard	exp-38: fine-tuning LR 1e-5→3e-5 (3x); hard_neg_weight=1.0; top_k=7; temp=0.05; target better optimization in fine-tuning; baseline exp-33 primary=55.16
560237d	53.15	37.0	120.3	stanfordnlp/snli;ms_marco;glue;yahoo_answers_topics;fancyzhx/dbpedia_14;sentence-transformers/reddit-title-body;sentence-transformers/natural-questions;sentence-transformers/stackexchange-duplicates;ag_news	discard	exp-39: contrastive duration 45→60 min (+33% contrastive training); hard_neg_weight=1.0; LR=1e-5; top_k=7; target retrieval+clustering from better representations; baseline exp-33 primary=55.16
429a02b	54.15	37.0	105.3	yahoo_answers_topics;sentence-transformers/natural-questions;fancyzhx/dbpedia_14;sentence-transformers/reddit-title-body;ag_news;stanfordnlp/snli;ms_marco;sentence-transformers/stackexchange-duplicates;glue	discard	exp-40: source_stratification=false (mixed-source batches vs per-source); hard_neg_weight=1.0; LR=1e-5; top_k=7; target diversity in contrastive batches; baseline exp-33 primary=55.16
43372b1	54.86	37.0	105.3	sentence-transformers/natural-questions;sentence-transformers/reddit-title-body;yahoo_answers_topics;sentence-transformers/stackexchange-duplicates;stanfordnlp/snli;fancyzhx/dbpedia_14;ag_news;glue;ms_marco	discard	exp-41: fine-tuning warmup_ratio 0.0→0.1 (LR warmup before hard-neg fine-tuning); hard_neg_weight=1.0; LR=1e-5; top_k=7; target smoother adaptation to hard negs; baseline exp-33 primary=55.16
30191ff	52.98	37.0	105.3	fancyzhx/dbpedia_14;sentence-transformers/natural-questions;ms_marco;glue;ag_news;yahoo_answers_topics;sentence-transformers/stackexchange-duplicates;sentence-transformers/reddit-title-body;stanfordnlp/snli	discard	exp-42: contrastive LR 5e-5→8e-5 (1.6x faster learning in contrastive); hard_neg_weight=1.0; top_k=7; temp=0.05; target better contrastive representations; baseline exp-33 primary=55.16
f37c1f8	52.96	37.2	105.3	glue;sentence-transformers/stackexchange-duplicates;fancyzhx/dbpedia_14;stanfordnlp/snli;sentence-transformers/reddit-title-body;sentence-transformers/natural-questions;yahoo_answers_topics;ag_news;ms_marco	discard	exp-43: cls_mean pooling (CLS+mean concat then project); hard_neg_weight=1.0; LR=1e-5; top_k=7; temp=0.05; target richer token info vs CLS-only; baseline exp-33 primary=55.16
6c7ed9a	44.53	34.4	7.3	ms_marco;sentence-transformers/natural-questions;sentence-transformers/reddit-title-body;stanfordnlp/snli;sentence-transformers/stackexchange-duplicates;glue;ag_news;yahoo_answers_topics;fancyzhx/dbpedia_14	discard	exp-44: latent_attn pooling (K=4 trainable queries cross-attend encoder output, NV-Embed-v2 style); 5-min exploration; hard_neg_weight=1.0; baseline exp-33 primary=55.16
cc5722d	44.39	32.5	7.5	fancyzhx/dbpedia_14;glue;ms_marco;yahoo_answers_topics;sentence-transformers/natural-questions;stanfordnlp/snli;sentence-transformers/stackexchange-duplicates;ag_news;sentence-transformers/reddit-title-body	discard	exp-45: CLS pooling quick baseline (2+3+2 min); hard_neg_weight=1.0; to compare vs exp-44 latent_attn same training duration; baseline exp-33 primary=55.16
5bf35c8	50.30	37.3	105.3	glue;ms_marco;ag_news;sentence-transformers/natural-questions;stanfordnlp/snli;sentence-transformers/stackexchange-duplicates;fancyzhx/dbpedia_14;yahoo_answers_topics;sentence-transformers/reddit-title-body	discard	exp-46: latent_attn pooling full run (15+45+45 min); K=4 trainable query vectors cross-attend encoder output; hard_neg_weight=1.0; NV-Embed-v2 style; baseline exp-33 primary=55.16
238760a	29.37	34.1	7.3	yahoo_answers_topics;sentence-transformers/stackexchange-duplicates;sentence-transformers/reddit-title-body;fancyzhx/dbpedia_14;stanfordnlp/snli;glue;sentence-transformers/natural-questions;ag_news;ms_marco	discard	exp-47: layer_weighted pooling quick (2+3+2 min); learnable softmax weights over 22 CLS layer outputs; baseline exp-45 CLS quick=44.39
0476869	54.54	36.4	105.3	yahoo_answers_topics;ms_marco;fancyzhx/dbpedia_14;stanfordnlp/snli;ag_news;sentence-transformers/stackexchange-duplicates;sentence-transformers/natural-questions;glue;hotpot_qa;sentence-transformers/reddit-title-body	discard	exp-48: add HotpotQA retrieval pairs (question→supporting passage); full run 15+45+5+45 min; CLS pooling; target retrieval (SciFact 44.5, NFCorpus 19.19); baseline exp-33 primary=55.16
c724792	55.76	36.4	65.3	fancyzhx/dbpedia_14;sentence-transformers/reddit-title-body;ag_news;yahoo_answers_topics;stanfordnlp/snli;glue;sentence-transformers/stackexchange-duplicates;sentence-transformers/natural-questions;ms_marco;hotpot_qa	keep	exp-49: HotpotQA data + short fine-tuning (5 min); fix exp-48 overfitting (45min FT on 8000 samples = 58 epochs hurt); contrastive 45min; FT 5min; baseline exp-33 primary=55.16
85503c3	55.71	37.0	65.3	stanfordnlp/snli;glue;ag_news;yahoo_answers_topics;fancyzhx/dbpedia_14;sentence-transformers/natural-questions;sentence-transformers/reddit-title-body;ms_marco;sentence-transformers/stackexchange-duplicates	discard	exp-50: ablation remove HotpotQA, keep 5-min FT; isolate whether improvement in exp-49 (55.76) came from HotpotQA data vs short FT; baseline exp-33 primary=55.16 (no HotpotQA, 5-min FT same)
75c2f5e	56.81	36.4	80.3	sentence-transformers/reddit-title-body;ms_marco;sentence-transformers/natural-questions;ag_news;yahoo_answers_topics;glue;hotpot_qa;stanfordnlp/snli;fancyzhx/dbpedia_14;sentence-transformers/stackexchange-duplicates	keep	exp-51: extend contrastive to 60min (was 45min); HotpotQA included; 5-min FT; hypothesis: model not fully converging at 45min; baseline exp-49 primary=55.76
d6ca110	56.45	36.4	110.3	hotpot_qa;glue;sentence-transformers/natural-questions;fancyzhx/dbpedia_14;stanfordnlp/snli;sentence-transformers/stackexchange-duplicates;yahoo_answers_topics;sentence-transformers/reddit-title-body;ms_marco;ag_news	discard	exp-52: extend contrastive to 90min (was 60min); HotpotQA included; 5-min FT; hypothesis: more training = better; baseline exp-51 primary=56.81
2307c46	56.17	41.4	80.3	fancyzhx/dbpedia_14;sentence-transformers/stackexchange-duplicates;sentence-transformers/natural-questions;yahoo_answers_topics;stanfordnlp/snli;trivia_qa;glue;ms_marco;hotpot_qa;sentence-transformers/reddit-title-body;ag_news	discard	exp-53: add TriviaQA retrieval pairs (question→answer+context); 60-min contrastive; HotpotQA included; baseline exp-51 primary=56.81
b8ff765	56.21	69.3	80.3	sentence-transformers/natural-questions;sentence-transformers/reddit-title-body;yahoo_answers_topics;hotpot_qa;ms_marco;fancyzhx/dbpedia_14;glue;sentence-transformers/stackexchange-duplicates;ag_news;stanfordnlp/snli	discard	exp-54: larger contrastive batch_size=128 (was 64); more in-batch negatives per InfoNCE step; 60-min contrastive; HotpotQA; baseline exp-51 primary=56.81
fa652df	56.11	36.4	80.3	fancyzhx/dbpedia_14;stanfordnlp/snli;ms_marco;yahoo_answers_topics;sentence-transformers/natural-questions;hotpot_qa;sentence-transformers/stackexchange-duplicates;sentence-transformers/reddit-title-body;ag_news;glue	discard	exp-55: lower temperature 0.04 (was 0.05) for contrastive+FT; 60-min contrastive; batch=64; HotpotQA; hypothesis: harder discrimination = better embeddings; baseline exp-51 primary=56.81
3b285aa	54.80	38.8	80.3	sentence-transformers/reddit-title-body;yahoo_answers_topics;sentence-transformers/stackexchange-duplicates;ag_news;glue;stanfordnlp/snli;fancyzhx/dbpedia_14;hotpot_qa;sentence-transformers/natural-questions;ms_marco;google-research-datasets/paws	discard	exp-56: add PAWS paraphrase pairs (adversarial) to fix SICK-R regression from HotpotQA; 60-min contrastive; temp=0.05; batch=64; baseline exp-51 primary=56.81
7453ea8	47.26	36.4	80.3	sentence-transformers/reddit-title-body;stanfordnlp/snli;fancyzhx/dbpedia_14;hotpot_qa;glue;ag_news;yahoo_answers_topics;sentence-transformers/natural-questions;sentence-transformers/stackexchange-duplicates;ms_marco	discard	exp-57: symmetric InfoNCE (bidirectional query→pos + pos→query); 60-min contrastive; HotpotQA; hypothesis: 2x training signal improves representations; baseline exp-51 primary=56.81
e4f9140	56.31	36.4	80.3	fancyzhx/dbpedia_14;sentence-transformers/stackexchange-duplicates;sentence-transformers/natural-questions;sentence-transformers/reddit-title-body;stanfordnlp/snli;yahoo_answers_topics;glue;hotpot_qa;ms_marco;ag_news	discard	exp-58: Matryoshka Representation Learning (MRL) - InfoNCE at dims [768,512,256,128,64] averaged; 60-min contrastive; HotpotQA; hypothesis: MRL forces better info packing in early dims; baseline exp-51 primary=56.81
0adc323	55.26	37.3	85.3	yahoo_answers_topics;glue;sentence-transformers/stackexchange-duplicates;stanfordnlp/snli;hotpot_qa;sentence-transformers/natural-questions;ms_marco;fancyzhx/dbpedia_14;ag_news;sentence-transformers/reddit-title-body	discard	exp-59: extend warmup to 20min (was 15min); 60-min contrastive; HotpotQA; hypothesis: more paraphrase warmup fixes SICK-R regression; baseline exp-51 primary=56.81
906100e	0.00	0.0	0.0		crash	exp-60: implement actual cosine LR decay (was broken - lr_schedule config had no effect); warmup+cosine_decay now applied to contrastive; 60-min contrastive; baseline exp-51 primary=56.81
74525b0	57.11	36.4	80.3	hotpot_qa;glue;ms_marco;fancyzhx/dbpedia_14;ag_news;sentence-transformers/reddit-title-body;stanfordnlp/snli;sentence-transformers/stackexchange-duplicates;yahoo_answers_topics;sentence-transformers/natural-questions	keep	exp-61: fix crash from exp-60; actual cosine LR decay working; warmup uses linear_warmup_constant; contrastive uses cosine_decay from 5e-5 to 0; 60-min; HotpotQA; baseline exp-51 primary=56.81
56ec387	56.62	36.4	80.3	hotpot_qa;sentence-transformers/stackexchange-duplicates;fancyzhx/dbpedia_14;ag_news;glue;stanfordnlp/snli;sentence-transformers/natural-questions;yahoo_answers_topics;sentence-transformers/reddit-title-body;ms_marco	discard	exp-62: higher contrastive LR 8e-5 (was 5e-5) with cosine decay; 60-min; HotpotQA; hypothesis: higher peak LR + cosine decay = better convergence; baseline exp-61 primary=57.11
03052a0	55.56	36.4	80.3	ms_marco;sentence-transformers/stackexchange-duplicates;fancyzhx/dbpedia_14;stanfordnlp/snli;hotpot_qa;yahoo_answers_topics;sentence-transformers/reddit-title-body;ag_news;glue;sentence-transformers/natural-questions	discard	exp-63: lower contrastive LR 3e-5 (was 5e-5) with cosine decay; 60-min; HotpotQA; hypothesis: gentler learning keeps STS quality; baseline exp-61 primary=57.11
c66573a	57.00	36.4	80.3	hotpot_qa;glue;ms_marco;stanfordnlp/snli;yahoo_answers_topics;ag_news;sentence-transformers/reddit-title-body;fancyzhx/dbpedia_14;sentence-transformers/stackexchange-duplicates;sentence-transformers/natural-questions	discard	exp-64: warmup uses cosine_decay LR=1.5e-4 (was linear_warmup_constant LR=1e-4); contrastive cosine_decay 5e-5; 60-min; HotpotQA; baseline exp-61 primary=57.11
7217cbb	55.81	37.2	80.3	ag_news;ms_marco;sentence-transformers/stackexchange-duplicates;stanfordnlp/snli;glue;yahoo_answers_topics;sentence-transformers/natural-questions;sentence-transformers/reddit-title-body;fancyzhx/dbpedia_14;hotpot_qa	discard	exp-65: instruction-tuning for embeddings - task-specific query prefixes (e.g. 'Retrieve a passage that answers:'); 60-min cosine_decay contrastive; HotpotQA; baseline exp-61 primary=57.11
