{"commit": "5a31158", "primary_score": 37.7738, "memory_gb": 36.4, "training_min": 80.3, "datasets": ["sentence-transformers/reddit-title-body", "fancyzhx/dbpedia_14", "sentence-transformers/stackexchange-duplicates", "ms_marco", "stanfordnlp/snli", "ag_news", "glue", "sentence-transformers/natural-questions", "yahoo_answers_topics", "hotpot_qa"], "status": "discard", "description": "exp-70: activate hard neg loss in fine-tuning (weight=2.0 vs 1.0 which was disabled); hypothesis: explicit hard negs boost retrieval; baseline exp-67 primary=57.51", "task_scores": {"sts_bench": 61.57, "sick_r": 60.87, "twitter_url": 70.89, "sprint_dup": 60.31, "20news": 12.92, "reddit_clust": 10.54, "scifact": 16.47, "nfcorpus": 9.82}, "timestamp": "2026-03-16T13:22:56.681734+00:00", "config": {"base_model": "answerdotai/ModernBERT-base", "embedding_dim": 768, "projection_dim": 768, "pooling": "cls", "max_seq_length": 512, "normalize_embeddings": true, "stages": {"warmup": {"duration_minutes": 15, "data": "qqp_se_paraphrase", "loss": "infonce", "temperature": 0.1, "learning_rate": 0.0001, "lr_schedule": "linear_warmup_constant", "warmup_ratio": 0.1, "batch_size": 64, "negatives": "in_batch_only", "freeze_encoder_layers": 0}, "contrastive": {"duration_minutes": 60, "data": "all_curated", "loss": "infonce", "temperature": 0.05, "learning_rate": 5e-05, "lr_schedule": "cosine_decay", "warmup_ratio": 0.05, "batch_size": 64, "negatives": "in_batch_plus_explicit", "source_stratification": true}, "hard_neg_mining": {"duration_minutes": 5, "top_k": 7, "batch_size": 128, "min_similarity": 0.3}, "fine_tuning": {"duration_minutes": 5, "data": "all_curated_with_hard_negs", "loss": "infonce", "temperature": 0.05, "learning_rate": 1e-05, "lr_schedule": "cosine_decay", "warmup_ratio": 0.0, "batch_size": 32, "hard_neg_weight": 2.0}}, "optimizer": {"type": "adamw", "betas": [0.9, 0.999], "eps": 1e-08, "weight_decay": 0.01}, "memory": {"max_peak_gb": 55, "gradient_accumulation_steps": 4}}, "num_params_M": 149.0, "decontam_removed": 0, "wandb_run_id": "cvzakhsy"}
{"commit": "793bd09", "primary_score": 53.8543, "memory_gb": 69.9, "training_min": 80.4, "datasets": ["stanfordnlp/snli", "sentence-transformers/stackexchange-duplicates", "sentence-transformers/reddit-title-body", "hotpot_qa", "ms_marco", "fancyzhx/dbpedia_14", "sentence-transformers/natural-questions", "yahoo_answers_topics", "glue", "ag_news"], "status": "discard", "description": "exp-74: fix NaN gradient bug (attention mask -inf\u2192-1e9 prevents all-masked softmax rows) + max_seq_length=512 (was 256 for all prior exps) + data scaling 50K/dataset (~328K pairs); batch=64 no grad_accum; hypothesis: longer sequences improve retrieval tasks; baseline exp-67 primary=57.51", "task_scores": {"sts_bench": 73.68, "sick_r": 71.31, "twitter_url": 70.63, "sprint_dup": 78.69, "20news": 39.12, "reddit_clust": 40.35, "scifact": 40.51, "nfcorpus": 21.0}, "timestamp": "2026-03-16T17:20:25.350203+00:00", "config": {"base_model": "answerdotai/ModernBERT-base", "projection_dim": 768, "pooling": "cls", "max_seq_length": 512, "normalize_embeddings": true, "stages": {"warmup": {"duration_minutes": 15, "data": "qqp_se_paraphrase", "loss": "infonce", "temperature": 0.1, "learning_rate": 0.0001, "lr_schedule": "linear_warmup_constant", "warmup_ratio": 0.1, "batch_size": 64, "negatives": "in_batch_only", "freeze_encoder_layers": 0, "false_neg_threshold": 0.0}, "contrastive": {"duration_minutes": 60, "data": "all_curated", "loss": "infonce", "temperature": 0.05, "learning_rate": 5e-05, "lr_schedule": "cosine_decay", "warmup_ratio": 0.05, "batch_size": 64, "negatives": "in_batch_plus_explicit", "source_stratification": true, "false_neg_threshold": 0.7}, "hard_neg_mining": {"duration_minutes": 5, "top_k": 7, "batch_size": 128, "min_similarity": 0.3}, "fine_tuning": {"duration_minutes": 5, "data": "all_curated_with_hard_negs", "loss": "infonce", "temperature": 0.05, "learning_rate": 1e-05, "lr_schedule": "cosine_decay", "warmup_ratio": 0.0, "batch_size": 64, "hard_neg_weight": 0.0, "false_neg_threshold": 0.0}}, "optimizer": {"type": "adamw", "betas": [0.9, 0.999], "eps": 1e-08, "weight_decay": 0.01, "llrd_decay": 1.0, "ema_decay": 0.0}, "data": {"max_rows_per_dataset": 50000}, "memory": {"max_peak_gb": 55, "gradient_accumulation_steps": 1, "gradient_checkpointing": false}}, "num_params_M": 149.0, "decontam_removed": 0, "wandb_run_id": "op9oqbnp"}
{"commit": "8a94602", "primary_score": 54.5968, "memory_gb": 7.0, "training_min": 80.5, "datasets": ["ms_marco", "sentence-transformers/natural-questions", "yahoo_answers_topics", "glue", "sentence-transformers/reddit-title-body", "hotpot_qa", "ag_news", "fancyzhx/dbpedia_14", "stanfordnlp/snli", "sentence-transformers/stackexchange-duplicates"], "status": "discard", "description": "exp-75: mean pooling (was CLS for all prior exps); all other params match exp-67 baseline; hypothesis: mean pooling captures richer all-token representation vs single CLS token, expected to improve retrieval and clustering; baseline exp-67 primary=57.51 (CLS pooling)", "task_scores": {"sts_bench": 74.72, "sick_r": 71.76, "twitter_url": 71.92, "sprint_dup": 76.16, "20news": 40.46, "reddit_clust": 43.28, "scifact": 41.72, "nfcorpus": 21.22}, "timestamp": "2026-03-16T19:01:25.469929+00:00", "config": {"base_model": "answerdotai/ModernBERT-base", "projection_dim": 768, "pooling": "mean", "max_seq_length": 256, "normalize_embeddings": true, "stages": {"warmup": {"duration_minutes": 15, "data": "qqp_se_paraphrase", "loss": "infonce", "temperature": 0.1, "learning_rate": 0.0001, "lr_schedule": "linear_warmup_constant", "warmup_ratio": 0.1, "batch_size": 64, "negatives": "in_batch_only", "freeze_encoder_layers": 0, "false_neg_threshold": 0.0}, "contrastive": {"duration_minutes": 60, "data": "all_curated", "loss": "infonce", "temperature": 0.05, "learning_rate": 5e-05, "lr_schedule": "cosine_decay", "warmup_ratio": 0.05, "batch_size": 64, "negatives": "in_batch_plus_explicit", "source_stratification": true, "false_neg_threshold": 0.0}, "hard_neg_mining": {"duration_minutes": 5, "top_k": 7, "batch_size": 128, "min_similarity": 0.3}, "fine_tuning": {"duration_minutes": 5, "data": "all_curated_with_hard_negs", "loss": "infonce", "temperature": 0.05, "learning_rate": 1e-05, "lr_schedule": "cosine_decay", "warmup_ratio": 0.0, "batch_size": 64, "hard_neg_weight": 0.0, "false_neg_threshold": 0.0}}, "optimizer": {"type": "adamw", "betas": [0.9, 0.999], "eps": 1e-08, "weight_decay": 0.01, "llrd_decay": 1.0, "ema_decay": 0.0}, "data": {"max_rows_per_dataset": 30000}, "memory": {"max_peak_gb": 55, "gradient_accumulation_steps": 1, "gradient_checkpointing": true}}, "num_params_M": 149.0, "decontam_removed": 0, "wandb_run_id": "tc61pk8h"}
{"commit": "7db78ab", "primary_score": 0.0, "status": "crash", "description": "exp-71: disable source_stratification (mixed batches instead of single-source); killed manually \u2014 NaN loss from first step, root cause was -inf attention masks not stratification; baseline exp-67 primary=57.51", "task_scores": {}, "timestamp": "2026-03-16T13:23:00+00:00"}
{"commit": "7622d8a", "primary_score": 0.0, "status": "crash", "description": "exp-72: data scaling 30K\u219250K/dataset + grad accum fix; NaN loss \u2014 root cause was -inf in attention masks (misattributed to LLRD/EMA/grad_ckpt); multiple attempts, all NaN; baseline exp-67 primary=57.51", "task_scores": {}, "timestamp": "2026-03-16T14:30:00+00:00"}
{"commit": "5285ea5", "primary_score": 0.0, "status": "crash", "description": "exp-73: max_seq_length=512 + batch=32 + grad_accum=2; NaN loss \u2014 same -inf attention mask root cause; baseline exp-67 primary=57.51", "task_scores": {}, "timestamp": "2026-03-16T15:00:00+00:00"}
{"commit": "aa03013", "primary_score": 53.16, "status": "discard", "description": "exp-76: disable fine-tuning stage (duration=0) + extend contrastive to 65min; eval hung during clustering task (fixed in c55dcaf); scores from run.log; baseline exp-67 primary=57.51", "task_scores": {"sts_bench": 74.74, "sick_r": 74.59, "twitter_url": 66.24, "sprint_dup": 72.26, "20news": 42.47, "reddit_clust": 42.53, "scifact": 33.65, "nfcorpus": 21.5}, "timestamp": "2026-03-16T17:05:00+00:00"}
{"commit": "7ace5d0", "primary_score": 52.8765, "memory_gb": 37.3, "training_min": 80.6, "datasets": ["glue", "ms_marco", "ag_news", "hotpot_qa", "stanfordnlp/snli", "sentence-transformers/stackexchange-duplicates", "sentence-transformers/reddit-title-body", "sentence-transformers/natural-questions", "yahoo_answers_topics", "fancyzhx/dbpedia_14"], "status": "discard", "description": "exp-77: SimCLR projection head (2-layer MLP 768\u2192768\u2192768 with GELU, train on projected space, eval on raw encoder); all other params match exp-67 baseline; hypothesis: projection head absorbs task noise \u2192 cleaner encoder representations \u2192 better generalization across all task types; baseline exp-67 primary=57.51", "task_scores": {"sts_bench": 76.16, "sick_r": 69.89, "twitter_url": 72.55, "sprint_dup": 79.24, "20news": 42.28, "scifact": 29.43, "nfcorpus": 19.47}, "timestamp": "2026-03-16T22:48:18.889933+00:00", "config": {"base_model": "answerdotai/ModernBERT-base", "projection_dim": 768, "pooling": "cls", "max_seq_length": 256, "normalize_embeddings": true, "simclr_head": true, "stages": {"warmup": {"duration_minutes": 15, "data": "qqp_se_paraphrase", "loss": "infonce", "temperature": 0.1, "learning_rate": 0.0001, "lr_schedule": "linear_warmup_constant", "warmup_ratio": 0.1, "batch_size": 64, "negatives": "in_batch_only", "freeze_encoder_layers": 0, "false_neg_threshold": 0.0}, "contrastive": {"duration_minutes": 60, "data": "all_curated", "loss": "infonce", "temperature": 0.05, "learning_rate": 5e-05, "lr_schedule": "cosine_decay", "warmup_ratio": 0.05, "batch_size": 64, "negatives": "in_batch_plus_explicit", "source_stratification": true, "false_neg_threshold": 0.0}, "hard_neg_mining": {"duration_minutes": 5, "top_k": 7, "batch_size": 128, "min_similarity": 0.3}, "fine_tuning": {"duration_minutes": 5, "data": "all_curated_with_hard_negs", "loss": "infonce", "temperature": 0.05, "learning_rate": 1e-05, "lr_schedule": "cosine_decay", "warmup_ratio": 0.0, "batch_size": 64, "hard_neg_weight": 0.0, "false_neg_threshold": 0.0}}, "optimizer": {"type": "adamw", "betas": [0.9, 0.999], "eps": 1e-08, "weight_decay": 0.01, "llrd_decay": 1.0, "ema_decay": 0.0}, "data": {"max_rows_per_dataset": 30000}, "memory": {"max_peak_gb": 55, "gradient_accumulation_steps": 1, "gradient_checkpointing": false}}, "num_params_M": 150.2, "decontam_removed": 0, "wandb_run_id": "njk0xr4j"}
{"commit": "d6191a1", "primary_score": 52.1986, "memory_gb": 37.2, "training_min": 80.5, "datasets": ["yahoo_answers_topics", "hotpot_qa", "ag_news", "sentence-transformers/stackexchange-duplicates", "sentence-transformers/natural-questions", "sentence-transformers/reddit-title-body", "ms_marco", "fancyzhx/dbpedia_14", "glue", "stanfordnlp/snli"], "status": "discard", "description": "exp-78: data scaling 50K/dataset (was 30K in exp-67 baseline, ~328K\u2192~500K pairs); also fix: cache key now includes max_rows (previously stale 30K cache was reused); all other params match exp-67; hypothesis: more diverse training signal improves generalization; baseline exp-67 primary=57.51", "task_scores": {"sts_bench": 73.72, "sick_r": 71.94, "twitter_url": 71.02, "sprint_dup": 70.99, "20news": 41.68, "scifact": 31.87, "nfcorpus": 20.21}, "timestamp": "2026-03-17T00:38:46.326259+00:00", "config": {"base_model": "answerdotai/ModernBERT-base", "projection_dim": 768, "pooling": "cls", "max_seq_length": 256, "normalize_embeddings": true, "simclr_head": false, "stages": {"warmup": {"duration_minutes": 15, "data": "qqp_se_paraphrase", "loss": "infonce", "temperature": 0.1, "learning_rate": 0.0001, "lr_schedule": "linear_warmup_constant", "warmup_ratio": 0.1, "batch_size": 64, "negatives": "in_batch_only", "freeze_encoder_layers": 0, "false_neg_threshold": 0.0}, "contrastive": {"duration_minutes": 60, "data": "all_curated", "loss": "infonce", "temperature": 0.05, "learning_rate": 5e-05, "lr_schedule": "cosine_decay", "warmup_ratio": 0.05, "batch_size": 64, "negatives": "in_batch_plus_explicit", "source_stratification": true, "false_neg_threshold": 0.0}, "hard_neg_mining": {"duration_minutes": 5, "top_k": 7, "batch_size": 128, "min_similarity": 0.3}, "fine_tuning": {"duration_minutes": 5, "data": "all_curated_with_hard_negs", "loss": "infonce", "temperature": 0.05, "learning_rate": 1e-05, "lr_schedule": "cosine_decay", "warmup_ratio": 0.0, "batch_size": 64, "hard_neg_weight": 0.0, "false_neg_threshold": 0.0}}, "optimizer": {"type": "adamw", "betas": [0.9, 0.999], "eps": 1e-08, "weight_decay": 0.01, "llrd_decay": 1.0, "ema_decay": 0.0}, "data": {"max_rows_per_dataset": 50000}, "memory": {"max_peak_gb": 55, "gradient_accumulation_steps": 1, "gradient_checkpointing": false}}, "num_params_M": 149.0, "decontam_removed": 308, "wandb_run_id": "ppekc3b2"}
{"commit": "5fe20a3", "primary_score": 53.3919, "memory_gb": 37.9, "training_min": 80.5, "datasets": ["stanfordnlp/snli", "glue", "ms_marco", "yahoo_answers_topics", "sentence-transformers/reddit-title-body", "sentence-transformers/stackexchange-duplicates", "sentence-transformers/natural-questions", "ag_news", "hotpot_qa", "fancyzhx/dbpedia_14"], "status": "discard", "description": "exp-79: reproduce exp-67 baseline \u2014 revert attention masking to padding-only (no sliding window), restore grad_accum=4+batch=32 for FT; hypothesis: sliding window mask introduced in exp-73 caused regression in subsequent experiments; expected: ~57.5 (match exp-67); baseline exp-67 primary=57.51", "task_scores": {"sts_bench": 73.86, "sick_r": 72.9, "twitter_url": 69.37, "sprint_dup": 71.18, "20news": 40.02, "scifact": 43.83, "nfcorpus": 18.29}, "timestamp": "2026-03-17T02:15:52.059247+00:00", "config": {"base_model": "answerdotai/ModernBERT-base", "projection_dim": 768, "pooling": "cls", "max_seq_length": 256, "normalize_embeddings": true, "simclr_head": false, "stages": {"warmup": {"duration_minutes": 15, "data": "qqp_se_paraphrase", "loss": "infonce", "temperature": 0.1, "learning_rate": 0.0001, "lr_schedule": "linear_warmup_constant", "warmup_ratio": 0.1, "batch_size": 64, "negatives": "in_batch_only", "freeze_encoder_layers": 0, "false_neg_threshold": 0.0}, "contrastive": {"duration_minutes": 60, "data": "all_curated", "loss": "infonce", "temperature": 0.05, "learning_rate": 5e-05, "lr_schedule": "cosine_decay", "warmup_ratio": 0.05, "batch_size": 64, "negatives": "in_batch_plus_explicit", "source_stratification": true, "false_neg_threshold": 0.0}, "hard_neg_mining": {"duration_minutes": 5, "top_k": 7, "batch_size": 128, "min_similarity": 0.3}, "fine_tuning": {"duration_minutes": 5, "data": "all_curated_with_hard_negs", "loss": "infonce", "temperature": 0.05, "learning_rate": 1e-05, "lr_schedule": "cosine_decay", "warmup_ratio": 0.0, "batch_size": 32, "hard_neg_weight": 0.0, "false_neg_threshold": 0.0}}, "optimizer": {"type": "adamw", "betas": [0.9, 0.999], "eps": 1e-08, "weight_decay": 0.01, "llrd_decay": 1.0, "ema_decay": 0.0}, "data": {"max_rows_per_dataset": 50000}, "memory": {"max_peak_gb": 55, "gradient_accumulation_steps": 4, "gradient_checkpointing": false}}, "num_params_M": 149.0, "decontam_removed": 0, "wandb_run_id": "6rdna0pu"}
{"commit": "fa5f2c5", "primary_score": 52.9584, "memory_gb": 39.0, "training_min": 80.4, "datasets": ["ag_news", "stanfordnlp/snli", "sentence-transformers/natural-questions", "fancyzhx/dbpedia_14", "hotpot_qa", "yahoo_answers_topics", "sentence-transformers/reddit-title-body", "glue", "sentence-transformers/stackexchange-duplicates", "ms_marco"], "status": "discard", "description": "exp-80: LLRD decay=0.95 (lower layers get smaller LR, standard BERT FT technique) + increase MTEB timeout to 10min (fix RedditClustering timeout); grad_accum=4, batch=64/32, CLS pooling, seq_len=256; hypothesis: LLRD preserves pretrained lower-layer features while adapting upper layers \u2192 +1-2 points; baseline exp-67 primary=57.51", "task_scores": {"sts_bench": 74.91, "sick_r": 72.12, "twitter_url": 71.69, "sprint_dup": 61.77, "20news": 37.75, "reddit_clust": 40.65, "scifact": 46.42, "nfcorpus": 18.36}, "timestamp": "2026-03-17T04:03:59.084831+00:00", "config": {"base_model": "answerdotai/ModernBERT-base", "projection_dim": 768, "pooling": "cls", "max_seq_length": 256, "normalize_embeddings": true, "simclr_head": false, "stages": {"warmup": {"duration_minutes": 15, "data": "qqp_se_paraphrase", "loss": "infonce", "temperature": 0.1, "learning_rate": 0.0001, "lr_schedule": "linear_warmup_constant", "warmup_ratio": 0.1, "batch_size": 64, "negatives": "in_batch_only", "freeze_encoder_layers": 0, "false_neg_threshold": 0.0}, "contrastive": {"duration_minutes": 60, "data": "all_curated", "loss": "infonce", "temperature": 0.05, "learning_rate": 5e-05, "lr_schedule": "cosine_decay", "warmup_ratio": 0.05, "batch_size": 64, "negatives": "in_batch_plus_explicit", "source_stratification": true, "false_neg_threshold": 0.0}, "hard_neg_mining": {"duration_minutes": 5, "top_k": 7, "batch_size": 128, "min_similarity": 0.3}, "fine_tuning": {"duration_minutes": 5, "data": "all_curated_with_hard_negs", "loss": "infonce", "temperature": 0.05, "learning_rate": 1e-05, "lr_schedule": "cosine_decay", "warmup_ratio": 0.0, "batch_size": 32, "hard_neg_weight": 0.0, "false_neg_threshold": 0.0}}, "optimizer": {"type": "adamw", "betas": [0.9, 0.999], "eps": 1e-08, "weight_decay": 0.01, "llrd_decay": 0.95, "ema_decay": 0.0}, "data": {"max_rows_per_dataset": 50000}, "memory": {"max_peak_gb": 55, "gradient_accumulation_steps": 4, "gradient_checkpointing": false}}, "num_params_M": 149.0, "decontam_removed": 0, "wandb_run_id": "lmsgq4t8"}
{"commit": "09a71cd", "primary_score": 53.6687, "memory_gb": 37.9, "training_min": 80.4, "datasets": ["stanfordnlp/snli", "sentence-transformers/stackexchange-duplicates", "glue", "sentence-transformers/natural-questions", "fancyzhx/dbpedia_14", "hotpot_qa", "ms_marco", "ag_news", "sentence-transformers/reddit-title-body", "yahoo_answers_topics"], "status": "discard", "description": "exp-81: fix critical bug \u2014 grad_accum=1 (exp-67 config said 4 but code had NO grad_accum implementation, so actual was 1; exps 78-80 accidentally used grad_accum=4 causing 4x larger effective batch and fewer optimizer steps); LLRD=0.95; MTEB timeout=10min; hypothesis: fixing grad_accum to match exp-67's actual behavior + LLRD should reproduce/beat 57.51", "task_scores": {"sts_bench": 73.43, "sick_r": 73.14, "twitter_url": 74.53, "sprint_dup": 71.63, "20news": 38.11, "reddit_clust": 40.48, "scifact": 42.78, "nfcorpus": 18.61}, "timestamp": "2026-03-17T05:46:49.339228+00:00", "config": {"base_model": "answerdotai/ModernBERT-base", "projection_dim": 768, "pooling": "cls", "max_seq_length": 256, "normalize_embeddings": true, "simclr_head": false, "stages": {"warmup": {"duration_minutes": 15, "data": "qqp_se_paraphrase", "loss": "infonce", "temperature": 0.1, "learning_rate": 0.0001, "lr_schedule": "linear_warmup_constant", "warmup_ratio": 0.1, "batch_size": 64, "negatives": "in_batch_only", "freeze_encoder_layers": 0, "false_neg_threshold": 0.0}, "contrastive": {"duration_minutes": 60, "data": "all_curated", "loss": "infonce", "temperature": 0.05, "learning_rate": 5e-05, "lr_schedule": "cosine_decay", "warmup_ratio": 0.05, "batch_size": 64, "negatives": "in_batch_plus_explicit", "source_stratification": true, "false_neg_threshold": 0.0}, "hard_neg_mining": {"duration_minutes": 5, "top_k": 7, "batch_size": 128, "min_similarity": 0.3}, "fine_tuning": {"duration_minutes": 5, "data": "all_curated_with_hard_negs", "loss": "infonce", "temperature": 0.05, "learning_rate": 1e-05, "lr_schedule": "cosine_decay", "warmup_ratio": 0.0, "batch_size": 64, "hard_neg_weight": 0.0, "false_neg_threshold": 0.0}}, "optimizer": {"type": "adamw", "betas": [0.9, 0.999], "eps": 1e-08, "weight_decay": 0.01, "llrd_decay": 0.95, "ema_decay": 0.0}, "data": {"max_rows_per_dataset": 50000}, "memory": {"max_peak_gb": 55, "gradient_accumulation_steps": 1, "gradient_checkpointing": false}}, "num_params_M": 149.0, "decontam_removed": 0, "wandb_run_id": "zftdpszw"}
