{"commit": "22317aa", "primary_score": 0.0, "memory_gb": 0.0, "training_min": 0.0, "datasets": [], "status": "crash", "description": "exp-101: replace SNLI with AllNLI triplets (sentence-transformers/all-nli, triplet config); AllNLI = SNLI+MNLI with hard negatives (anchor/positive/negative); adds MNLI genre diversity + contrastive hard negatives; FEVER removed (hurt pair_class); 12 datasets, 140min contrastive; hypothesis: hard negatives from AllNLI improve STS/pair_class while maintaining retrieval; baseline exp-98 primary=58.69", "task_scores": {}, "timestamp": "2026-03-19T20:07:56.726602+00:00", "config": {"base_model": "answerdotai/ModernBERT-base", "projection_dim": 768, "pooling": "cls", "max_seq_length": 256, "normalize_embeddings": true, "simclr_head": false, "stages": {"warmup": {"duration_minutes": 15, "data": "qqp_se_paraphrase", "loss": "infonce", "temperature": 0.1, "learning_rate": 0.0001, "lr_schedule": "linear_warmup_constant", "warmup_ratio": 0.1, "batch_size": 64, "negatives": "in_batch_only", "freeze_encoder_layers": 0, "false_neg_threshold": 0.0}, "contrastive": {"duration_minutes": 140, "data": "all_curated", "loss": "infonce", "temperature": 0.05, "learning_rate": 5e-05, "lr_schedule": "cosine_decay", "warmup_ratio": 0.05, "batch_size": 64, "negatives": "in_batch_plus_explicit", "source_stratification": true, "false_neg_threshold": 0.0}, "hard_neg_mining": {"duration_minutes": 5, "top_k": 7, "batch_size": 128, "min_similarity": 0.3}, "fine_tuning": {"duration_minutes": 5, "data": "all_curated_with_hard_negs", "loss": "infonce", "temperature": 0.05, "learning_rate": 1e-05, "lr_schedule": "cosine_decay", "warmup_ratio": 0.0, "batch_size": 64, "hard_neg_weight": 0.0, "false_neg_threshold": 0.0}}, "optimizer": {"type": "adamw", "betas": [0.9, 0.999], "eps": 1e-08, "weight_decay": 0.01, "llrd_decay": 1.0, "ema_decay": 0.0}, "data": {"max_rows_per_dataset": 100000}, "memory": {"max_peak_gb": 55, "gradient_accumulation_steps": 1, "gradient_checkpointing": false}}, "num_params_M": null, "decontam_removed": 0}
{"commit": "22317aa", "primary_score": 0.0, "memory_gb": 0.0, "training_min": 0.0, "datasets": [], "status": "crash", "description": "exp-101: replace SNLI with AllNLI triplets (sentence-transformers/all-nli, triplet config); AllNLI = SNLI+MNLI with hard negatives (anchor/positive/negative); adds MNLI genre diversity + contrastive hard negatives; FEVER removed (hurt pair_class); 12 datasets, 140min contrastive; hypothesis: hard negatives from AllNLI improve STS/pair_class while maintaining retrieval; baseline exp-98 primary=58.69", "task_scores": {}, "timestamp": "2026-03-19T20:07:59.131839+00:00", "config": {"base_model": "answerdotai/ModernBERT-base", "projection_dim": 768, "pooling": "cls", "max_seq_length": 256, "normalize_embeddings": true, "simclr_head": false, "stages": {"warmup": {"duration_minutes": 15, "data": "qqp_se_paraphrase", "loss": "infonce", "temperature": 0.1, "learning_rate": 0.0001, "lr_schedule": "linear_warmup_constant", "warmup_ratio": 0.1, "batch_size": 64, "negatives": "in_batch_only", "freeze_encoder_layers": 0, "false_neg_threshold": 0.0}, "contrastive": {"duration_minutes": 140, "data": "all_curated", "loss": "infonce", "temperature": 0.05, "learning_rate": 5e-05, "lr_schedule": "cosine_decay", "warmup_ratio": 0.05, "batch_size": 64, "negatives": "in_batch_plus_explicit", "source_stratification": true, "false_neg_threshold": 0.0}, "hard_neg_mining": {"duration_minutes": 5, "top_k": 7, "batch_size": 128, "min_similarity": 0.3}, "fine_tuning": {"duration_minutes": 5, "data": "all_curated_with_hard_negs", "loss": "infonce", "temperature": 0.05, "learning_rate": 1e-05, "lr_schedule": "cosine_decay", "warmup_ratio": 0.0, "batch_size": 64, "hard_neg_weight": 0.0, "false_neg_threshold": 0.0}}, "optimizer": {"type": "adamw", "betas": [0.9, 0.999], "eps": 1e-08, "weight_decay": 0.01, "llrd_decay": 1.0, "ema_decay": 0.0}, "data": {"max_rows_per_dataset": 100000}, "memory": {"max_peak_gb": 55, "gradient_accumulation_steps": 1, "gradient_checkpointing": false}}, "num_params_M": null, "decontam_removed": 0}
{"commit": "2d6e409", "primary_score": 55.5044, "memory_gb": 38.1, "training_min": 170.5, "datasets": ["fancyzhx/dbpedia_14", "ag_news", "sentence-transformers/reddit-title-body", "hotpot_qa", "ms_marco", "sentence-transformers/s2orc", "sentence-transformers/natural-questions", "stanfordnlp/snli", "sentence-transformers/stackexchange-duplicates", "qiaojin/PubMedQA", "glue", "yahoo_answers_topics"], "status": "discard", "description": "exp-102: re-enable hard negative fine-tuning (weight=1.0, was disabled at 0.0 since exp-71) + extend to 15min (was 5min); mined hard negs are computed but currently wasted; weight=1.0 treats hard negs equal to in-batch (2.0 crashed exp-70); 15min gives ~3 passes over 8K mined pairs; hypothesis: properly using hard negatives improves retrieval (SciFact/NFCorpus); same data as exp-98 (SNLI restored, AllNLI OOM'd); baseline exp-98 primary=58.69", "task_scores": {"sts_bench": 76.66, "sick_r": 72.69, "twitter_url": 77.14, "sprint_dup": 86.18, "20news": 29.75, "reddit_clust": 33.86, "scifact": 48.99, "nfcorpus": 20.41}, "timestamp": "2026-03-19T23:22:41.212349+00:00", "config": {"base_model": "answerdotai/ModernBERT-base", "projection_dim": 768, "pooling": "cls", "max_seq_length": 256, "normalize_embeddings": true, "simclr_head": false, "stages": {"warmup": {"duration_minutes": 15, "data": "qqp_se_paraphrase", "loss": "infonce", "temperature": 0.1, "learning_rate": 0.0001, "lr_schedule": "linear_warmup_constant", "warmup_ratio": 0.1, "batch_size": 64, "negatives": "in_batch_only", "freeze_encoder_layers": 0, "false_neg_threshold": 0.0}, "contrastive": {"duration_minutes": 140, "data": "all_curated", "loss": "infonce", "temperature": 0.05, "learning_rate": 5e-05, "lr_schedule": "cosine_decay", "warmup_ratio": 0.05, "batch_size": 64, "negatives": "in_batch_plus_explicit", "source_stratification": true, "false_neg_threshold": 0.0}, "hard_neg_mining": {"duration_minutes": 5, "top_k": 7, "batch_size": 128, "min_similarity": 0.3}, "fine_tuning": {"duration_minutes": 15, "data": "all_curated_with_hard_negs", "loss": "infonce", "temperature": 0.05, "learning_rate": 1e-05, "lr_schedule": "cosine_decay", "warmup_ratio": 0.0, "batch_size": 64, "hard_neg_weight": 1.0, "false_neg_threshold": 0.0}}, "optimizer": {"type": "adamw", "betas": [0.9, 0.999], "eps": 1e-08, "weight_decay": 0.01, "llrd_decay": 1.0, "ema_decay": 0.0}, "data": {"max_rows_per_dataset": 100000}, "memory": {"max_peak_gb": 55, "gradient_accumulation_steps": 1, "gradient_checkpointing": false}}, "num_params_M": 149.0, "decontam_removed": 0, "wandb_run_id": "yoxur76d"}
{"commit": "8e89af0", "primary_score": 59.9422, "memory_gb": 38.1, "training_min": 160.5, "datasets": ["glue", "sentence-transformers/natural-questions", "sentence-transformers/stackexchange-duplicates", "yahoo_answers_topics", "qiaojin/PubMedQA", "sentence-transformers/reddit-title-body", "fancyzhx/dbpedia_14", "hotpot_qa", "stanfordnlp/snli", "sentence-transformers/s2orc", "ag_news", "ms_marco"], "status": "keep", "description": "exp-103: symmetric InfoNCE during contrastive (query→pos + pos→query averaged); doubles gradient signal per pair; standard in SimCSE/E5/GTE; exp-102 showed hard_neg fine-tuning causes catastrophic forgetting — reverted to disabled; same data/config as exp-98 otherwise; hypothesis: symmetric loss improves representation quality across all task categories; baseline exp-98 primary=58.69", "task_scores": {"sts_bench": 79.5, "sick_r": 76.03, "twitter_url": 80.49, "sprint_dup": 86.91, "20news": 40.31, "reddit_clust": 43.04, "scifact": 53.43, "nfcorpus": 23.5}, "timestamp": "2026-03-20T02:26:04.264961+00:00", "config": {"base_model": "answerdotai/ModernBERT-base", "projection_dim": 768, "pooling": "cls", "max_seq_length": 256, "normalize_embeddings": true, "simclr_head": false, "stages": {"warmup": {"duration_minutes": 15, "data": "qqp_se_paraphrase", "loss": "infonce", "temperature": 0.1, "learning_rate": 0.0001, "lr_schedule": "linear_warmup_constant", "warmup_ratio": 0.1, "batch_size": 64, "negatives": "in_batch_only", "freeze_encoder_layers": 0, "false_neg_threshold": 0.0}, "contrastive": {"duration_minutes": 140, "data": "all_curated", "loss": "infonce", "temperature": 0.05, "learning_rate": 5e-05, "lr_schedule": "cosine_decay", "warmup_ratio": 0.05, "batch_size": 64, "negatives": "in_batch_plus_explicit", "source_stratification": true, "symmetric": true, "false_neg_threshold": 0.0}, "hard_neg_mining": {"duration_minutes": 5, "top_k": 7, "batch_size": 128, "min_similarity": 0.3}, "fine_tuning": {"duration_minutes": 5, "data": "all_curated_with_hard_negs", "loss": "infonce", "temperature": 0.05, "learning_rate": 1e-05, "lr_schedule": "cosine_decay", "warmup_ratio": 0.0, "batch_size": 64, "hard_neg_weight": 0.0, "false_neg_threshold": 0.0}}, "optimizer": {"type": "adamw", "betas": [0.9, 0.999], "eps": 1e-08, "weight_decay": 0.01, "llrd_decay": 1.0, "ema_decay": 0.0}, "data": {"max_rows_per_dataset": 100000}, "memory": {"max_peak_gb": 55, "gradient_accumulation_steps": 1, "gradient_checkpointing": false}}, "num_params_M": 149.0, "decontam_removed": 0, "wandb_run_id": "arheanic"}
{"commit": "7c5f9c8", "primary_score": 59.9757, "memory_gb": 38.1, "training_min": 160.4, "datasets": ["ms_marco", "yahoo_answers_topics", "sentence-transformers/stackexchange-duplicates", "glue", "sentence-transformers/natural-questions", "sentence-transformers/s2orc", "hotpot_qa", "qiaojin/PubMedQA", "fancyzhx/dbpedia_14", "stanfordnlp/snli", "sentence-transformers/reddit-title-body", "ag_news"], "status": "keep", "description": "exp-104: temperature annealing during contrastive (0.07→0.03); softer distribution early = more exploration, sharper late = better discrimination; proven technique in SimCLR/CLIP; all other settings match exp-103 (symmetric InfoNCE, 12 datasets, 140min contrastive); hypothesis: annealing improves final representation quality especially for retrieval; baseline exp-103 primary=59.94 (NEW BEST)", "task_scores": {"sts_bench": 78.97, "sick_r": 75.61, "twitter_url": 81.3, "sprint_dup": 86.47, "20news": 40.95, "reddit_clust": 44.05, "scifact": 52.64, "nfcorpus": 24.1}, "timestamp": "2026-03-20T05:29:45.116863+00:00", "config": {"base_model": "answerdotai/ModernBERT-base", "projection_dim": 768, "pooling": "cls", "max_seq_length": 256, "normalize_embeddings": true, "simclr_head": false, "stages": {"warmup": {"duration_minutes": 15, "data": "qqp_se_paraphrase", "loss": "infonce", "temperature": 0.1, "learning_rate": 0.0001, "lr_schedule": "linear_warmup_constant", "warmup_ratio": 0.1, "batch_size": 64, "negatives": "in_batch_only", "freeze_encoder_layers": 0, "false_neg_threshold": 0.0}, "contrastive": {"duration_minutes": 140, "data": "all_curated", "loss": "infonce", "temperature": 0.07, "temperature_end": 0.03, "learning_rate": 5e-05, "lr_schedule": "cosine_decay", "warmup_ratio": 0.05, "batch_size": 64, "negatives": "in_batch_plus_explicit", "source_stratification": true, "symmetric": true, "false_neg_threshold": 0.0}, "hard_neg_mining": {"duration_minutes": 5, "top_k": 7, "batch_size": 128, "min_similarity": 0.3}, "fine_tuning": {"duration_minutes": 5, "data": "all_curated_with_hard_negs", "loss": "infonce", "temperature": 0.05, "learning_rate": 1e-05, "lr_schedule": "cosine_decay", "warmup_ratio": 0.0, "batch_size": 64, "hard_neg_weight": 0.0, "false_neg_threshold": 0.0}}, "optimizer": {"type": "adamw", "betas": [0.9, 0.999], "eps": 1e-08, "weight_decay": 0.01, "llrd_decay": 1.0, "ema_decay": 0.0}, "data": {"max_rows_per_dataset": 100000}, "memory": {"max_peak_gb": 55, "gradient_accumulation_steps": 1, "gradient_checkpointing": false}}, "num_params_M": 149.0, "decontam_removed": 0, "wandb_run_id": "pvu7djvt"}
{"commit": "db1630a", "primary_score": 59.3985, "memory_gb": 40.9, "training_min": 160.5, "datasets": ["sentence-transformers/reddit-title-body", "sentence-transformers/s2orc", "sentence-transformers/stackexchange-duplicates", "hotpot_qa", "ms_marco", "ag_news", "glue", "fancyzhx/dbpedia_14", "stanfordnlp/snli", "sentence-transformers/natural-questions", "yahoo_answers_topics", "qiaojin/PubMedQA"], "status": "discard", "description": "exp-105: data scaling 2x (100K→200K max_rows_per_dataset); more unique training pairs with same 140min contrastive (21% sat at 100K = plenty of learning capacity); temperature reverted to fixed 0.05 (exp-104 annealing was +0.04, within noise); program.md says Data > everything; hypothesis: 2x unique pairs significantly improves all categories; baseline exp-104 primary=59.98 (NEW BEST)", "task_scores": {"sts_bench": 78.03, "sick_r": 75.23, "twitter_url": 80.27, "sprint_dup": 82.11, "20news": 41.37, "reddit_clust": 42.94, "scifact": 56.14, "nfcorpus": 22.12}, "timestamp": "2026-03-20T09:30:45.680502+00:00", "config": {"base_model": "answerdotai/ModernBERT-base", "projection_dim": 768, "pooling": "cls", "max_seq_length": 256, "normalize_embeddings": true, "simclr_head": false, "stages": {"warmup": {"duration_minutes": 15, "data": "qqp_se_paraphrase", "loss": "infonce", "temperature": 0.1, "learning_rate": 0.0001, "lr_schedule": "linear_warmup_constant", "warmup_ratio": 0.1, "batch_size": 64, "negatives": "in_batch_only", "freeze_encoder_layers": 0, "false_neg_threshold": 0.0}, "contrastive": {"duration_minutes": 140, "data": "all_curated", "loss": "infonce", "temperature": 0.05, "temperature_end": 0.0, "learning_rate": 5e-05, "lr_schedule": "cosine_decay", "warmup_ratio": 0.05, "batch_size": 64, "negatives": "in_batch_plus_explicit", "source_stratification": true, "symmetric": true, "false_neg_threshold": 0.0}, "hard_neg_mining": {"duration_minutes": 5, "top_k": 7, "batch_size": 128, "min_similarity": 0.3}, "fine_tuning": {"duration_minutes": 5, "data": "all_curated_with_hard_negs", "loss": "infonce", "temperature": 0.05, "learning_rate": 1e-05, "lr_schedule": "cosine_decay", "warmup_ratio": 0.0, "batch_size": 64, "hard_neg_weight": 0.0, "false_neg_threshold": 0.0}}, "optimizer": {"type": "adamw", "betas": [0.9, 0.999], "eps": 1e-08, "weight_decay": 0.01, "llrd_decay": 1.0, "ema_decay": 0.0}, "data": {"max_rows_per_dataset": 200000}, "memory": {"max_peak_gb": 55, "gradient_accumulation_steps": 1, "gradient_checkpointing": false}}, "num_params_M": 149.0, "decontam_removed": 1212, "wandb_run_id": "11mxwg31"}
{"commit": "a68a54b", "primary_score": 59.6378, "memory_gb": 40.9, "training_min": 220.6, "datasets": ["ag_news", "ms_marco", "qiaojin/PubMedQA", "glue", "stanfordnlp/snli", "sentence-transformers/stackexchange-duplicates", "sentence-transformers/reddit-title-body", "sentence-transformers/natural-questions", "yahoo_answers_topics", "hotpot_qa", "fancyzhx/dbpedia_14", "sentence-transformers/s2orc"], "status": "discard", "description": "exp-106: 200K data + 200min contrastive (exp-105 showed 200K@140min undertrained: 18% sat, STS -0.94, SprintDup -4.36, but SciFact +3.50; scaling contrastive proportionally to data increase; hypothesis: longer training recovers STS/PairClass while keeping SciFact gains from data diversity; baseline exp-104 primary=59.98 (NEW BEST)", "task_scores": {"sts_bench": 79.25, "sick_r": 75.49, "twitter_url": 81.91, "sprint_dup": 83.41, "20news": 40.67, "reddit_clust": 43.63, "scifact": 54.27, "nfcorpus": 22.16}, "timestamp": "2026-03-20T13:36:11.921265+00:00", "config": {"base_model": "answerdotai/ModernBERT-base", "projection_dim": 768, "pooling": "cls", "max_seq_length": 256, "normalize_embeddings": true, "simclr_head": false, "stages": {"warmup": {"duration_minutes": 15, "data": "qqp_se_paraphrase", "loss": "infonce", "temperature": 0.1, "learning_rate": 0.0001, "lr_schedule": "linear_warmup_constant", "warmup_ratio": 0.1, "batch_size": 64, "negatives": "in_batch_only", "freeze_encoder_layers": 0, "false_neg_threshold": 0.0}, "contrastive": {"duration_minutes": 200, "data": "all_curated", "loss": "infonce", "temperature": 0.05, "temperature_end": 0.0, "learning_rate": 5e-05, "lr_schedule": "cosine_decay", "warmup_ratio": 0.05, "batch_size": 64, "negatives": "in_batch_plus_explicit", "source_stratification": true, "symmetric": true, "false_neg_threshold": 0.0}, "hard_neg_mining": {"duration_minutes": 5, "top_k": 7, "batch_size": 128, "min_similarity": 0.3}, "fine_tuning": {"duration_minutes": 5, "data": "all_curated_with_hard_negs", "loss": "infonce", "temperature": 0.05, "learning_rate": 1e-05, "lr_schedule": "cosine_decay", "warmup_ratio": 0.0, "batch_size": 64, "hard_neg_weight": 0.0, "false_neg_threshold": 0.0}}, "optimizer": {"type": "adamw", "betas": [0.9, 0.999], "eps": 1e-08, "weight_decay": 0.01, "llrd_decay": 1.0, "ema_decay": 0.0}, "data": {"max_rows_per_dataset": 200000}, "memory": {"max_peak_gb": 55, "gradient_accumulation_steps": 1, "gradient_checkpointing": false}}, "num_params_M": 149.0, "decontam_removed": 0, "wandb_run_id": "l0j2zduu"}
{"commit": "056ce57", "primary_score": 0.0, "memory_gb": 0.0, "training_min": 0.0, "datasets": [], "status": "crash", "description": "exp-107: longer contrastive 180min on 100K data (revert data to exp-104 baseline); exp-105/106 showed 200K data helps retrieval/clustering but hurts STS/PairClass via dilution (-2.01 SprintDup even at 200min); instead test more compute on same data — exp-104 had 21% sat at 140min suggesting room for improvement; hypothesis: 180min pushes saturation higher and improves all categories without dilution tradeoff; baseline exp-104 primary=59.98 (NEW BEST)", "task_scores": {}, "timestamp": "2026-03-20T14:35:37.137511+00:00", "config": {"base_model": "answerdotai/ModernBERT-base", "projection_dim": 768, "pooling": "cls", "max_seq_length": 256, "normalize_embeddings": true, "simclr_head": false, "stages": {"warmup": {"duration_minutes": 15, "data": "qqp_se_paraphrase", "loss": "infonce", "temperature": 0.1, "learning_rate": 0.0001, "lr_schedule": "linear_warmup_constant", "warmup_ratio": 0.1, "batch_size": 64, "negatives": "in_batch_only", "freeze_encoder_layers": 0, "false_neg_threshold": 0.0}, "contrastive": {"duration_minutes": 180, "data": "all_curated", "loss": "infonce", "temperature": 0.05, "temperature_end": 0.0, "learning_rate": 5e-05, "lr_schedule": "cosine_decay", "warmup_ratio": 0.05, "batch_size": 64, "negatives": "in_batch_plus_explicit", "source_stratification": true, "symmetric": true, "false_neg_threshold": 0.0}, "hard_neg_mining": {"duration_minutes": 5, "top_k": 7, "batch_size": 128, "min_similarity": 0.3}, "fine_tuning": {"duration_minutes": 5, "data": "all_curated_with_hard_negs", "loss": "infonce", "temperature": 0.05, "learning_rate": 1e-05, "lr_schedule": "cosine_decay", "warmup_ratio": 0.0, "batch_size": 64, "hard_neg_weight": 0.0, "false_neg_threshold": 0.0}}, "optimizer": {"type": "adamw", "betas": [0.9, 0.999], "eps": 1e-08, "weight_decay": 0.01, "llrd_decay": 1.0, "ema_decay": 0.0}, "data": {"max_rows_per_dataset": 100000}, "memory": {"max_peak_gb": 55, "gradient_accumulation_steps": 1, "gradient_checkpointing": false}}, "num_params_M": null, "decontam_removed": 0}
{"commit": "37895de", "primary_score": 0.0, "memory_gb": 0.0, "training_min": 0.0, "datasets": [], "status": "crash", "description": "exp-107: retry — longer contrastive 180min on 100K data (revert data to exp-104 baseline); previous run killed by OOM at step 950 (exit 137); exp-105/106 showed 200K data helps retrieval/clustering but hurts STS/PairClass via dilution; hypothesis: 180min on 100K improves all categories without dilution; baseline exp-104 primary=59.98 (NEW BEST)", "task_scores": {}, "timestamp": "2026-03-20T14:41:06.733327+00:00", "config": {"base_model": "answerdotai/ModernBERT-base", "projection_dim": 768, "pooling": "cls", "max_seq_length": 256, "normalize_embeddings": true, "simclr_head": false, "stages": {"warmup": {"duration_minutes": 15, "data": "qqp_se_paraphrase", "loss": "infonce", "temperature": 0.1, "learning_rate": 0.0001, "lr_schedule": "linear_warmup_constant", "warmup_ratio": 0.1, "batch_size": 64, "negatives": "in_batch_only", "freeze_encoder_layers": 0, "false_neg_threshold": 0.0}, "contrastive": {"duration_minutes": 180, "data": "all_curated", "loss": "infonce", "temperature": 0.05, "temperature_end": 0.0, "learning_rate": 5e-05, "lr_schedule": "cosine_decay", "warmup_ratio": 0.05, "batch_size": 64, "negatives": "in_batch_plus_explicit", "source_stratification": true, "symmetric": true, "false_neg_threshold": 0.0}, "hard_neg_mining": {"duration_minutes": 5, "top_k": 7, "batch_size": 128, "min_similarity": 0.3}, "fine_tuning": {"duration_minutes": 5, "data": "all_curated_with_hard_negs", "loss": "infonce", "temperature": 0.05, "learning_rate": 1e-05, "lr_schedule": "cosine_decay", "warmup_ratio": 0.0, "batch_size": 64, "hard_neg_weight": 0.0, "false_neg_threshold": 0.0}}, "optimizer": {"type": "adamw", "betas": [0.9, 0.999], "eps": 1e-08, "weight_decay": 0.01, "llrd_decay": 1.0, "ema_decay": 0.0}, "data": {"max_rows_per_dataset": 100000}, "memory": {"max_peak_gb": 55, "gradient_accumulation_steps": 1, "gradient_checkpointing": false}}, "num_params_M": null, "decontam_removed": 0}
