{"commit": "b6bf217", "primary_score": 0.0, "memory_gb": 0.0, "training_min": 0.0, "datasets": [], "status": "crash", "description": "exp-150: FT temp=0.03 (was 0.05); exp-149 proved FT is essential (-4.23 without it); matching contrastive temp through FT for consistency; exp-114 showed FT temp=0.03 hurt retrieval at weaker baseline but 480min foundation may handle it; all other settings match exp-146 best (480min contrastive, temp=0.03, LR=3e-5, CLS, 200K, FT=60min LR=1e-5); baseline exp-146=63.69", "task_scores": {}, "timestamp": "2026-04-14T12:39:13.804589+00:00", "config": {"base_model": "answerdotai/ModernBERT-base", "projection_dim": 768, "pooling": "cls", "max_seq_length": 256, "normalize_embeddings": true, "simclr_head": false, "stages": {"warmup": {"duration_minutes": 15, "data": "qqp_se_paraphrase", "loss": "infonce", "temperature": 0.1, "learning_rate": 0.0001, "lr_schedule": "linear_warmup_constant", "warmup_ratio": 0.1, "batch_size": 64, "negatives": "in_batch_only", "freeze_encoder_layers": 0, "false_neg_threshold": 0.0}, "contrastive": {"duration_minutes": 480, "data": "all_curated", "loss": "infonce", "temperature": 0.03, "temperature_end": 0.0, "learning_rate": 3e-05, "learning_rate_min": 0.0, "lr_schedule": "cosine_decay", "warmup_ratio": 0.05, "batch_size": 64, "negatives": "in_batch_plus_explicit", "source_stratification": false, "symmetric": true, "false_neg_threshold": 0.0}, "hard_neg_mining": {"duration_minutes": 5, "top_k": 7, "batch_size": 128, "min_similarity": 0.3}, "fine_tuning": {"duration_minutes": 60, "data": "all_curated_with_hard_negs", "loss": "infonce", "temperature": 0.03, "learning_rate": 1e-05, "lr_schedule": "cosine_decay", "warmup_ratio": 0.0, "batch_size": 64, "hard_neg_weight": 0.0, "false_neg_threshold": 0.0}}, "optimizer": {"type": "adamw", "betas": [0.9, 0.999], "eps": 1e-08, "weight_decay": 0.01, "llrd_decay": 1.0, "ema_decay": 0.0}, "data": {"max_rows_per_dataset": 200000, "cross_dedup": false}, "memory": {"max_peak_gb": 55, "gradient_accumulation_steps": 1, "gradient_checkpointing": false}}, "num_params_M": null, "decontam_removed": 0}
