commit	primary_score	memory_gb	training_min	datasets	status	description
955a0eb	0.00	0.0	0.0		crash	exp-107: retry2 — longer contrastive 180min on 100K data (revert data to exp-104 baseline); exp-105/106 showed 200K data hurts STS/PairClass via dilution; hypothesis: more compute on same data improves without dilution tradeoff; baseline exp-104 primary=59.98
472dd7f	65.16	38.1	200.8	ag_news;sentence-transformers/natural-questions;ms_marco;sentence-transformers/reddit-title-body;yahoo_answers_topics;qiaojin/PubMedQA;glue;hotpot_qa;fancyzhx/dbpedia_14;sentence-transformers/s2orc;stanfordnlp/snli;sentence-transformers/stackexchange-duplicates	keep	exp-107: retry4 — 180min contrastive on 100K data; baseline exp-104 primary=59.98
7949661	58.36	38.1	216.2	sentence-transformers/natural-questions;sentence-transformers/s2orc;sentence-transformers/reddit-title-body;sentence-transformers/stackexchange-duplicates;hotpot_qa;yahoo_answers_topics;ms_marco;stanfordnlp/snli;ag_news;glue;qiaojin/PubMedQA;fancyzhx/dbpedia_14	discard	exp-108: skip fine-tuning (99% sat = wasted compute) + extend contrastive to 200min; fix nano retrieval score parsing (train split); exp-107 corrected baseline primary=62.29 (21-task); hypothesis: removing saturated fine-tuning prevents overfit while more contrastive improves all categories
74c53f9	61.87	35.6	201.2	glue;fancyzhx/dbpedia_14;sentence-transformers/reddit-title-body;ms_marco;stanfordnlp/snli;ag_news;qiaojin/PubMedQA;sentence-transformers/s2orc;yahoo_answers_topics;sentence-transformers/natural-questions;hotpot_qa;sentence-transformers/stackexchange-duplicates	discard	exp-109: mean pooling instead of CLS (GTE/E5/all-MiniLM all use mean; exp-90 tested mean but only had 8-task eval; now with 21-task eval including 13 retrieval tasks); mean pools all tokens vs CLS which uses only one; hypothesis: mean pooling improves retrieval/clustering by using richer representation; baseline exp-107 corrected primary=62.29 (21-task)
85677ab	0.00	0.0	0.0		crash	exp-110: re-add FEVER claim-evidence pairs (copenlu/fever_gold_evidence, SUPPORTS only); exp-99/100 showed FEVER helps retrieval (SciFact +2.45) but hurt pair_class (-2.78 SprintDup); with 21-task eval (13 retrieval vs 2 pair_class), retrieval benefit should dominate; 190min contrastive (proportional to ~915K pairs); CLS pooling (exp-109 showed mean was flat); baseline exp-107 corrected primary=62.29 (21-task)
fd1dfb2	61.82	37.3	210.9	sentence-transformers/stackexchange-duplicates;sentence-transformers/natural-questions;sentence-transformers/s2orc;glue;ag_news;sentence-transformers/reddit-title-body;stanfordnlp/snli;qiaojin/PubMedQA;copenlu/fever_gold_evidence;fancyzhx/dbpedia_14;yahoo_answers_topics;ms_marco;hotpot_qa	discard	exp-110: retry — re-add FEVER claim-evidence pairs + 190min contrastive; previous run OOM'd during MTEB eval (training completed, STS=78.63 SICK-R=74.08 before crash); same config as commit 85677ab; baseline exp-107 corrected primary=62.29 (21-task)
24c4ec0	62.41	38.1	200.8	fancyzhx/dbpedia_14;ag_news;sentence-transformers/reddit-title-body;yahoo_answers_topics;sentence-transformers/natural-questions;sentence-transformers/stackexchange-duplicates;hotpot_qa;qiaojin/PubMedQA;sentence-transformers/s2orc;ms_marco;stanfordnlp/snli;glue	discard	exp-111: lower contrastive temperature 0.03 (was 0.05); sharper similarity distribution should improve retrieval discrimination; revert FEVER (exp-110 showed it hurt retrieval -2.54); 180min contrastive, 12 datasets, CLS pooling — matches exp-107 config except temp; exp-107 non-retrieval primary=65.17 but retrieval OOM'd; exp-110 6-cat primary=61.82; hypothesis: lower temp specifically improves retrieval (weakest category at ~44-47)
2cdc8c6	61.79	38.1	200.8	ms_marco;sentence-transformers/natural-questions;ag_news;stanfordnlp/snli;sentence-transformers/s2orc;sentence-transformers/stackexchange-duplicates;glue;sentence-transformers/reddit-title-body;yahoo_answers_topics;fancyzhx/dbpedia_14;qiaojin/PubMedQA;hotpot_qa	discard	exp-112: even lower contrastive temperature 0.02 (exp-111 showed 0.03 improved retrieval +3.53 vs 0.05 at temp=0.05); sharper distribution for better discrimination; same 12 datasets, 180min, CLS pooling as exp-111; exp-111 primary=62.41 (6-cat best so far), retrieval=48.06; hypothesis: 0.02 pushes retrieval higher while maintaining other categories
a4a88a6	62.16	61.1	200.5	sentence-transformers/natural-questions;fancyzhx/dbpedia_14;sentence-transformers/reddit-title-body;ag_news;qiaojin/PubMedQA;glue;sentence-transformers/stackexchange-duplicates;ms_marco;hotpot_qa;sentence-transformers/all-nli;sentence-transformers/s2orc;yahoo_answers_topics	discard	exp-113: replace SNLI with AllNLI triplets (sentence-transformers/all-nli, triplet config) + revert temp to 0.03 (exp-112 showed 0.02 regressed -0.62 primary, -1.33 retrieval vs exp-111); AllNLI = SNLI+MNLI with explicit hard negatives (anchor/positive/negative); hard negs used during contrastive via triplet format; same 12 datasets, 180min, CLS pooling; baseline exp-111 primary=62.41 (6-cat best); hypothesis: hard negatives from AllNLI improve discrimination without temperature brittleness
eba94d4	62.25	38.1	200.7	sentence-transformers/reddit-title-body;yahoo_answers_topics;ms_marco;fancyzhx/dbpedia_14;ag_news;qiaojin/PubMedQA;sentence-transformers/natural-questions;glue;hotpot_qa;sentence-transformers/s2orc;stanfordnlp/snli;sentence-transformers/stackexchange-duplicates	discard	exp-114: align fine-tuning temperature to 0.03 (matching contrastive); was 0.05 creating a distribution mismatch between stages — model trains at sharp 0.03 distribution then fine-tunes at softer 0.05; revert AllNLI→SNLI (exp-113 showed AllNLI hurt retrieval -2.92); same 12 datasets, 180min contrastive, CLS pooling; baseline exp-111 primary=62.41; hypothesis: consistent temperature across stages prevents fine-tuning from undoing contrastive gains
c739324	0.00	0.0	0.0		crash	exp-115: double warmup duration to 30min (was 15); longer warmup gives model more time to build initial representations with easy paraphrase data before the harder contrastive stage; all other settings match exp-111 best config (temp=0.03, CLS, 180min contrastive, FT temp=0.05, 12 datasets); baseline exp-111 primary=62.41; hypothesis: better initialization from longer warmup improves all downstream categories
069179b	0.00	0.0	0.0		crash	exp-115: retry — double warmup duration to 30min (was 15); previous run failed on network proxy error during model download; longer warmup gives model more time to build initial representations with easy paraphrase data before harder contrastive stage; all settings match exp-111 best config (temp=0.03, CLS, 180min contrastive, FT temp=0.05, 12 datasets); baseline exp-111 primary=62.41; hypothesis: better initialization from longer warmup improves all downstream categories
2adc5a0	57.53	39.0	215.8	stanfordnlp/snli;fancyzhx/dbpedia_14;ag_news;sentence-transformers/natural-questions;sentence-transformers/reddit-title-body;hotpot_qa;sentence-transformers/s2orc;glue;sentence-transformers/stackexchange-duplicates;ms_marco;qiaojin/PubMedQA;yahoo_answers_topics	discard	exp-115: retry2 — double warmup to 30min (was 15); fix HF offline mode for proxy errors; longer warmup gives more time to build initial representations before harder contrastive; all settings match exp-111 best config (temp=0.03, CLS, 180min contrastive, FT temp=0.05, 12 datasets); baseline exp-111 primary=62.41; hypothesis: better initialization from longer warmup improves all categories
4c976b5	0.00	38.7	200.4	glue;yahoo_answers_topics;sentence-transformers/natural-questions;stanfordnlp/snli;hotpot_qa;sentence-transformers/s2orc;sentence-transformers/reddit-title-body;ms_marco;fancyzhx/dbpedia_14;qiaojin/PubMedQA;sentence-transformers/stackexchange-duplicates;ag_news	discard	exp-117: enable EMA (decay=0.999) + swap EMA weights before save/eval; EMA averages weights across training steps reducing noise for better generalization; literature suggests +0.5-1.0 free points; code already does mx.eval every step (NaN was from attention masks, not EMA); added weight swap before checkpoint save and eval; all other settings match exp-111 best config (temp=0.03, CLS, 180min contrastive, LR=5e-5, FT temp=0.05, 12 datasets); baseline exp-111 primary=62.41 (4-task); hypothesis: EMA smoothing improves all categories, especially retrieval where noise hurts discrimination
ee3e558	0.00	1.1	0.0	sentence-transformers/reddit-title-body;glue;sentence-transformers/natural-questions;ms_marco;hotpot_qa;yahoo_answers_topics;ag_news;fancyzhx/dbpedia_14;sentence-transformers/s2orc;stanfordnlp/snli;qiaojin/PubMedQA;sentence-transformers/stackexchange-duplicates	discard	exp-117: retry — fix HF_HUB_OFFLINE blocking eval; re-eval existing EMA checkpoint (training completed, all sources healthy, 14% saturation); EMA decay=0.999 + weight swap before save/eval; all settings match exp-111 (temp=0.03, CLS, 180min, LR=5e-5, 12 datasets); baseline exp-111 primary=62.41 (4-task)
7412dc1	21.56	15.0	0.0	sentence-transformers/s2orc;stanfordnlp/snli;ag_news;glue;ms_marco;yahoo_answers_topics;hotpot_qa;fancyzhx/dbpedia_14;sentence-transformers/natural-questions;sentence-transformers/reddit-title-body;qiaojin/PubMedQA;sentence-transformers/stackexchange-duplicates	discard	exp-117: retry2 — fix HF offline module reload for eval; re-eval EMA checkpoint; EMA decay=0.999 + weight swap; settings match exp-111 (temp=0.03, CLS, 180min, LR=5e-5, 12 datasets); baseline exp-111 primary=62.41 (4-task)
d43f6a4	62.34	15.0	0.0	yahoo_answers_topics;fancyzhx/dbpedia_14;ms_marco;sentence-transformers/s2orc;sentence-transformers/natural-questions;ag_news;hotpot_qa;stanfordnlp/snli;qiaojin/PubMedQA;sentence-transformers/reddit-title-body;glue;sentence-transformers/stackexchange-duplicates	discard	exp-117: retry3 — eval non-EMA trained weights from finetune checkpoint; fix HF offline + skip EMA swap on resume; this gives baseline score for comparison with full EMA run; settings match exp-111 (temp=0.03, CLS, 180min, LR=5e-5, 12 datasets); baseline exp-111 primary=62.41 (4-task)
c489afc	61.66	38.1	261.2	qiaojin/PubMedQA;stanfordnlp/snli;ag_news;sentence-transformers/stackexchange-duplicates;ms_marco;sentence-transformers/reddit-title-body;sentence-transformers/natural-questions;hotpot_qa;fancyzhx/dbpedia_14;sentence-transformers/s2orc;yahoo_answers_topics;glue	discard	exp-118: extend contrastive to 240min (was 180); at 180min only 14% saturated with 855K pairs seen 0.22x each — clearly undertrained; 240min gives 33% more training with same data/config; all sources healthy at 180min (max PubMedQA 21% sat); expect retrieval and clustering improvements from longer training; all other settings match exp-117 baseline (temp=0.03, CLS, LR=5e-5, FT temp=0.05, 12 datasets); baseline exp-117 primary=62.34 (21-task); hypothesis: longer contrastive improves retrieval avg from 48.26 and cluster from 37.90
afaff29	0.00	0.0	0.0		crash	exp-119: double contrastive batch size to 128 (was 64); 2x in-batch negatives (127 vs 63) directly improves retrieval discrimination; previous B=128 OOM was at seq=512, now at seq=256 should fit; keep symmetric InfoNCE (raised tiled threshold to B>=256); all other settings match exp-111/117 baseline (temp=0.03, CLS, 180min, LR=5e-5, FT temp=0.05, 12 datasets); baseline exp-117 primary=62.34 (21-task); hypothesis: 2x negatives improves retrieval (48.26→52+) and clustering
aad3d74	0.00	0.0	0.0		crash	exp-119: retry — batch=96 contrastive (was 64, 128 hung); 50% more in-batch negatives (95 vs 63) with symmetric InfoNCE; exp-94 showed B=96 fits at 38GB but used wrong LR=7.5e-5; here we keep LR=5e-5; raised tiled-loss threshold to B>=256 so symmetric works at B=96; all other settings match exp-117 baseline (temp=0.03, CLS, 180min, FT temp=0.05, 12 datasets); baseline exp-117 primary=62.34 (21-task); hypothesis: more negatives improves retrieval discrimination (48.26→52+)
dc74f22	0.00	0.0	0.0		crash	exp-119: retry2 — batch=96 contrastive WITHOUT symmetric (symmetric 8x slower at B=96, only 370 steps/180min vs 3000 at B=64); standard InfoNCE at B=96 gives 50% more negatives with ~1.5x slower steps (~2000 steps/180min); all other settings match exp-117 baseline (temp=0.03, CLS, 180min, LR=5e-5, FT temp=0.05, 12 datasets); baseline exp-117 primary=62.34; hypothesis: more negatives per step outweighs fewer total steps
ce8f2ea	60.13	33.3	202.4	glue;yahoo_answers_topics;qiaojin/PubMedQA;fancyzhx/dbpedia_14;sentence-transformers/reddit-title-body;sentence-transformers/stackexchange-duplicates;ag_news;hotpot_qa;sentence-transformers/s2orc;ms_marco;sentence-transformers/natural-questions;stanfordnlp/snli	discard	exp-120: enable false negative filtering (threshold=0.8) during contrastive; masks in-batch pairs with cosine sim > 0.8 to prevent false negatives from poisoning contrastive signal; with B=64 and mixed-source batches, cross-source near-duplicates (e.g., overlapping NQ/HotpotQA passages) act as false negatives; all other settings match exp-117 baseline (temp=0.03, CLS, 180min, LR=5e-5, B=64, symmetric, FT temp=0.05, 12 datasets); baseline exp-117 primary=62.34 (21-task); hypothesis: cleaner contrastive signal improves retrieval discrimination
0cd8db5	59.29	33.9	203.1	ag_news;sentence-transformers/stackexchange-duplicates;yahoo_answers_topics;glue;fancyzhx/dbpedia_14;stanfordnlp/snli;sentence-transformers/reddit-title-body;ms_marco;qiaojin/PubMedQA;sentence-transformers/s2orc;sentence-transformers/natural-questions;hotpot_qa	discard	exp-121: enable EMA (decay=0.999) with weight swap before save/eval; EMA smooths weights across training steps reducing optimization noise; code fixes from exp-117 retries ensure correct swap (skip on resume, reload HF constants); false_neg_threshold reverted to 0.0 (exp-120 regressed -2.21 but confounded by GPU contention); all other settings match exp-117 baseline (temp=0.03, CLS, 180min, LR=5e-5, B=64, symmetric, FT temp=0.05, 12 datasets); baseline exp-117 primary=62.34 (21-task); NOTE: 3 concurrent TTS processes may cause GPU contention; hypothesis: EMA smoothing improves generalization +0.5-1.0 across all categories
1090cbd	62.60	39.9	200.4	sentence-transformers/natural-questions;ms_marco;glue;sentence-transformers/s2orc;qiaojin/PubMedQA;sentence-transformers/reddit-title-body;hotpot_qa;stanfordnlp/snli;sentence-transformers/stackexchange-duplicates;ag_news;fancyzhx/dbpedia_14;yahoo_answers_topics	discard	exp-122: EMA (decay=0.999) + lower contrastive LR (3e-5, was 5e-5); exp-121 showed EMA improved clustering +3.37 even with only 722/3000 steps (GPU contention); lower LR should navigate temp=0.03 sharp landscape more carefully, and each step does less work so fewer steps are less harmful; stacking EMA+LR is somewhat risky but both have strong theoretical backing; all other settings match baseline (temp=0.03, CLS, 180min, B=64, symmetric, FT temp=0.05, 12 datasets); baseline exp-117 primary=62.34 (21-task); TTS processes reduced from 15→4; hypothesis: EMA+lower LR improves clustering and retrieval
4b5cc3e	62.20	39.8	200.3	sentence-transformers/reddit-title-body;sentence-transformers/natural-questions;fancyzhx/dbpedia_14;sentence-transformers/s2orc;glue;hotpot_qa;yahoo_answers_topics;sentence-transformers/stackexchange-duplicates;ms_marco;ag_news;qiaojin/PubMedQA;stanfordnlp/snli	discard	exp-123: EMA (decay=0.999) with baseline LR=5e-5 to isolate EMA effect; exp-122 showed EMA+LR=3e-5 improved clustering +6.21 and primary +0.26 but PairClass regressed -3.36; need to determine if EMA alone helps or if lower LR is the driver; restoring LR=5e-5 while keeping EMA; GPU is now contention-free (0 TTS processes) so expect ~3000+ contrastive steps at full speed; all other settings match baseline (temp=0.03, CLS, 180min, B=64, symmetric, FT temp=0.05, 12 datasets); baseline exp-117 primary=62.34 (21-task); hypothesis: EMA at baseline LR preserves clustering gains while recovering PairClass
6e7a50f	62.67	38.7	210.7	fancyzhx/dbpedia_14;sentence-transformers/s2orc;ms_marco;stanfordnlp/snli;sentence-transformers/stackexchange-duplicates;sentence-transformers/natural-questions;ag_news;qiaojin/PubMedQA;hotpot_qa;glue;yahoo_answers_topics;sentence-transformers/reddit-title-body	discard	exp-124: extend fine-tuning to 15min (was 5) to recover PairClass; exp-122 (EMA+LR=3e-5) was best at 62.60 primary but PairClass regressed -3.36; exp-123 confirmed EMA at LR=5e-5 was worse (62.20); fine-tuning stage uses hard negatives which help pair discrimination — longer FT gives more time to refine these features; EMA+LR=3e-5 preserved, all other settings match exp-122; GPU clean (0 TTS); baseline exp-117 primary=62.34, current best exp-122 primary=62.60; hypothesis: longer FT recovers PairClass while keeping cluster+STS gains
32dcc59	63.10	39.3	200.3	stanfordnlp/snli;ms_marco;sentence-transformers/stackexchange-duplicates;hotpot_qa;sentence-transformers/natural-questions;fancyzhx/dbpedia_14;qiaojin/PubMedQA;sentence-transformers/reddit-title-body;yahoo_answers_topics;ag_news;sentence-transformers/s2orc;glue	discard	exp-125: no EMA + LR=3e-5 to isolate LR effect on clustering; exp-122 EMA+LR=3e-5 gave primary=62.60 with cluster +6.21 but PairClass -3.36; exp-124 EMA+LR=3e-5+FT=15min gave 62.67 but PairClass still -2.22 and FT was 99% saturated; hypothesis: LR=3e-5 alone drives the clustering improvement and without EMA PairClass will recover; FT reverted to 5min (99% sat at 15min proved wasteful); all other settings match exp-122 baseline (temp=0.03, CLS, 180min, B=64, symmetric, 12 datasets); baseline exp-117 LR=5e-5 primary=62.34
2dc6de4	62.79	39.3	200.6	glue;sentence-transformers/reddit-title-body;sentence-transformers/stackexchange-duplicates;yahoo_answers_topics;sentence-transformers/s2orc;ag_news;stanfordnlp/snli;qiaojin/PubMedQA;ms_marco;sentence-transformers/natural-questions;hotpot_qa;fancyzhx/dbpedia_14	discard	exp-126: contrastive LR=2e-5 (was 3e-5); exp-125 no-EMA+LR=3e-5 set new best primary=63.10 (+0.76 over LR=5e-5 baseline); LR trend: 5e-5→3e-5 was +0.76; lower LR gives more stable gradients at temp=0.03 and more training steps (8449 steps at 1.28s/step); hypothesis: LR=2e-5 further improves retrieval (48.44) and classification (69.85); EMA stays disabled (exp-125 proved LR is the driver, not EMA); FT=5min (still 99% saturated — consider reducing further); all other settings match exp-125 (temp=0.03, CLS, 180min, B=64, symmetric, 12 datasets)
85c4009	63.31	40.9	200.4	glue;sentence-transformers/stackexchange-duplicates;ag_news;sentence-transformers/s2orc;sentence-transformers/reddit-title-body;sentence-transformers/natural-questions;yahoo_answers_topics;stanfordnlp/snli;ms_marco;fancyzhx/dbpedia_14;qiaojin/PubMedQA;hotpot_qa	discard	exp-127: scale data to 200K rows/dataset (was 100K); exp-125 LR=3e-5 set best primary=63.10 with 855K pairs; exp-126 LR=2e-5 regressed to 62.79 confirming 3e-5 is optimal; exp-105/106 previously showed 200K regressed at LR=5e-5 via signal dilution but that was before LR was optimized; at LR=3e-5, more data per step means more unique examples per epoch; expect ~1.5-1.7M pairs; hypothesis: more training data improves retrieval (48.44→50+) and clustering (41.60→43+) without PairClass regression; all other settings match exp-125 (LR=3e-5, no EMA, temp=0.03, CLS, 180min, B=64, symmetric, FT=5min, 12 datasets)
bb4f4f6	63.53	53.4	260.3	sentence-transformers/reddit-title-body;fancyzhx/dbpedia_14;glue;sentence-transformers/stackexchange-duplicates;sentence-transformers/natural-questions;sentence-transformers/s2orc;yahoo_answers_topics;qiaojin/PubMedQA;hotpot_qa;ag_news;stanfordnlp/snli;ms_marco	discard	exp-128: 240min contrastive with 200K data (was 180min); exp-127 200K+180min set new best primary=63.31 but retrieval regressed -2.73 vs exp-125 100K; with 200K data (1.5M pairs, ~0.27 epochs at 180min), model is undertrained on retrieval — only 20% saturation at end; 240min gives 33% more training steps (~8300 vs 6237) to better learn retrieval-oriented pairs; exp-118 240min+100K overfit but 200K provides enough diversity to prevent it; all other settings match exp-127 (LR=3e-5, no EMA, temp=0.03, CLS, B=64, symmetric, FT=5min, 200K/dataset, 12 datasets); hypothesis: longer training recovers retrieval (45.71→48+) while keeping PairClass gains (83.85)
34579a3	62.94	50.2	260.6	hotpot_qa;sentence-transformers/natural-questions;ms_marco;sentence-transformers/reddit-title-body;sentence-transformers/stackexchange-duplicates;ag_news;sentence-transformers/s2orc;glue;fancyzhx/dbpedia_14;qiaojin/PubMedQA;yahoo_answers_topics;stanfordnlp/snli	discard	exp-129: implement source-stratified batching (config said true but was dead code); with 200K data, top 4 sources are 53.6% while retrieval sources are only 21%; stratification gives each of 12 sources equal ~5 examples per batch (64/12); exp-128 240min+200K gave 63.53 but retrieval barely improved (+0.05 avg) because in-distribution sources dominated; hypothesis: equal source weight improves out-of-distribution retrieval
4002353	58.90	53.4	261.8	ms_marco;yahoo_answers_topics;glue;sentence-transformers/reddit-title-body;sentence-transformers/stackexchange-duplicates;hotpot_qa;qiaojin/PubMedQA;ag_news;sentence-transformers/s2orc;fancyzhx/dbpedia_14;sentence-transformers/natural-questions;stanfordnlp/snli	discard	exp-130: enable hard negatives with proper weight scaling (0.5); loss function now multiplies sim_hardneg by hard_neg_weight (was no-op); source-diverse mining pool samples equally from 12 sources (was biased triplets[:8000]); exp-102 weight=1.0 caused catastrophic forgetting (-3.19) — 0.5 halves the repulsion; FT has been completely inert since weight=0 meant hard negs were never injected; with LR=3e-5+240min+200K best config; source_stratification reverted to false (exp-129 regressed); hypothesis: proper hard neg signal improves retrieval discrimination (45→48+) without catastrophic forgetting
