{"commit": "906100e", "primary_score": 0.0, "memory_gb": 0.0, "training_min": 0.0, "datasets": [], "status": "crash", "description": "exp-60: implement actual cosine LR decay (was broken - lr_schedule config had no effect); warmup+cosine_decay now applied to contrastive; 60-min contrastive; baseline exp-51 primary=56.81", "task_scores": {}, "timestamp": "2026-03-15T20:21:44.157313+00:00", "config": {"base_model": "answerdotai/ModernBERT-base", "embedding_dim": 768, "projection_dim": 768, "pooling": "cls", "max_seq_length": 512, "normalize_embeddings": true, "stages": {"warmup": {"duration_minutes": 15, "data": "qqp_se_paraphrase", "loss": "infonce", "temperature": 0.1, "learning_rate": 0.0001, "lr_schedule": "linear_warmup_constant", "warmup_ratio": 0.1, "batch_size": 64, "negatives": "in_batch_only", "freeze_encoder_layers": 0}, "contrastive": {"duration_minutes": 60, "data": "all_curated", "loss": "infonce", "temperature": 0.05, "learning_rate": 5e-05, "lr_schedule": "cosine_decay", "warmup_ratio": 0.05, "batch_size": 64, "negatives": "in_batch_plus_explicit", "source_stratification": true}, "hard_neg_mining": {"duration_minutes": 5, "top_k": 7, "batch_size": 128, "min_similarity": 0.3}, "fine_tuning": {"duration_minutes": 5, "data": "all_curated_with_hard_negs", "loss": "infonce", "temperature": 0.05, "learning_rate": 1e-05, "lr_schedule": "cosine_decay", "warmup_ratio": 0.0, "batch_size": 32, "hard_neg_weight": 1.0}}, "optimizer": {"type": "adamw", "betas": [0.9, 0.999], "eps": 1e-08, "weight_decay": 0.01}, "memory": {"max_peak_gb": 55, "gradient_accumulation_steps": 4}}, "num_params_M": null, "decontam_removed": 0}
{"commit": "74525b0", "primary_score": 57.112, "memory_gb": 36.4, "training_min": 80.3, "datasets": ["hotpot_qa", "glue", "ms_marco", "fancyzhx/dbpedia_14", "ag_news", "sentence-transformers/reddit-title-body", "stanfordnlp/snli", "sentence-transformers/stackexchange-duplicates", "yahoo_answers_topics", "sentence-transformers/natural-questions"], "status": "keep", "description": "exp-61: fix crash from exp-60; actual cosine LR decay working; warmup uses linear_warmup_constant; contrastive uses cosine_decay from 5e-5 to 0; 60-min; HotpotQA; baseline exp-51 primary=56.81", "task_scores": {"sts_bench": 76.82, "sick_r": 74.34, "twitter_url": 77.62, "sprint_dup": 84.43, "20news": 38.0, "reddit_clust": 41.51, "scifact": 48.89, "nfcorpus": 19.66}, "timestamp": "2026-03-15T21:58:43.743415+00:00", "config": {"base_model": "answerdotai/ModernBERT-base", "embedding_dim": 768, "projection_dim": 768, "pooling": "cls", "max_seq_length": 512, "normalize_embeddings": true, "stages": {"warmup": {"duration_minutes": 15, "data": "qqp_se_paraphrase", "loss": "infonce", "temperature": 0.1, "learning_rate": 0.0001, "lr_schedule": "linear_warmup_constant", "warmup_ratio": 0.1, "batch_size": 64, "negatives": "in_batch_only", "freeze_encoder_layers": 0}, "contrastive": {"duration_minutes": 60, "data": "all_curated", "loss": "infonce", "temperature": 0.05, "learning_rate": 5e-05, "lr_schedule": "cosine_decay", "warmup_ratio": 0.05, "batch_size": 64, "negatives": "in_batch_plus_explicit", "source_stratification": true}, "hard_neg_mining": {"duration_minutes": 5, "top_k": 7, "batch_size": 128, "min_similarity": 0.3}, "fine_tuning": {"duration_minutes": 5, "data": "all_curated_with_hard_negs", "loss": "infonce", "temperature": 0.05, "learning_rate": 1e-05, "lr_schedule": "cosine_decay", "warmup_ratio": 0.0, "batch_size": 32, "hard_neg_weight": 1.0}}, "optimizer": {"type": "adamw", "betas": [0.9, 0.999], "eps": 1e-08, "weight_decay": 0.01}, "memory": {"max_peak_gb": 55, "gradient_accumulation_steps": 4}}, "num_params_M": 149.0, "decontam_removed": 0, "wandb_run_id": "e86wtsnj"}
{"commit": "56ec387", "primary_score": 56.6152, "memory_gb": 36.4, "training_min": 80.3, "datasets": ["hotpot_qa", "sentence-transformers/stackexchange-duplicates", "fancyzhx/dbpedia_14", "ag_news", "glue", "stanfordnlp/snli", "sentence-transformers/natural-questions", "yahoo_answers_topics", "sentence-transformers/reddit-title-body", "ms_marco"], "status": "discard", "description": "exp-62: higher contrastive LR 8e-5 (was 5e-5) with cosine decay; 60-min; HotpotQA; hypothesis: higher peak LR + cosine decay = better convergence; baseline exp-61 primary=57.11", "task_scores": {"sts_bench": 77.38, "sick_r": 72.97, "twitter_url": 76.13, "sprint_dup": 84.25, "20news": 37.5, "reddit_clust": 40.32, "scifact": 47.63, "nfcorpus": 20.65}, "timestamp": "2026-03-15T23:35:54.213998+00:00", "config": {"base_model": "answerdotai/ModernBERT-base", "embedding_dim": 768, "projection_dim": 768, "pooling": "cls", "max_seq_length": 512, "normalize_embeddings": true, "stages": {"warmup": {"duration_minutes": 15, "data": "qqp_se_paraphrase", "loss": "infonce", "temperature": 0.1, "learning_rate": 0.0001, "lr_schedule": "linear_warmup_constant", "warmup_ratio": 0.1, "batch_size": 64, "negatives": "in_batch_only", "freeze_encoder_layers": 0}, "contrastive": {"duration_minutes": 60, "data": "all_curated", "loss": "infonce", "temperature": 0.05, "learning_rate": 8e-05, "lr_schedule": "cosine_decay", "warmup_ratio": 0.05, "batch_size": 64, "negatives": "in_batch_plus_explicit", "source_stratification": true}, "hard_neg_mining": {"duration_minutes": 5, "top_k": 7, "batch_size": 128, "min_similarity": 0.3}, "fine_tuning": {"duration_minutes": 5, "data": "all_curated_with_hard_negs", "loss": "infonce", "temperature": 0.05, "learning_rate": 1e-05, "lr_schedule": "cosine_decay", "warmup_ratio": 0.0, "batch_size": 32, "hard_neg_weight": 1.0}}, "optimizer": {"type": "adamw", "betas": [0.9, 0.999], "eps": 1e-08, "weight_decay": 0.01}, "memory": {"max_peak_gb": 55, "gradient_accumulation_steps": 4}}, "num_params_M": 149.0, "decontam_removed": 0, "wandb_run_id": "nzuzuy2x"}
{"commit": "03052a0", "primary_score": 55.5611, "memory_gb": 36.4, "training_min": 80.3, "datasets": ["ms_marco", "sentence-transformers/stackexchange-duplicates", "fancyzhx/dbpedia_14", "stanfordnlp/snli", "hotpot_qa", "yahoo_answers_topics", "sentence-transformers/reddit-title-body", "ag_news", "glue", "sentence-transformers/natural-questions"], "status": "discard", "description": "exp-63: lower contrastive LR 3e-5 (was 5e-5) with cosine decay; 60-min; HotpotQA; hypothesis: gentler learning keeps STS quality; baseline exp-61 primary=57.11", "task_scores": {"sts_bench": 77.24, "sick_r": 72.2, "twitter_url": 78.99, "sprint_dup": 82.44, "20news": 35.7, "reddit_clust": 40.32, "scifact": 43.52, "nfcorpus": 19.15}, "timestamp": "2026-03-16T01:13:03.079458+00:00", "config": {"base_model": "answerdotai/ModernBERT-base", "embedding_dim": 768, "projection_dim": 768, "pooling": "cls", "max_seq_length": 512, "normalize_embeddings": true, "stages": {"warmup": {"duration_minutes": 15, "data": "qqp_se_paraphrase", "loss": "infonce", "temperature": 0.1, "learning_rate": 0.0001, "lr_schedule": "linear_warmup_constant", "warmup_ratio": 0.1, "batch_size": 64, "negatives": "in_batch_only", "freeze_encoder_layers": 0}, "contrastive": {"duration_minutes": 60, "data": "all_curated", "loss": "infonce", "temperature": 0.05, "learning_rate": 3e-05, "lr_schedule": "cosine_decay", "warmup_ratio": 0.05, "batch_size": 64, "negatives": "in_batch_plus_explicit", "source_stratification": true}, "hard_neg_mining": {"duration_minutes": 5, "top_k": 7, "batch_size": 128, "min_similarity": 0.3}, "fine_tuning": {"duration_minutes": 5, "data": "all_curated_with_hard_negs", "loss": "infonce", "temperature": 0.05, "learning_rate": 1e-05, "lr_schedule": "cosine_decay", "warmup_ratio": 0.0, "batch_size": 32, "hard_neg_weight": 1.0}}, "optimizer": {"type": "adamw", "betas": [0.9, 0.999], "eps": 1e-08, "weight_decay": 0.01}, "memory": {"max_peak_gb": 55, "gradient_accumulation_steps": 4}}, "num_params_M": 149.0, "decontam_removed": 0, "wandb_run_id": "3k8l2ykn"}
{"commit": "c66573a", "primary_score": 57.0035, "memory_gb": 36.4, "training_min": 80.3, "datasets": ["hotpot_qa", "glue", "ms_marco", "stanfordnlp/snli", "yahoo_answers_topics", "ag_news", "sentence-transformers/reddit-title-body", "fancyzhx/dbpedia_14", "sentence-transformers/stackexchange-duplicates", "sentence-transformers/natural-questions"], "status": "discard", "description": "exp-64: warmup uses cosine_decay LR=1.5e-4 (was linear_warmup_constant LR=1e-4); contrastive cosine_decay 5e-5; 60-min; HotpotQA; baseline exp-61 primary=57.11", "task_scores": {"sts_bench": 77.66, "sick_r": 74.24, "twitter_url": 77.64, "sprint_dup": 85.07, "20news": 36.55, "reddit_clust": 40.63, "scifact": 48.11, "nfcorpus": 20.09}, "timestamp": "2026-03-16T02:50:02.527382+00:00", "config": {"base_model": "answerdotai/ModernBERT-base", "embedding_dim": 768, "projection_dim": 768, "pooling": "cls", "max_seq_length": 512, "normalize_embeddings": true, "stages": {"warmup": {"duration_minutes": 15, "data": "qqp_se_paraphrase", "loss": "infonce", "temperature": 0.1, "learning_rate": 0.00015, "lr_schedule": "cosine_decay", "warmup_ratio": 0.1, "batch_size": 64, "negatives": "in_batch_only", "freeze_encoder_layers": 0}, "contrastive": {"duration_minutes": 60, "data": "all_curated", "loss": "infonce", "temperature": 0.05, "learning_rate": 5e-05, "lr_schedule": "cosine_decay", "warmup_ratio": 0.05, "batch_size": 64, "negatives": "in_batch_plus_explicit", "source_stratification": true}, "hard_neg_mining": {"duration_minutes": 5, "top_k": 7, "batch_size": 128, "min_similarity": 0.3}, "fine_tuning": {"duration_minutes": 5, "data": "all_curated_with_hard_negs", "loss": "infonce", "temperature": 0.05, "learning_rate": 1e-05, "lr_schedule": "cosine_decay", "warmup_ratio": 0.0, "batch_size": 32, "hard_neg_weight": 1.0}}, "optimizer": {"type": "adamw", "betas": [0.9, 0.999], "eps": 1e-08, "weight_decay": 0.01}, "memory": {"max_peak_gb": 55, "gradient_accumulation_steps": 4}}, "num_params_M": 149.0, "decontam_removed": 0, "wandb_run_id": "i4vx474v"}
{"commit": "7217cbb", "primary_score": 55.8108, "memory_gb": 37.2, "training_min": 80.3, "datasets": ["ag_news", "ms_marco", "sentence-transformers/stackexchange-duplicates", "stanfordnlp/snli", "glue", "yahoo_answers_topics", "sentence-transformers/natural-questions", "sentence-transformers/reddit-title-body", "fancyzhx/dbpedia_14", "hotpot_qa"], "status": "discard", "description": "exp-65: instruction-tuning for embeddings - task-specific query prefixes (e.g. 'Retrieve a passage that answers:'); 60-min cosine_decay contrastive; HotpotQA; baseline exp-61 primary=57.11", "task_scores": {"sts_bench": 77.47, "sick_r": 72.9, "twitter_url": 78.28, "sprint_dup": 84.34, "20news": 35.65, "reddit_clust": 38.24, "scifact": 46.19, "nfcorpus": 17.85}, "timestamp": "2026-03-16T04:27:42.809232+00:00", "config": {"base_model": "answerdotai/ModernBERT-base", "embedding_dim": 768, "projection_dim": 768, "pooling": "cls", "max_seq_length": 512, "normalize_embeddings": true, "stages": {"warmup": {"duration_minutes": 15, "data": "qqp_se_paraphrase", "loss": "infonce", "temperature": 0.1, "learning_rate": 0.0001, "lr_schedule": "linear_warmup_constant", "warmup_ratio": 0.1, "batch_size": 64, "negatives": "in_batch_only", "freeze_encoder_layers": 0}, "contrastive": {"duration_minutes": 60, "data": "all_curated", "loss": "infonce", "temperature": 0.05, "learning_rate": 5e-05, "lr_schedule": "cosine_decay", "warmup_ratio": 0.05, "batch_size": 64, "negatives": "in_batch_plus_explicit", "source_stratification": true, "instruction_prefix": true}, "hard_neg_mining": {"duration_minutes": 5, "top_k": 7, "batch_size": 128, "min_similarity": 0.3}, "fine_tuning": {"duration_minutes": 5, "data": "all_curated_with_hard_negs", "loss": "infonce", "temperature": 0.05, "learning_rate": 1e-05, "lr_schedule": "cosine_decay", "warmup_ratio": 0.0, "batch_size": 32, "hard_neg_weight": 1.0}}, "optimizer": {"type": "adamw", "betas": [0.9, 0.999], "eps": 1e-08, "weight_decay": 0.01}, "memory": {"max_peak_gb": 55, "gradient_accumulation_steps": 4}}, "num_params_M": 149.0, "decontam_removed": 0, "wandb_run_id": "sdofsxlk"}
{"commit": "17c0680", "primary_score": 56.3962, "memory_gb": 36.4, "training_min": 95.3, "datasets": ["sentence-transformers/reddit-title-body", "stanfordnlp/snli", "ms_marco", "glue", "yahoo_answers_topics", "ag_news", "sentence-transformers/natural-questions", "hotpot_qa", "fancyzhx/dbpedia_14", "sentence-transformers/stackexchange-duplicates"], "status": "discard", "description": "exp-66: contrastive 75min (interpolate between 60 and 90); cosine_decay LR=5e-5; HotpotQA; hypothesis: 60<75<90 sweet spot; baseline exp-61 primary=57.11 (60min) vs exp-52 56.45 (90min)", "task_scores": {"sts_bench": 76.37, "sick_r": 73.78, "twitter_url": 77.85, "sprint_dup": 84.26, "20news": 39.69, "reddit_clust": 42.64, "scifact": 43.8, "nfcorpus": 19.06}, "timestamp": "2026-03-16T06:20:29.056700+00:00", "config": {"base_model": "answerdotai/ModernBERT-base", "embedding_dim": 768, "projection_dim": 768, "pooling": "cls", "max_seq_length": 512, "normalize_embeddings": true, "stages": {"warmup": {"duration_minutes": 15, "data": "qqp_se_paraphrase", "loss": "infonce", "temperature": 0.1, "learning_rate": 0.0001, "lr_schedule": "linear_warmup_constant", "warmup_ratio": 0.1, "batch_size": 64, "negatives": "in_batch_only", "freeze_encoder_layers": 0}, "contrastive": {"duration_minutes": 75, "data": "all_curated", "loss": "infonce", "temperature": 0.05, "learning_rate": 5e-05, "lr_schedule": "cosine_decay", "warmup_ratio": 0.05, "batch_size": 64, "negatives": "in_batch_plus_explicit", "source_stratification": true}, "hard_neg_mining": {"duration_minutes": 5, "top_k": 7, "batch_size": 128, "min_similarity": 0.3}, "fine_tuning": {"duration_minutes": 5, "data": "all_curated_with_hard_negs", "loss": "infonce", "temperature": 0.05, "learning_rate": 1e-05, "lr_schedule": "cosine_decay", "warmup_ratio": 0.0, "batch_size": 32, "hard_neg_weight": 1.0}}, "optimizer": {"type": "adamw", "betas": [0.9, 0.999], "eps": 1e-08, "weight_decay": 0.01}, "memory": {"max_peak_gb": 55, "gradient_accumulation_steps": 4}}, "num_params_M": 149.0, "decontam_removed": 0, "wandb_run_id": "6c6y9er7"}
{"commit": "d9d0497", "primary_score": 57.5131, "memory_gb": 36.4, "training_min": 80.3, "datasets": ["glue", "ms_marco", "sentence-transformers/natural-questions", "sentence-transformers/reddit-title-body", "stanfordnlp/snli", "fancyzhx/dbpedia_14", "hotpot_qa", "ag_news", "yahoo_answers_topics", "sentence-transformers/stackexchange-duplicates"], "status": "keep", "description": "exp-67: time-based cosine LR decay (fix: was step-estimate based which under-counted for long runs); 60-min contrastive; baseline exp-61 primary=57.11 (was step-based)", "task_scores": {"sts_bench": 77.7, "sick_r": 74.54, "twitter_url": 78.92, "sprint_dup": 84.13, "20news": 39.81, "reddit_clust": 42.83, "scifact": 47.42, "nfcorpus": 19.97}, "timestamp": "2026-03-16T08:08:06.577670+00:00", "config": {"base_model": "answerdotai/ModernBERT-base", "embedding_dim": 768, "projection_dim": 768, "pooling": "cls", "max_seq_length": 512, "normalize_embeddings": true, "stages": {"warmup": {"duration_minutes": 15, "data": "qqp_se_paraphrase", "loss": "infonce", "temperature": 0.1, "learning_rate": 0.0001, "lr_schedule": "linear_warmup_constant", "warmup_ratio": 0.1, "batch_size": 64, "negatives": "in_batch_only", "freeze_encoder_layers": 0}, "contrastive": {"duration_minutes": 60, "data": "all_curated", "loss": "infonce", "temperature": 0.05, "learning_rate": 5e-05, "lr_schedule": "cosine_decay", "warmup_ratio": 0.05, "batch_size": 64, "negatives": "in_batch_plus_explicit", "source_stratification": true}, "hard_neg_mining": {"duration_minutes": 5, "top_k": 7, "batch_size": 128, "min_similarity": 0.3}, "fine_tuning": {"duration_minutes": 5, "data": "all_curated_with_hard_negs", "loss": "infonce", "temperature": 0.05, "learning_rate": 1e-05, "lr_schedule": "cosine_decay", "warmup_ratio": 0.0, "batch_size": 32, "hard_neg_weight": 1.0}}, "optimizer": {"type": "adamw", "betas": [0.9, 0.999], "eps": 1e-08, "weight_decay": 0.01}, "memory": {"max_peak_gb": 55, "gradient_accumulation_steps": 4}}, "num_params_M": 149.0, "decontam_removed": 0, "wandb_run_id": "6jvdeo2z"}
{"commit": "d47d69e", "primary_score": 57.4147, "memory_gb": 36.4, "training_min": 95.3, "datasets": ["yahoo_answers_topics", "sentence-transformers/natural-questions", "stanfordnlp/snli", "hotpot_qa", "glue", "ag_news", "ms_marco", "fancyzhx/dbpedia_14", "sentence-transformers/stackexchange-duplicates", "sentence-transformers/reddit-title-body"], "status": "discard", "description": "exp-68: 75-min contrastive with time-based cosine decay (exp-66 used buggy step-based); baseline exp-67 primary=57.51 (60-min)", "task_scores": {"sts_bench": 79.82, "sick_r": 74.49, "twitter_url": 80.53, "sprint_dup": 82.89, "20news": 40.08, "reddit_clust": 43.0, "scifact": 45.21, "nfcorpus": 18.91}, "timestamp": "2026-03-16T10:00:30.700392+00:00", "config": {"base_model": "answerdotai/ModernBERT-base", "embedding_dim": 768, "projection_dim": 768, "pooling": "cls", "max_seq_length": 512, "normalize_embeddings": true, "stages": {"warmup": {"duration_minutes": 15, "data": "qqp_se_paraphrase", "loss": "infonce", "temperature": 0.1, "learning_rate": 0.0001, "lr_schedule": "linear_warmup_constant", "warmup_ratio": 0.1, "batch_size": 64, "negatives": "in_batch_only", "freeze_encoder_layers": 0}, "contrastive": {"duration_minutes": 75, "data": "all_curated", "loss": "infonce", "temperature": 0.05, "learning_rate": 5e-05, "lr_schedule": "cosine_decay", "warmup_ratio": 0.05, "batch_size": 64, "negatives": "in_batch_plus_explicit", "source_stratification": true}, "hard_neg_mining": {"duration_minutes": 5, "top_k": 7, "batch_size": 128, "min_similarity": 0.3}, "fine_tuning": {"duration_minutes": 5, "data": "all_curated_with_hard_negs", "loss": "infonce", "temperature": 0.05, "learning_rate": 1e-05, "lr_schedule": "cosine_decay", "warmup_ratio": 0.0, "batch_size": 32, "hard_neg_weight": 1.0}}, "optimizer": {"type": "adamw", "betas": [0.9, 0.999], "eps": 1e-08, "weight_decay": 0.01}, "memory": {"max_peak_gb": 55, "gradient_accumulation_steps": 4}}, "num_params_M": 149.0, "decontam_removed": 0, "wandb_run_id": "ce9kmsai"}
{"commit": "609bfa5", "primary_score": 56.5306, "memory_gb": 36.4, "training_min": 85.7, "datasets": ["glue", "fancyzhx/dbpedia_14", "hotpot_qa", "sentence-transformers/natural-questions", "ag_news", "sentence-transformers/stackexchange-duplicates", "ms_marco", "stanfordnlp/snli", "yahoo_answers_topics", "sentence-transformers/reddit-title-body"], "status": "discard", "description": "exp-69: expand hard neg mining 8K\u219216K + fine-tuning 5min\u219210min; baseline exp-67 primary=57.51", "task_scores": {"sts_bench": 76.03, "sick_r": 73.9, "twitter_url": 77.19, "sprint_dup": 77.88, "20news": 40.22, "reddit_clust": 42.89, "scifact": 46.84, "nfcorpus": 21.32}, "timestamp": "2026-03-16T11:45:22.682526+00:00", "config": {"base_model": "answerdotai/ModernBERT-base", "embedding_dim": 768, "projection_dim": 768, "pooling": "cls", "max_seq_length": 512, "normalize_embeddings": true, "stages": {"warmup": {"duration_minutes": 15, "data": "qqp_se_paraphrase", "loss": "infonce", "temperature": 0.1, "learning_rate": 0.0001, "lr_schedule": "linear_warmup_constant", "warmup_ratio": 0.1, "batch_size": 64, "negatives": "in_batch_only", "freeze_encoder_layers": 0}, "contrastive": {"duration_minutes": 60, "data": "all_curated", "loss": "infonce", "temperature": 0.05, "learning_rate": 5e-05, "lr_schedule": "cosine_decay", "warmup_ratio": 0.05, "batch_size": 64, "negatives": "in_batch_plus_explicit", "source_stratification": true}, "hard_neg_mining": {"duration_minutes": 5, "top_k": 7, "batch_size": 128, "min_similarity": 0.3}, "fine_tuning": {"duration_minutes": 10, "data": "all_curated_with_hard_negs", "loss": "infonce", "temperature": 0.05, "learning_rate": 1e-05, "lr_schedule": "cosine_decay", "warmup_ratio": 0.0, "batch_size": 32, "hard_neg_weight": 1.0}}, "optimizer": {"type": "adamw", "betas": [0.9, 0.999], "eps": 1e-08, "weight_decay": 0.01}, "memory": {"max_peak_gb": 55, "gradient_accumulation_steps": 4}}, "num_params_M": 149.0, "decontam_removed": 0, "wandb_run_id": "d3ukmqwz"}
