{"commit": "0179bad", "primary_score": 58.5672, "memory_gb": 53.4, "training_min": 261.8, "datasets": ["ms_marco", "sentence-transformers/reddit-title-body", "qiaojin/PubMedQA", "sentence-transformers/s2orc", "sentence-transformers/natural-questions", "ag_news", "yahoo_answers_topics", "stanfordnlp/snli", "glue", "sentence-transformers/stackexchange-duplicates", "hotpot_qa", "fancyzhx/dbpedia_14"], "status": "discard", "description": "exp-133: increase weight_decay to 0.03 (was 0.01); stronger regularization for better generalization; all other settings match exp-128 best (temp=0.03, LR=3e-5, 200K, 240min, B=64, symmetric); standard value in many transformer training recipes is 0.01-0.1; hypothesis: higher weight decay reduces overfitting on large sources and improves OOD generalization", "task_scores": {"sts_bench": 76.26, "sick_r": 73.01, "twitter_url": 74.44, "sprint_dup": 67.02}, "timestamp": "2026-04-10T20:03:38.078178+00:00", "config": {"base_model": "answerdotai/ModernBERT-base", "projection_dim": 768, "pooling": "cls", "max_seq_length": 256, "normalize_embeddings": true, "simclr_head": false, "stages": {"warmup": {"duration_minutes": 15, "data": "qqp_se_paraphrase", "loss": "infonce", "temperature": 0.1, "learning_rate": 0.0001, "lr_schedule": "linear_warmup_constant", "warmup_ratio": 0.1, "batch_size": 64, "negatives": "in_batch_only", "freeze_encoder_layers": 0, "false_neg_threshold": 0.0}, "contrastive": {"duration_minutes": 240, "data": "all_curated", "loss": "infonce", "temperature": 0.03, "temperature_end": 0.0, "learning_rate": 3e-05, "lr_schedule": "cosine_decay", "warmup_ratio": 0.05, "batch_size": 64, "negatives": "in_batch_plus_explicit", "source_stratification": false, "symmetric": true, "false_neg_threshold": 0.0}, "hard_neg_mining": {"duration_minutes": 5, "top_k": 7, "batch_size": 128, "min_similarity": 0.3}, "fine_tuning": {"duration_minutes": 5, "data": "all_curated_with_hard_negs", "loss": "infonce", "temperature": 0.05, "learning_rate": 1e-05, "lr_schedule": "cosine_decay", "warmup_ratio": 0.0, "batch_size": 64, "hard_neg_weight": 0.0, "false_neg_threshold": 0.0}}, "optimizer": {"type": "adamw", "betas": [0.9, 0.999], "eps": 1e-08, "weight_decay": 0.03, "llrd_decay": 1.0, "ema_decay": 0.0}, "data": {"max_rows_per_dataset": 200000}, "memory": {"max_peak_gb": 55, "gradient_accumulation_steps": 1, "gradient_checkpointing": false}}, "num_params_M": 149.0, "decontam_removed": 0, "wandb_run_id": "fifdrvvi"}
{"commit": "4fba2b4", "primary_score": 48.1597, "memory_gb": 39.2, "training_min": 201.8, "datasets": ["qiaojin/PubMedQA", "stanfordnlp/snli", "ms_marco", "sentence-transformers/stackexchange-duplicates", "yahoo_answers_topics", "fancyzhx/dbpedia_14", "glue", "hotpot_qa", "ag_news", "sentence-transformers/natural-questions", "sentence-transformers/s2orc", "sentence-transformers/reddit-title-body"], "status": "discard", "description": "exp-134: gentle LLRD (decay=0.99) on exp-107 best recipe (temp=0.05, LR=5e-5, 100K, 180min); exp-92 LLRD=0.95 was catastrophic (39.21) but 0.99 is much milder — bottom layer gets 0.81x LR vs 0.34x; preserves lower-layer pretrained features while adapting upper layers more aggressively; standard technique in NV-Embed/GTE/Arctic-Embed; all other settings match exp-107 exactly; weight_decay reverted to 0.01 (exp-133 proved 0.03 catastrophic at -4.96); baseline exp-107 primary=65.16; hypothesis: LLRD improves generalization by preventing lower-layer forgetting", "task_scores": {"sts_bench": 65.18, "sick_r": 60.11, "twitter_url": 73.82, "sprint_dup": 71.64}, "timestamp": "2026-04-10T23:42:06.379652+00:00", "config": {"base_model": "answerdotai/ModernBERT-base", "projection_dim": 768, "pooling": "cls", "max_seq_length": 256, "normalize_embeddings": true, "simclr_head": false, "stages": {"warmup": {"duration_minutes": 15, "data": "qqp_se_paraphrase", "loss": "infonce", "temperature": 0.1, "learning_rate": 0.0001, "lr_schedule": "linear_warmup_constant", "warmup_ratio": 0.1, "batch_size": 64, "negatives": "in_batch_only", "freeze_encoder_layers": 0, "false_neg_threshold": 0.0}, "contrastive": {"duration_minutes": 180, "data": "all_curated", "loss": "infonce", "temperature": 0.05, "temperature_end": 0.0, "learning_rate": 5e-05, "lr_schedule": "cosine_decay", "warmup_ratio": 0.05, "batch_size": 64, "negatives": "in_batch_plus_explicit", "source_stratification": false, "symmetric": true, "false_neg_threshold": 0.0}, "hard_neg_mining": {"duration_minutes": 5, "top_k": 7, "batch_size": 128, "min_similarity": 0.3}, "fine_tuning": {"duration_minutes": 5, "data": "all_curated_with_hard_negs", "loss": "infonce", "temperature": 0.05, "learning_rate": 1e-05, "lr_schedule": "cosine_decay", "warmup_ratio": 0.0, "batch_size": 64, "hard_neg_weight": 0.0, "false_neg_threshold": 0.0}}, "optimizer": {"type": "adamw", "betas": [0.9, 0.999], "eps": 1e-08, "weight_decay": 0.01, "llrd_decay": 0.99, "ema_decay": 0.0}, "data": {"max_rows_per_dataset": 100000}, "memory": {"max_peak_gb": 55, "gradient_accumulation_steps": 1, "gradient_checkpointing": false}}, "num_params_M": 149.0, "decontam_removed": 0, "wandb_run_id": "82pv43sp"}
{"commit": "eac5e7c", "primary_score": 57.9764, "memory_gb": 39.3, "training_min": 201.9, "datasets": ["ms_marco", "qiaojin/PubMedQA", "glue", "yahoo_answers_topics", "stanfordnlp/snli", "hotpot_qa", "sentence-transformers/reddit-title-body", "sentence-transformers/s2orc", "fancyzhx/dbpedia_14", "sentence-transformers/natural-questions", "ag_news", "sentence-transformers/stackexchange-duplicates"], "status": "discard", "description": "exp-135: reproduce exp-107 exactly (temp=0.05, LR=5e-5, 100K, 180min); LLRD reverted to 1.0 (exp-134 LLRD=0.99 was catastrophic at 48.16, -17 from baseline); need to verify exp-107's 65.16 is reproducible and not seed variance; all settings match exp-107 exactly; if confirmed, this becomes the stable foundation for methodology experiments", "task_scores": {"sts_bench": 75.94, "sick_r": 71.69, "twitter_url": 68.88, "sprint_dup": 67.67}, "timestamp": "2026-04-11T03:24:06.728306+00:00", "config": {"base_model": "answerdotai/ModernBERT-base", "projection_dim": 768, "pooling": "cls", "max_seq_length": 256, "normalize_embeddings": true, "simclr_head": false, "stages": {"warmup": {"duration_minutes": 15, "data": "qqp_se_paraphrase", "loss": "infonce", "temperature": 0.1, "learning_rate": 0.0001, "lr_schedule": "linear_warmup_constant", "warmup_ratio": 0.1, "batch_size": 64, "negatives": "in_batch_only", "freeze_encoder_layers": 0, "false_neg_threshold": 0.0}, "contrastive": {"duration_minutes": 180, "data": "all_curated", "loss": "infonce", "temperature": 0.05, "temperature_end": 0.0, "learning_rate": 5e-05, "lr_schedule": "cosine_decay", "warmup_ratio": 0.05, "batch_size": 64, "negatives": "in_batch_plus_explicit", "source_stratification": false, "symmetric": true, "false_neg_threshold": 0.0}, "hard_neg_mining": {"duration_minutes": 5, "top_k": 7, "batch_size": 128, "min_similarity": 0.3}, "fine_tuning": {"duration_minutes": 5, "data": "all_curated_with_hard_negs", "loss": "infonce", "temperature": 0.05, "learning_rate": 1e-05, "lr_schedule": "cosine_decay", "warmup_ratio": 0.0, "batch_size": 64, "hard_neg_weight": 0.0, "false_neg_threshold": 0.0}}, "optimizer": {"type": "adamw", "betas": [0.9, 0.999], "eps": 1e-08, "weight_decay": 0.01, "llrd_decay": 1.0, "ema_decay": 0.0}, "data": {"max_rows_per_dataset": 100000}, "memory": {"max_peak_gb": 55, "gradient_accumulation_steps": 1, "gradient_checkpointing": false}}, "num_params_M": 149.0, "decontam_removed": 0, "wandb_run_id": "y9wperug"}
{"commit": "957b3f6", "primary_score": 57.2867, "memory_gb": 37.7, "training_min": 202.0, "datasets": ["sentence-transformers/stackexchange-duplicates", "sentence-transformers/reddit-title-body", "ag_news", "qiaojin/PubMedQA", "yahoo_answers_topics", "hotpot_qa", "ms_marco", "glue", "sentence-transformers/s2orc", "fancyzhx/dbpedia_14", "stanfordnlp/snli", "sentence-transformers/natural-questions"], "status": "discard", "description": "exp-136: re-enable source_stratification=true to match exp-107 exactly; exp-135 showed stratification=false regressed -4.31 (57.98 vs exp-107 corrected 62.29); stratification was the ONLY config difference; exp-129 tested stratification at temp=0.03 recipe and regressed -0.59, but exp-107 best was temp=0.05+stratification=true; all other settings match exp-107/135 (temp=0.05, LR=5e-5, 100K, 180min, weight_decay=0.01, no LLRD); hypothesis: source stratification is critical at temp=0.05 to prevent large-source dominance", "task_scores": {"sts_bench": 75.85, "sick_r": 71.29, "twitter_url": 61.27, "sprint_dup": 71.61}, "timestamp": "2026-04-11T07:02:42.186545+00:00", "config": {"base_model": "answerdotai/ModernBERT-base", "projection_dim": 768, "pooling": "cls", "max_seq_length": 256, "normalize_embeddings": true, "simclr_head": false, "stages": {"warmup": {"duration_minutes": 15, "data": "qqp_se_paraphrase", "loss": "infonce", "temperature": 0.1, "learning_rate": 0.0001, "lr_schedule": "linear_warmup_constant", "warmup_ratio": 0.1, "batch_size": 64, "negatives": "in_batch_only", "freeze_encoder_layers": 0, "false_neg_threshold": 0.0}, "contrastive": {"duration_minutes": 180, "data": "all_curated", "loss": "infonce", "temperature": 0.05, "temperature_end": 0.0, "learning_rate": 5e-05, "lr_schedule": "cosine_decay", "warmup_ratio": 0.05, "batch_size": 64, "negatives": "in_batch_plus_explicit", "source_stratification": true, "symmetric": true, "false_neg_threshold": 0.0}, "hard_neg_mining": {"duration_minutes": 5, "top_k": 7, "batch_size": 128, "min_similarity": 0.3}, "fine_tuning": {"duration_minutes": 5, "data": "all_curated_with_hard_negs", "loss": "infonce", "temperature": 0.05, "learning_rate": 1e-05, "lr_schedule": "cosine_decay", "warmup_ratio": 0.0, "batch_size": 64, "hard_neg_weight": 0.0, "false_neg_threshold": 0.0}}, "optimizer": {"type": "adamw", "betas": [0.9, 0.999], "eps": 1e-08, "weight_decay": 0.01, "llrd_decay": 1.0, "ema_decay": 0.0}, "data": {"max_rows_per_dataset": 100000}, "memory": {"max_peak_gb": 55, "gradient_accumulation_steps": 1, "gradient_checkpointing": false}}, "num_params_M": 149.0, "decontam_removed": 0, "wandb_run_id": "efnhyg2e"}
{"commit": "5d92069", "primary_score": 53.9993, "memory_gb": 38.2, "training_min": 262.3, "datasets": ["sentence-transformers/natural-questions", "ms_marco", "hotpot_qa", "sentence-transformers/stackexchange-duplicates", "yahoo_answers_topics", "sentence-transformers/reddit-title-body", "ag_news", "sentence-transformers/s2orc", "fancyzhx/dbpedia_14", "stanfordnlp/snli", "qiaojin/PubMedQA", "glue"], "status": "discard", "description": "exp-137: cross-dataset MinHash dedup on exp-128 best recipe (temp=0.03+LR=3e-5+200K+240min); dedup removes near-duplicate pairs across 12 sources (Jaccard>0.8 on query+positive); hypothesis: reducing redundancy improves diversity per training step → better generalization; exp-128 baseline primary=63.53 (21-task); all other settings match exp-128 exactly (strat=false in practice, symmetric, B=64, FT temp=0.05, hard_neg_weight=0.0); new code: dedup_triplets_minhash() added to pipeline, controlled by data.cross_dedup config flag", "task_scores": {"sts_bench": 75.54, "sick_r": 75.31, "twitter_url": 73.88, "sprint_dup": 74.64}, "timestamp": "2026-04-11T13:10:39.781630+00:00", "config": {"base_model": "answerdotai/ModernBERT-base", "projection_dim": 768, "pooling": "cls", "max_seq_length": 256, "normalize_embeddings": true, "simclr_head": false, "stages": {"warmup": {"duration_minutes": 15, "data": "qqp_se_paraphrase", "loss": "infonce", "temperature": 0.1, "learning_rate": 0.0001, "lr_schedule": "linear_warmup_constant", "warmup_ratio": 0.1, "batch_size": 64, "negatives": "in_batch_only", "freeze_encoder_layers": 0, "false_neg_threshold": 0.0}, "contrastive": {"duration_minutes": 240, "data": "all_curated", "loss": "infonce", "temperature": 0.03, "temperature_end": 0.0, "learning_rate": 3e-05, "lr_schedule": "cosine_decay", "warmup_ratio": 0.05, "batch_size": 64, "negatives": "in_batch_plus_explicit", "source_stratification": false, "symmetric": true, "false_neg_threshold": 0.0}, "hard_neg_mining": {"duration_minutes": 5, "top_k": 7, "batch_size": 128, "min_similarity": 0.3}, "fine_tuning": {"duration_minutes": 5, "data": "all_curated_with_hard_negs", "loss": "infonce", "temperature": 0.05, "learning_rate": 1e-05, "lr_schedule": "cosine_decay", "warmup_ratio": 0.0, "batch_size": 64, "hard_neg_weight": 0.0, "false_neg_threshold": 0.0}}, "optimizer": {"type": "adamw", "betas": [0.9, 0.999], "eps": 1e-08, "weight_decay": 0.01, "llrd_decay": 1.0, "ema_decay": 0.0}, "data": {"max_rows_per_dataset": 200000, "cross_dedup": true}, "memory": {"max_peak_gb": 55, "gradient_accumulation_steps": 1, "gradient_checkpointing": false}}, "num_params_M": 149.0, "decontam_removed": 1218, "wandb_run_id": "9at01gn4"}
{"commit": "3e3c31a", "primary_score": 52.1875, "memory_gb": 38.5, "training_min": 262.0, "datasets": ["sentence-transformers/reddit-title-body", "sentence-transformers/stackexchange-duplicates", "stanfordnlp/snli", "ms_marco", "hotpot_qa", "sentence-transformers/s2orc", "sentence-transformers/natural-questions", "glue", "fancyzhx/dbpedia_14", "qiaojin/PubMedQA", "yahoo_answers_topics", "ag_news"], "status": "discard", "description": "exp-138: reproduce exp-128 on current codebase WITHOUT dedup to isolate regression; exp-137 added cross-dataset dedup and collapsed to 54.0 (-9.5 vs exp-128's 63.53); need to determine if regression is from dedup or from code changes since exp-128 (source-diverse mining pool, stratification code path); all settings match exp-128 exactly (temp=0.03, LR=3e-5, 200K, 240min, strat=false, symmetric, B=64, FT temp=0.05, hard_neg_weight=0.0, WD=0.01); baseline exp-128 primary=63.53", "task_scores": {"sts_bench": 76.67, "sick_r": 73.16, "twitter_url": 69.65, "sprint_dup": 63.88}, "timestamp": "2026-04-11T18:33:53.092058+00:00", "config": {"base_model": "answerdotai/ModernBERT-base", "projection_dim": 768, "pooling": "cls", "max_seq_length": 256, "normalize_embeddings": true, "simclr_head": false, "stages": {"warmup": {"duration_minutes": 15, "data": "qqp_se_paraphrase", "loss": "infonce", "temperature": 0.1, "learning_rate": 0.0001, "lr_schedule": "linear_warmup_constant", "warmup_ratio": 0.1, "batch_size": 64, "negatives": "in_batch_only", "freeze_encoder_layers": 0, "false_neg_threshold": 0.0}, "contrastive": {"duration_minutes": 240, "data": "all_curated", "loss": "infonce", "temperature": 0.03, "temperature_end": 0.0, "learning_rate": 3e-05, "lr_schedule": "cosine_decay", "warmup_ratio": 0.05, "batch_size": 64, "negatives": "in_batch_plus_explicit", "source_stratification": false, "symmetric": true, "false_neg_threshold": 0.0}, "hard_neg_mining": {"duration_minutes": 5, "top_k": 7, "batch_size": 128, "min_similarity": 0.3}, "fine_tuning": {"duration_minutes": 5, "data": "all_curated_with_hard_negs", "loss": "infonce", "temperature": 0.05, "learning_rate": 1e-05, "lr_schedule": "cosine_decay", "warmup_ratio": 0.0, "batch_size": 64, "hard_neg_weight": 0.0, "false_neg_threshold": 0.0}}, "optimizer": {"type": "adamw", "betas": [0.9, 0.999], "eps": 1e-08, "weight_decay": 0.01, "llrd_decay": 1.0, "ema_decay": 0.0}, "data": {"max_rows_per_dataset": 200000, "cross_dedup": false}, "memory": {"max_peak_gb": 55, "gradient_accumulation_steps": 1, "gradient_checkpointing": false}}, "num_params_M": 149.0, "decontam_removed": 1218, "wandb_run_id": "n1ofzqhr"}
{"commit": "c14e2cc", "primary_score": 62.8619, "memory_gb": 38.5, "training_min": 260.5, "datasets": ["sentence-transformers/reddit-title-body", "glue", "ms_marco", "yahoo_answers_topics", "fancyzhx/dbpedia_14", "sentence-transformers/s2orc", "ag_news", "qiaojin/PubMedQA", "sentence-transformers/stackexchange-duplicates", "hotpot_qa", "stanfordnlp/snli", "sentence-transformers/natural-questions"], "status": "discard", "description": "exp-139: revert source-diverse mining pool to triplets[:8000] (matching exp-128 exactly); exp-138 showed -11.3 regression (52.19 vs 63.53) from code drift; the only functional change was mining pool diversification (20K source-balanced vs 8K sequential); even with hard_neg_weight=0.0 the FT stage trains on different subsets; reverting to isolate if this caused AskUbuntuDupQuestions collapse (23→54); all settings match exp-128 (temp=0.03, LR=3e-5, 200K, 240min, no dedup)", "task_scores": {"sts_bench": 78.79, "sick_r": 74.72, "twitter_url": 81.73, "sprint_dup": 84.97}, "timestamp": "2026-04-11T23:10:25.199413+00:00", "config": {"base_model": "answerdotai/ModernBERT-base", "projection_dim": 768, "pooling": "cls", "max_seq_length": 256, "normalize_embeddings": true, "simclr_head": false, "stages": {"warmup": {"duration_minutes": 15, "data": "qqp_se_paraphrase", "loss": "infonce", "temperature": 0.1, "learning_rate": 0.0001, "lr_schedule": "linear_warmup_constant", "warmup_ratio": 0.1, "batch_size": 64, "negatives": "in_batch_only", "freeze_encoder_layers": 0, "false_neg_threshold": 0.0}, "contrastive": {"duration_minutes": 240, "data": "all_curated", "loss": "infonce", "temperature": 0.03, "temperature_end": 0.0, "learning_rate": 3e-05, "lr_schedule": "cosine_decay", "warmup_ratio": 0.05, "batch_size": 64, "negatives": "in_batch_plus_explicit", "source_stratification": false, "symmetric": true, "false_neg_threshold": 0.0}, "hard_neg_mining": {"duration_minutes": 5, "top_k": 7, "batch_size": 128, "min_similarity": 0.3}, "fine_tuning": {"duration_minutes": 5, "data": "all_curated_with_hard_negs", "loss": "infonce", "temperature": 0.05, "learning_rate": 1e-05, "lr_schedule": "cosine_decay", "warmup_ratio": 0.0, "batch_size": 64, "hard_neg_weight": 0.0, "false_neg_threshold": 0.0}}, "optimizer": {"type": "adamw", "betas": [0.9, 0.999], "eps": 1e-08, "weight_decay": 0.01, "llrd_decay": 1.0, "ema_decay": 0.0}, "data": {"max_rows_per_dataset": 200000, "cross_dedup": false}, "memory": {"max_peak_gb": 55, "gradient_accumulation_steps": 1, "gradient_checkpointing": false}}, "num_params_M": 149.0, "decontam_removed": 0, "wandb_run_id": "n44fplpu"}
{"commit": "76db2c8", "primary_score": 15.1592, "memory_gb": 14.4, "training_min": 0.0, "datasets": [], "status": "discard", "description": "exp-140: data scaling 200K→400K (max_rows_per_dataset=400000); exp-139 confirmed mining pool revert recovered 62.86 (vs exp-128's 63.53); program.md says data scaling is highest ROI and explicitly recommends 200K vs 400K vs 800K; 4 datasets (stackexchange, reddit, s2orc, PubMedQA) were hitting 200K cap — scaling to 400K doubles their contribution (~3M total triplets vs 1.5M); more diverse training signal should improve generalization; all other settings match exp-128/139 recipe (temp=0.03, LR=3e-5, 240min, strat=false, symmetric, mining=triplets[:8000], hard_neg_weight=0.0); baseline exp-139 primary=62.86", "task_scores": {"sts_bench": 15.2, "sick_r": 23.15, "twitter_url": 44.57, "sprint_dup": 2.45}, "timestamp": "2026-04-11T23:34:01.345402+00:00", "config": {"base_model": "answerdotai/ModernBERT-base", "projection_dim": 768, "pooling": "cls", "max_seq_length": 256, "normalize_embeddings": true, "simclr_head": false, "stages": {"warmup": {"duration_minutes": 15, "data": "qqp_se_paraphrase", "loss": "infonce", "temperature": 0.1, "learning_rate": 0.0001, "lr_schedule": "linear_warmup_constant", "warmup_ratio": 0.1, "batch_size": 64, "negatives": "in_batch_only", "freeze_encoder_layers": 0, "false_neg_threshold": 0.0}, "contrastive": {"duration_minutes": 240, "data": "all_curated", "loss": "infonce", "temperature": 0.03, "temperature_end": 0.0, "learning_rate": 3e-05, "lr_schedule": "cosine_decay", "warmup_ratio": 0.05, "batch_size": 64, "negatives": "in_batch_plus_explicit", "source_stratification": false, "symmetric": true, "false_neg_threshold": 0.0}, "hard_neg_mining": {"duration_minutes": 5, "top_k": 7, "batch_size": 128, "min_similarity": 0.3}, "fine_tuning": {"duration_minutes": 5, "data": "all_curated_with_hard_negs", "loss": "infonce", "temperature": 0.05, "learning_rate": 1e-05, "lr_schedule": "cosine_decay", "warmup_ratio": 0.0, "batch_size": 64, "hard_neg_weight": 0.0, "false_neg_threshold": 0.0}}, "optimizer": {"type": "adamw", "betas": [0.9, 0.999], "eps": 1e-08, "weight_decay": 0.01, "llrd_decay": 1.0, "ema_decay": 0.0}, "data": {"max_rows_per_dataset": 400000, "cross_dedup": false}, "memory": {"max_peak_gb": 55, "gradient_accumulation_steps": 1, "gradient_checkpointing": false}}, "num_params_M": 149.0, "decontam_removed": 0, "wandb_run_id": "rqiqgvn5"}
