{"commit": "4c7e2b0", "primary_score": 0.0, "memory_gb": 0.0, "training_min": 0.0, "datasets": [], "status": "crash", "description": "exp-141: RETRY data scaling 200K→400K (max_rows_per_dataset=400000); exp-140 failed (15.16) because empty data was cached — deleted poisoned cache file + added guard to prevent caching empty results; hypothesis same as exp-140: 4 datasets hit 200K cap, scaling to 400K doubles their contribution; all settings match exp-128/139 recipe (temp=0.03, LR=3e-5, 240min, strat=false, symmetric, mining=triplets[:8000], hard_neg_weight=0.0); baseline exp-139 primary=62.86", "task_scores": {}, "timestamp": "2026-04-11T23:50:36.512163+00:00", "config": {"base_model": "answerdotai/ModernBERT-base", "projection_dim": 768, "pooling": "cls", "max_seq_length": 256, "normalize_embeddings": true, "simclr_head": false, "stages": {"warmup": {"duration_minutes": 15, "data": "qqp_se_paraphrase", "loss": "infonce", "temperature": 0.1, "learning_rate": 0.0001, "lr_schedule": "linear_warmup_constant", "warmup_ratio": 0.1, "batch_size": 64, "negatives": "in_batch_only", "freeze_encoder_layers": 0, "false_neg_threshold": 0.0}, "contrastive": {"duration_minutes": 240, "data": "all_curated", "loss": "infonce", "temperature": 0.03, "temperature_end": 0.0, "learning_rate": 3e-05, "lr_schedule": "cosine_decay", "warmup_ratio": 0.05, "batch_size": 64, "negatives": "in_batch_plus_explicit", "source_stratification": false, "symmetric": true, "false_neg_threshold": 0.0}, "hard_neg_mining": {"duration_minutes": 5, "top_k": 7, "batch_size": 128, "min_similarity": 0.3}, "fine_tuning": {"duration_minutes": 5, "data": "all_curated_with_hard_negs", "loss": "infonce", "temperature": 0.05, "learning_rate": 1e-05, "lr_schedule": "cosine_decay", "warmup_ratio": 0.0, "batch_size": 64, "hard_neg_weight": 0.0, "false_neg_threshold": 0.0}}, "optimizer": {"type": "adamw", "betas": [0.9, 0.999], "eps": 1e-08, "weight_decay": 0.01, "llrd_decay": 1.0, "ema_decay": 0.0}, "data": {"max_rows_per_dataset": 400000, "cross_dedup": false}, "memory": {"max_peak_gb": 55, "gradient_accumulation_steps": 1, "gradient_checkpointing": false}}, "num_params_M": null, "decontam_removed": 0}
{"commit": "caf767c", "primary_score": 62.7724, "memory_gb": 39.7, "training_min": 260.4, "datasets": ["sentence-transformers/s2orc", "sentence-transformers/natural-questions", "ms_marco", "sentence-transformers/reddit-title-body", "yahoo_answers_topics", "fancyzhx/dbpedia_14", "glue", "hotpot_qa", "sentence-transformers/stackexchange-duplicates", "qiaojin/PubMedQA", "stanfordnlp/snli", "ag_news"], "status": "discard", "description": "exp-143: data scaling 200K→400K (max_rows_per_dataset=400000); RETRY after exp-140/141/142 all failed on infrastructure (offline mode, empty cache); data cache is now populated and verified (2.45M raw triplets from 12 sources); 4 datasets scaled significantly: s2orc 200K→400K, reddit 200K→400K, stackexchange 200K→305K, pubmedqa 200K→211K; all settings match exp-128/139 recipe (temp=0.03, LR=3e-5, 240min, strat=false, symmetric, mining=triplets[:8000], hard_neg_weight=0.0); baseline exp-139 primary=62.86", "task_scores": {"sts_bench": 78.64, "sick_r": 76.52, "twitter_url": 82.21, "sprint_dup": 84.7}, "timestamp": "2026-04-12T05:56:56.486554+00:00", "config": {"base_model": "answerdotai/ModernBERT-base", "projection_dim": 768, "pooling": "cls", "max_seq_length": 256, "normalize_embeddings": true, "simclr_head": false, "stages": {"warmup": {"duration_minutes": 15, "data": "qqp_se_paraphrase", "loss": "infonce", "temperature": 0.1, "learning_rate": 0.0001, "lr_schedule": "linear_warmup_constant", "warmup_ratio": 0.1, "batch_size": 64, "negatives": "in_batch_only", "freeze_encoder_layers": 0, "false_neg_threshold": 0.0}, "contrastive": {"duration_minutes": 240, "data": "all_curated", "loss": "infonce", "temperature": 0.03, "temperature_end": 0.0, "learning_rate": 3e-05, "lr_schedule": "cosine_decay", "warmup_ratio": 0.05, "batch_size": 64, "negatives": "in_batch_plus_explicit", "source_stratification": false, "symmetric": true, "false_neg_threshold": 0.0}, "hard_neg_mining": {"duration_minutes": 5, "top_k": 7, "batch_size": 128, "min_similarity": 0.3}, "fine_tuning": {"duration_minutes": 5, "data": "all_curated_with_hard_negs", "loss": "infonce", "temperature": 0.05, "learning_rate": 1e-05, "lr_schedule": "cosine_decay", "warmup_ratio": 0.0, "batch_size": 64, "hard_neg_weight": 0.0, "false_neg_threshold": 0.0}}, "optimizer": {"type": "adamw", "betas": [0.9, 0.999], "eps": 1e-08, "weight_decay": 0.01, "llrd_decay": 1.0, "ema_decay": 0.0}, "data": {"max_rows_per_dataset": 400000, "cross_dedup": false}, "memory": {"max_peak_gb": 55, "gradient_accumulation_steps": 1, "gradient_checkpointing": false}}, "num_params_M": 149.0, "decontam_removed": 2320, "wandb_run_id": "l0db03lf"}
{"commit": "e9afb53", "primary_score": 62.902, "memory_gb": 40.0, "training_min": 260.4, "datasets": ["qiaojin/PubMedQA", "ag_news", "yahoo_answers_topics", "sentence-transformers/reddit-title-body", "sentence-transformers/natural-questions", "sentence-transformers/stackexchange-duplicates", "sentence-transformers/s2orc", "ms_marco", "glue", "hotpot_qa", "stanfordnlp/snli", "fancyzhx/dbpedia_14"], "status": "discard", "description": "exp-144: latent attention pooling (pooling=latent_attn, K=4 latent queries); NV-Embed-v2 (#1 MTEB) uses this; program.md says it was fixed and ready to re-test; exp-143 showed 400K data scaling didn't help (62.77 vs 62.86 baseline) — model isn't data-limited; trying architecture improvement instead; all other settings match exp-128/139 recipe (temp=0.03, LR=3e-5, 200K, 240min, strat=false, symmetric, mining=triplets[:8000], hard_neg_weight=0.0); baseline exp-139 primary=62.86", "task_scores": {"sts_bench": 78.59, "sick_r": 74.46, "twitter_url": 81.52, "sprint_dup": 85.66}, "timestamp": "2026-04-12T10:33:45.595620+00:00", "config": {"base_model": "answerdotai/ModernBERT-base", "projection_dim": 768, "pooling": "latent_attn", "max_seq_length": 256, "normalize_embeddings": true, "simclr_head": false, "stages": {"warmup": {"duration_minutes": 15, "data": "qqp_se_paraphrase", "loss": "infonce", "temperature": 0.1, "learning_rate": 0.0001, "lr_schedule": "linear_warmup_constant", "warmup_ratio": 0.1, "batch_size": 64, "negatives": "in_batch_only", "freeze_encoder_layers": 0, "false_neg_threshold": 0.0}, "contrastive": {"duration_minutes": 240, "data": "all_curated", "loss": "infonce", "temperature": 0.03, "temperature_end": 0.0, "learning_rate": 3e-05, "lr_schedule": "cosine_decay", "warmup_ratio": 0.05, "batch_size": 64, "negatives": "in_batch_plus_explicit", "source_stratification": false, "symmetric": true, "false_neg_threshold": 0.0}, "hard_neg_mining": {"duration_minutes": 5, "top_k": 7, "batch_size": 128, "min_similarity": 0.3}, "fine_tuning": {"duration_minutes": 5, "data": "all_curated_with_hard_negs", "loss": "infonce", "temperature": 0.05, "learning_rate": 1e-05, "lr_schedule": "cosine_decay", "warmup_ratio": 0.0, "batch_size": 64, "hard_neg_weight": 0.0, "false_neg_threshold": 0.0}}, "optimizer": {"type": "adamw", "betas": [0.9, 0.999], "eps": 1e-08, "weight_decay": 0.01, "llrd_decay": 1.0, "ema_decay": 0.0}, "data": {"max_rows_per_dataset": 200000, "cross_dedup": false}, "memory": {"max_peak_gb": 55, "gradient_accumulation_steps": 1, "gradient_checkpointing": false}}, "num_params_M": 151.4, "decontam_removed": 0, "wandb_run_id": "8hhuco3h"}
{"commit": "503d49d", "primary_score": 63.4416, "memory_gb": 53.4, "training_min": 380.4, "datasets": ["qiaojin/PubMedQA", "fancyzhx/dbpedia_14", "ms_marco", "glue", "hotpot_qa", "sentence-transformers/s2orc", "ag_news", "stanfordnlp/snli", "yahoo_answers_topics", "sentence-transformers/natural-questions", "sentence-transformers/reddit-title-body", "sentence-transformers/stackexchange-duplicates"], "status": "discard", "description": "exp-145: longer contrastive 240min→360min; exp-143 (400K data) and exp-144 (latent_attn) both flat vs baseline (~62.8-62.9 vs 62.86); contrastive saturation was only 16% (CLS) / 24% (latent) at 240min end — model wasn't saturated, may benefit from 50% longer training; all other settings match exp-128/139 recipe (CLS pooling, temp=0.03, LR=3e-5, 200K, strat=false, symmetric, mining=triplets[:8000], hard_neg_weight=0.0); baseline exp-139 primary=62.86", "task_scores": {"sts_bench": 78.98, "sick_r": 75.35, "twitter_url": 81.85, "sprint_dup": 85.48}, "timestamp": "2026-04-12T17:09:32.393755+00:00", "config": {"base_model": "answerdotai/ModernBERT-base", "projection_dim": 768, "pooling": "cls", "max_seq_length": 256, "normalize_embeddings": true, "simclr_head": false, "stages": {"warmup": {"duration_minutes": 15, "data": "qqp_se_paraphrase", "loss": "infonce", "temperature": 0.1, "learning_rate": 0.0001, "lr_schedule": "linear_warmup_constant", "warmup_ratio": 0.1, "batch_size": 64, "negatives": "in_batch_only", "freeze_encoder_layers": 0, "false_neg_threshold": 0.0}, "contrastive": {"duration_minutes": 360, "data": "all_curated", "loss": "infonce", "temperature": 0.03, "temperature_end": 0.0, "learning_rate": 3e-05, "lr_schedule": "cosine_decay", "warmup_ratio": 0.05, "batch_size": 64, "negatives": "in_batch_plus_explicit", "source_stratification": false, "symmetric": true, "false_neg_threshold": 0.0}, "hard_neg_mining": {"duration_minutes": 5, "top_k": 7, "batch_size": 128, "min_similarity": 0.3}, "fine_tuning": {"duration_minutes": 5, "data": "all_curated_with_hard_negs", "loss": "infonce", "temperature": 0.05, "learning_rate": 1e-05, "lr_schedule": "cosine_decay", "warmup_ratio": 0.0, "batch_size": 64, "hard_neg_weight": 0.0, "false_neg_threshold": 0.0}}, "optimizer": {"type": "adamw", "betas": [0.9, 0.999], "eps": 1e-08, "weight_decay": 0.01, "llrd_decay": 1.0, "ema_decay": 0.0}, "data": {"max_rows_per_dataset": 200000, "cross_dedup": false}, "memory": {"max_peak_gb": 55, "gradient_accumulation_steps": 1, "gradient_checkpointing": false}}, "num_params_M": 149.0, "decontam_removed": 0, "wandb_run_id": "693hbdz0"}
{"commit": "28e27a2", "primary_score": 63.6887, "memory_gb": 53.4, "training_min": 500.4, "datasets": ["ag_news", "qiaojin/PubMedQA", "sentence-transformers/reddit-title-body", "stanfordnlp/snli", "sentence-transformers/natural-questions", "yahoo_answers_topics", "sentence-transformers/s2orc", "ms_marco", "sentence-transformers/stackexchange-duplicates", "hotpot_qa", "glue", "fancyzhx/dbpedia_14"], "status": "discard", "description": "exp-146: longer contrastive 480min (2x baseline); exp-145 showed 360min=63.44 (+0.58 vs 240min=62.86), still only 32% saturated at end — more training should help; loss was 0.213 and declining at 360min end; all settings match exp-128/139 recipe (CLS pooling, temp=0.03, LR=3e-5, 200K, strat=false, symmetric, mining=triplets[:8000], hard_neg_weight=0.0); baseline exp-139 primary=62.86, exp-128 best=63.53", "task_scores": {"sts_bench": 78.99, "sick_r": 75.94, "twitter_url": 81.49, "sprint_dup": 84.92}, "timestamp": "2026-04-13T01:46:01.028171+00:00", "config": {"base_model": "answerdotai/ModernBERT-base", "projection_dim": 768, "pooling": "cls", "max_seq_length": 256, "normalize_embeddings": true, "simclr_head": false, "stages": {"warmup": {"duration_minutes": 15, "data": "qqp_se_paraphrase", "loss": "infonce", "temperature": 0.1, "learning_rate": 0.0001, "lr_schedule": "linear_warmup_constant", "warmup_ratio": 0.1, "batch_size": 64, "negatives": "in_batch_only", "freeze_encoder_layers": 0, "false_neg_threshold": 0.0}, "contrastive": {"duration_minutes": 480, "data": "all_curated", "loss": "infonce", "temperature": 0.03, "temperature_end": 0.0, "learning_rate": 3e-05, "lr_schedule": "cosine_decay", "warmup_ratio": 0.05, "batch_size": 64, "negatives": "in_batch_plus_explicit", "source_stratification": false, "symmetric": true, "false_neg_threshold": 0.0}, "hard_neg_mining": {"duration_minutes": 5, "top_k": 7, "batch_size": 128, "min_similarity": 0.3}, "fine_tuning": {"duration_minutes": 5, "data": "all_curated_with_hard_negs", "loss": "infonce", "temperature": 0.05, "learning_rate": 1e-05, "lr_schedule": "cosine_decay", "warmup_ratio": 0.0, "batch_size": 64, "hard_neg_weight": 0.0, "false_neg_threshold": 0.0}}, "optimizer": {"type": "adamw", "betas": [0.9, 0.999], "eps": 1e-08, "weight_decay": 0.01, "llrd_decay": 1.0, "ema_decay": 0.0}, "data": {"max_rows_per_dataset": 200000, "cross_dedup": false}, "memory": {"max_peak_gb": 55, "gradient_accumulation_steps": 1, "gradient_checkpointing": false}}, "num_params_M": 149.0, "decontam_removed": 0, "wandb_run_id": "6ojr9trh"}
{"commit": "a62ab5c", "primary_score": 63.5391, "memory_gb": 53.3, "training_min": 500.4, "datasets": ["sentence-transformers/natural-questions", "sentence-transformers/reddit-title-body", "sentence-transformers/stackexchange-duplicates", "qiaojin/PubMedQA", "glue", "ag_news", "sentence-transformers/s2orc", "hotpot_qa", "fancyzhx/dbpedia_14", "yahoo_answers_topics", "ms_marco", "stanfordnlp/snli"], "status": "discard", "description": "exp-147: cosine LR with min_lr floor (3e-6 = 10% of base); exp-146 showed 480min=63.69 NEW BEST but cosine decays LR to ~0 in final 20% — model stops learning; min_lr floor keeps LR at 3e-6 so model continues improving through end; all other settings match exp-146 (480min, CLS, temp=0.03, LR=3e-5, 200K, strat=false, symmetric); baseline exp-146=63.69", "task_scores": {"sts_bench": 78.87, "sick_r": 75.78, "twitter_url": 80.31, "sprint_dup": 83.75}, "timestamp": "2026-04-13T10:22:24.090942+00:00", "config": {"base_model": "answerdotai/ModernBERT-base", "projection_dim": 768, "pooling": "cls", "max_seq_length": 256, "normalize_embeddings": true, "simclr_head": false, "stages": {"warmup": {"duration_minutes": 15, "data": "qqp_se_paraphrase", "loss": "infonce", "temperature": 0.1, "learning_rate": 0.0001, "lr_schedule": "linear_warmup_constant", "warmup_ratio": 0.1, "batch_size": 64, "negatives": "in_batch_only", "freeze_encoder_layers": 0, "false_neg_threshold": 0.0}, "contrastive": {"duration_minutes": 480, "data": "all_curated", "loss": "infonce", "temperature": 0.03, "temperature_end": 0.0, "learning_rate": 3e-05, "learning_rate_min": 3e-06, "lr_schedule": "cosine_decay", "warmup_ratio": 0.05, "batch_size": 64, "negatives": "in_batch_plus_explicit", "source_stratification": false, "symmetric": true, "false_neg_threshold": 0.0}, "hard_neg_mining": {"duration_minutes": 5, "top_k": 7, "batch_size": 128, "min_similarity": 0.3}, "fine_tuning": {"duration_minutes": 5, "data": "all_curated_with_hard_negs", "loss": "infonce", "temperature": 0.05, "learning_rate": 1e-05, "lr_schedule": "cosine_decay", "warmup_ratio": 0.0, "batch_size": 64, "hard_neg_weight": 0.0, "false_neg_threshold": 0.0}}, "optimizer": {"type": "adamw", "betas": [0.9, 0.999], "eps": 1e-08, "weight_decay": 0.01, "llrd_decay": 1.0, "ema_decay": 0.0}, "data": {"max_rows_per_dataset": 200000, "cross_dedup": false}, "memory": {"max_peak_gb": 55, "gradient_accumulation_steps": 1, "gradient_checkpointing": false}}, "num_params_M": 149.0, "decontam_removed": 0, "wandb_run_id": "xklke09q"}
{"commit": "8b483bf", "primary_score": 62.6011, "memory_gb": 53.4, "training_min": 500.3, "datasets": ["sentence-transformers/natural-questions", "ag_news", "hotpot_qa", "stanfordnlp/snli", "sentence-transformers/s2orc", "yahoo_answers_topics", "ms_marco", "glue", "qiaojin/PubMedQA", "fancyzhx/dbpedia_14", "sentence-transformers/reddit-title-body", "sentence-transformers/stackexchange-duplicates"], "status": "discard", "description": "exp-148: sharper temperature 0.02 (was 0.03); exp-147 min_lr floor was flat (63.54 vs 63.69); temp=0.03 was optimized at 240min but 480min model may benefit from sharper contrastive signal — lower temp makes similarity matrix more peaked, forcing harder discrimination; LR stays at 3e-5 to isolate temp effect; all other settings match exp-146 best (480min, CLS, LR=3e-5, 200K, strat=false, symmetric); baseline exp-146=63.69", "task_scores": {"sts_bench": 78.04, "sick_r": 75.12, "twitter_url": 81.42, "sprint_dup": 82.69}, "timestamp": "2026-04-13T19:00:30.851641+00:00", "config": {"base_model": "answerdotai/ModernBERT-base", "projection_dim": 768, "pooling": "cls", "max_seq_length": 256, "normalize_embeddings": true, "simclr_head": false, "stages": {"warmup": {"duration_minutes": 15, "data": "qqp_se_paraphrase", "loss": "infonce", "temperature": 0.1, "learning_rate": 0.0001, "lr_schedule": "linear_warmup_constant", "warmup_ratio": 0.1, "batch_size": 64, "negatives": "in_batch_only", "freeze_encoder_layers": 0, "false_neg_threshold": 0.0}, "contrastive": {"duration_minutes": 480, "data": "all_curated", "loss": "infonce", "temperature": 0.02, "temperature_end": 0.0, "learning_rate": 3e-05, "learning_rate_min": 0.0, "lr_schedule": "cosine_decay", "warmup_ratio": 0.05, "batch_size": 64, "negatives": "in_batch_plus_explicit", "source_stratification": false, "symmetric": true, "false_neg_threshold": 0.0}, "hard_neg_mining": {"duration_minutes": 5, "top_k": 7, "batch_size": 128, "min_similarity": 0.3}, "fine_tuning": {"duration_minutes": 5, "data": "all_curated_with_hard_negs", "loss": "infonce", "temperature": 0.05, "learning_rate": 1e-05, "lr_schedule": "cosine_decay", "warmup_ratio": 0.0, "batch_size": 64, "hard_neg_weight": 0.0, "false_neg_threshold": 0.0}}, "optimizer": {"type": "adamw", "betas": [0.9, 0.999], "eps": 1e-08, "weight_decay": 0.01, "llrd_decay": 1.0, "ema_decay": 0.0}, "data": {"max_rows_per_dataset": 200000, "cross_dedup": false}, "memory": {"max_peak_gb": 55, "gradient_accumulation_steps": 1, "gradient_checkpointing": false}}, "num_params_M": 149.0, "decontam_removed": 0, "wandb_run_id": "ljhve9wi"}
{"commit": "51c9cb1", "primary_score": 59.4571, "memory_gb": 53.4, "training_min": 495.6, "datasets": ["sentence-transformers/s2orc", "hotpot_qa", "stanfordnlp/snli", "ag_news", "sentence-transformers/natural-questions", "fancyzhx/dbpedia_14", "qiaojin/PubMedQA", "yahoo_answers_topics", "glue", "ms_marco", "sentence-transformers/reddit-title-body", "sentence-transformers/stackexchange-duplicates"], "status": "discard", "description": "exp-149: skip FT stage (duration=0); FT with hard_neg_weight=0.0 is just contrastive at suboptimal hyperparams (temp=0.05 vs 0.03, LR=1e-5 vs 3e-5); may be shifting model away from optimal endpoint; all other settings match exp-146 best (480min contrastive, temp=0.03, LR=3e-5, CLS, 200K, strat=false, symmetric); baseline exp-146=63.69", "task_scores": {"sts_bench": 76.76, "sick_r": 73.94, "twitter_url": 77.73, "sprint_dup": 67.86}, "timestamp": "2026-04-14T03:45:41.079917+00:00", "config": {"base_model": "answerdotai/ModernBERT-base", "projection_dim": 768, "pooling": "cls", "max_seq_length": 256, "normalize_embeddings": true, "simclr_head": false, "stages": {"warmup": {"duration_minutes": 15, "data": "qqp_se_paraphrase", "loss": "infonce", "temperature": 0.1, "learning_rate": 0.0001, "lr_schedule": "linear_warmup_constant", "warmup_ratio": 0.1, "batch_size": 64, "negatives": "in_batch_only", "freeze_encoder_layers": 0, "false_neg_threshold": 0.0}, "contrastive": {"duration_minutes": 480, "data": "all_curated", "loss": "infonce", "temperature": 0.03, "temperature_end": 0.0, "learning_rate": 3e-05, "learning_rate_min": 0.0, "lr_schedule": "cosine_decay", "warmup_ratio": 0.05, "batch_size": 64, "negatives": "in_batch_plus_explicit", "source_stratification": false, "symmetric": true, "false_neg_threshold": 0.0}, "hard_neg_mining": {"duration_minutes": 5, "top_k": 7, "batch_size": 128, "min_similarity": 0.3}, "fine_tuning": {"duration_minutes": 0, "data": "all_curated_with_hard_negs", "loss": "infonce", "temperature": 0.05, "learning_rate": 1e-05, "lr_schedule": "cosine_decay", "warmup_ratio": 0.0, "batch_size": 64, "hard_neg_weight": 0.0, "false_neg_threshold": 0.0}}, "optimizer": {"type": "adamw", "betas": [0.9, 0.999], "eps": 1e-08, "weight_decay": 0.01, "llrd_decay": 1.0, "ema_decay": 0.0}, "data": {"max_rows_per_dataset": 200000, "cross_dedup": false}, "memory": {"max_peak_gb": 55, "gradient_accumulation_steps": 1, "gradient_checkpointing": false}}, "num_params_M": 149.0, "decontam_removed": 0, "wandb_run_id": "qtuqhjep"}
