{"commit": "429a02b", "primary_score": 54.1548, "memory_gb": 37.0, "training_min": 105.3, "datasets": ["yahoo_answers_topics", "sentence-transformers/natural-questions", "fancyzhx/dbpedia_14", "sentence-transformers/reddit-title-body", "ag_news", "stanfordnlp/snli", "ms_marco", "sentence-transformers/stackexchange-duplicates", "glue"], "status": "discard", "description": "exp-40: source_stratification=false (mixed-source batches vs per-source); hard_neg_weight=1.0; LR=1e-5; top_k=7; target diversity in contrastive batches; baseline exp-33 primary=55.16", "task_scores": {"sts_bench": 75.13, "sick_r": 71.48, "twitter_url": 78.14, "sprint_dup": 79.97, "20news": 35.07, "reddit_clust": 38.54, "scifact": 43.62, "nfcorpus": 16.31}, "timestamp": "2026-03-14T12:42:15.110325+00:00", "config": {"base_model": "answerdotai/ModernBERT-base", "embedding_dim": 768, "projection_dim": 768, "pooling": "cls", "max_seq_length": 512, "normalize_embeddings": true, "stages": {"warmup": {"duration_minutes": 15, "data": "qqp_se_paraphrase", "loss": "infonce", "temperature": 0.1, "learning_rate": 0.0001, "lr_schedule": "linear_warmup_constant", "warmup_ratio": 0.1, "batch_size": 64, "negatives": "in_batch_only", "freeze_encoder_layers": 0}, "contrastive": {"duration_minutes": 45, "data": "all_curated", "loss": "infonce", "temperature": 0.05, "learning_rate": 5e-05, "lr_schedule": "cosine_decay", "warmup_ratio": 0.05, "batch_size": 64, "negatives": "in_batch_plus_explicit", "source_stratification": false}, "hard_neg_mining": {"duration_minutes": 5, "top_k": 7, "batch_size": 128, "min_similarity": 0.3}, "fine_tuning": {"duration_minutes": 45, "data": "all_curated_with_hard_negs", "loss": "infonce", "temperature": 0.05, "learning_rate": 1e-05, "lr_schedule": "cosine_decay", "warmup_ratio": 0.0, "batch_size": 32, "hard_neg_weight": 1.0}}, "optimizer": {"type": "adamw", "betas": [0.9, 0.999], "eps": 1e-08, "weight_decay": 0.01}, "memory": {"max_peak_gb": 55, "gradient_accumulation_steps": 4}}, "num_params_M": 149.0, "decontam_removed": 0, "wandb_run_id": "0105rm78"}
{"commit": "43372b1", "primary_score": 54.8625, "memory_gb": 37.0, "training_min": 105.3, "datasets": ["sentence-transformers/natural-questions", "sentence-transformers/reddit-title-body", "yahoo_answers_topics", "sentence-transformers/stackexchange-duplicates", "stanfordnlp/snli", "fancyzhx/dbpedia_14", "ag_news", "glue", "ms_marco"], "status": "discard", "description": "exp-41: fine-tuning warmup_ratio 0.0\u21920.1 (LR warmup before hard-neg fine-tuning); hard_neg_weight=1.0; LR=1e-5; top_k=7; target smoother adaptation to hard negs; baseline exp-33 primary=55.16", "task_scores": {"sts_bench": 75.79, "sick_r": 72.71, "twitter_url": 76.39, "sprint_dup": 82.53, "20news": 35.82, "reddit_clust": 39.24, "scifact": 43.07, "nfcorpus": 18.2}, "timestamp": "2026-03-14T14:54:52.519298+00:00", "config": {"base_model": "answerdotai/ModernBERT-base", "embedding_dim": 768, "projection_dim": 768, "pooling": "cls", "max_seq_length": 512, "normalize_embeddings": true, "stages": {"warmup": {"duration_minutes": 15, "data": "qqp_se_paraphrase", "loss": "infonce", "temperature": 0.1, "learning_rate": 0.0001, "lr_schedule": "linear_warmup_constant", "warmup_ratio": 0.1, "batch_size": 64, "negatives": "in_batch_only", "freeze_encoder_layers": 0}, "contrastive": {"duration_minutes": 45, "data": "all_curated", "loss": "infonce", "temperature": 0.05, "learning_rate": 5e-05, "lr_schedule": "cosine_decay", "warmup_ratio": 0.05, "batch_size": 64, "negatives": "in_batch_plus_explicit", "source_stratification": true}, "hard_neg_mining": {"duration_minutes": 5, "top_k": 7, "batch_size": 128, "min_similarity": 0.3}, "fine_tuning": {"duration_minutes": 45, "data": "all_curated_with_hard_negs", "loss": "infonce", "temperature": 0.05, "learning_rate": 1e-05, "lr_schedule": "cosine_decay", "warmup_ratio": 0.1, "batch_size": 32, "hard_neg_weight": 1.0}}, "optimizer": {"type": "adamw", "betas": [0.9, 0.999], "eps": 1e-08, "weight_decay": 0.01}, "memory": {"max_peak_gb": 55, "gradient_accumulation_steps": 4}}, "num_params_M": 149.0, "decontam_removed": 0, "wandb_run_id": "k5nyg4vh"}
{"commit": "30191ff", "primary_score": 52.9753, "memory_gb": 37.0, "training_min": 105.3, "datasets": ["fancyzhx/dbpedia_14", "sentence-transformers/natural-questions", "ms_marco", "glue", "ag_news", "yahoo_answers_topics", "sentence-transformers/stackexchange-duplicates", "sentence-transformers/reddit-title-body", "stanfordnlp/snli"], "status": "discard", "description": "exp-42: contrastive LR 5e-5\u21928e-5 (1.6x faster learning in contrastive); hard_neg_weight=1.0; top_k=7; temp=0.05; target better contrastive representations; baseline exp-33 primary=55.16", "task_scores": {"sts_bench": 74.68, "sick_r": 68.73, "twitter_url": 75.57, "sprint_dup": 79.63, "20news": 34.48, "reddit_clust": 39.81, "scifact": 41.32, "nfcorpus": 15.45}, "timestamp": "2026-03-14T17:06:54.984367+00:00", "config": {"base_model": "answerdotai/ModernBERT-base", "embedding_dim": 768, "projection_dim": 768, "pooling": "cls", "max_seq_length": 512, "normalize_embeddings": true, "stages": {"warmup": {"duration_minutes": 15, "data": "qqp_se_paraphrase", "loss": "infonce", "temperature": 0.1, "learning_rate": 0.0001, "lr_schedule": "linear_warmup_constant", "warmup_ratio": 0.1, "batch_size": 64, "negatives": "in_batch_only", "freeze_encoder_layers": 0}, "contrastive": {"duration_minutes": 45, "data": "all_curated", "loss": "infonce", "temperature": 0.05, "learning_rate": 8e-05, "lr_schedule": "cosine_decay", "warmup_ratio": 0.05, "batch_size": 64, "negatives": "in_batch_plus_explicit", "source_stratification": true}, "hard_neg_mining": {"duration_minutes": 5, "top_k": 7, "batch_size": 128, "min_similarity": 0.3}, "fine_tuning": {"duration_minutes": 45, "data": "all_curated_with_hard_negs", "loss": "infonce", "temperature": 0.05, "learning_rate": 1e-05, "lr_schedule": "cosine_decay", "warmup_ratio": 0.0, "batch_size": 32, "hard_neg_weight": 1.0}}, "optimizer": {"type": "adamw", "betas": [0.9, 0.999], "eps": 1e-08, "weight_decay": 0.01}, "memory": {"max_peak_gb": 55, "gradient_accumulation_steps": 4}}, "num_params_M": 149.0, "decontam_removed": 0, "wandb_run_id": "j3n6m15o"}
{"commit": "f37c1f8", "primary_score": 52.9565, "memory_gb": 37.2, "training_min": 105.3, "datasets": ["glue", "sentence-transformers/stackexchange-duplicates", "fancyzhx/dbpedia_14", "stanfordnlp/snli", "sentence-transformers/reddit-title-body", "sentence-transformers/natural-questions", "yahoo_answers_topics", "ag_news", "ms_marco"], "status": "discard", "description": "exp-43: cls_mean pooling (CLS+mean concat then project); hard_neg_weight=1.0; LR=1e-5; top_k=7; temp=0.05; target richer token info vs CLS-only; baseline exp-33 primary=55.16", "task_scores": {"sts_bench": 76.02, "sick_r": 70.54, "twitter_url": 76.55, "sprint_dup": 79.46, "20news": 33.0, "reddit_clust": 37.62, "scifact": 40.42, "nfcorpus": 14.98}, "timestamp": "2026-03-14T19:11:00.944992+00:00", "config": {"base_model": "answerdotai/ModernBERT-base", "embedding_dim": 768, "projection_dim": 768, "pooling": "cls_mean", "max_seq_length": 512, "normalize_embeddings": true, "stages": {"warmup": {"duration_minutes": 15, "data": "qqp_se_paraphrase", "loss": "infonce", "temperature": 0.1, "learning_rate": 0.0001, "lr_schedule": "linear_warmup_constant", "warmup_ratio": 0.1, "batch_size": 64, "negatives": "in_batch_only", "freeze_encoder_layers": 0}, "contrastive": {"duration_minutes": 45, "data": "all_curated", "loss": "infonce", "temperature": 0.05, "learning_rate": 5e-05, "lr_schedule": "cosine_decay", "warmup_ratio": 0.05, "batch_size": 64, "negatives": "in_batch_plus_explicit", "source_stratification": true}, "hard_neg_mining": {"duration_minutes": 5, "top_k": 7, "batch_size": 128, "min_similarity": 0.3}, "fine_tuning": {"duration_minutes": 45, "data": "all_curated_with_hard_negs", "loss": "infonce", "temperature": 0.05, "learning_rate": 1e-05, "lr_schedule": "cosine_decay", "warmup_ratio": 0.0, "batch_size": 32, "hard_neg_weight": 1.0}}, "optimizer": {"type": "adamw", "betas": [0.9, 0.999], "eps": 1e-08, "weight_decay": 0.01}, "memory": {"max_peak_gb": 55, "gradient_accumulation_steps": 4}}, "num_params_M": 150.2, "decontam_removed": 0, "wandb_run_id": "glxvnpqy"}
{"commit": "6c7ed9a", "primary_score": 44.5319, "memory_gb": 34.4, "training_min": 7.3, "datasets": ["ms_marco", "sentence-transformers/natural-questions", "sentence-transformers/reddit-title-body", "stanfordnlp/snli", "sentence-transformers/stackexchange-duplicates", "glue", "ag_news", "yahoo_answers_topics", "fancyzhx/dbpedia_14"], "status": "discard", "description": "exp-44: latent_attn pooling (K=4 trainable queries cross-attend encoder output, NV-Embed-v2 style); 5-min exploration; hard_neg_weight=1.0; baseline exp-33 primary=55.16", "task_scores": {"sts_bench": 68.73, "sick_r": 65.43, "twitter_url": 76.91, "sprint_dup": 73.93, "20news": 28.03, "reddit_clust": 29.5, "scifact": 16.3, "nfcorpus": 7.51}, "timestamp": "2026-03-14T19:45:10.351029+00:00", "config": {"base_model": "answerdotai/ModernBERT-base", "embedding_dim": 768, "projection_dim": 768, "pooling": "latent_attn", "max_seq_length": 512, "normalize_embeddings": true, "stages": {"warmup": {"duration_minutes": 2, "data": "qqp_se_paraphrase", "loss": "infonce", "temperature": 0.1, "learning_rate": 0.0001, "lr_schedule": "linear_warmup_constant", "warmup_ratio": 0.1, "batch_size": 64, "negatives": "in_batch_only", "freeze_encoder_layers": 0}, "contrastive": {"duration_minutes": 3, "data": "all_curated", "loss": "infonce", "temperature": 0.05, "learning_rate": 5e-05, "lr_schedule": "cosine_decay", "warmup_ratio": 0.05, "batch_size": 64, "negatives": "in_batch_plus_explicit", "source_stratification": true}, "hard_neg_mining": {"duration_minutes": 5, "top_k": 7, "batch_size": 128, "min_similarity": 0.3}, "fine_tuning": {"duration_minutes": 2, "data": "all_curated_with_hard_negs", "loss": "infonce", "temperature": 0.05, "learning_rate": 1e-05, "lr_schedule": "cosine_decay", "warmup_ratio": 0.0, "batch_size": 32, "hard_neg_weight": 1.0}}, "optimizer": {"type": "adamw", "betas": [0.9, 0.999], "eps": 1e-08, "weight_decay": 0.01}, "memory": {"max_peak_gb": 55, "gradient_accumulation_steps": 4}}, "num_params_M": 151.4, "decontam_removed": 0, "wandb_run_id": "yyk77dt7"}
{"commit": "cc5722d", "primary_score": 44.3901, "memory_gb": 32.5, "training_min": 7.5, "datasets": ["fancyzhx/dbpedia_14", "glue", "ms_marco", "yahoo_answers_topics", "sentence-transformers/natural-questions", "stanfordnlp/snli", "sentence-transformers/stackexchange-duplicates", "ag_news", "sentence-transformers/reddit-title-body"], "status": "discard", "description": "exp-45: CLS pooling quick baseline (2+3+2 min); hard_neg_weight=1.0; to compare vs exp-44 latent_attn same training duration; baseline exp-33 primary=55.16", "task_scores": {"sts_bench": 62.73, "sick_r": 62.45, "twitter_url": 77.15, "sprint_dup": 76.45, "20news": 26.91, "reddit_clust": 29.02, "scifact": 20.52, "nfcorpus": 10.55}, "timestamp": "2026-03-14T20:37:51.532939+00:00", "config": {"base_model": "answerdotai/ModernBERT-base", "embedding_dim": 768, "projection_dim": 768, "pooling": "cls", "max_seq_length": 512, "normalize_embeddings": true, "stages": {"warmup": {"duration_minutes": 2, "data": "qqp_se_paraphrase", "loss": "infonce", "temperature": 0.1, "learning_rate": 0.0001, "lr_schedule": "linear_warmup_constant", "warmup_ratio": 0.1, "batch_size": 64, "negatives": "in_batch_only", "freeze_encoder_layers": 0}, "contrastive": {"duration_minutes": 3, "data": "all_curated", "loss": "infonce", "temperature": 0.05, "learning_rate": 5e-05, "lr_schedule": "cosine_decay", "warmup_ratio": 0.05, "batch_size": 64, "negatives": "in_batch_plus_explicit", "source_stratification": true}, "hard_neg_mining": {"duration_minutes": 5, "top_k": 7, "batch_size": 128, "min_similarity": 0.3}, "fine_tuning": {"duration_minutes": 2, "data": "all_curated_with_hard_negs", "loss": "infonce", "temperature": 0.05, "learning_rate": 1e-05, "lr_schedule": "cosine_decay", "warmup_ratio": 0.0, "batch_size": 32, "hard_neg_weight": 1.0}}, "optimizer": {"type": "adamw", "betas": [0.9, 0.999], "eps": 1e-08, "weight_decay": 0.01}, "memory": {"max_peak_gb": 55, "gradient_accumulation_steps": 4}}, "num_params_M": 149.0, "decontam_removed": 0, "wandb_run_id": "a4l85u7c"}
{"commit": "5bf35c8", "primary_score": 50.3048, "memory_gb": 37.3, "training_min": 105.3, "datasets": ["glue", "ms_marco", "ag_news", "sentence-transformers/natural-questions", "stanfordnlp/snli", "sentence-transformers/stackexchange-duplicates", "fancyzhx/dbpedia_14", "yahoo_answers_topics", "sentence-transformers/reddit-title-body"], "status": "discard", "description": "exp-46: latent_attn pooling full run (15+45+45 min); K=4 trainable query vectors cross-attend encoder output; hard_neg_weight=1.0; NV-Embed-v2 style; baseline exp-33 primary=55.16", "task_scores": {"sts_bench": 74.85, "sick_r": 70.13, "twitter_url": 78.72, "sprint_dup": 80.02, "20news": 28.35, "reddit_clust": 33.0, "scifact": 31.97, "nfcorpus": 11.69}, "timestamp": "2026-03-14T22:47:03.151929+00:00", "config": {"base_model": "answerdotai/ModernBERT-base", "embedding_dim": 768, "projection_dim": 768, "pooling": "latent_attn", "max_seq_length": 512, "normalize_embeddings": true, "stages": {"warmup": {"duration_minutes": 15, "data": "qqp_se_paraphrase", "loss": "infonce", "temperature": 0.1, "learning_rate": 0.0001, "lr_schedule": "linear_warmup_constant", "warmup_ratio": 0.1, "batch_size": 64, "negatives": "in_batch_only", "freeze_encoder_layers": 0}, "contrastive": {"duration_minutes": 45, "data": "all_curated", "loss": "infonce", "temperature": 0.05, "learning_rate": 5e-05, "lr_schedule": "cosine_decay", "warmup_ratio": 0.05, "batch_size": 64, "negatives": "in_batch_plus_explicit", "source_stratification": true}, "hard_neg_mining": {"duration_minutes": 5, "top_k": 7, "batch_size": 128, "min_similarity": 0.3}, "fine_tuning": {"duration_minutes": 45, "data": "all_curated_with_hard_negs", "loss": "infonce", "temperature": 0.05, "learning_rate": 1e-05, "lr_schedule": "cosine_decay", "warmup_ratio": 0.0, "batch_size": 32, "hard_neg_weight": 1.0}}, "optimizer": {"type": "adamw", "betas": [0.9, 0.999], "eps": 1e-08, "weight_decay": 0.01}, "memory": {"max_peak_gb": 55, "gradient_accumulation_steps": 4}}, "num_params_M": 151.4, "decontam_removed": 0, "wandb_run_id": "455lb88y"}
{"commit": "238760a", "primary_score": 29.3657, "memory_gb": 34.1, "training_min": 7.3, "datasets": ["yahoo_answers_topics", "sentence-transformers/stackexchange-duplicates", "sentence-transformers/reddit-title-body", "fancyzhx/dbpedia_14", "stanfordnlp/snli", "glue", "sentence-transformers/natural-questions", "ag_news", "ms_marco"], "status": "discard", "description": "exp-47: layer_weighted pooling quick (2+3+2 min); learnable softmax weights over 22 CLS layer outputs; baseline exp-45 CLS quick=44.39", "task_scores": {"sts_bench": 51.58, "sick_r": 51.51, "twitter_url": 61.88, "sprint_dup": 24.64, "20news": 22.46, "reddit_clust": 21.24, "scifact": 4.21, "nfcorpus": 1.66}, "timestamp": "2026-03-14T23:22:11.196647+00:00", "config": {"base_model": "answerdotai/ModernBERT-base", "embedding_dim": 768, "projection_dim": 768, "pooling": "layer_weighted", "max_seq_length": 512, "normalize_embeddings": true, "stages": {"warmup": {"duration_minutes": 2, "data": "qqp_se_paraphrase", "loss": "infonce", "temperature": 0.1, "learning_rate": 0.0001, "lr_schedule": "linear_warmup_constant", "warmup_ratio": 0.1, "batch_size": 64, "negatives": "in_batch_only", "freeze_encoder_layers": 0}, "contrastive": {"duration_minutes": 3, "data": "all_curated", "loss": "infonce", "temperature": 0.05, "learning_rate": 5e-05, "lr_schedule": "cosine_decay", "warmup_ratio": 0.05, "batch_size": 64, "negatives": "in_batch_plus_explicit", "source_stratification": true}, "hard_neg_mining": {"duration_minutes": 5, "top_k": 7, "batch_size": 128, "min_similarity": 0.3}, "fine_tuning": {"duration_minutes": 2, "data": "all_curated_with_hard_negs", "loss": "infonce", "temperature": 0.05, "learning_rate": 1e-05, "lr_schedule": "cosine_decay", "warmup_ratio": 0.0, "batch_size": 32, "hard_neg_weight": 1.0}}, "optimizer": {"type": "adamw", "betas": [0.9, 0.999], "eps": 1e-08, "weight_decay": 0.01}, "memory": {"max_peak_gb": 55, "gradient_accumulation_steps": 4}}, "num_params_M": 149.0, "decontam_removed": 0, "wandb_run_id": "upverspr"}
{"commit": "0476869", "primary_score": 54.5384, "memory_gb": 36.4, "training_min": 105.3, "datasets": ["yahoo_answers_topics", "ms_marco", "fancyzhx/dbpedia_14", "stanfordnlp/snli", "ag_news", "sentence-transformers/stackexchange-duplicates", "sentence-transformers/natural-questions", "glue", "hotpot_qa", "sentence-transformers/reddit-title-body"], "status": "discard", "description": "exp-48: add HotpotQA retrieval pairs (question\u2192supporting passage); full run 15+45+5+45 min; CLS pooling; target retrieval (SciFact 44.5, NFCorpus 19.19); baseline exp-33 primary=55.16", "task_scores": {"sts_bench": 75.7, "sick_r": 72.91, "twitter_url": 78.83, "sprint_dup": 78.23, "20news": 34.49, "reddit_clust": 39.12, "scifact": 44.06, "nfcorpus": 17.13}, "timestamp": "2026-03-15T01:40:38.709835+00:00", "config": {"base_model": "answerdotai/ModernBERT-base", "embedding_dim": 768, "projection_dim": 768, "pooling": "cls", "max_seq_length": 512, "normalize_embeddings": true, "stages": {"warmup": {"duration_minutes": 15, "data": "qqp_se_paraphrase", "loss": "infonce", "temperature": 0.1, "learning_rate": 0.0001, "lr_schedule": "linear_warmup_constant", "warmup_ratio": 0.1, "batch_size": 64, "negatives": "in_batch_only", "freeze_encoder_layers": 0}, "contrastive": {"duration_minutes": 45, "data": "all_curated", "loss": "infonce", "temperature": 0.05, "learning_rate": 5e-05, "lr_schedule": "cosine_decay", "warmup_ratio": 0.05, "batch_size": 64, "negatives": "in_batch_plus_explicit", "source_stratification": true}, "hard_neg_mining": {"duration_minutes": 5, "top_k": 7, "batch_size": 128, "min_similarity": 0.3}, "fine_tuning": {"duration_minutes": 45, "data": "all_curated_with_hard_negs", "loss": "infonce", "temperature": 0.05, "learning_rate": 1e-05, "lr_schedule": "cosine_decay", "warmup_ratio": 0.0, "batch_size": 32, "hard_neg_weight": 1.0}}, "optimizer": {"type": "adamw", "betas": [0.9, 0.999], "eps": 1e-08, "weight_decay": 0.01}, "memory": {"max_peak_gb": 55, "gradient_accumulation_steps": 4}}, "num_params_M": 149.0, "decontam_removed": 170, "wandb_run_id": "aflgyj05"}
{"commit": "c724792", "primary_score": 55.7641, "memory_gb": 36.4, "training_min": 65.3, "datasets": ["fancyzhx/dbpedia_14", "sentence-transformers/reddit-title-body", "ag_news", "yahoo_answers_topics", "stanfordnlp/snli", "glue", "sentence-transformers/stackexchange-duplicates", "sentence-transformers/natural-questions", "ms_marco", "hotpot_qa"], "status": "keep", "description": "exp-49: HotpotQA data + short fine-tuning (5 min); fix exp-48 overfitting (45min FT on 8000 samples = 58 epochs hurt); contrastive 45min; FT 5min; baseline exp-33 primary=55.16", "task_scores": {"sts_bench": 77.41, "sick_r": 69.35, "twitter_url": 79.01, "sprint_dup": 82.67, "20news": 36.24, "reddit_clust": 41.3, "scifact": 46.3, "nfcorpus": 19.22}, "timestamp": "2026-03-15T03:02:29.424547+00:00", "config": {"base_model": "answerdotai/ModernBERT-base", "embedding_dim": 768, "projection_dim": 768, "pooling": "cls", "max_seq_length": 512, "normalize_embeddings": true, "stages": {"warmup": {"duration_minutes": 15, "data": "qqp_se_paraphrase", "loss": "infonce", "temperature": 0.1, "learning_rate": 0.0001, "lr_schedule": "linear_warmup_constant", "warmup_ratio": 0.1, "batch_size": 64, "negatives": "in_batch_only", "freeze_encoder_layers": 0}, "contrastive": {"duration_minutes": 45, "data": "all_curated", "loss": "infonce", "temperature": 0.05, "learning_rate": 5e-05, "lr_schedule": "cosine_decay", "warmup_ratio": 0.05, "batch_size": 64, "negatives": "in_batch_plus_explicit", "source_stratification": true}, "hard_neg_mining": {"duration_minutes": 5, "top_k": 7, "batch_size": 128, "min_similarity": 0.3}, "fine_tuning": {"duration_minutes": 5, "data": "all_curated_with_hard_negs", "loss": "infonce", "temperature": 0.05, "learning_rate": 1e-05, "lr_schedule": "cosine_decay", "warmup_ratio": 0.0, "batch_size": 32, "hard_neg_weight": 1.0}}, "optimizer": {"type": "adamw", "betas": [0.9, 0.999], "eps": 1e-08, "weight_decay": 0.01}, "memory": {"max_peak_gb": 55, "gradient_accumulation_steps": 4}}, "num_params_M": 149.0, "decontam_removed": 0, "wandb_run_id": "komwa9hm"}
