{"commit": "32dcc59", "primary_score": 63.1047, "memory_gb": 39.3, "training_min": 200.3, "datasets": ["stanfordnlp/snli", "ms_marco", "sentence-transformers/stackexchange-duplicates", "hotpot_qa", "sentence-transformers/natural-questions", "fancyzhx/dbpedia_14", "qiaojin/PubMedQA", "sentence-transformers/reddit-title-body", "yahoo_answers_topics", "ag_news", "sentence-transformers/s2orc", "glue"], "status": "discard", "description": "exp-125: no EMA + LR=3e-5 to isolate LR effect on clustering; exp-122 EMA+LR=3e-5 gave primary=62.60 with cluster +6.21 but PairClass -3.36; exp-124 EMA+LR=3e-5+FT=15min gave 62.67 but PairClass still -2.22 and FT was 99% saturated; hypothesis: LR=3e-5 alone drives the clustering improvement and without EMA PairClass will recover; FT reverted to 5min (99% sat at 15min proved wasteful); all other settings match exp-122 baseline (temp=0.03, CLS, 180min, B=64, symmetric, 12 datasets); baseline exp-117 LR=5e-5 primary=62.34", "task_scores": {"sts_bench": 79.22, "sick_r": 75.64, "twitter_url": 81.42, "sprint_dup": 81.83}, "timestamp": "2026-04-09T08:35:37.093773+00:00", "config": {"base_model": "answerdotai/ModernBERT-base", "projection_dim": 768, "pooling": "cls", "max_seq_length": 256, "normalize_embeddings": true, "simclr_head": false, "stages": {"warmup": {"duration_minutes": 15, "data": "qqp_se_paraphrase", "loss": "infonce", "temperature": 0.1, "learning_rate": 0.0001, "lr_schedule": "linear_warmup_constant", "warmup_ratio": 0.1, "batch_size": 64, "negatives": "in_batch_only", "freeze_encoder_layers": 0, "false_neg_threshold": 0.0}, "contrastive": {"duration_minutes": 180, "data": "all_curated", "loss": "infonce", "temperature": 0.03, "temperature_end": 0.0, "learning_rate": 3e-05, "lr_schedule": "cosine_decay", "warmup_ratio": 0.05, "batch_size": 64, "negatives": "in_batch_plus_explicit", "source_stratification": true, "symmetric": true, "false_neg_threshold": 0.0}, "hard_neg_mining": {"duration_minutes": 5, "top_k": 7, "batch_size": 128, "min_similarity": 0.3}, "fine_tuning": {"duration_minutes": 5, "data": "all_curated_with_hard_negs", "loss": "infonce", "temperature": 0.05, "learning_rate": 1e-05, "lr_schedule": "cosine_decay", "warmup_ratio": 0.0, "batch_size": 64, "hard_neg_weight": 0.0, "false_neg_threshold": 0.0}}, "optimizer": {"type": "adamw", "betas": [0.9, 0.999], "eps": 1e-08, "weight_decay": 0.01, "llrd_decay": 1.0, "ema_decay": 0.0}, "data": {"max_rows_per_dataset": 100000}, "memory": {"max_peak_gb": 55, "gradient_accumulation_steps": 1, "gradient_checkpointing": false}}, "num_params_M": 149.0, "decontam_removed": 0, "wandb_run_id": "9pd7i11w"}
{"commit": "2dc6de4", "primary_score": 62.7889, "memory_gb": 39.3, "training_min": 200.6, "datasets": ["glue", "sentence-transformers/reddit-title-body", "sentence-transformers/stackexchange-duplicates", "yahoo_answers_topics", "sentence-transformers/s2orc", "ag_news", "stanfordnlp/snli", "qiaojin/PubMedQA", "ms_marco", "sentence-transformers/natural-questions", "hotpot_qa", "fancyzhx/dbpedia_14"], "status": "discard", "description": "exp-126: contrastive LR=2e-5 (was 3e-5); exp-125 no-EMA+LR=3e-5 set new best primary=63.10 (+0.76 over LR=5e-5 baseline); LR trend: 5e-5→3e-5 was +0.76; lower LR gives more stable gradients at temp=0.03 and more training steps (8449 steps at 1.28s/step); hypothesis: LR=2e-5 further improves retrieval (48.44) and classification (69.85); EMA stays disabled (exp-125 proved LR is the driver, not EMA); FT=5min (still 99% saturated — consider reducing further); all other settings match exp-125 (temp=0.03, CLS, 180min, B=64, symmetric, 12 datasets)", "task_scores": {"sts_bench": 78.33, "sick_r": 76.92, "twitter_url": 81.75, "sprint_dup": 79.08}, "timestamp": "2026-04-09T12:15:24.317283+00:00", "config": {"base_model": "answerdotai/ModernBERT-base", "projection_dim": 768, "pooling": "cls", "max_seq_length": 256, "normalize_embeddings": true, "simclr_head": false, "stages": {"warmup": {"duration_minutes": 15, "data": "qqp_se_paraphrase", "loss": "infonce", "temperature": 0.1, "learning_rate": 0.0001, "lr_schedule": "linear_warmup_constant", "warmup_ratio": 0.1, "batch_size": 64, "negatives": "in_batch_only", "freeze_encoder_layers": 0, "false_neg_threshold": 0.0}, "contrastive": {"duration_minutes": 180, "data": "all_curated", "loss": "infonce", "temperature": 0.03, "temperature_end": 0.0, "learning_rate": 2e-05, "lr_schedule": "cosine_decay", "warmup_ratio": 0.05, "batch_size": 64, "negatives": "in_batch_plus_explicit", "source_stratification": true, "symmetric": true, "false_neg_threshold": 0.0}, "hard_neg_mining": {"duration_minutes": 5, "top_k": 7, "batch_size": 128, "min_similarity": 0.3}, "fine_tuning": {"duration_minutes": 5, "data": "all_curated_with_hard_negs", "loss": "infonce", "temperature": 0.05, "learning_rate": 1e-05, "lr_schedule": "cosine_decay", "warmup_ratio": 0.0, "batch_size": 64, "hard_neg_weight": 0.0, "false_neg_threshold": 0.0}}, "optimizer": {"type": "adamw", "betas": [0.9, 0.999], "eps": 1e-08, "weight_decay": 0.01, "llrd_decay": 1.0, "ema_decay": 0.0}, "data": {"max_rows_per_dataset": 100000}, "memory": {"max_peak_gb": 55, "gradient_accumulation_steps": 1, "gradient_checkpointing": false}}, "num_params_M": 149.0, "decontam_removed": 0, "wandb_run_id": "dfuyy68q"}
{"commit": "85c4009", "primary_score": 63.3088, "memory_gb": 40.9, "training_min": 200.4, "datasets": ["glue", "sentence-transformers/stackexchange-duplicates", "ag_news", "sentence-transformers/s2orc", "sentence-transformers/reddit-title-body", "sentence-transformers/natural-questions", "yahoo_answers_topics", "stanfordnlp/snli", "ms_marco", "fancyzhx/dbpedia_14", "qiaojin/PubMedQA", "hotpot_qa"], "status": "discard", "description": "exp-127: scale data to 200K rows/dataset (was 100K); exp-125 LR=3e-5 set best primary=63.10 with 855K pairs; exp-126 LR=2e-5 regressed to 62.79 confirming 3e-5 is optimal; exp-105/106 previously showed 200K regressed at LR=5e-5 via signal dilution but that was before LR was optimized; at LR=3e-5, more data per step means more unique examples per epoch; expect ~1.5-1.7M pairs; hypothesis: more training data improves retrieval (48.44→50+) and clustering (41.60→43+) without PairClass regression; all other settings match exp-125 (LR=3e-5, no EMA, temp=0.03, CLS, 180min, B=64, symmetric, FT=5min, 12 datasets)", "task_scores": {"sts_bench": 78.82, "sick_r": 74.73, "twitter_url": 82.22, "sprint_dup": 85.48}, "timestamp": "2026-04-09T15:59:19.990017+00:00", "config": {"base_model": "answerdotai/ModernBERT-base", "projection_dim": 768, "pooling": "cls", "max_seq_length": 256, "normalize_embeddings": true, "simclr_head": false, "stages": {"warmup": {"duration_minutes": 15, "data": "qqp_se_paraphrase", "loss": "infonce", "temperature": 0.1, "learning_rate": 0.0001, "lr_schedule": "linear_warmup_constant", "warmup_ratio": 0.1, "batch_size": 64, "negatives": "in_batch_only", "freeze_encoder_layers": 0, "false_neg_threshold": 0.0}, "contrastive": {"duration_minutes": 180, "data": "all_curated", "loss": "infonce", "temperature": 0.03, "temperature_end": 0.0, "learning_rate": 3e-05, "lr_schedule": "cosine_decay", "warmup_ratio": 0.05, "batch_size": 64, "negatives": "in_batch_plus_explicit", "source_stratification": true, "symmetric": true, "false_neg_threshold": 0.0}, "hard_neg_mining": {"duration_minutes": 5, "top_k": 7, "batch_size": 128, "min_similarity": 0.3}, "fine_tuning": {"duration_minutes": 5, "data": "all_curated_with_hard_negs", "loss": "infonce", "temperature": 0.05, "learning_rate": 1e-05, "lr_schedule": "cosine_decay", "warmup_ratio": 0.0, "batch_size": 64, "hard_neg_weight": 0.0, "false_neg_threshold": 0.0}}, "optimizer": {"type": "adamw", "betas": [0.9, 0.999], "eps": 1e-08, "weight_decay": 0.01, "llrd_decay": 1.0, "ema_decay": 0.0}, "data": {"max_rows_per_dataset": 200000}, "memory": {"max_peak_gb": 55, "gradient_accumulation_steps": 1, "gradient_checkpointing": false}}, "num_params_M": 149.0, "decontam_removed": 0, "wandb_run_id": "hzq93nfw"}
{"commit": "bb4f4f6", "primary_score": 63.5323, "memory_gb": 53.4, "training_min": 260.3, "datasets": ["sentence-transformers/reddit-title-body", "fancyzhx/dbpedia_14", "glue", "sentence-transformers/stackexchange-duplicates", "sentence-transformers/natural-questions", "sentence-transformers/s2orc", "yahoo_answers_topics", "qiaojin/PubMedQA", "hotpot_qa", "ag_news", "stanfordnlp/snli", "ms_marco"], "status": "discard", "description": "exp-128: 240min contrastive with 200K data (was 180min); exp-127 200K+180min set new best primary=63.31 but retrieval regressed -2.73 vs exp-125 100K; with 200K data (1.5M pairs, ~0.27 epochs at 180min), model is undertrained on retrieval — only 20% saturation at end; 240min gives 33% more training steps (~8300 vs 6237) to better learn retrieval-oriented pairs; exp-118 240min+100K overfit but 200K provides enough diversity to prevent it; all other settings match exp-127 (LR=3e-5, no EMA, temp=0.03, CLS, B=64, symmetric, FT=5min, 200K/dataset, 12 datasets); hypothesis: longer training recovers retrieval (45.71→48+) while keeping PairClass gains (83.85)", "task_scores": {"sts_bench": 79.11, "sick_r": 75.14, "twitter_url": 81.91, "sprint_dup": 85.88}, "timestamp": "2026-04-09T20:38:43.214035+00:00", "config": {"base_model": "answerdotai/ModernBERT-base", "projection_dim": 768, "pooling": "cls", "max_seq_length": 256, "normalize_embeddings": true, "simclr_head": false, "stages": {"warmup": {"duration_minutes": 15, "data": "qqp_se_paraphrase", "loss": "infonce", "temperature": 0.1, "learning_rate": 0.0001, "lr_schedule": "linear_warmup_constant", "warmup_ratio": 0.1, "batch_size": 64, "negatives": "in_batch_only", "freeze_encoder_layers": 0, "false_neg_threshold": 0.0}, "contrastive": {"duration_minutes": 240, "data": "all_curated", "loss": "infonce", "temperature": 0.03, "temperature_end": 0.0, "learning_rate": 3e-05, "lr_schedule": "cosine_decay", "warmup_ratio": 0.05, "batch_size": 64, "negatives": "in_batch_plus_explicit", "source_stratification": true, "symmetric": true, "false_neg_threshold": 0.0}, "hard_neg_mining": {"duration_minutes": 5, "top_k": 7, "batch_size": 128, "min_similarity": 0.3}, "fine_tuning": {"duration_minutes": 5, "data": "all_curated_with_hard_negs", "loss": "infonce", "temperature": 0.05, "learning_rate": 1e-05, "lr_schedule": "cosine_decay", "warmup_ratio": 0.0, "batch_size": 64, "hard_neg_weight": 0.0, "false_neg_threshold": 0.0}}, "optimizer": {"type": "adamw", "betas": [0.9, 0.999], "eps": 1e-08, "weight_decay": 0.01, "llrd_decay": 1.0, "ema_decay": 0.0}, "data": {"max_rows_per_dataset": 200000}, "memory": {"max_peak_gb": 55, "gradient_accumulation_steps": 1, "gradient_checkpointing": false}}, "num_params_M": 149.0, "decontam_removed": 0, "wandb_run_id": "urzgvz7q"}
{"commit": "34579a3", "primary_score": 62.9379, "memory_gb": 50.2, "training_min": 260.6, "datasets": ["hotpot_qa", "sentence-transformers/natural-questions", "ms_marco", "sentence-transformers/reddit-title-body", "sentence-transformers/stackexchange-duplicates", "ag_news", "sentence-transformers/s2orc", "glue", "fancyzhx/dbpedia_14", "qiaojin/PubMedQA", "yahoo_answers_topics", "stanfordnlp/snli"], "status": "discard", "description": "exp-129: implement source-stratified batching (config said true but was dead code); with 200K data, top 4 sources are 53.6% while retrieval sources are only 21%; stratification gives each of 12 sources equal ~5 examples per batch (64/12); exp-128 240min+200K gave 63.53 but retrieval barely improved (+0.05 avg) because in-distribution sources dominated; hypothesis: equal source weight improves out-of-distribution retrieval", "task_scores": {"sts_bench": 79.8, "sick_r": 73.95, "twitter_url": 79.42, "sprint_dup": 86.3}, "timestamp": "2026-04-10T01:16:33.567207+00:00", "config": {"base_model": "answerdotai/ModernBERT-base", "projection_dim": 768, "pooling": "cls", "max_seq_length": 256, "normalize_embeddings": true, "simclr_head": false, "stages": {"warmup": {"duration_minutes": 15, "data": "qqp_se_paraphrase", "loss": "infonce", "temperature": 0.1, "learning_rate": 0.0001, "lr_schedule": "linear_warmup_constant", "warmup_ratio": 0.1, "batch_size": 64, "negatives": "in_batch_only", "freeze_encoder_layers": 0, "false_neg_threshold": 0.0}, "contrastive": {"duration_minutes": 240, "data": "all_curated", "loss": "infonce", "temperature": 0.03, "temperature_end": 0.0, "learning_rate": 3e-05, "lr_schedule": "cosine_decay", "warmup_ratio": 0.05, "batch_size": 64, "negatives": "in_batch_plus_explicit", "source_stratification": true, "symmetric": true, "false_neg_threshold": 0.0}, "hard_neg_mining": {"duration_minutes": 5, "top_k": 7, "batch_size": 128, "min_similarity": 0.3}, "fine_tuning": {"duration_minutes": 5, "data": "all_curated_with_hard_negs", "loss": "infonce", "temperature": 0.05, "learning_rate": 1e-05, "lr_schedule": "cosine_decay", "warmup_ratio": 0.0, "batch_size": 64, "hard_neg_weight": 0.0, "false_neg_threshold": 0.0}}, "optimizer": {"type": "adamw", "betas": [0.9, 0.999], "eps": 1e-08, "weight_decay": 0.01, "llrd_decay": 1.0, "ema_decay": 0.0}, "data": {"max_rows_per_dataset": 200000}, "memory": {"max_peak_gb": 55, "gradient_accumulation_steps": 1, "gradient_checkpointing": false}}, "num_params_M": 149.0, "decontam_removed": 0, "wandb_run_id": "xq0iikqk"}
{"commit": "4002353", "primary_score": 58.8969, "memory_gb": 53.4, "training_min": 261.8, "datasets": ["ms_marco", "yahoo_answers_topics", "glue", "sentence-transformers/reddit-title-body", "sentence-transformers/stackexchange-duplicates", "hotpot_qa", "qiaojin/PubMedQA", "ag_news", "sentence-transformers/s2orc", "fancyzhx/dbpedia_14", "sentence-transformers/natural-questions", "stanfordnlp/snli"], "status": "discard", "description": "exp-130: enable hard negatives with proper weight scaling (0.5); loss function now multiplies sim_hardneg by hard_neg_weight (was no-op); source-diverse mining pool samples equally from 12 sources (was biased triplets[:8000]); exp-102 weight=1.0 caused catastrophic forgetting (-3.19) — 0.5 halves the repulsion; FT has been completely inert since weight=0 meant hard negs were never injected; with LR=3e-5+240min+200K best config; source_stratification reverted to false (exp-129 regressed); hypothesis: proper hard neg signal improves retrieval discrimination (45→48+) without catastrophic forgetting", "task_scores": {"sts_bench": 76.72, "sick_r": 73.68, "twitter_url": 75.3, "sprint_dup": 67.54}, "timestamp": "2026-04-10T06:02:39.024419+00:00", "config": {"base_model": "answerdotai/ModernBERT-base", "projection_dim": 768, "pooling": "cls", "max_seq_length": 256, "normalize_embeddings": true, "simclr_head": false, "stages": {"warmup": {"duration_minutes": 15, "data": "qqp_se_paraphrase", "loss": "infonce", "temperature": 0.1, "learning_rate": 0.0001, "lr_schedule": "linear_warmup_constant", "warmup_ratio": 0.1, "batch_size": 64, "negatives": "in_batch_only", "freeze_encoder_layers": 0, "false_neg_threshold": 0.0}, "contrastive": {"duration_minutes": 240, "data": "all_curated", "loss": "infonce", "temperature": 0.03, "temperature_end": 0.0, "learning_rate": 3e-05, "lr_schedule": "cosine_decay", "warmup_ratio": 0.05, "batch_size": 64, "negatives": "in_batch_plus_explicit", "source_stratification": false, "symmetric": true, "false_neg_threshold": 0.0}, "hard_neg_mining": {"duration_minutes": 5, "top_k": 7, "batch_size": 128, "min_similarity": 0.3}, "fine_tuning": {"duration_minutes": 5, "data": "all_curated_with_hard_negs", "loss": "infonce", "temperature": 0.05, "learning_rate": 1e-05, "lr_schedule": "cosine_decay", "warmup_ratio": 0.0, "batch_size": 64, "hard_neg_weight": 0.5, "false_neg_threshold": 0.0}}, "optimizer": {"type": "adamw", "betas": [0.9, 0.999], "eps": 1e-08, "weight_decay": 0.01, "llrd_decay": 1.0, "ema_decay": 0.0}, "data": {"max_rows_per_dataset": 200000}, "memory": {"max_peak_gb": 55, "gradient_accumulation_steps": 1, "gradient_checkpointing": false}}, "num_params_M": 149.0, "decontam_removed": 0, "wandb_run_id": "6f6t1yvm"}
{"commit": "6cf8de5", "primary_score": 56.7069, "memory_gb": 53.4, "training_min": 261.8, "datasets": ["sentence-transformers/natural-questions", "glue", "stanfordnlp/snli", "qiaojin/PubMedQA", "sentence-transformers/stackexchange-duplicates", "sentence-transformers/reddit-title-body", "fancyzhx/dbpedia_14", "yahoo_answers_topics", "sentence-transformers/s2orc", "ag_news", "ms_marco", "hotpot_qa"], "status": "discard", "description": "exp-131: revert contrastive temp to 0.05 (was 0.03); exp-107 temp=0.05 is actual best at 65.16 vs exp-128 temp=0.03 at 63.53; temp=0.03 improved STS/PairClass (+0.68/+0.95) but hurt Class+Clust+Rerank+Retrieval by -2.86 avg; hard_neg_weight reverted to 0.0 (exp-130 weight=0.5 catastrophic -4.63); exp-107 had LR=5e-5+100K+180min — now testing temp=0.05 with improved LR=3e-5+200K+240min; hypothesis: combining best temperature with best training recipe beats 65.16", "task_scores": {"sts_bench": 75.19, "sick_r": 72.6, "twitter_url": 61.68, "sprint_dup": 65.13}, "timestamp": "2026-04-10T10:40:51.873297+00:00", "config": {"base_model": "answerdotai/ModernBERT-base", "projection_dim": 768, "pooling": "cls", "max_seq_length": 256, "normalize_embeddings": true, "simclr_head": false, "stages": {"warmup": {"duration_minutes": 15, "data": "qqp_se_paraphrase", "loss": "infonce", "temperature": 0.1, "learning_rate": 0.0001, "lr_schedule": "linear_warmup_constant", "warmup_ratio": 0.1, "batch_size": 64, "negatives": "in_batch_only", "freeze_encoder_layers": 0, "false_neg_threshold": 0.0}, "contrastive": {"duration_minutes": 240, "data": "all_curated", "loss": "infonce", "temperature": 0.05, "temperature_end": 0.0, "learning_rate": 3e-05, "lr_schedule": "cosine_decay", "warmup_ratio": 0.05, "batch_size": 64, "negatives": "in_batch_plus_explicit", "source_stratification": false, "symmetric": true, "false_neg_threshold": 0.0}, "hard_neg_mining": {"duration_minutes": 5, "top_k": 7, "batch_size": 128, "min_similarity": 0.3}, "fine_tuning": {"duration_minutes": 5, "data": "all_curated_with_hard_negs", "loss": "infonce", "temperature": 0.05, "learning_rate": 1e-05, "lr_schedule": "cosine_decay", "warmup_ratio": 0.0, "batch_size": 64, "hard_neg_weight": 0.0, "false_neg_threshold": 0.0}}, "optimizer": {"type": "adamw", "betas": [0.9, 0.999], "eps": 1e-08, "weight_decay": 0.01, "llrd_decay": 1.0, "ema_decay": 0.0}, "data": {"max_rows_per_dataset": 200000}, "memory": {"max_peak_gb": 55, "gradient_accumulation_steps": 1, "gradient_checkpointing": false}}, "num_params_M": 149.0, "decontam_removed": 0, "wandb_run_id": "ybx4jcci"}
{"commit": "c191c7a", "primary_score": 57.9371, "memory_gb": 40.9, "training_min": 262.2, "datasets": ["sentence-transformers/natural-questions", "sentence-transformers/reddit-title-body", "qiaojin/PubMedQA", "ag_news", "sentence-transformers/stackexchange-duplicates", "yahoo_answers_topics", "sentence-transformers/s2orc", "glue", "stanfordnlp/snli", "ms_marco", "fancyzhx/dbpedia_14", "hotpot_qa"], "status": "discard", "description": "exp-132: temp=0.05+LR=5e-5+200K+240min — match exp-107 best combo (65.16) with more data and training; exp-107 used temp=0.05+LR=5e-5+100K+180min; exp-131 proved temp=0.05+LR=3e-5 catastrophic (56.71) — LR must match temperature; at temp=0.05 softer gradients need higher LR; exp-105/106 showed 200K regressed at LR=5e-5+temp=0.05 but those were 140-200min — 240min gives enough time; hypothesis: 200K data+240min prevents overfitting while improving diversity coverage beyond exp-107", "task_scores": {"sts_bench": 75.97, "sick_r": 71.75, "twitter_url": 73.96, "sprint_dup": 65.77}, "timestamp": "2026-04-10T15:25:28.606865+00:00", "config": {"base_model": "answerdotai/ModernBERT-base", "projection_dim": 768, "pooling": "cls", "max_seq_length": 256, "normalize_embeddings": true, "simclr_head": false, "stages": {"warmup": {"duration_minutes": 15, "data": "qqp_se_paraphrase", "loss": "infonce", "temperature": 0.1, "learning_rate": 0.0001, "lr_schedule": "linear_warmup_constant", "warmup_ratio": 0.1, "batch_size": 64, "negatives": "in_batch_only", "freeze_encoder_layers": 0, "false_neg_threshold": 0.0}, "contrastive": {"duration_minutes": 240, "data": "all_curated", "loss": "infonce", "temperature": 0.05, "temperature_end": 0.0, "learning_rate": 5e-05, "lr_schedule": "cosine_decay", "warmup_ratio": 0.05, "batch_size": 64, "negatives": "in_batch_plus_explicit", "source_stratification": false, "symmetric": true, "false_neg_threshold": 0.0}, "hard_neg_mining": {"duration_minutes": 5, "top_k": 7, "batch_size": 128, "min_similarity": 0.3}, "fine_tuning": {"duration_minutes": 5, "data": "all_curated_with_hard_negs", "loss": "infonce", "temperature": 0.05, "learning_rate": 1e-05, "lr_schedule": "cosine_decay", "warmup_ratio": 0.0, "batch_size": 64, "hard_neg_weight": 0.0, "false_neg_threshold": 0.0}}, "optimizer": {"type": "adamw", "betas": [0.9, 0.999], "eps": 1e-08, "weight_decay": 0.01, "llrd_decay": 1.0, "ema_decay": 0.0}, "data": {"max_rows_per_dataset": 200000}, "memory": {"max_peak_gb": 55, "gradient_accumulation_steps": 1, "gradient_checkpointing": false}}, "num_params_M": 149.0, "decontam_removed": 0, "wandb_run_id": "pcsrrbfa"}
