{"commit": "6af9820", "primary_score": 57.7179, "memory_gb": 37.5, "training_min": 80.3, "datasets": ["stanfordnlp/snli", "sentence-transformers/natural-questions", "hotpot_qa", "ms_marco", "fancyzhx/dbpedia_14", "glue", "sentence-transformers/reddit-title-body", "yahoo_answers_topics", "ag_news", "sentence-transformers/stackexchange-duplicates"], "status": "keep", "description": "exp-82: exact exp-67 code reproduction (reverted train.py + model.py to exp-67 commit d9d0497); only diff is config fields (llrd_decay, ema_decay, etc.) which are ignored by old code; hypothesis: should reproduce ~57.51 primary score", "task_scores": {"sts_bench": 78.64, "sick_r": 74.84, "twitter_url": 76.63, "sprint_dup": 82.01, "20news": 40.64, "reddit_clust": 42.85, "scifact": 49.1, "nfcorpus": 20.79}, "timestamp": "2026-03-17T07:29:44.036505+00:00", "config": {"base_model": "answerdotai/ModernBERT-base", "projection_dim": 768, "pooling": "cls", "max_seq_length": 256, "normalize_embeddings": true, "simclr_head": false, "stages": {"warmup": {"duration_minutes": 15, "data": "qqp_se_paraphrase", "loss": "infonce", "temperature": 0.1, "learning_rate": 0.0001, "lr_schedule": "linear_warmup_constant", "warmup_ratio": 0.1, "batch_size": 64, "negatives": "in_batch_only", "freeze_encoder_layers": 0, "false_neg_threshold": 0.0}, "contrastive": {"duration_minutes": 60, "data": "all_curated", "loss": "infonce", "temperature": 0.05, "learning_rate": 5e-05, "lr_schedule": "cosine_decay", "warmup_ratio": 0.05, "batch_size": 64, "negatives": "in_batch_plus_explicit", "source_stratification": true, "false_neg_threshold": 0.0}, "hard_neg_mining": {"duration_minutes": 5, "top_k": 7, "batch_size": 128, "min_similarity": 0.3}, "fine_tuning": {"duration_minutes": 5, "data": "all_curated_with_hard_negs", "loss": "infonce", "temperature": 0.05, "learning_rate": 1e-05, "lr_schedule": "cosine_decay", "warmup_ratio": 0.0, "batch_size": 64, "hard_neg_weight": 0.0, "false_neg_threshold": 0.0}}, "optimizer": {"type": "adamw", "betas": [0.9, 0.999], "eps": 1e-08, "weight_decay": 0.01, "llrd_decay": 1.0, "ema_decay": 0.0}, "data": {"max_rows_per_dataset": 50000}, "memory": {"max_peak_gb": 55, "gradient_accumulation_steps": 1, "gradient_checkpointing": false}}, "num_params_M": 149.0, "decontam_removed": 0, "wandb_run_id": "j5j9g5ua"}
{"commit": "5f8e98f", "primary_score": 57.4566, "memory_gb": 36.5, "training_min": 80.3, "datasets": ["fancyzhx/dbpedia_14", "glue", "ms_marco", "ag_news", "hotpot_qa", "yahoo_answers_topics", "stanfordnlp/snli", "sentence-transformers/reddit-title-body", "sentence-transformers/natural-questions", "sentence-transformers/stackexchange-duplicates"], "status": "discard", "description": "exp-83: data scaling 100K/dataset (was 30K in exp-82 baseline); expect ~500K+ pairs from larger datasets (reddit, NQ, MS-MARCO); all other code identical to exp-82; hypothesis: more diverse training data is highest-ROI improvement per program.md; baseline exp-82 primary=57.72", "task_scores": {"sts_bench": 79.49, "sick_r": 74.59, "twitter_url": 79.4, "sprint_dup": 79.1, "20news": 38.72, "reddit_clust": 42.25, "scifact": 48.72, "nfcorpus": 20.59}, "timestamp": "2026-03-17T09:36:55.920402+00:00", "config": {"base_model": "answerdotai/ModernBERT-base", "projection_dim": 768, "pooling": "cls", "max_seq_length": 256, "normalize_embeddings": true, "simclr_head": false, "stages": {"warmup": {"duration_minutes": 15, "data": "qqp_se_paraphrase", "loss": "infonce", "temperature": 0.1, "learning_rate": 0.0001, "lr_schedule": "linear_warmup_constant", "warmup_ratio": 0.1, "batch_size": 64, "negatives": "in_batch_only", "freeze_encoder_layers": 0, "false_neg_threshold": 0.0}, "contrastive": {"duration_minutes": 60, "data": "all_curated", "loss": "infonce", "temperature": 0.05, "learning_rate": 5e-05, "lr_schedule": "cosine_decay", "warmup_ratio": 0.05, "batch_size": 64, "negatives": "in_batch_plus_explicit", "source_stratification": true, "false_neg_threshold": 0.0}, "hard_neg_mining": {"duration_minutes": 5, "top_k": 7, "batch_size": 128, "min_similarity": 0.3}, "fine_tuning": {"duration_minutes": 5, "data": "all_curated_with_hard_negs", "loss": "infonce", "temperature": 0.05, "learning_rate": 1e-05, "lr_schedule": "cosine_decay", "warmup_ratio": 0.0, "batch_size": 64, "hard_neg_weight": 0.0, "false_neg_threshold": 0.0}}, "optimizer": {"type": "adamw", "betas": [0.9, 0.999], "eps": 1e-08, "weight_decay": 0.01, "llrd_decay": 1.0, "ema_decay": 0.0}, "data": {"max_rows_per_dataset": 100000}, "memory": {"max_peak_gb": 55, "gradient_accumulation_steps": 1, "gradient_checkpointing": false}}, "num_params_M": 149.0, "decontam_removed": 605, "wandb_run_id": "dm88gafx"}
{"commit": "e60dc9e", "primary_score": 57.1889, "memory_gb": 37.5, "training_min": 110.3, "datasets": ["ag_news", "ms_marco", "fancyzhx/dbpedia_14", "yahoo_answers_topics", "sentence-transformers/natural-questions", "glue", "sentence-transformers/stackexchange-duplicates", "sentence-transformers/reddit-title-body", "stanfordnlp/snli", "hotpot_qa"], "status": "discard", "description": "exp-85: symmetric InfoNCE loss (bidirectional: query\u2192positive + positive\u2192query) for both warmup and contrastive stages; 90-min contrastive; hypothesis: symmetric loss doubles contrastive signal and improves retrieval tasks; baseline exp-84 primary=57.89", "task_scores": {"sts_bench": 78.11, "sick_r": 74.66, "twitter_url": 78.53, "sprint_dup": 79.96, "20news": 41.44, "reddit_clust": 42.57, "scifact": 47.29, "nfcorpus": 19.54}, "timestamp": "2026-03-17T14:33:49.430418+00:00", "config": {"base_model": "answerdotai/ModernBERT-base", "projection_dim": 768, "pooling": "cls", "max_seq_length": 256, "normalize_embeddings": true, "simclr_head": false, "stages": {"warmup": {"duration_minutes": 15, "data": "qqp_se_paraphrase", "loss": "infonce", "temperature": 0.1, "learning_rate": 0.0001, "lr_schedule": "linear_warmup_constant", "warmup_ratio": 0.1, "batch_size": 64, "negatives": "in_batch_only", "freeze_encoder_layers": 0, "false_neg_threshold": 0.0, "symmetric": true}, "contrastive": {"duration_minutes": 90, "data": "all_curated", "loss": "infonce", "temperature": 0.05, "learning_rate": 5e-05, "lr_schedule": "cosine_decay", "warmup_ratio": 0.05, "batch_size": 64, "negatives": "in_batch_plus_explicit", "source_stratification": true, "false_neg_threshold": 0.0, "symmetric": true}, "hard_neg_mining": {"duration_minutes": 5, "top_k": 7, "batch_size": 128, "min_similarity": 0.3}, "fine_tuning": {"duration_minutes": 5, "data": "all_curated_with_hard_negs", "loss": "infonce", "temperature": 0.05, "learning_rate": 1e-05, "lr_schedule": "cosine_decay", "warmup_ratio": 0.0, "batch_size": 64, "hard_neg_weight": 0.0, "false_neg_threshold": 0.0}}, "optimizer": {"type": "adamw", "betas": [0.9, 0.999], "eps": 1e-08, "weight_decay": 0.01, "llrd_decay": 1.0, "ema_decay": 0.0}, "data": {"max_rows_per_dataset": 30000}, "memory": {"max_peak_gb": 55, "gradient_accumulation_steps": 1, "gradient_checkpointing": false}}, "num_params_M": 149.0, "decontam_removed": 0, "wandb_run_id": "6uuxqs40"}
{"commit": "b6da9d1", "primary_score": 55.99, "status": "discard", "description": "exp-84: extend contrastive to 90min; INCOMPLETE eval \u2014 7/8 tasks (RedditClustering timed out, scored as 0); NOT comparable to full 8-task evals", "task_scores": {"sts_bench": 77.82, "sick_r": 73.09, "twitter_url": 80.9, "sprint_dup": 80.63, "20news": 37.83, "scifact": 45.53, "nfcorpus": 18.71}, "timestamp": "2026-03-17T12:00:00+00:00"}
{"commit": "ac3eb8a", "primary_score": 54.4, "status": "discard", "description": "exp-87: baseline rerun with L2 grad norm (REGRESSED \u2014 reverted); full 8/8 eval; L2 clip cost 48% steps; baseline exp-82 primary=57.72", "task_scores": {"sts_bench": 76.93, "sick_r": 71.7, "twitter_url": 78.83, "sprint_dup": 78.7, "20news": 36.81, "reddit_clust": 39.05, "scifact": 40.83, "nfcorpus": 17.63}, "timestamp": "2026-03-17T17:30:00+00:00"}
{"commit": "8bd4add", "primary_score": 56.1282, "memory_gb": 35.7, "training_min": 80.5, "datasets": ["sentence-transformers/reddit-title-body", "sentence-transformers/stackexchange-duplicates", "ms_marco", "ag_news", "stanfordnlp/snli", "yahoo_answers_topics", "fancyzhx/dbpedia_14", "hotpot_qa", "glue", "sentence-transformers/natural-questions"], "status": "discard", "description": "exp-88: MinHash cross-dataset deduplication (word 3-gram, 64 perms, threshold=0.5); removes near-duplicate pairs across 10 training datasets; hypothesis: dedup removes noisy/redundant pairs that waste compute and bias contrastive loss (false negatives); all other config identical to exp-82 baseline (60-min contrastive, temp=0.05, CLS, seq_len=256, batch=64); baseline exp-82 primary=57.72", "task_scores": {"sts_bench": 77.37, "sick_r": 72.36, "twitter_url": 79.35, "sprint_dup": 85.39, "20news": 36.04, "reddit_clust": 38.38, "scifact": 46.82, "nfcorpus": 18.2}, "timestamp": "2026-03-18T04:37:40.496559+00:00", "config": {"base_model": "answerdotai/ModernBERT-base", "projection_dim": 768, "pooling": "cls", "max_seq_length": 256, "normalize_embeddings": true, "simclr_head": false, "stages": {"warmup": {"duration_minutes": 15, "data": "qqp_se_paraphrase", "loss": "infonce", "temperature": 0.1, "learning_rate": 0.0001, "lr_schedule": "linear_warmup_constant", "warmup_ratio": 0.1, "batch_size": 64, "negatives": "in_batch_only", "freeze_encoder_layers": 0, "false_neg_threshold": 0.0}, "contrastive": {"duration_minutes": 60, "data": "all_curated", "loss": "infonce", "temperature": 0.05, "learning_rate": 5e-05, "lr_schedule": "cosine_decay", "warmup_ratio": 0.05, "batch_size": 64, "negatives": "in_batch_plus_explicit", "source_stratification": true, "false_neg_threshold": 0.0}, "hard_neg_mining": {"duration_minutes": 5, "top_k": 7, "batch_size": 128, "min_similarity": 0.3}, "fine_tuning": {"duration_minutes": 5, "data": "all_curated_with_hard_negs", "loss": "infonce", "temperature": 0.05, "learning_rate": 1e-05, "lr_schedule": "cosine_decay", "warmup_ratio": 0.0, "batch_size": 64, "hard_neg_weight": 0.0, "false_neg_threshold": 0.0}}, "optimizer": {"type": "adamw", "betas": [0.9, 0.999], "eps": 1e-08, "weight_decay": 0.01, "llrd_decay": 1.0, "ema_decay": 0.0}, "data": {"max_rows_per_dataset": 30000}, "memory": {"max_peak_gb": 55, "gradient_accumulation_steps": 1, "gradient_checkpointing": false}}, "num_params_M": 149.0, "decontam_removed": 170, "wandb_run_id": "epcl863f"}
{"commit": "95e09fc", "primary_score": 55.4957, "memory_gb": 37.5, "training_min": 80.6, "datasets": ["fancyzhx/dbpedia_14", "stanfordnlp/snli", "sentence-transformers/natural-questions", "sentence-transformers/reddit-title-body", "yahoo_answers_topics", "ms_marco", "hotpot_qa", "ag_news", "glue", "sentence-transformers/stackexchange-duplicates"], "status": "discard", "description": "exp-89: fix hard neg gate (>0.0 not >1.0) + enable hard negs in fine-tuning (weight=1.0, natural scale); fix hard neg loss formula (remove logit amplification that destroyed exp-70); hypothesis: hard neg mining was always wasted because the gate silently disabled hard negs in fine-tuning — enabling them at natural scale should improve retrieval tasks; baseline exp-82 primary=57.72", "task_scores": {"sts_bench": 76.22, "sick_r": 74.42, "twitter_url": 76.84, "sprint_dup": 83.03, "20news": 35.47, "reddit_clust": 36.66, "scifact": 46.38, "nfcorpus": 18.28}, "timestamp": "2026-03-18T06:22:20.975458+00:00", "config": {"base_model": "answerdotai/ModernBERT-base", "projection_dim": 768, "pooling": "cls", "max_seq_length": 256, "normalize_embeddings": true, "simclr_head": false, "stages": {"warmup": {"duration_minutes": 15, "data": "qqp_se_paraphrase", "loss": "infonce", "temperature": 0.1, "learning_rate": 0.0001, "lr_schedule": "linear_warmup_constant", "warmup_ratio": 0.1, "batch_size": 64, "negatives": "in_batch_only", "freeze_encoder_layers": 0, "false_neg_threshold": 0.0}, "contrastive": {"duration_minutes": 60, "data": "all_curated", "loss": "infonce", "temperature": 0.05, "learning_rate": 5e-05, "lr_schedule": "cosine_decay", "warmup_ratio": 0.05, "batch_size": 64, "negatives": "in_batch_plus_explicit", "source_stratification": true, "false_neg_threshold": 0.0}, "hard_neg_mining": {"duration_minutes": 5, "top_k": 7, "batch_size": 128, "min_similarity": 0.3}, "fine_tuning": {"duration_minutes": 5, "data": "all_curated_with_hard_negs", "loss": "infonce", "temperature": 0.05, "learning_rate": 1e-05, "lr_schedule": "cosine_decay", "warmup_ratio": 0.0, "batch_size": 64, "hard_neg_weight": 1.0, "false_neg_threshold": 0.0}}, "optimizer": {"type": "adamw", "betas": [0.9, 0.999], "eps": 1e-08, "weight_decay": 0.01, "llrd_decay": 1.0, "ema_decay": 0.0}, "data": {"max_rows_per_dataset": 30000}, "memory": {"max_peak_gb": 55, "gradient_accumulation_steps": 1, "gradient_checkpointing": false}}, "num_params_M": 149.0, "decontam_removed": 0, "wandb_run_id": "7grbwev2"}
{"commit": "32e1397", "primary_score": 57.9118, "memory_gb": 36.5, "training_min": 140.5, "datasets": ["yahoo_answers_topics", "stanfordnlp/snli", "glue", "fancyzhx/dbpedia_14", "sentence-transformers/reddit-title-body", "ms_marco", "ag_news", "hotpot_qa", "sentence-transformers/natural-questions", "sentence-transformers/stackexchange-duplicates"], "status": "keep", "description": "exp-91: data scaling 100K/dataset (655K pairs) + 120min contrastive (2x baseline); fix max_rows_per_dataset to read from config (was hardcoded 30K); exp-83 used 100K data but only 60min training — model saw each pair ~1.5x vs 3x at baseline; hypothesis: proportional training time with more data will improve score; baseline exp-82 primary=57.72", "task_scores": {"sts_bench": 79.96, "sick_r": 74.52, "twitter_url": 80.86, "sprint_dup": 83.18, "20news": 37.88, "reddit_clust": 40.74, "scifact": 49.52, "nfcorpus": 20.31}, "timestamp": "2026-03-18T10:52:30.438882+00:00", "config": {"base_model": "answerdotai/ModernBERT-base", "projection_dim": 768, "pooling": "cls", "max_seq_length": 256, "normalize_embeddings": true, "simclr_head": false, "stages": {"warmup": {"duration_minutes": 15, "data": "qqp_se_paraphrase", "loss": "infonce", "temperature": 0.1, "learning_rate": 0.0001, "lr_schedule": "linear_warmup_constant", "warmup_ratio": 0.1, "batch_size": 64, "negatives": "in_batch_only", "freeze_encoder_layers": 0, "false_neg_threshold": 0.0}, "contrastive": {"duration_minutes": 120, "data": "all_curated", "loss": "infonce", "temperature": 0.05, "learning_rate": 5e-05, "lr_schedule": "cosine_decay", "warmup_ratio": 0.05, "batch_size": 64, "negatives": "in_batch_plus_explicit", "source_stratification": true, "false_neg_threshold": 0.0}, "hard_neg_mining": {"duration_minutes": 5, "top_k": 7, "batch_size": 128, "min_similarity": 0.3}, "fine_tuning": {"duration_minutes": 5, "data": "all_curated_with_hard_negs", "loss": "infonce", "temperature": 0.05, "learning_rate": 1e-05, "lr_schedule": "cosine_decay", "warmup_ratio": 0.0, "batch_size": 64, "hard_neg_weight": 0.0, "false_neg_threshold": 0.0}}, "optimizer": {"type": "adamw", "betas": [0.9, 0.999], "eps": 1e-08, "weight_decay": 0.01, "llrd_decay": 1.0, "ema_decay": 0.0}, "data": {"max_rows_per_dataset": 100000}, "memory": {"max_peak_gb": 55, "gradient_accumulation_steps": 1, "gradient_checkpointing": false}}, "num_params_M": 149.0, "decontam_removed": 0, "wandb_run_id": "jqnhnzs0"}
{"commit": "63c7da2", "primary_score": 39.2106, "memory_gb": 36.5, "training_min": 140.9, "datasets": ["stanfordnlp/snli", "ag_news", "sentence-transformers/natural-questions", "sentence-transformers/stackexchange-duplicates", "yahoo_answers_topics", "ms_marco", "glue", "hotpot_qa", "fancyzhx/dbpedia_14", "sentence-transformers/reddit-title-body"], "status": "discard", "description": "exp-92: LLRD decay=0.95 (layer-wise LR decay); lower layers get 34%-57% of base LR, preserving pretrained features while adapting upper layers more; standard for BERT fine-tuning (GTE, NV-Embed, Arctic-Embed all use this); all other config same as exp-91 (100K/dataset, 120min contrastive); baseline exp-91 primary=57.91", "task_scores": {"sts_bench": 66.9, "sick_r": 59.25, "twitter_url": 76.38, "sprint_dup": 85.42, "20news": 16.86, "reddit_clust": 20.47, "scifact": 0.45, "nfcorpus": 2.05}, "timestamp": "2026-03-18T13:39:44.040329+00:00", "config": {"base_model": "answerdotai/ModernBERT-base", "projection_dim": 768, "pooling": "cls", "max_seq_length": 256, "normalize_embeddings": true, "simclr_head": false, "stages": {"warmup": {"duration_minutes": 15, "data": "qqp_se_paraphrase", "loss": "infonce", "temperature": 0.1, "learning_rate": 0.0001, "lr_schedule": "linear_warmup_constant", "warmup_ratio": 0.1, "batch_size": 64, "negatives": "in_batch_only", "freeze_encoder_layers": 0, "false_neg_threshold": 0.0}, "contrastive": {"duration_minutes": 120, "data": "all_curated", "loss": "infonce", "temperature": 0.05, "learning_rate": 5e-05, "lr_schedule": "cosine_decay", "warmup_ratio": 0.05, "batch_size": 64, "negatives": "in_batch_plus_explicit", "source_stratification": true, "false_neg_threshold": 0.0}, "hard_neg_mining": {"duration_minutes": 5, "top_k": 7, "batch_size": 128, "min_similarity": 0.3}, "fine_tuning": {"duration_minutes": 5, "data": "all_curated_with_hard_negs", "loss": "infonce", "temperature": 0.05, "learning_rate": 1e-05, "lr_schedule": "cosine_decay", "warmup_ratio": 0.0, "batch_size": 64, "hard_neg_weight": 0.0, "false_neg_threshold": 0.0}}, "optimizer": {"type": "adamw", "betas": [0.9, 0.999], "eps": 1e-08, "weight_decay": 0.01, "llrd_decay": 0.95, "ema_decay": 0.0}, "data": {"max_rows_per_dataset": 100000}, "memory": {"max_peak_gb": 55, "gradient_accumulation_steps": 1, "gradient_checkpointing": false}}, "num_params_M": 149.0, "decontam_removed": 0, "wandb_run_id": "k4wc4fbf"}
{"commit": "281ee00", "primary_score": 56.5976, "memory_gb": 36.5, "training_min": 140.9, "datasets": ["sentence-transformers/natural-questions", "hotpot_qa", "ms_marco", "yahoo_answers_topics", "sentence-transformers/reddit-title-body", "stanfordnlp/snli", "sentence-transformers/stackexchange-duplicates", "glue", "ag_news", "fancyzhx/dbpedia_14"], "status": "discard", "description": "exp-93: 2x contrastive LR (1e-4 vs 5e-5); with 655K pairs and 120min, higher LR may push further into the loss landscape; warmup LR unchanged at 1e-4; hypothesis: higher LR exploits the larger dataset more effectively; all other config same as exp-91 (100K/dataset, 120min, CLS, temp=0.05, batch=64); baseline exp-91 primary=57.91", "task_scores": {"sts_bench": 78.55, "sick_r": 73.76, "twitter_url": 79.12, "sprint_dup": 80.6, "20news": 37.87, "scifact": 48.35, "nfcorpus": 19.68}, "timestamp": "2026-03-18T16:32:33.136919+00:00", "config": {"base_model": "answerdotai/ModernBERT-base", "projection_dim": 768, "pooling": "cls", "max_seq_length": 256, "normalize_embeddings": true, "simclr_head": false, "stages": {"warmup": {"duration_minutes": 15, "data": "qqp_se_paraphrase", "loss": "infonce", "temperature": 0.1, "learning_rate": 0.0001, "lr_schedule": "linear_warmup_constant", "warmup_ratio": 0.1, "batch_size": 64, "negatives": "in_batch_only", "freeze_encoder_layers": 0, "false_neg_threshold": 0.0}, "contrastive": {"duration_minutes": 120, "data": "all_curated", "loss": "infonce", "temperature": 0.05, "learning_rate": 0.0001, "lr_schedule": "cosine_decay", "warmup_ratio": 0.05, "batch_size": 64, "negatives": "in_batch_plus_explicit", "source_stratification": true, "false_neg_threshold": 0.0}, "hard_neg_mining": {"duration_minutes": 5, "top_k": 7, "batch_size": 128, "min_similarity": 0.3}, "fine_tuning": {"duration_minutes": 5, "data": "all_curated_with_hard_negs", "loss": "infonce", "temperature": 0.05, "learning_rate": 1e-05, "lr_schedule": "cosine_decay", "warmup_ratio": 0.0, "batch_size": 64, "hard_neg_weight": 0.0, "false_neg_threshold": 0.0}}, "optimizer": {"type": "adamw", "betas": [0.9, 0.999], "eps": 1e-08, "weight_decay": 0.01, "llrd_decay": 1.0, "ema_decay": 0.0}, "data": {"max_rows_per_dataset": 100000}, "memory": {"max_peak_gb": 55, "gradient_accumulation_steps": 1, "gradient_checkpointing": false}}, "num_params_M": 149.0, "decontam_removed": 0, "wandb_run_id": "1ffmexca"}
