{"commit": "afaff29", "primary_score": 0.0, "memory_gb": 0.0, "training_min": 0.0, "datasets": [], "status": "crash", "description": "exp-119: double contrastive batch size to 128 (was 64); 2x in-batch negatives (127 vs 63) directly improves retrieval discrimination; previous B=128 OOM was at seq=512, now at seq=256 should fit; keep symmetric InfoNCE (raised tiled threshold to B>=256); all other settings match exp-111/117 baseline (temp=0.03, CLS, 180min, LR=5e-5, FT temp=0.05, 12 datasets); baseline exp-117 primary=62.34 (21-task); hypothesis: 2x negatives improves retrieval (48.26→52+) and clustering", "task_scores": {}, "timestamp": "2026-04-08T02:53:41.974735+00:00", "config": {"base_model": "answerdotai/ModernBERT-base", "projection_dim": 768, "pooling": "cls", "max_seq_length": 256, "normalize_embeddings": true, "simclr_head": false, "stages": {"warmup": {"duration_minutes": 15, "data": "qqp_se_paraphrase", "loss": "infonce", "temperature": 0.1, "learning_rate": 0.0001, "lr_schedule": "linear_warmup_constant", "warmup_ratio": 0.1, "batch_size": 64, "negatives": "in_batch_only", "freeze_encoder_layers": 0, "false_neg_threshold": 0.0}, "contrastive": {"duration_minutes": 180, "data": "all_curated", "loss": "infonce", "temperature": 0.03, "temperature_end": 0.0, "learning_rate": 5e-05, "lr_schedule": "cosine_decay", "warmup_ratio": 0.05, "batch_size": 128, "negatives": "in_batch_plus_explicit", "source_stratification": true, "symmetric": true, "false_neg_threshold": 0.0}, "hard_neg_mining": {"duration_minutes": 5, "top_k": 7, "batch_size": 128, "min_similarity": 0.3}, "fine_tuning": {"duration_minutes": 5, "data": "all_curated_with_hard_negs", "loss": "infonce", "temperature": 0.05, "learning_rate": 1e-05, "lr_schedule": "cosine_decay", "warmup_ratio": 0.0, "batch_size": 64, "hard_neg_weight": 0.0, "false_neg_threshold": 0.0}}, "optimizer": {"type": "adamw", "betas": [0.9, 0.999], "eps": 1e-08, "weight_decay": 0.01, "llrd_decay": 1.0, "ema_decay": 0.0}, "data": {"max_rows_per_dataset": 100000}, "memory": {"max_peak_gb": 55, "gradient_accumulation_steps": 1, "gradient_checkpointing": false}}, "num_params_M": null, "decontam_removed": 0}
{"commit": "aad3d74", "primary_score": 0.0, "memory_gb": 0.0, "training_min": 0.0, "datasets": [], "status": "crash", "description": "exp-119: retry — batch=96 contrastive (was 64, 128 hung); 50% more in-batch negatives (95 vs 63) with symmetric InfoNCE; exp-94 showed B=96 fits at 38GB but used wrong LR=7.5e-5; here we keep LR=5e-5; raised tiled-loss threshold to B>=256 so symmetric works at B=96; all other settings match exp-117 baseline (temp=0.03, CLS, 180min, FT temp=0.05, 12 datasets); baseline exp-117 primary=62.34 (21-task); hypothesis: more negatives improves retrieval discrimination (48.26→52+)", "task_scores": {}, "timestamp": "2026-04-08T03:40:27.344092+00:00", "config": {"base_model": "answerdotai/ModernBERT-base", "projection_dim": 768, "pooling": "cls", "max_seq_length": 256, "normalize_embeddings": true, "simclr_head": false, "stages": {"warmup": {"duration_minutes": 15, "data": "qqp_se_paraphrase", "loss": "infonce", "temperature": 0.1, "learning_rate": 0.0001, "lr_schedule": "linear_warmup_constant", "warmup_ratio": 0.1, "batch_size": 64, "negatives": "in_batch_only", "freeze_encoder_layers": 0, "false_neg_threshold": 0.0}, "contrastive": {"duration_minutes": 180, "data": "all_curated", "loss": "infonce", "temperature": 0.03, "temperature_end": 0.0, "learning_rate": 5e-05, "lr_schedule": "cosine_decay", "warmup_ratio": 0.05, "batch_size": 96, "negatives": "in_batch_plus_explicit", "source_stratification": true, "symmetric": true, "false_neg_threshold": 0.0}, "hard_neg_mining": {"duration_minutes": 5, "top_k": 7, "batch_size": 128, "min_similarity": 0.3}, "fine_tuning": {"duration_minutes": 5, "data": "all_curated_with_hard_negs", "loss": "infonce", "temperature": 0.05, "learning_rate": 1e-05, "lr_schedule": "cosine_decay", "warmup_ratio": 0.0, "batch_size": 64, "hard_neg_weight": 0.0, "false_neg_threshold": 0.0}}, "optimizer": {"type": "adamw", "betas": [0.9, 0.999], "eps": 1e-08, "weight_decay": 0.01, "llrd_decay": 1.0, "ema_decay": 0.0}, "data": {"max_rows_per_dataset": 100000}, "memory": {"max_peak_gb": 55, "gradient_accumulation_steps": 1, "gradient_checkpointing": false}}, "num_params_M": null, "decontam_removed": 0}
{"commit": "dc74f22", "primary_score": 0.0, "memory_gb": 0.0, "training_min": 0.0, "datasets": [], "status": "crash", "description": "exp-119: retry2 — batch=96 contrastive WITHOUT symmetric (symmetric 8x slower at B=96, only 370 steps/180min vs 3000 at B=64); standard InfoNCE at B=96 gives 50% more negatives with ~1.5x slower steps (~2000 steps/180min); all other settings match exp-117 baseline (temp=0.03, CLS, 180min, LR=5e-5, FT temp=0.05, 12 datasets); baseline exp-117 primary=62.34; hypothesis: more negatives per step outweighs fewer total steps", "task_scores": {}, "timestamp": "2026-04-08T04:26:56.739040+00:00", "config": {"base_model": "answerdotai/ModernBERT-base", "projection_dim": 768, "pooling": "cls", "max_seq_length": 256, "normalize_embeddings": true, "simclr_head": false, "stages": {"warmup": {"duration_minutes": 15, "data": "qqp_se_paraphrase", "loss": "infonce", "temperature": 0.1, "learning_rate": 0.0001, "lr_schedule": "linear_warmup_constant", "warmup_ratio": 0.1, "batch_size": 64, "negatives": "in_batch_only", "freeze_encoder_layers": 0, "false_neg_threshold": 0.0}, "contrastive": {"duration_minutes": 180, "data": "all_curated", "loss": "infonce", "temperature": 0.03, "temperature_end": 0.0, "learning_rate": 5e-05, "lr_schedule": "cosine_decay", "warmup_ratio": 0.05, "batch_size": 96, "negatives": "in_batch_plus_explicit", "source_stratification": true, "symmetric": false, "false_neg_threshold": 0.0}, "hard_neg_mining": {"duration_minutes": 5, "top_k": 7, "batch_size": 128, "min_similarity": 0.3}, "fine_tuning": {"duration_minutes": 5, "data": "all_curated_with_hard_negs", "loss": "infonce", "temperature": 0.05, "learning_rate": 1e-05, "lr_schedule": "cosine_decay", "warmup_ratio": 0.0, "batch_size": 64, "hard_neg_weight": 0.0, "false_neg_threshold": 0.0}}, "optimizer": {"type": "adamw", "betas": [0.9, 0.999], "eps": 1e-08, "weight_decay": 0.01, "llrd_decay": 1.0, "ema_decay": 0.0}, "data": {"max_rows_per_dataset": 100000}, "memory": {"max_peak_gb": 55, "gradient_accumulation_steps": 1, "gradient_checkpointing": false}}, "num_params_M": null, "decontam_removed": 0}
{"commit": "ce8f2ea", "primary_score": 60.128, "memory_gb": 33.3, "training_min": 202.4, "datasets": ["glue", "yahoo_answers_topics", "qiaojin/PubMedQA", "fancyzhx/dbpedia_14", "sentence-transformers/reddit-title-body", "sentence-transformers/stackexchange-duplicates", "ag_news", "hotpot_qa", "sentence-transformers/s2orc", "ms_marco", "sentence-transformers/natural-questions", "stanfordnlp/snli"], "status": "discard", "description": "exp-120: enable false negative filtering (threshold=0.8) during contrastive; masks in-batch pairs with cosine sim > 0.8 to prevent false negatives from poisoning contrastive signal; with B=64 and mixed-source batches, cross-source near-duplicates (e.g., overlapping NQ/HotpotQA passages) act as false negatives; all other settings match exp-117 baseline (temp=0.03, CLS, 180min, LR=5e-5, B=64, symmetric, FT temp=0.05, 12 datasets); baseline exp-117 primary=62.34 (21-task); hypothesis: cleaner contrastive signal improves retrieval discrimination", "task_scores": {"sts_bench": 76.68, "sick_r": 71.73, "twitter_url": 80.14, "sprint_dup": 83.1}, "timestamp": "2026-04-08T08:35:55.567106+00:00", "config": {"base_model": "answerdotai/ModernBERT-base", "projection_dim": 768, "pooling": "cls", "max_seq_length": 256, "normalize_embeddings": true, "simclr_head": false, "stages": {"warmup": {"duration_minutes": 15, "data": "qqp_se_paraphrase", "loss": "infonce", "temperature": 0.1, "learning_rate": 0.0001, "lr_schedule": "linear_warmup_constant", "warmup_ratio": 0.1, "batch_size": 64, "negatives": "in_batch_only", "freeze_encoder_layers": 0, "false_neg_threshold": 0.0}, "contrastive": {"duration_minutes": 180, "data": "all_curated", "loss": "infonce", "temperature": 0.03, "temperature_end": 0.0, "learning_rate": 5e-05, "lr_schedule": "cosine_decay", "warmup_ratio": 0.05, "batch_size": 64, "negatives": "in_batch_plus_explicit", "source_stratification": true, "symmetric": true, "false_neg_threshold": 0.8}, "hard_neg_mining": {"duration_minutes": 5, "top_k": 7, "batch_size": 128, "min_similarity": 0.3}, "fine_tuning": {"duration_minutes": 5, "data": "all_curated_with_hard_negs", "loss": "infonce", "temperature": 0.05, "learning_rate": 1e-05, "lr_schedule": "cosine_decay", "warmup_ratio": 0.0, "batch_size": 64, "hard_neg_weight": 0.0, "false_neg_threshold": 0.0}}, "optimizer": {"type": "adamw", "betas": [0.9, 0.999], "eps": 1e-08, "weight_decay": 0.01, "llrd_decay": 1.0, "ema_decay": 0.0}, "data": {"max_rows_per_dataset": 100000}, "memory": {"max_peak_gb": 55, "gradient_accumulation_steps": 1, "gradient_checkpointing": false}}, "num_params_M": 149.0, "decontam_removed": 0, "wandb_run_id": "wkglx2yl"}
{"commit": "0cd8db5", "primary_score": 59.2882, "memory_gb": 33.9, "training_min": 203.1, "datasets": ["ag_news", "sentence-transformers/stackexchange-duplicates", "yahoo_answers_topics", "glue", "fancyzhx/dbpedia_14", "stanfordnlp/snli", "sentence-transformers/reddit-title-body", "ms_marco", "qiaojin/PubMedQA", "sentence-transformers/s2orc", "sentence-transformers/natural-questions", "hotpot_qa"], "status": "discard", "description": "exp-121: enable EMA (decay=0.999) with weight swap before save/eval; EMA smooths weights across training steps reducing optimization noise; code fixes from exp-117 retries ensure correct swap (skip on resume, reload HF constants); false_neg_threshold reverted to 0.0 (exp-120 regressed -2.21 but confounded by GPU contention); all other settings match exp-117 baseline (temp=0.03, CLS, 180min, LR=5e-5, B=64, symmetric, FT temp=0.05, 12 datasets); baseline exp-117 primary=62.34 (21-task); NOTE: 3 concurrent TTS processes may cause GPU contention; hypothesis: EMA smoothing improves generalization +0.5-1.0 across all categories", "task_scores": {"sts_bench": 73.35, "sick_r": 69.69, "twitter_url": 79.07, "sprint_dup": 81.27}, "timestamp": "2026-04-08T12:42:41.811100+00:00", "config": {"base_model": "answerdotai/ModernBERT-base", "projection_dim": 768, "pooling": "cls", "max_seq_length": 256, "normalize_embeddings": true, "simclr_head": false, "stages": {"warmup": {"duration_minutes": 15, "data": "qqp_se_paraphrase", "loss": "infonce", "temperature": 0.1, "learning_rate": 0.0001, "lr_schedule": "linear_warmup_constant", "warmup_ratio": 0.1, "batch_size": 64, "negatives": "in_batch_only", "freeze_encoder_layers": 0, "false_neg_threshold": 0.0}, "contrastive": {"duration_minutes": 180, "data": "all_curated", "loss": "infonce", "temperature": 0.03, "temperature_end": 0.0, "learning_rate": 5e-05, "lr_schedule": "cosine_decay", "warmup_ratio": 0.05, "batch_size": 64, "negatives": "in_batch_plus_explicit", "source_stratification": true, "symmetric": true, "false_neg_threshold": 0.0}, "hard_neg_mining": {"duration_minutes": 5, "top_k": 7, "batch_size": 128, "min_similarity": 0.3}, "fine_tuning": {"duration_minutes": 5, "data": "all_curated_with_hard_negs", "loss": "infonce", "temperature": 0.05, "learning_rate": 1e-05, "lr_schedule": "cosine_decay", "warmup_ratio": 0.0, "batch_size": 64, "hard_neg_weight": 0.0, "false_neg_threshold": 0.0}}, "optimizer": {"type": "adamw", "betas": [0.9, 0.999], "eps": 1e-08, "weight_decay": 0.01, "llrd_decay": 1.0, "ema_decay": 0.999}, "data": {"max_rows_per_dataset": 100000}, "memory": {"max_peak_gb": 55, "gradient_accumulation_steps": 1, "gradient_checkpointing": false}}, "num_params_M": 149.0, "decontam_removed": 0, "wandb_run_id": "yenrl9ef"}
{"commit": "1090cbd", "primary_score": 62.6011, "memory_gb": 39.9, "training_min": 200.4, "datasets": ["sentence-transformers/natural-questions", "ms_marco", "glue", "sentence-transformers/s2orc", "qiaojin/PubMedQA", "sentence-transformers/reddit-title-body", "hotpot_qa", "stanfordnlp/snli", "sentence-transformers/stackexchange-duplicates", "ag_news", "fancyzhx/dbpedia_14", "yahoo_answers_topics"], "status": "discard", "description": "exp-122: EMA (decay=0.999) + lower contrastive LR (3e-5, was 5e-5); exp-121 showed EMA improved clustering +3.37 even with only 722/3000 steps (GPU contention); lower LR should navigate temp=0.03 sharp landscape more carefully, and each step does less work so fewer steps are less harmful; stacking EMA+LR is somewhat risky but both have strong theoretical backing; all other settings match baseline (temp=0.03, CLS, 180min, B=64, symmetric, FT temp=0.05, 12 datasets); baseline exp-117 primary=62.34 (21-task); TTS processes reduced from 15→4; hypothesis: EMA+lower LR improves clustering and retrieval", "task_scores": {"sts_bench": 77.39, "sick_r": 74.11, "twitter_url": 78.07, "sprint_dup": 81.32}, "timestamp": "2026-04-08T16:24:32.447001+00:00", "config": {"base_model": "answerdotai/ModernBERT-base", "projection_dim": 768, "pooling": "cls", "max_seq_length": 256, "normalize_embeddings": true, "simclr_head": false, "stages": {"warmup": {"duration_minutes": 15, "data": "qqp_se_paraphrase", "loss": "infonce", "temperature": 0.1, "learning_rate": 0.0001, "lr_schedule": "linear_warmup_constant", "warmup_ratio": 0.1, "batch_size": 64, "negatives": "in_batch_only", "freeze_encoder_layers": 0, "false_neg_threshold": 0.0}, "contrastive": {"duration_minutes": 180, "data": "all_curated", "loss": "infonce", "temperature": 0.03, "temperature_end": 0.0, "learning_rate": 3e-05, "lr_schedule": "cosine_decay", "warmup_ratio": 0.05, "batch_size": 64, "negatives": "in_batch_plus_explicit", "source_stratification": true, "symmetric": true, "false_neg_threshold": 0.0}, "hard_neg_mining": {"duration_minutes": 5, "top_k": 7, "batch_size": 128, "min_similarity": 0.3}, "fine_tuning": {"duration_minutes": 5, "data": "all_curated_with_hard_negs", "loss": "infonce", "temperature": 0.05, "learning_rate": 1e-05, "lr_schedule": "cosine_decay", "warmup_ratio": 0.0, "batch_size": 64, "hard_neg_weight": 0.0, "false_neg_threshold": 0.0}}, "optimizer": {"type": "adamw", "betas": [0.9, 0.999], "eps": 1e-08, "weight_decay": 0.01, "llrd_decay": 1.0, "ema_decay": 0.999}, "data": {"max_rows_per_dataset": 100000}, "memory": {"max_peak_gb": 55, "gradient_accumulation_steps": 1, "gradient_checkpointing": false}}, "num_params_M": 149.0, "decontam_removed": 0, "wandb_run_id": "j40hiarl"}
{"commit": "4b5cc3e", "primary_score": 62.1954, "memory_gb": 39.8, "training_min": 200.3, "datasets": ["sentence-transformers/reddit-title-body", "sentence-transformers/natural-questions", "fancyzhx/dbpedia_14", "sentence-transformers/s2orc", "glue", "hotpot_qa", "yahoo_answers_topics", "sentence-transformers/stackexchange-duplicates", "ms_marco", "ag_news", "qiaojin/PubMedQA", "stanfordnlp/snli"], "status": "discard", "description": "exp-123: EMA (decay=0.999) with baseline LR=5e-5 to isolate EMA effect; exp-122 showed EMA+LR=3e-5 improved clustering +6.21 and primary +0.26 but PairClass regressed -3.36; need to determine if EMA alone helps or if lower LR is the driver; restoring LR=5e-5 while keeping EMA; GPU is now contention-free (0 TTS processes) so expect ~3000+ contrastive steps at full speed; all other settings match baseline (temp=0.03, CLS, 180min, B=64, symmetric, FT temp=0.05, 12 datasets); baseline exp-117 primary=62.34 (21-task); hypothesis: EMA at baseline LR preserves clustering gains while recovering PairClass", "task_scores": {"sts_bench": 77.75, "sick_r": 74.11, "twitter_url": 78.0, "sprint_dup": 79.6}, "timestamp": "2026-04-08T20:01:00.797378+00:00", "config": {"base_model": "answerdotai/ModernBERT-base", "projection_dim": 768, "pooling": "cls", "max_seq_length": 256, "normalize_embeddings": true, "simclr_head": false, "stages": {"warmup": {"duration_minutes": 15, "data": "qqp_se_paraphrase", "loss": "infonce", "temperature": 0.1, "learning_rate": 0.0001, "lr_schedule": "linear_warmup_constant", "warmup_ratio": 0.1, "batch_size": 64, "negatives": "in_batch_only", "freeze_encoder_layers": 0, "false_neg_threshold": 0.0}, "contrastive": {"duration_minutes": 180, "data": "all_curated", "loss": "infonce", "temperature": 0.03, "temperature_end": 0.0, "learning_rate": 5e-05, "lr_schedule": "cosine_decay", "warmup_ratio": 0.05, "batch_size": 64, "negatives": "in_batch_plus_explicit", "source_stratification": true, "symmetric": true, "false_neg_threshold": 0.0}, "hard_neg_mining": {"duration_minutes": 5, "top_k": 7, "batch_size": 128, "min_similarity": 0.3}, "fine_tuning": {"duration_minutes": 5, "data": "all_curated_with_hard_negs", "loss": "infonce", "temperature": 0.05, "learning_rate": 1e-05, "lr_schedule": "cosine_decay", "warmup_ratio": 0.0, "batch_size": 64, "hard_neg_weight": 0.0, "false_neg_threshold": 0.0}}, "optimizer": {"type": "adamw", "betas": [0.9, 0.999], "eps": 1e-08, "weight_decay": 0.01, "llrd_decay": 1.0, "ema_decay": 0.999}, "data": {"max_rows_per_dataset": 100000}, "memory": {"max_peak_gb": 55, "gradient_accumulation_steps": 1, "gradient_checkpointing": false}}, "num_params_M": 149.0, "decontam_removed": 0, "wandb_run_id": "ql3d3os0"}
{"commit": "6e7a50f", "primary_score": 62.6688, "memory_gb": 38.7, "training_min": 210.7, "datasets": ["fancyzhx/dbpedia_14", "sentence-transformers/s2orc", "ms_marco", "stanfordnlp/snli", "sentence-transformers/stackexchange-duplicates", "sentence-transformers/natural-questions", "ag_news", "qiaojin/PubMedQA", "hotpot_qa", "glue", "yahoo_answers_topics", "sentence-transformers/reddit-title-body"], "status": "discard", "description": "exp-124: extend fine-tuning to 15min (was 5) to recover PairClass; exp-122 (EMA+LR=3e-5) was best at 62.60 primary but PairClass regressed -3.36; exp-123 confirmed EMA at LR=5e-5 was worse (62.20); fine-tuning stage uses hard negatives which help pair discrimination — longer FT gives more time to refine these features; EMA+LR=3e-5 preserved, all other settings match exp-122; GPU clean (0 TTS); baseline exp-117 primary=62.34, current best exp-122 primary=62.60; hypothesis: longer FT recovers PairClass while keeping cluster+STS gains", "task_scores": {"sts_bench": 78.1, "sick_r": 75.55, "twitter_url": 80.09, "sprint_dup": 81.58}, "timestamp": "2026-04-09T04:57:39.069613+00:00", "config": {"base_model": "answerdotai/ModernBERT-base", "projection_dim": 768, "pooling": "cls", "max_seq_length": 256, "normalize_embeddings": true, "simclr_head": false, "stages": {"warmup": {"duration_minutes": 15, "data": "qqp_se_paraphrase", "loss": "infonce", "temperature": 0.1, "learning_rate": 0.0001, "lr_schedule": "linear_warmup_constant", "warmup_ratio": 0.1, "batch_size": 64, "negatives": "in_batch_only", "freeze_encoder_layers": 0, "false_neg_threshold": 0.0}, "contrastive": {"duration_minutes": 180, "data": "all_curated", "loss": "infonce", "temperature": 0.03, "temperature_end": 0.0, "learning_rate": 3e-05, "lr_schedule": "cosine_decay", "warmup_ratio": 0.05, "batch_size": 64, "negatives": "in_batch_plus_explicit", "source_stratification": true, "symmetric": true, "false_neg_threshold": 0.0}, "hard_neg_mining": {"duration_minutes": 5, "top_k": 7, "batch_size": 128, "min_similarity": 0.3}, "fine_tuning": {"duration_minutes": 15, "data": "all_curated_with_hard_negs", "loss": "infonce", "temperature": 0.05, "learning_rate": 1e-05, "lr_schedule": "cosine_decay", "warmup_ratio": 0.0, "batch_size": 64, "hard_neg_weight": 0.0, "false_neg_threshold": 0.0}}, "optimizer": {"type": "adamw", "betas": [0.9, 0.999], "eps": 1e-08, "weight_decay": 0.01, "llrd_decay": 1.0, "ema_decay": 0.999}, "data": {"max_rows_per_dataset": 100000}, "memory": {"max_peak_gb": 55, "gradient_accumulation_steps": 1, "gradient_checkpointing": false}}, "num_params_M": 149.0, "decontam_removed": 0, "wandb_run_id": "tchwrzj0"}
