{"commit": "928d0fd", "primary_score": 0.0, "memory_gb": 0.0, "training_min": 0.0, "datasets": [], "status": "crash", "description": "exp-94: batch=128 contrastive (2x in-batch negatives, 127 vs 63); linear-scaled LR=1e-4 (from batch=64/LR=5e-5); exp-93 showed LR=1e-4 at batch=64 regressed (56.60 vs 57.91) — the proper test requires batch=128 per linear scaling rule; more negatives per step improves contrastive signal, especially for retrieval; all other config same as exp-91; baseline exp-91 primary=57.91", "task_scores": {}, "timestamp": "2026-03-18T18:09:16.210082+00:00", "config": {"base_model": "answerdotai/ModernBERT-base", "projection_dim": 768, "pooling": "cls", "max_seq_length": 256, "normalize_embeddings": true, "simclr_head": false, "stages": {"warmup": {"duration_minutes": 15, "data": "qqp_se_paraphrase", "loss": "infonce", "temperature": 0.1, "learning_rate": 0.0001, "lr_schedule": "linear_warmup_constant", "warmup_ratio": 0.1, "batch_size": 64, "negatives": "in_batch_only", "freeze_encoder_layers": 0, "false_neg_threshold": 0.0}, "contrastive": {"duration_minutes": 120, "data": "all_curated", "loss": "infonce", "temperature": 0.05, "learning_rate": 0.0001, "lr_schedule": "cosine_decay", "warmup_ratio": 0.05, "batch_size": 128, "negatives": "in_batch_plus_explicit", "source_stratification": true, "false_neg_threshold": 0.0}, "hard_neg_mining": {"duration_minutes": 5, "top_k": 7, "batch_size": 128, "min_similarity": 0.3}, "fine_tuning": {"duration_minutes": 5, "data": "all_curated_with_hard_negs", "loss": "infonce", "temperature": 0.05, "learning_rate": 1e-05, "lr_schedule": "cosine_decay", "warmup_ratio": 0.0, "batch_size": 64, "hard_neg_weight": 0.0, "false_neg_threshold": 0.0}}, "optimizer": {"type": "adamw", "betas": [0.9, 0.999], "eps": 1e-08, "weight_decay": 0.01, "llrd_decay": 1.0, "ema_decay": 0.0}, "data": {"max_rows_per_dataset": 100000}, "memory": {"max_peak_gb": 55, "gradient_accumulation_steps": 1, "gradient_checkpointing": false}}, "num_params_M": null, "decontam_removed": 0}
{"commit": "705b227", "primary_score": 56.3143, "memory_gb": 58.8, "training_min": 140.5, "datasets": ["ms_marco", "stanfordnlp/snli", "fancyzhx/dbpedia_14", "sentence-transformers/natural-questions", "ag_news", "glue", "yahoo_answers_topics", "sentence-transformers/reddit-title-body", "hotpot_qa", "sentence-transformers/stackexchange-duplicates"], "status": "discard", "description": "exp-94: batch=96 contrastive (1.5x in-batch negatives, 95 vs 63); linear-scaled LR=7.5e-5 (from batch=64/LR=5e-5); batch=128 hung at 51GB due to Metal memory; batch=96 stays under tiled-loss threshold, uses standard InfoNCE; more negatives per step improves contrastive signal for retrieval; all other config same as exp-91; baseline exp-91 primary=57.91", "task_scores": {"sts_bench": 77.69, "sick_r": 75.07, "twitter_url": 77.46, "sprint_dup": 81.9, "20news": 39.74, "reddit_clust": 41.71, "scifact": 43.39, "nfcorpus": 18.73}, "timestamp": "2026-03-18T20:53:15.902153+00:00", "config": {"base_model": "answerdotai/ModernBERT-base", "projection_dim": 768, "pooling": "cls", "max_seq_length": 256, "normalize_embeddings": true, "simclr_head": false, "stages": {"warmup": {"duration_minutes": 15, "data": "qqp_se_paraphrase", "loss": "infonce", "temperature": 0.1, "learning_rate": 0.0001, "lr_schedule": "linear_warmup_constant", "warmup_ratio": 0.1, "batch_size": 64, "negatives": "in_batch_only", "freeze_encoder_layers": 0, "false_neg_threshold": 0.0}, "contrastive": {"duration_minutes": 120, "data": "all_curated", "loss": "infonce", "temperature": 0.05, "learning_rate": 7.5e-05, "lr_schedule": "cosine_decay", "warmup_ratio": 0.05, "batch_size": 96, "negatives": "in_batch_plus_explicit", "source_stratification": true, "false_neg_threshold": 0.0}, "hard_neg_mining": {"duration_minutes": 5, "top_k": 7, "batch_size": 128, "min_similarity": 0.3}, "fine_tuning": {"duration_minutes": 5, "data": "all_curated_with_hard_negs", "loss": "infonce", "temperature": 0.05, "learning_rate": 1e-05, "lr_schedule": "cosine_decay", "warmup_ratio": 0.0, "batch_size": 64, "hard_neg_weight": 0.0, "false_neg_threshold": 0.0}}, "optimizer": {"type": "adamw", "betas": [0.9, 0.999], "eps": 1e-08, "weight_decay": 0.01, "llrd_decay": 1.0, "ema_decay": 0.0}, "data": {"max_rows_per_dataset": 100000}, "memory": {"max_peak_gb": 55, "gradient_accumulation_steps": 1, "gradient_checkpointing": false}}, "num_params_M": 149.0, "decontam_removed": 0, "wandb_run_id": "aj3rw248"}
{"commit": "93e4fe6", "primary_score": 57.7128, "memory_gb": 38.5, "training_min": 140.7, "datasets": ["yahoo_answers_topics", "hotpot_qa", "ms_marco", "sentence-transformers/reddit-title-body", "stanfordnlp/snli", "fancyzhx/dbpedia_14", "sentence-transformers/natural-questions", "glue", "qiaojin/PubMedQA", "ag_news", "sentence-transformers/stackexchange-duplicates"], "status": "discard", "description": "exp-95: add PubMedQA biomedical training data (211K question-context pairs from qiaojin/PubMedQA pqa_artificial); directly targets our weakest tasks: NFCorpus=20.31, SciFact=49.52; no other config changes from exp-91 baseline (batch=64, LR=5e-5, 120min contrastive, CLS, temp=0.05); hypothesis: biomedical domain data improves retrieval scores; baseline exp-91 primary=57.91", "task_scores": {"sts_bench": 77.78, "sick_r": 72.08, "twitter_url": 79.57, "sprint_dup": 82.13, "20news": 40.53, "reddit_clust": 42.35, "scifact": 51.99, "nfcorpus": 19.84}, "timestamp": "2026-03-19T00:13:31.782374+00:00", "config": {"base_model": "answerdotai/ModernBERT-base", "projection_dim": 768, "pooling": "cls", "max_seq_length": 256, "normalize_embeddings": true, "simclr_head": false, "stages": {"warmup": {"duration_minutes": 15, "data": "qqp_se_paraphrase", "loss": "infonce", "temperature": 0.1, "learning_rate": 0.0001, "lr_schedule": "linear_warmup_constant", "warmup_ratio": 0.1, "batch_size": 64, "negatives": "in_batch_only", "freeze_encoder_layers": 0, "false_neg_threshold": 0.0}, "contrastive": {"duration_minutes": 120, "data": "all_curated", "loss": "infonce", "temperature": 0.05, "learning_rate": 5e-05, "lr_schedule": "cosine_decay", "warmup_ratio": 0.05, "batch_size": 64, "negatives": "in_batch_plus_explicit", "source_stratification": true, "false_neg_threshold": 0.0}, "hard_neg_mining": {"duration_minutes": 5, "top_k": 7, "batch_size": 128, "min_similarity": 0.3}, "fine_tuning": {"duration_minutes": 5, "data": "all_curated_with_hard_negs", "loss": "infonce", "temperature": 0.05, "learning_rate": 1e-05, "lr_schedule": "cosine_decay", "warmup_ratio": 0.0, "batch_size": 64, "hard_neg_weight": 0.0, "false_neg_threshold": 0.0}}, "optimizer": {"type": "adamw", "betas": [0.9, 0.999], "eps": 1e-08, "weight_decay": 0.01, "llrd_decay": 1.0, "ema_decay": 0.0}, "data": {"max_rows_per_dataset": 100000}, "memory": {"max_peak_gb": 55, "gradient_accumulation_steps": 1, "gradient_checkpointing": false}}, "num_params_M": 149.0, "decontam_removed": 605, "wandb_run_id": "q6r7e1pd"}
{"commit": "2a1c6af", "primary_score": 58.2313, "memory_gb": 38.4, "training_min": 160.8, "datasets": ["sentence-transformers/stackexchange-duplicates", "hotpot_qa", "fancyzhx/dbpedia_14", "glue", "stanfordnlp/snli", "sentence-transformers/natural-questions", "qiaojin/PubMedQA", "ag_news", "sentence-transformers/reddit-title-body", "yahoo_answers_topics", "ms_marco"], "status": "keep", "description": "exp-96: PubMedQA + 140min contrastive (proportional to 756K pairs); exp-95 showed PubMedQA helped SciFact (+2.47) and clustering (+2.65 20news) but STS regressed (-2.18) — likely from insufficient training with 15% more data; 140min gives same pairs-per-minute as exp-91 (120min/655K); all other config same as exp-91; baseline exp-91 primary=57.91, exp-95 primary=57.71", "task_scores": {"sts_bench": 78.73, "sick_r": 73.81, "twitter_url": 80.0, "sprint_dup": 86.19, "20news": 37.96, "reddit_clust": 41.67, "scifact": 51.64, "nfcorpus": 20.15}, "timestamp": "2026-03-19T03:25:18.563254+00:00", "config": {"base_model": "answerdotai/ModernBERT-base", "projection_dim": 768, "pooling": "cls", "max_seq_length": 256, "normalize_embeddings": true, "simclr_head": false, "stages": {"warmup": {"duration_minutes": 15, "data": "qqp_se_paraphrase", "loss": "infonce", "temperature": 0.1, "learning_rate": 0.0001, "lr_schedule": "linear_warmup_constant", "warmup_ratio": 0.1, "batch_size": 64, "negatives": "in_batch_only", "freeze_encoder_layers": 0, "false_neg_threshold": 0.0}, "contrastive": {"duration_minutes": 140, "data": "all_curated", "loss": "infonce", "temperature": 0.05, "learning_rate": 5e-05, "lr_schedule": "cosine_decay", "warmup_ratio": 0.05, "batch_size": 64, "negatives": "in_batch_plus_explicit", "source_stratification": true, "false_neg_threshold": 0.0}, "hard_neg_mining": {"duration_minutes": 5, "top_k": 7, "batch_size": 128, "min_similarity": 0.3}, "fine_tuning": {"duration_minutes": 5, "data": "all_curated_with_hard_negs", "loss": "infonce", "temperature": 0.05, "learning_rate": 1e-05, "lr_schedule": "cosine_decay", "warmup_ratio": 0.0, "batch_size": 64, "hard_neg_weight": 0.0, "false_neg_threshold": 0.0}}, "optimizer": {"type": "adamw", "betas": [0.9, 0.999], "eps": 1e-08, "weight_decay": 0.01, "llrd_decay": 1.0, "ema_decay": 0.0}, "data": {"max_rows_per_dataset": 100000}, "memory": {"max_peak_gb": 55, "gradient_accumulation_steps": 1, "gradient_checkpointing": false}}, "num_params_M": 149.0, "decontam_removed": 0, "wandb_run_id": "qrzf4v37"}
{"commit": "3711cbf", "primary_score": 57.5721, "memory_gb": 38.4, "training_min": 200.7, "datasets": ["sentence-transformers/stackexchange-duplicates", "sentence-transformers/reddit-title-body", "glue", "ag_news", "qiaojin/PubMedQA", "stanfordnlp/snli", "ms_marco", "yahoo_answers_topics", "sentence-transformers/natural-questions", "fancyzhx/dbpedia_14", "hotpot_qa"], "status": "discard", "description": "exp-97: extended contrastive to 180min (exp-96 loss 0.312 not saturated); PubMedQA data (756K pairs); same LR=5e-5, batch=64, CLS, temp=0.05; 180min gives ~4.5 passes over 756K pairs vs 3.5 in exp-96; hypothesis: more training improves all task categories; baseline exp-96 primary=58.23 (NEW BEST)", "task_scores": {"sts_bench": 78.81, "sick_r": 72.42, "twitter_url": 79.45, "sprint_dup": 86.26, "20news": 37.64, "scifact": 52.51, "nfcorpus": 19.42}, "timestamp": "2026-03-19T07:20:33.650919+00:00", "config": {"base_model": "answerdotai/ModernBERT-base", "projection_dim": 768, "pooling": "cls", "max_seq_length": 256, "normalize_embeddings": true, "simclr_head": false, "stages": {"warmup": {"duration_minutes": 15, "data": "qqp_se_paraphrase", "loss": "infonce", "temperature": 0.1, "learning_rate": 0.0001, "lr_schedule": "linear_warmup_constant", "warmup_ratio": 0.1, "batch_size": 64, "negatives": "in_batch_only", "freeze_encoder_layers": 0, "false_neg_threshold": 0.0}, "contrastive": {"duration_minutes": 180, "data": "all_curated", "loss": "infonce", "temperature": 0.05, "learning_rate": 5e-05, "lr_schedule": "cosine_decay", "warmup_ratio": 0.05, "batch_size": 64, "negatives": "in_batch_plus_explicit", "source_stratification": true, "false_neg_threshold": 0.0}, "hard_neg_mining": {"duration_minutes": 5, "top_k": 7, "batch_size": 128, "min_similarity": 0.3}, "fine_tuning": {"duration_minutes": 5, "data": "all_curated_with_hard_negs", "loss": "infonce", "temperature": 0.05, "learning_rate": 1e-05, "lr_schedule": "cosine_decay", "warmup_ratio": 0.0, "batch_size": 64, "hard_neg_weight": 0.0, "false_neg_threshold": 0.0}}, "optimizer": {"type": "adamw", "betas": [0.9, 0.999], "eps": 1e-08, "weight_decay": 0.01, "llrd_decay": 1.0, "ema_decay": 0.0}, "data": {"max_rows_per_dataset": 100000}, "memory": {"max_peak_gb": 55, "gradient_accumulation_steps": 1, "gradient_checkpointing": false}}, "num_params_M": 149.0, "decontam_removed": 0, "wandb_run_id": "ganmf230"}
{"commit": "b42588a", "primary_score": 58.6887, "memory_gb": 38.0, "training_min": 160.7, "datasets": ["sentence-transformers/reddit-title-body", "sentence-transformers/natural-questions", "glue", "hotpot_qa", "ag_news", "fancyzhx/dbpedia_14", "sentence-transformers/stackexchange-duplicates", "sentence-transformers/s2orc", "ms_marco", "qiaojin/PubMedQA", "yahoo_answers_topics", "stanfordnlp/snli"], "status": "keep", "description": "exp-98: add S2ORC scientific title-abstract pairs (sentence-transformers/s2orc, streaming); targets weak retrieval (SciFact, NFCorpus) and clustering diversity; 140min contrastive (180min overfit in exp-97); code adds s2orc_title_abstract format handler; hypothesis: scientific domain data improves retrieval like PubMedQA did; baseline exp-96 primary=58.23", "task_scores": {"sts_bench": 78.15, "sick_r": 75.09, "twitter_url": 79.71, "sprint_dup": 87.52, "20news": 38.67, "reddit_clust": 40.31, "scifact": 51.76, "nfcorpus": 22.12}, "timestamp": "2026-03-19T10:58:16.443289+00:00", "config": {"base_model": "answerdotai/ModernBERT-base", "projection_dim": 768, "pooling": "cls", "max_seq_length": 256, "normalize_embeddings": true, "simclr_head": false, "stages": {"warmup": {"duration_minutes": 15, "data": "qqp_se_paraphrase", "loss": "infonce", "temperature": 0.1, "learning_rate": 0.0001, "lr_schedule": "linear_warmup_constant", "warmup_ratio": 0.1, "batch_size": 64, "negatives": "in_batch_only", "freeze_encoder_layers": 0, "false_neg_threshold": 0.0}, "contrastive": {"duration_minutes": 140, "data": "all_curated", "loss": "infonce", "temperature": 0.05, "learning_rate": 5e-05, "lr_schedule": "cosine_decay", "warmup_ratio": 0.05, "batch_size": 64, "negatives": "in_batch_plus_explicit", "source_stratification": true, "false_neg_threshold": 0.0}, "hard_neg_mining": {"duration_minutes": 5, "top_k": 7, "batch_size": 128, "min_similarity": 0.3}, "fine_tuning": {"duration_minutes": 5, "data": "all_curated_with_hard_negs", "loss": "infonce", "temperature": 0.05, "learning_rate": 1e-05, "lr_schedule": "cosine_decay", "warmup_ratio": 0.0, "batch_size": 64, "hard_neg_weight": 0.0, "false_neg_threshold": 0.0}}, "optimizer": {"type": "adamw", "betas": [0.9, 0.999], "eps": 1e-08, "weight_decay": 0.01, "llrd_decay": 1.0, "ema_decay": 0.0}, "data": {"max_rows_per_dataset": 100000}, "memory": {"max_peak_gb": 55, "gradient_accumulation_steps": 1, "gradient_checkpointing": false}}, "num_params_M": 149.0, "decontam_removed": 605, "wandb_run_id": "ly69p4d7"}
{"commit": "04d3017", "primary_score": 58.5542, "memory_gb": 36.5, "training_min": 180.7, "datasets": ["sentence-transformers/reddit-title-body", "sentence-transformers/natural-questions", "yahoo_answers_topics", "sentence-transformers/s2orc", "hotpot_qa", "qiaojin/PubMedQA", "copenlu/fever_gold_evidence", "sentence-transformers/stackexchange-duplicates", "stanfordnlp/snli", "fancyzhx/dbpedia_14", "ag_news", "glue", "ms_marco"], "status": "discard", "description": "exp-99: add FEVER claim-evidence pairs (copenlu/fever_gold_evidence, SUPPORTS only) + 160min contrastive (proportional to ~936K pairs); FEVER targets fact-based retrieval like SciFact; combined with S2ORC (exp-98) and PubMedQA; hypothesis: more retrieval diversity improves SciFact and NFCorpus; baseline exp-98 primary=58.69 (NEW BEST)", "task_scores": {"sts_bench": 79.43, "sick_r": 73.46, "twitter_url": 79.49, "sprint_dup": 85.53, "20news": 38.54, "scifact": 54.21, "nfcorpus": 21.86}, "timestamp": "2026-03-19T15:04:54.414652+00:00", "config": {"base_model": "answerdotai/ModernBERT-base", "projection_dim": 768, "pooling": "cls", "max_seq_length": 256, "normalize_embeddings": true, "simclr_head": false, "stages": {"warmup": {"duration_minutes": 15, "data": "qqp_se_paraphrase", "loss": "infonce", "temperature": 0.1, "learning_rate": 0.0001, "lr_schedule": "linear_warmup_constant", "warmup_ratio": 0.1, "batch_size": 64, "negatives": "in_batch_only", "freeze_encoder_layers": 0, "false_neg_threshold": 0.0}, "contrastive": {"duration_minutes": 160, "data": "all_curated", "loss": "infonce", "temperature": 0.05, "learning_rate": 5e-05, "lr_schedule": "cosine_decay", "warmup_ratio": 0.05, "batch_size": 64, "negatives": "in_batch_plus_explicit", "source_stratification": true, "false_neg_threshold": 0.0}, "hard_neg_mining": {"duration_minutes": 5, "top_k": 7, "batch_size": 128, "min_similarity": 0.3}, "fine_tuning": {"duration_minutes": 5, "data": "all_curated_with_hard_negs", "loss": "infonce", "temperature": 0.05, "learning_rate": 1e-05, "lr_schedule": "cosine_decay", "warmup_ratio": 0.0, "batch_size": 64, "hard_neg_weight": 0.0, "false_neg_threshold": 0.0}}, "optimizer": {"type": "adamw", "betas": [0.9, 0.999], "eps": 1e-08, "weight_decay": 0.01, "llrd_decay": 1.0, "ema_decay": 0.0}, "data": {"max_rows_per_dataset": 100000}, "memory": {"max_peak_gb": 55, "gradient_accumulation_steps": 1, "gradient_checkpointing": false}}, "num_params_M": 149.0, "decontam_removed": 605, "wandb_run_id": "qp3slw7y"}
{"commit": "4fab3f7", "primary_score": 58.1966, "memory_gb": 36.5, "training_min": 160.9, "datasets": ["sentence-transformers/natural-questions", "ag_news", "fancyzhx/dbpedia_14", "yahoo_answers_topics", "stanfordnlp/snli", "qiaojin/PubMedQA", "sentence-transformers/stackexchange-duplicates", "hotpot_qa", "sentence-transformers/s2orc", "sentence-transformers/reddit-title-body", "glue", "ms_marco", "copenlu/fever_gold_evidence"], "status": "discard", "description": "exp-100: FEVER + S2ORC + PubMedQA at 140min contrastive (exp-99 showed 160min slightly overfit, 58.55 vs 58.69); exp-99 SciFact improved +2.45 from FEVER but pair_class regressed — testing whether 140min fixes regression while keeping SciFact gains; 908K pairs, 13 datasets; baseline exp-98 primary=58.69", "task_scores": {"sts_bench": 78.47, "sick_r": 72.68, "twitter_url": 80.59, "sprint_dup": 84.74, "20news": 39.23, "scifact": 53.31, "nfcorpus": 20.98}, "timestamp": "2026-03-19T18:17:12.853110+00:00", "config": {"base_model": "answerdotai/ModernBERT-base", "projection_dim": 768, "pooling": "cls", "max_seq_length": 256, "normalize_embeddings": true, "simclr_head": false, "stages": {"warmup": {"duration_minutes": 15, "data": "qqp_se_paraphrase", "loss": "infonce", "temperature": 0.1, "learning_rate": 0.0001, "lr_schedule": "linear_warmup_constant", "warmup_ratio": 0.1, "batch_size": 64, "negatives": "in_batch_only", "freeze_encoder_layers": 0, "false_neg_threshold": 0.0}, "contrastive": {"duration_minutes": 140, "data": "all_curated", "loss": "infonce", "temperature": 0.05, "learning_rate": 5e-05, "lr_schedule": "cosine_decay", "warmup_ratio": 0.05, "batch_size": 64, "negatives": "in_batch_plus_explicit", "source_stratification": true, "false_neg_threshold": 0.0}, "hard_neg_mining": {"duration_minutes": 5, "top_k": 7, "batch_size": 128, "min_similarity": 0.3}, "fine_tuning": {"duration_minutes": 5, "data": "all_curated_with_hard_negs", "loss": "infonce", "temperature": 0.05, "learning_rate": 1e-05, "lr_schedule": "cosine_decay", "warmup_ratio": 0.0, "batch_size": 64, "hard_neg_weight": 0.0, "false_neg_threshold": 0.0}}, "optimizer": {"type": "adamw", "betas": [0.9, 0.999], "eps": 1e-08, "weight_decay": 0.01, "llrd_decay": 1.0, "ema_decay": 0.0}, "data": {"max_rows_per_dataset": 100000}, "memory": {"max_peak_gb": 55, "gradient_accumulation_steps": 1, "gradient_checkpointing": false}}, "num_params_M": 149.0, "decontam_removed": 0, "wandb_run_id": "eq4r5sm2"}
{"commit": "22317aa", "primary_score": 0.0, "memory_gb": 0.0, "training_min": 0.0, "datasets": [], "status": "crash", "description": "exp-101: replace SNLI with AllNLI triplets (sentence-transformers/all-nli, triplet config); AllNLI = SNLI+MNLI with hard negatives (anchor/positive/negative); adds MNLI genre diversity + contrastive hard negatives; FEVER removed (hurt pair_class); 12 datasets, 140min contrastive; hypothesis: hard negatives from AllNLI improve STS/pair_class while maintaining retrieval; baseline exp-98 primary=58.69", "task_scores": {}, "timestamp": "2026-03-19T20:07:56.717434+00:00", "config": {"base_model": "answerdotai/ModernBERT-base", "projection_dim": 768, "pooling": "cls", "max_seq_length": 256, "normalize_embeddings": true, "simclr_head": false, "stages": {"warmup": {"duration_minutes": 15, "data": "qqp_se_paraphrase", "loss": "infonce", "temperature": 0.1, "learning_rate": 0.0001, "lr_schedule": "linear_warmup_constant", "warmup_ratio": 0.1, "batch_size": 64, "negatives": "in_batch_only", "freeze_encoder_layers": 0, "false_neg_threshold": 0.0}, "contrastive": {"duration_minutes": 140, "data": "all_curated", "loss": "infonce", "temperature": 0.05, "learning_rate": 5e-05, "lr_schedule": "cosine_decay", "warmup_ratio": 0.05, "batch_size": 64, "negatives": "in_batch_plus_explicit", "source_stratification": true, "false_neg_threshold": 0.0}, "hard_neg_mining": {"duration_minutes": 5, "top_k": 7, "batch_size": 128, "min_similarity": 0.3}, "fine_tuning": {"duration_minutes": 5, "data": "all_curated_with_hard_negs", "loss": "infonce", "temperature": 0.05, "learning_rate": 1e-05, "lr_schedule": "cosine_decay", "warmup_ratio": 0.0, "batch_size": 64, "hard_neg_weight": 0.0, "false_neg_threshold": 0.0}}, "optimizer": {"type": "adamw", "betas": [0.9, 0.999], "eps": 1e-08, "weight_decay": 0.01, "llrd_decay": 1.0, "ema_decay": 0.0}, "data": {"max_rows_per_dataset": 100000}, "memory": {"max_peak_gb": 55, "gradient_accumulation_steps": 1, "gradient_checkpointing": false}}, "num_params_M": null, "decontam_removed": 0}
