commit	primary_score	memory_gb	training_min	datasets	status	description
17c0680	56.40	36.4	95.3	sentence-transformers/reddit-title-body;stanfordnlp/snli;ms_marco;glue;yahoo_answers_topics;ag_news;sentence-transformers/natural-questions;hotpot_qa;fancyzhx/dbpedia_14;sentence-transformers/stackexchange-duplicates	discard	exp-66: contrastive 75min (interpolate between 60 and 90); cosine_decay LR=5e-5; HotpotQA; hypothesis: 60<75<90 sweet spot; baseline exp-61 primary=57.11 (60min) vs exp-52 56.45 (90min)
d9d0497	57.51	36.4	80.3	glue;ms_marco;sentence-transformers/natural-questions;sentence-transformers/reddit-title-body;stanfordnlp/snli;fancyzhx/dbpedia_14;hotpot_qa;ag_news;yahoo_answers_topics;sentence-transformers/stackexchange-duplicates	keep	exp-67: time-based cosine LR decay (fix: was step-estimate based which under-counted for long runs); 60-min contrastive; baseline exp-61 primary=57.11 (was step-based)
d47d69e	57.41	36.4	95.3	yahoo_answers_topics;sentence-transformers/natural-questions;stanfordnlp/snli;hotpot_qa;glue;ag_news;ms_marco;fancyzhx/dbpedia_14;sentence-transformers/stackexchange-duplicates;sentence-transformers/reddit-title-body	discard	exp-68: 75-min contrastive with time-based cosine decay (exp-66 used buggy step-based); baseline exp-67 primary=57.51 (60-min)
609bfa5	56.53	36.4	85.7	glue;fancyzhx/dbpedia_14;hotpot_qa;sentence-transformers/natural-questions;ag_news;sentence-transformers/stackexchange-duplicates;ms_marco;stanfordnlp/snli;yahoo_answers_topics;sentence-transformers/reddit-title-body	discard	exp-69: expand hard neg mining 8K→16K + fine-tuning 5min→10min; baseline exp-67 primary=57.51
5a31158	37.77	36.4	80.3	sentence-transformers/reddit-title-body;fancyzhx/dbpedia_14;sentence-transformers/stackexchange-duplicates;ms_marco;stanfordnlp/snli;ag_news;glue;sentence-transformers/natural-questions;yahoo_answers_topics;hotpot_qa	discard	exp-70: activate hard neg loss in fine-tuning (weight=2.0 vs 1.0 which was disabled); hypothesis: explicit hard negs boost retrieval; baseline exp-67 primary=57.51
793bd09	53.85	69.9	80.4	stanfordnlp/snli;sentence-transformers/stackexchange-duplicates;sentence-transformers/reddit-title-body;hotpot_qa;ms_marco;fancyzhx/dbpedia_14;sentence-transformers/natural-questions;yahoo_answers_topics;glue;ag_news	discard	exp-74: fix NaN gradient bug (attention mask -inf→-1e9 prevents all-masked softmax rows) + max_seq_length=512 (was 256 for all prior exps) + data scaling 50K/dataset (~328K pairs); batch=64 no grad_accum; hypothesis: longer sequences improve retrieval tasks; baseline exp-67 primary=57.51
8a94602	54.60	7.0	80.5	ms_marco;sentence-transformers/natural-questions;yahoo_answers_topics;glue;sentence-transformers/reddit-title-body;hotpot_qa;ag_news;fancyzhx/dbpedia_14;stanfordnlp/snli;sentence-transformers/stackexchange-duplicates	discard	exp-75: mean pooling (was CLS for all prior exps); all other params match exp-67 baseline; hypothesis: mean pooling captures richer all-token representation vs single CLS token, expected to improve retrieval and clustering; baseline exp-67 primary=57.51 (CLS pooling)
7db78ab	0.00				crash	exp-71: disable source_stratification (mixed batches instead of single-source); killed manually — NaN loss from first step, root cause was -inf attention masks not stratification; baseline exp-67 primary=57.51
7622d8a	0.00				crash	exp-72: data scaling 30K→50K/dataset + grad accum fix; NaN loss — root cause was -inf in attention masks (misattributed to LLRD/EMA/grad_ckpt); multiple attempts, all NaN; baseline exp-67 primary=57.51
5285ea5	0.00				crash	exp-73: max_seq_length=512 + batch=32 + grad_accum=2; NaN loss — same -inf attention mask root cause; baseline exp-67 primary=57.51
aa03013	53.16				discard	exp-76: disable fine-tuning stage (duration=0) + extend contrastive to 65min; eval hung during clustering task (fixed in c55dcaf); scores from run.log; baseline exp-67 primary=57.51
7ace5d0	52.88	37.3	80.6	glue;ms_marco;ag_news;hotpot_qa;stanfordnlp/snli;sentence-transformers/stackexchange-duplicates;sentence-transformers/reddit-title-body;sentence-transformers/natural-questions;yahoo_answers_topics;fancyzhx/dbpedia_14	discard	exp-77: SimCLR projection head (2-layer MLP 768→768→768 with GELU, train on projected space, eval on raw encoder); all other params match exp-67 baseline; hypothesis: projection head absorbs task noise → cleaner encoder representations → better generalization across all task types; baseline exp-67 primary=57.51
d6191a1	52.20	37.2	80.5	yahoo_answers_topics;hotpot_qa;ag_news;sentence-transformers/stackexchange-duplicates;sentence-transformers/natural-questions;sentence-transformers/reddit-title-body;ms_marco;fancyzhx/dbpedia_14;glue;stanfordnlp/snli	discard	exp-78: data scaling 50K/dataset (was 30K in exp-67 baseline, ~328K→~500K pairs); also fix: cache key now includes max_rows (previously stale 30K cache was reused); all other params match exp-67; hypothesis: more diverse training signal improves generalization; baseline exp-67 primary=57.51
5fe20a3	53.39	37.9	80.5	stanfordnlp/snli;glue;ms_marco;yahoo_answers_topics;sentence-transformers/reddit-title-body;sentence-transformers/stackexchange-duplicates;sentence-transformers/natural-questions;ag_news;hotpot_qa;fancyzhx/dbpedia_14	discard	exp-79: reproduce exp-67 baseline — revert attention masking to padding-only (no sliding window), restore grad_accum=4+batch=32 for FT; hypothesis: sliding window mask introduced in exp-73 caused regression in subsequent experiments; expected: ~57.5 (match exp-67); baseline exp-67 primary=57.51
fa5f2c5	52.96	39.0	80.4	ag_news;stanfordnlp/snli;sentence-transformers/natural-questions;fancyzhx/dbpedia_14;hotpot_qa;yahoo_answers_topics;sentence-transformers/reddit-title-body;glue;sentence-transformers/stackexchange-duplicates;ms_marco	discard	exp-80: LLRD decay=0.95 (lower layers get smaller LR, standard BERT FT technique) + increase MTEB timeout to 10min (fix RedditClustering timeout); grad_accum=4, batch=64/32, CLS pooling, seq_len=256; hypothesis: LLRD preserves pretrained lower-layer features while adapting upper layers → +1-2 points; baseline exp-67 primary=57.51
09a71cd	53.67	37.9	80.4	stanfordnlp/snli;sentence-transformers/stackexchange-duplicates;glue;sentence-transformers/natural-questions;fancyzhx/dbpedia_14;hotpot_qa;ms_marco;ag_news;sentence-transformers/reddit-title-body;yahoo_answers_topics	discard	exp-81: fix critical bug — grad_accum=1 (exp-67 config said 4 but code had NO grad_accum implementation, so actual was 1; exps 78-80 accidentally used grad_accum=4 causing 4x larger effective batch and fewer optimizer steps); LLRD=0.95; MTEB timeout=10min; hypothesis: fixing grad_accum to match exp-67's actual behavior + LLRD should reproduce/beat 57.51
6af9820	57.72	37.5	80.3	stanfordnlp/snli;sentence-transformers/natural-questions;hotpot_qa;ms_marco;fancyzhx/dbpedia_14;glue;sentence-transformers/reddit-title-body;yahoo_answers_topics;ag_news;sentence-transformers/stackexchange-duplicates	keep	exp-82: exact exp-67 code reproduction (reverted train.py + model.py to exp-67 commit d9d0497); only diff is config fields (llrd_decay, ema_decay, etc.) which are ignored by old code; hypothesis: should reproduce ~57.51 primary score
5f8e98f	57.46	36.5	80.3	fancyzhx/dbpedia_14;glue;ms_marco;ag_news;hotpot_qa;yahoo_answers_topics;stanfordnlp/snli;sentence-transformers/reddit-title-body;sentence-transformers/natural-questions;sentence-transformers/stackexchange-duplicates	discard	exp-83: data scaling 100K/dataset (was 30K in exp-82 baseline); expect ~500K+ pairs from larger datasets (reddit, NQ, MS-MARCO); all other code identical to exp-82; hypothesis: more diverse training data is highest-ROI improvement per program.md; baseline exp-82 primary=57.72
e60dc9e	57.19	37.5	110.3	ag_news;ms_marco;fancyzhx/dbpedia_14;yahoo_answers_topics;sentence-transformers/natural-questions;glue;sentence-transformers/stackexchange-duplicates;sentence-transformers/reddit-title-body;stanfordnlp/snli;hotpot_qa	discard	exp-85: symmetric InfoNCE loss (bidirectional: query→positive + positive→query) for both warmup and contrastive stages; 90-min contrastive; hypothesis: symmetric loss doubles contrastive signal and improves retrieval tasks; baseline exp-84 primary=57.89
b6da9d1	55.99				discard	exp-84: extend contrastive to 90min; INCOMPLETE eval — 7/8 tasks (RedditClustering timed out, scored as 0); NOT comparable to full 8-task evals
ac3eb8a	54.40				discard	exp-87: baseline rerun with L2 grad norm (REGRESSED — reverted); full 8/8 eval; L2 clip cost 48% steps; baseline exp-82 primary=57.72
8bd4add	56.13	35.7	80.5	sentence-transformers/reddit-title-body;sentence-transformers/stackexchange-duplicates;ms_marco;ag_news;stanfordnlp/snli;yahoo_answers_topics;fancyzhx/dbpedia_14;hotpot_qa;glue;sentence-transformers/natural-questions	discard	exp-88: MinHash cross-dataset deduplication (word 3-gram, 64 perms, threshold=0.5); removes near-duplicate pairs across 10 training datasets; hypothesis: dedup removes noisy/redundant pairs that waste compute and bias contrastive loss (false negatives); all other config identical to exp-82 baseline (60-min contrastive, temp=0.05, CLS, seq_len=256, batch=64); baseline exp-82 primary=57.72
95e09fc	55.50	37.5	80.6	fancyzhx/dbpedia_14;stanfordnlp/snli;sentence-transformers/natural-questions;sentence-transformers/reddit-title-body;yahoo_answers_topics;ms_marco;hotpot_qa;ag_news;glue;sentence-transformers/stackexchange-duplicates	discard	exp-89: fix hard neg gate (>0.0 not >1.0) + enable hard negs in fine-tuning (weight=1.0, natural scale); fix hard neg loss formula (remove logit amplification that destroyed exp-70); hypothesis: hard neg mining was always wasted because the gate silently disabled hard negs in fine-tuning — enabling them at natural scale should improve retrieval tasks; baseline exp-82 primary=57.72
32e1397	57.91	36.5	140.5	yahoo_answers_topics;stanfordnlp/snli;glue;fancyzhx/dbpedia_14;sentence-transformers/reddit-title-body;ms_marco;ag_news;hotpot_qa;sentence-transformers/natural-questions;sentence-transformers/stackexchange-duplicates	keep	exp-91: data scaling 100K/dataset (655K pairs) + 120min contrastive (2x baseline); fix max_rows_per_dataset to read from config (was hardcoded 30K); exp-83 used 100K data but only 60min training — model saw each pair ~1.5x vs 3x at baseline; hypothesis: proportional training time with more data will improve score; baseline exp-82 primary=57.72
63c7da2	39.21	36.5	140.9	stanfordnlp/snli;ag_news;sentence-transformers/natural-questions;sentence-transformers/stackexchange-duplicates;yahoo_answers_topics;ms_marco;glue;hotpot_qa;fancyzhx/dbpedia_14;sentence-transformers/reddit-title-body	discard	exp-92: LLRD decay=0.95 (layer-wise LR decay); lower layers get 34%-57% of base LR, preserving pretrained features while adapting upper layers more; standard for BERT fine-tuning (GTE, NV-Embed, Arctic-Embed all use this); all other config same as exp-91 (100K/dataset, 120min contrastive); baseline exp-91 primary=57.91
281ee00	56.60	36.5	140.9	sentence-transformers/natural-questions;hotpot_qa;ms_marco;yahoo_answers_topics;sentence-transformers/reddit-title-body;stanfordnlp/snli;sentence-transformers/stackexchange-duplicates;glue;ag_news;fancyzhx/dbpedia_14	discard	exp-93: 2x contrastive LR (1e-4 vs 5e-5); with 655K pairs and 120min, higher LR may push further into the loss landscape; warmup LR unchanged at 1e-4; hypothesis: higher LR exploits the larger dataset more effectively; all other config same as exp-91 (100K/dataset, 120min, CLS, temp=0.05, batch=64); baseline exp-91 primary=57.91
928d0fd	0.00	0.0	0.0		crash	exp-94: batch=128 contrastive (2x in-batch negatives, 127 vs 63); linear-scaled LR=1e-4 (from batch=64/LR=5e-5); exp-93 showed LR=1e-4 at batch=64 regressed (56.60 vs 57.91) — the proper test requires batch=128 per linear scaling rule; more negatives per step improves contrastive signal, especially for retrieval; all other config same as exp-91; baseline exp-91 primary=57.91
705b227	56.31	58.8	140.5	ms_marco;stanfordnlp/snli;fancyzhx/dbpedia_14;sentence-transformers/natural-questions;ag_news;glue;yahoo_answers_topics;sentence-transformers/reddit-title-body;hotpot_qa;sentence-transformers/stackexchange-duplicates	discard	exp-94: batch=96 contrastive (1.5x in-batch negatives, 95 vs 63); linear-scaled LR=7.5e-5 (from batch=64/LR=5e-5); batch=128 hung at 51GB due to Metal memory; batch=96 stays under tiled-loss threshold, uses standard InfoNCE; more negatives per step improves contrastive signal for retrieval; all other config same as exp-91; baseline exp-91 primary=57.91
93e4fe6	57.71	38.5	140.7	yahoo_answers_topics;hotpot_qa;ms_marco;sentence-transformers/reddit-title-body;stanfordnlp/snli;fancyzhx/dbpedia_14;sentence-transformers/natural-questions;glue;qiaojin/PubMedQA;ag_news;sentence-transformers/stackexchange-duplicates	discard	exp-95: add PubMedQA biomedical training data (211K question-context pairs from qiaojin/PubMedQA pqa_artificial); directly targets our weakest tasks: NFCorpus=20.31, SciFact=49.52; no other config changes from exp-91 baseline (batch=64, LR=5e-5, 120min contrastive, CLS, temp=0.05); hypothesis: biomedical domain data improves retrieval scores; baseline exp-91 primary=57.91
2a1c6af	58.23	38.4	160.8	sentence-transformers/stackexchange-duplicates;hotpot_qa;fancyzhx/dbpedia_14;glue;stanfordnlp/snli;sentence-transformers/natural-questions;qiaojin/PubMedQA;ag_news;sentence-transformers/reddit-title-body;yahoo_answers_topics;ms_marco	keep	exp-96: PubMedQA + 140min contrastive (proportional to 756K pairs); exp-95 showed PubMedQA helped SciFact (+2.47) and clustering (+2.65 20news) but STS regressed (-2.18) — likely from insufficient training with 15% more data; 140min gives same pairs-per-minute as exp-91 (120min/655K); all other config same as exp-91; baseline exp-91 primary=57.91, exp-95 primary=57.71
3711cbf	57.57	38.4	200.7	sentence-transformers/stackexchange-duplicates;sentence-transformers/reddit-title-body;glue;ag_news;qiaojin/PubMedQA;stanfordnlp/snli;ms_marco;yahoo_answers_topics;sentence-transformers/natural-questions;fancyzhx/dbpedia_14;hotpot_qa	discard	exp-97: extended contrastive to 180min (exp-96 loss 0.312 not saturated); PubMedQA data (756K pairs); same LR=5e-5, batch=64, CLS, temp=0.05; 180min gives ~4.5 passes over 756K pairs vs 3.5 in exp-96; hypothesis: more training improves all task categories; baseline exp-96 primary=58.23 (NEW BEST)
b42588a	58.69	38.0	160.7	sentence-transformers/reddit-title-body;sentence-transformers/natural-questions;glue;hotpot_qa;ag_news;fancyzhx/dbpedia_14;sentence-transformers/stackexchange-duplicates;sentence-transformers/s2orc;ms_marco;qiaojin/PubMedQA;yahoo_answers_topics;stanfordnlp/snli	keep	exp-98: add S2ORC scientific title-abstract pairs (sentence-transformers/s2orc, streaming); targets weak retrieval (SciFact, NFCorpus) and clustering diversity; 140min contrastive (180min overfit in exp-97); code adds s2orc_title_abstract format handler; hypothesis: scientific domain data improves retrieval like PubMedQA did; baseline exp-96 primary=58.23
04d3017	58.55	36.5	180.7	sentence-transformers/reddit-title-body;sentence-transformers/natural-questions;yahoo_answers_topics;sentence-transformers/s2orc;hotpot_qa;qiaojin/PubMedQA;copenlu/fever_gold_evidence;sentence-transformers/stackexchange-duplicates;stanfordnlp/snli;fancyzhx/dbpedia_14;ag_news;glue;ms_marco	discard	exp-99: add FEVER claim-evidence pairs (copenlu/fever_gold_evidence, SUPPORTS only) + 160min contrastive (proportional to ~936K pairs); FEVER targets fact-based retrieval like SciFact; combined with S2ORC (exp-98) and PubMedQA; hypothesis: more retrieval diversity improves SciFact and NFCorpus; baseline exp-98 primary=58.69 (NEW BEST)
4fab3f7	58.20	36.5	160.9	sentence-transformers/natural-questions;ag_news;fancyzhx/dbpedia_14;yahoo_answers_topics;stanfordnlp/snli;qiaojin/PubMedQA;sentence-transformers/stackexchange-duplicates;hotpot_qa;sentence-transformers/s2orc;sentence-transformers/reddit-title-body;glue;ms_marco;copenlu/fever_gold_evidence	discard	exp-100: FEVER + S2ORC + PubMedQA at 140min contrastive (exp-99 showed 160min slightly overfit, 58.55 vs 58.69); exp-99 SciFact improved +2.45 from FEVER but pair_class regressed — testing whether 140min fixes regression while keeping SciFact gains; 908K pairs, 13 datasets; baseline exp-98 primary=58.69
22317aa	0.00	0.0	0.0		crash	exp-101: replace SNLI with AllNLI triplets (sentence-transformers/all-nli, triplet config); AllNLI = SNLI+MNLI with hard negatives (anchor/positive/negative); adds MNLI genre diversity + contrastive hard negatives; FEVER removed (hurt pair_class); 12 datasets, 140min contrastive; hypothesis: hard negatives from AllNLI improve STS/pair_class while maintaining retrieval; baseline exp-98 primary=58.69
22317aa	0.00	0.0	0.0		crash	exp-101: replace SNLI with AllNLI triplets (sentence-transformers/all-nli, triplet config); AllNLI = SNLI+MNLI with hard negatives (anchor/positive/negative); adds MNLI genre diversity + contrastive hard negatives; FEVER removed (hurt pair_class); 12 datasets, 140min contrastive; hypothesis: hard negatives from AllNLI improve STS/pair_class while maintaining retrieval; baseline exp-98 primary=58.69
22317aa	0.00	0.0	0.0		crash	exp-101: replace SNLI with AllNLI triplets (sentence-transformers/all-nli, triplet config); AllNLI = SNLI+MNLI with hard negatives (anchor/positive/negative); adds MNLI genre diversity + contrastive hard negatives; FEVER removed (hurt pair_class); 12 datasets, 140min contrastive; hypothesis: hard negatives from AllNLI improve STS/pair_class while maintaining retrieval; baseline exp-98 primary=58.69
2d6e409	55.50	38.1	170.5	fancyzhx/dbpedia_14;ag_news;sentence-transformers/reddit-title-body;hotpot_qa;ms_marco;sentence-transformers/s2orc;sentence-transformers/natural-questions;stanfordnlp/snli;sentence-transformers/stackexchange-duplicates;qiaojin/PubMedQA;glue;yahoo_answers_topics	discard	exp-102: re-enable hard negative fine-tuning (weight=1.0, was disabled at 0.0 since exp-71) + extend to 15min (was 5min); mined hard negs are computed but currently wasted; weight=1.0 treats hard negs equal to in-batch (2.0 crashed exp-70); 15min gives ~3 passes over 8K mined pairs; hypothesis: properly using hard negatives improves retrieval (SciFact/NFCorpus); same data as exp-98 (SNLI restored, AllNLI OOM'd); baseline exp-98 primary=58.69
8e89af0	59.94	38.1	160.5	glue;sentence-transformers/natural-questions;sentence-transformers/stackexchange-duplicates;yahoo_answers_topics;qiaojin/PubMedQA;sentence-transformers/reddit-title-body;fancyzhx/dbpedia_14;hotpot_qa;stanfordnlp/snli;sentence-transformers/s2orc;ag_news;ms_marco	keep	exp-103: symmetric InfoNCE during contrastive (query→pos + pos→query averaged); doubles gradient signal per pair; standard in SimCSE/E5/GTE; exp-102 showed hard_neg fine-tuning causes catastrophic forgetting — reverted to disabled; same data/config as exp-98 otherwise; hypothesis: symmetric loss improves representation quality across all task categories; baseline exp-98 primary=58.69
7c5f9c8	59.98	38.1	160.4	ms_marco;yahoo_answers_topics;sentence-transformers/stackexchange-duplicates;glue;sentence-transformers/natural-questions;sentence-transformers/s2orc;hotpot_qa;qiaojin/PubMedQA;fancyzhx/dbpedia_14;stanfordnlp/snli;sentence-transformers/reddit-title-body;ag_news	keep	exp-104: temperature annealing during contrastive (0.07→0.03); softer distribution early = more exploration, sharper late = better discrimination; proven technique in SimCLR/CLIP; all other settings match exp-103 (symmetric InfoNCE, 12 datasets, 140min contrastive); hypothesis: annealing improves final representation quality especially for retrieval; baseline exp-103 primary=59.94 (NEW BEST)
db1630a	59.40	40.9	160.5	sentence-transformers/reddit-title-body;sentence-transformers/s2orc;sentence-transformers/stackexchange-duplicates;hotpot_qa;ms_marco;ag_news;glue;fancyzhx/dbpedia_14;stanfordnlp/snli;sentence-transformers/natural-questions;yahoo_answers_topics;qiaojin/PubMedQA	discard	exp-105: data scaling 2x (100K→200K max_rows_per_dataset); more unique training pairs with same 140min contrastive (21% sat at 100K = plenty of learning capacity); temperature reverted to fixed 0.05 (exp-104 annealing was +0.04, within noise); program.md says Data > everything; hypothesis: 2x unique pairs significantly improves all categories; baseline exp-104 primary=59.98 (NEW BEST)
a68a54b	59.64	40.9	220.6	ag_news;ms_marco;qiaojin/PubMedQA;glue;stanfordnlp/snli;sentence-transformers/stackexchange-duplicates;sentence-transformers/reddit-title-body;sentence-transformers/natural-questions;yahoo_answers_topics;hotpot_qa;fancyzhx/dbpedia_14;sentence-transformers/s2orc	discard	exp-106: 200K data + 200min contrastive (exp-105 showed 200K@140min undertrained: 18% sat, STS -0.94, SprintDup -4.36, but SciFact +3.50; scaling contrastive proportionally to data increase; hypothesis: longer training recovers STS/PairClass while keeping SciFact gains from data diversity; baseline exp-104 primary=59.98 (NEW BEST)
056ce57	0.00	0.0	0.0		crash	exp-107: longer contrastive 180min on 100K data (revert data to exp-104 baseline); exp-105/106 showed 200K data helps retrieval/clustering but hurts STS/PairClass via dilution (-2.01 SprintDup even at 200min); instead test more compute on same data — exp-104 had 21% sat at 140min suggesting room for improvement; hypothesis: 180min pushes saturation higher and improves all categories without dilution tradeoff; baseline exp-104 primary=59.98 (NEW BEST)
37895de	0.00	0.0	0.0		crash	exp-107: retry — longer contrastive 180min on 100K data (revert data to exp-104 baseline); previous run killed by OOM at step 950 (exit 137); exp-105/106 showed 200K data helps retrieval/clustering but hurts STS/PairClass via dilution; hypothesis: 180min on 100K improves all categories without dilution; baseline exp-104 primary=59.98 (NEW BEST)
