{"commit": "d24b573", "primary_score": 45.76, "memory_gb": 84.6, "training_min": 51.5, "datasets": ["snli", "mnli", "all-nli"], "status": "contaminated", "description": "baseline ModernBERT-base 4-stage; snli/mnli overlap with SICK-R(2.9%) and STSBench(3.0%)", "task_scores": {}, "timestamp": "2026-03-10T00:00:00Z", "config": {}}
{"commit": "a3fa28a", "primary_score": 43.34, "memory_gb": 71.3, "training_min": 51.5, "datasets": ["all-nli", "quora", "msmarco"], "status": "contaminated", "description": "remove snli/mnli but all-nli still has Flickr overlap SICK-R(2.0%) STSBench(1.9%)", "task_scores": {}, "timestamp": "2026-03-10T00:00:00Z", "config": {}}
{"commit": "e0931b1", "primary_score": 27.2, "memory_gb": 75.3, "training_min": 51.5, "datasets": ["se-dups", "nq", "msmarco"], "status": "keep", "description": "exp-3 first clean baseline: SE+NQ+MSMARCO, contamination PASS (0% all tasks)", "task_scores": {"sts_bench": 45.71, "sick_r": 49.23, "twitter_url": 68.08, "sprint_dup": 34.12, "20news": 9.11, "reddit_clust": 8.82, "scifact": 4.06, "nfcorpus": 2.25}, "timestamp": "2026-03-10T00:00:00Z", "config": {}}
{"commit": "892d982", "primary_score": 33.8, "memory_gb": 79.5, "training_min": 51.5, "datasets": ["mrpc", "qqp", "mnli-nonpic"], "status": "contaminated", "description": "MRPC news text overlaps STSBenchmark (2.95%)", "task_scores": {}, "timestamp": "2026-03-10T00:00:00Z", "config": {}}
{"commit": "8136ecc", "primary_score": 32.6869, "memory_gb": 78.4, "training_min": 50.8, "datasets": ["glue", "ms_marco", "multi_nli", "sentence-transformers/all-nli", "sentence-transformers/stackexchange-duplicates"], "status": "discard", "description": "test: verify wrapper pipeline with MPS optimizations", "task_scores": {"sts_bench": 64.55, "sick_r": 48.55, "twitter_url": 78.61}, "timestamp": "2026-03-11T15:04:58.716977+00:00", "config": {"base_model": "answerdotai/ModernBERT-base", "embedding_dim": 768, "projection_dim": 256, "pooling": "mean", "max_seq_length": 512, "normalize_embeddings": true, "stages": {"warmup": {"duration_minutes": 10, "data": "nli_entailment_only", "loss": "infonce", "temperature": 0.1, "learning_rate": 0.0001, "lr_schedule": "linear_warmup_constant", "warmup_ratio": 0.1, "batch_size": 256, "negatives": "in_batch_only", "freeze_encoder_layers": 0}, "contrastive": {"duration_minutes": 20, "data": "all_curated", "loss": "infonce", "temperature": 0.05, "learning_rate": 5e-05, "lr_schedule": "cosine_decay", "warmup_ratio": 0.05, "batch_size": 256, "negatives": "in_batch_plus_explicit", "source_stratification": true}, "hard_neg_mining": {"duration_minutes": 5, "top_k": 7, "batch_size": 512, "min_similarity": 0.3}, "fine_tuning": {"duration_minutes": 20, "data": "all_curated_with_hard_negs", "loss": "infonce", "temperature": 0.02, "learning_rate": 1e-05, "lr_schedule": "cosine_decay", "warmup_ratio": 0.0, "batch_size": 128, "hard_neg_weight": 2.0}}, "optimizer": {"type": "adamw", "betas": [0.9, 0.999], "eps": 1e-08, "weight_decay": 0.01}, "memory": {"max_peak_gb": 55, "gradient_accumulation_steps": 4}}, "num_params_M": 149.2, "decontam_removed": 1974, "wandb_run_id": "3ewci5mb"}
{"commit": "1e3d2d1", "primary_score": 0.0, "memory_gb": 0.0, "training_min": 0.0, "datasets": [], "status": "crash", "description": "exp-8: projection_dim=768 + reddit diversity; targeting clustering(9%\u2192fix) and retrieval(3%\u2192fix)", "task_scores": {}, "timestamp": "2026-03-11T17:03:55.386192+00:00", "config": {"base_model": "answerdotai/ModernBERT-base", "embedding_dim": 768, "projection_dim": 768, "pooling": "mean", "max_seq_length": 512, "normalize_embeddings": true, "stages": {"warmup": {"duration_minutes": 15, "data": "qqp_se_paraphrase", "loss": "infonce", "temperature": 0.1, "learning_rate": 0.0001, "lr_schedule": "linear_warmup_constant", "warmup_ratio": 0.1, "batch_size": 256, "negatives": "in_batch_only", "freeze_encoder_layers": 0}, "contrastive": {"duration_minutes": 30, "data": "all_curated", "loss": "infonce", "temperature": 0.05, "learning_rate": 5e-05, "lr_schedule": "cosine_decay", "warmup_ratio": 0.05, "batch_size": 256, "negatives": "in_batch_plus_explicit", "source_stratification": true}, "hard_neg_mining": {"duration_minutes": 5, "top_k": 7, "batch_size": 512, "min_similarity": 0.3}, "fine_tuning": {"duration_minutes": 30, "data": "all_curated_with_hard_negs", "loss": "infonce", "temperature": 0.02, "learning_rate": 1e-05, "lr_schedule": "cosine_decay", "warmup_ratio": 0.0, "batch_size": 128, "hard_neg_weight": 2.0}}, "optimizer": {"type": "adamw", "betas": [0.9, 0.999], "eps": 1e-08, "weight_decay": 0.01}, "memory": {"max_peak_gb": 55, "gradient_accumulation_steps": 4}}, "num_params_M": null, "decontam_removed": 0}
{"commit": "e1724f2", "primary_score": 0.0, "memory_gb": 0.0, "training_min": 0.0, "datasets": [], "status": "crash", "description": "exp-9: fix OOM - reduce batch sizes (256\u2192128 warmup/contrastive, 128\u219264 finetune); same proj_dim=768 + reddit", "task_scores": {}, "timestamp": "2026-03-11T17:06:14.064531+00:00", "config": {"base_model": "answerdotai/ModernBERT-base", "embedding_dim": 768, "projection_dim": 768, "pooling": "mean", "max_seq_length": 512, "normalize_embeddings": true, "stages": {"warmup": {"duration_minutes": 15, "data": "qqp_se_paraphrase", "loss": "infonce", "temperature": 0.1, "learning_rate": 0.0001, "lr_schedule": "linear_warmup_constant", "warmup_ratio": 0.1, "batch_size": 128, "negatives": "in_batch_only", "freeze_encoder_layers": 0}, "contrastive": {"duration_minutes": 30, "data": "all_curated", "loss": "infonce", "temperature": 0.05, "learning_rate": 5e-05, "lr_schedule": "cosine_decay", "warmup_ratio": 0.05, "batch_size": 128, "negatives": "in_batch_plus_explicit", "source_stratification": true}, "hard_neg_mining": {"duration_minutes": 5, "top_k": 7, "batch_size": 256, "min_similarity": 0.3}, "fine_tuning": {"duration_minutes": 30, "data": "all_curated_with_hard_negs", "loss": "infonce", "temperature": 0.02, "learning_rate": 1e-05, "lr_schedule": "cosine_decay", "warmup_ratio": 0.0, "batch_size": 64, "hard_neg_weight": 2.0}}, "optimizer": {"type": "adamw", "betas": [0.9, 0.999], "eps": 1e-08, "weight_decay": 0.01}, "memory": {"max_peak_gb": 55, "gradient_accumulation_steps": 4}}, "num_params_M": null, "decontam_removed": 0}
{"commit": "d19b9dc", "primary_score": 0.0, "memory_gb": 0.0, "training_min": 0.0, "datasets": [], "status": "crash", "description": "exp-10: fix OOM - batch_size 64/64/32 (9GB/step); proj_dim=768 + reddit; baseline for larger batches", "task_scores": {}, "timestamp": "2026-03-11T17:57:12.147579+00:00", "config": {"base_model": "answerdotai/ModernBERT-base", "embedding_dim": 768, "projection_dim": 768, "pooling": "mean", "max_seq_length": 512, "normalize_embeddings": true, "stages": {"warmup": {"duration_minutes": 15, "data": "qqp_se_paraphrase", "loss": "infonce", "temperature": 0.1, "learning_rate": 0.0001, "lr_schedule": "linear_warmup_constant", "warmup_ratio": 0.1, "batch_size": 64, "negatives": "in_batch_only", "freeze_encoder_layers": 0}, "contrastive": {"duration_minutes": 30, "data": "all_curated", "loss": "infonce", "temperature": 0.05, "learning_rate": 5e-05, "lr_schedule": "cosine_decay", "warmup_ratio": 0.05, "batch_size": 64, "negatives": "in_batch_plus_explicit", "source_stratification": true}, "hard_neg_mining": {"duration_minutes": 5, "top_k": 7, "batch_size": 128, "min_similarity": 0.3}, "fine_tuning": {"duration_minutes": 30, "data": "all_curated_with_hard_negs", "loss": "infonce", "temperature": 0.02, "learning_rate": 1e-05, "lr_schedule": "cosine_decay", "warmup_ratio": 0.0, "batch_size": 32, "hard_neg_weight": 2.0}}, "optimizer": {"type": "adamw", "betas": [0.9, 0.999], "eps": 1e-08, "weight_decay": 0.01}, "memory": {"max_peak_gb": 55, "gradient_accumulation_steps": 4}}, "num_params_M": null, "decontam_removed": 0}
{"commit": "4ad1e87", "primary_score": 32.6684, "memory_gb": 32.5, "training_min": 75.5, "datasets": ["sentence-transformers/reddit-title-body", "ms_marco", "sentence-transformers/natural-questions", "sentence-transformers/stackexchange-duplicates", "glue"], "status": "keep", "description": "exp-11: fix hard-neg mining OOM - reduce to 8K docs + batch_size=32; same proj_dim=768 + reddit + 64/64/32 batches", "task_scores": {"sts_bench": 54.73, "sick_r": 51.77, "twitter_url": 69.27, "sprint_dup": 60.91, "20news": 11.25, "reddit_clust": 6.85, "scifact": 9.37, "nfcorpus": 3.07}, "timestamp": "2026-03-11T19:29:30.345297+00:00", "config": {"base_model": "answerdotai/ModernBERT-base", "embedding_dim": 768, "projection_dim": 768, "pooling": "mean", "max_seq_length": 512, "normalize_embeddings": true, "stages": {"warmup": {"duration_minutes": 15, "data": "qqp_se_paraphrase", "loss": "infonce", "temperature": 0.1, "learning_rate": 0.0001, "lr_schedule": "linear_warmup_constant", "warmup_ratio": 0.1, "batch_size": 64, "negatives": "in_batch_only", "freeze_encoder_layers": 0}, "contrastive": {"duration_minutes": 30, "data": "all_curated", "loss": "infonce", "temperature": 0.05, "learning_rate": 5e-05, "lr_schedule": "cosine_decay", "warmup_ratio": 0.05, "batch_size": 64, "negatives": "in_batch_plus_explicit", "source_stratification": true}, "hard_neg_mining": {"duration_minutes": 5, "top_k": 7, "batch_size": 128, "min_similarity": 0.3}, "fine_tuning": {"duration_minutes": 30, "data": "all_curated_with_hard_negs", "loss": "infonce", "temperature": 0.02, "learning_rate": 1e-05, "lr_schedule": "cosine_decay", "warmup_ratio": 0.0, "batch_size": 32, "hard_neg_weight": 2.0}}, "optimizer": {"type": "adamw", "betas": [0.9, 0.999], "eps": 1e-08, "weight_decay": 0.01}, "memory": {"max_peak_gb": 55, "gradient_accumulation_steps": 4}}, "num_params_M": 149.0, "decontam_removed": 0, "wandb_run_id": "4ojtqvwt"}
{"commit": "64cea21", "primary_score": 34.6557, "memory_gb": 34.7, "training_min": 75.3, "datasets": ["glue", "sentence-transformers/stackexchange-duplicates", "sentence-transformers/natural-questions", "sentence-transformers/reddit-title-body", "ms_marco", "ag_news"], "status": "keep", "description": "exp-12: add ag_news same-label pairs for clustering + finetune temp 0.02\u21920.05; target clustering(9%\u219215%)", "task_scores": {"sts_bench": 57.2, "sick_r": 54.8, "twitter_url": 69.92, "sprint_dup": 63.77, "20news": 10.65, "reddit_clust": 7.73, "scifact": 12.95, "nfcorpus": 4.71}, "timestamp": "2026-03-11T21:58:45.014053+00:00", "config": {"base_model": "answerdotai/ModernBERT-base", "embedding_dim": 768, "projection_dim": 768, "pooling": "mean", "max_seq_length": 512, "normalize_embeddings": true, "stages": {"warmup": {"duration_minutes": 15, "data": "qqp_se_paraphrase", "loss": "infonce", "temperature": 0.1, "learning_rate": 0.0001, "lr_schedule": "linear_warmup_constant", "warmup_ratio": 0.1, "batch_size": 64, "negatives": "in_batch_only", "freeze_encoder_layers": 0}, "contrastive": {"duration_minutes": 30, "data": "all_curated", "loss": "infonce", "temperature": 0.05, "learning_rate": 5e-05, "lr_schedule": "cosine_decay", "warmup_ratio": 0.05, "batch_size": 64, "negatives": "in_batch_plus_explicit", "source_stratification": true}, "hard_neg_mining": {"duration_minutes": 5, "top_k": 7, "batch_size": 128, "min_similarity": 0.3}, "fine_tuning": {"duration_minutes": 30, "data": "all_curated_with_hard_negs", "loss": "infonce", "temperature": 0.05, "learning_rate": 1e-05, "lr_schedule": "cosine_decay", "warmup_ratio": 0.0, "batch_size": 32, "hard_neg_weight": 2.0}}, "optimizer": {"type": "adamw", "betas": [0.9, 0.999], "eps": 1e-08, "weight_decay": 0.01}, "memory": {"max_peak_gb": 55, "gradient_accumulation_steps": 4}}, "num_params_M": 149.0, "decontam_removed": 0, "wandb_run_id": "avsucn93"}
{"commit": "7a8f211", "primary_score": 38.4351, "memory_gb": 37.8, "training_min": 75.3, "datasets": ["sentence-transformers/reddit-title-body", "ag_news", "fancyzhx/dbpedia_14", "ms_marco", "glue", "sentence-transformers/natural-questions", "yahoo_answers_topics", "sentence-transformers/stackexchange-duplicates"], "status": "keep", "description": "exp-13: add DBpedia-14 (14 classes) + Yahoo Answers (10 classes) for finer clustering; target 20News/Reddit cluster improvement", "task_scores": {"sts_bench": 59.7, "sick_r": 58.09, "twitter_url": 73.32, "sprint_dup": 69.36, "20news": 11.68, "reddit_clust": 10.58, "scifact": 20.94, "nfcorpus": 7.55}, "timestamp": "2026-03-12T00:26:20.757769+00:00", "config": {"base_model": "answerdotai/ModernBERT-base", "embedding_dim": 768, "projection_dim": 768, "pooling": "mean", "max_seq_length": 512, "normalize_embeddings": true, "stages": {"warmup": {"duration_minutes": 15, "data": "qqp_se_paraphrase", "loss": "infonce", "temperature": 0.1, "learning_rate": 0.0001, "lr_schedule": "linear_warmup_constant", "warmup_ratio": 0.1, "batch_size": 64, "negatives": "in_batch_only", "freeze_encoder_layers": 0}, "contrastive": {"duration_minutes": 30, "data": "all_curated", "loss": "infonce", "temperature": 0.05, "learning_rate": 5e-05, "lr_schedule": "cosine_decay", "warmup_ratio": 0.05, "batch_size": 64, "negatives": "in_batch_plus_explicit", "source_stratification": true}, "hard_neg_mining": {"duration_minutes": 5, "top_k": 7, "batch_size": 128, "min_similarity": 0.3}, "fine_tuning": {"duration_minutes": 30, "data": "all_curated_with_hard_negs", "loss": "infonce", "temperature": 0.05, "learning_rate": 1e-05, "lr_schedule": "cosine_decay", "warmup_ratio": 0.0, "batch_size": 32, "hard_neg_weight": 2.0}}, "optimizer": {"type": "adamw", "betas": [0.9, 0.999], "eps": 1e-08, "weight_decay": 0.01}, "memory": {"max_peak_gb": 55, "gradient_accumulation_steps": 4}}, "num_params_M": 149.0, "decontam_removed": 0, "wandb_run_id": "eymgze6w"}
{"commit": "1537540", "primary_score": 38.838, "memory_gb": 37.0, "training_min": 75.3, "datasets": ["sentence-transformers/stackexchange-duplicates", "sentence-transformers/reddit-title-body", "glue", "ag_news", "yahoo_answers_topics", "fancyzhx/dbpedia_14", "stanfordnlp/snli", "sentence-transformers/natural-questions", "ms_marco"], "status": "keep", "description": "exp-14: add SNLI entailment pairs for STS signal; DBpedia+Yahoo+SNLI; target STS>65, primary>40", "task_scores": {"sts_bench": 62.6, "sick_r": 57.96, "twitter_url": 74.37, "sprint_dup": 71.93, "20news": 14.12, "reddit_clust": 11.43, "scifact": 16.03, "nfcorpus": 7.76}, "timestamp": "2026-03-12T02:08:49.748979+00:00", "config": {"base_model": "answerdotai/ModernBERT-base", "embedding_dim": 768, "projection_dim": 768, "pooling": "mean", "max_seq_length": 512, "normalize_embeddings": true, "stages": {"warmup": {"duration_minutes": 15, "data": "qqp_se_paraphrase", "loss": "infonce", "temperature": 0.1, "learning_rate": 0.0001, "lr_schedule": "linear_warmup_constant", "warmup_ratio": 0.1, "batch_size": 64, "negatives": "in_batch_only", "freeze_encoder_layers": 0}, "contrastive": {"duration_minutes": 30, "data": "all_curated", "loss": "infonce", "temperature": 0.05, "learning_rate": 5e-05, "lr_schedule": "cosine_decay", "warmup_ratio": 0.05, "batch_size": 64, "negatives": "in_batch_plus_explicit", "source_stratification": true}, "hard_neg_mining": {"duration_minutes": 5, "top_k": 7, "batch_size": 128, "min_similarity": 0.3}, "fine_tuning": {"duration_minutes": 30, "data": "all_curated_with_hard_negs", "loss": "infonce", "temperature": 0.05, "learning_rate": 1e-05, "lr_schedule": "cosine_decay", "warmup_ratio": 0.0, "batch_size": 32, "hard_neg_weight": 2.0}}, "optimizer": {"type": "adamw", "betas": [0.9, 0.999], "eps": 1e-08, "weight_decay": 0.01}, "memory": {"max_peak_gb": 55, "gradient_accumulation_steps": 4}}, "num_params_M": 149.0, "decontam_removed": 170, "wandb_run_id": "jgrtiy1x"}
{"commit": "b557dad", "primary_score": 36.8818, "memory_gb": 35.3, "training_min": 75.3, "datasets": ["glue", "hotpot_qa", "sentence-transformers/stackexchange-duplicates", "ag_news", "nyu-mll/multi_nli", "ms_marco", "fancyzhx/dbpedia_14", "sentence-transformers/reddit-title-body", "sentence-transformers/natural-questions", "yahoo_answers_topics", "stanfordnlp/snli"], "status": "discard", "description": "exp-15: add MultiNLI + HotpotQA for more NLI diversity and retrieval signal; target SciFact recovery + primary>40", "task_scores": {"sts_bench": 53.5, "sick_r": 58.76, "twitter_url": 70.53, "sprint_dup": 70.13, "20news": 13.25, "reddit_clust": 11.0, "scifact": 16.66, "nfcorpus": 7.02}, "timestamp": "2026-03-12T04:13:30.151465+00:00", "config": {"base_model": "answerdotai/ModernBERT-base", "embedding_dim": 768, "projection_dim": 768, "pooling": "mean", "max_seq_length": 512, "normalize_embeddings": true, "stages": {"warmup": {"duration_minutes": 15, "data": "qqp_se_paraphrase", "loss": "infonce", "temperature": 0.1, "learning_rate": 0.0001, "lr_schedule": "linear_warmup_constant", "warmup_ratio": 0.1, "batch_size": 64, "negatives": "in_batch_only", "freeze_encoder_layers": 0}, "contrastive": {"duration_minutes": 30, "data": "all_curated", "loss": "infonce", "temperature": 0.05, "learning_rate": 5e-05, "lr_schedule": "cosine_decay", "warmup_ratio": 0.05, "batch_size": 64, "negatives": "in_batch_plus_explicit", "source_stratification": true}, "hard_neg_mining": {"duration_minutes": 5, "top_k": 7, "batch_size": 128, "min_similarity": 0.3}, "fine_tuning": {"duration_minutes": 30, "data": "all_curated_with_hard_negs", "loss": "infonce", "temperature": 0.05, "learning_rate": 1e-05, "lr_schedule": "cosine_decay", "warmup_ratio": 0.0, "batch_size": 32, "hard_neg_weight": 2.0}}, "optimizer": {"type": "adamw", "betas": [0.9, 0.999], "eps": 1e-08, "weight_decay": 0.01}, "memory": {"max_peak_gb": 55, "gradient_accumulation_steps": 4}}, "num_params_M": 149.0, "decontam_removed": 170, "wandb_run_id": "yforedrl"}
{"commit": "81f881a", "primary_score": 40.9727, "memory_gb": 37.0, "training_min": 105.3, "datasets": ["sentence-transformers/reddit-title-body", "ms_marco", "fancyzhx/dbpedia_14", "stanfordnlp/snli", "ag_news", "sentence-transformers/stackexchange-duplicates", "yahoo_answers_topics", "glue", "sentence-transformers/natural-questions"], "status": "keep", "description": "exp-16: extend training 30\u219245min (contrastive+finetune); same exp-14 data (SNLI+DBpedia+Yahoo); target primary>40", "task_scores": {"sts_bench": 59.03, "sick_r": 59.37, "twitter_url": 73.5, "sprint_dup": 81.55, "20news": 14.0, "reddit_clust": 11.0, "scifact": 24.26, "nfcorpus": 10.45}, "timestamp": "2026-03-12T06:48:10.226519+00:00", "config": {"base_model": "answerdotai/ModernBERT-base", "embedding_dim": 768, "projection_dim": 768, "pooling": "mean", "max_seq_length": 512, "normalize_embeddings": true, "stages": {"warmup": {"duration_minutes": 15, "data": "qqp_se_paraphrase", "loss": "infonce", "temperature": 0.1, "learning_rate": 0.0001, "lr_schedule": "linear_warmup_constant", "warmup_ratio": 0.1, "batch_size": 64, "negatives": "in_batch_only", "freeze_encoder_layers": 0}, "contrastive": {"duration_minutes": 45, "data": "all_curated", "loss": "infonce", "temperature": 0.05, "learning_rate": 5e-05, "lr_schedule": "cosine_decay", "warmup_ratio": 0.05, "batch_size": 64, "negatives": "in_batch_plus_explicit", "source_stratification": true}, "hard_neg_mining": {"duration_minutes": 5, "top_k": 7, "batch_size": 128, "min_similarity": 0.3}, "fine_tuning": {"duration_minutes": 45, "data": "all_curated_with_hard_negs", "loss": "infonce", "temperature": 0.05, "learning_rate": 1e-05, "lr_schedule": "cosine_decay", "warmup_ratio": 0.0, "batch_size": 32, "hard_neg_weight": 2.0}}, "optimizer": {"type": "adamw", "betas": [0.9, 0.999], "eps": 1e-08, "weight_decay": 0.01}, "memory": {"max_peak_gb": 55, "gradient_accumulation_steps": 4}}, "num_params_M": 149.0, "decontam_removed": 0, "wandb_run_id": "14unifxw"}
{"commit": "2c1dc30", "primary_score": 36.2445, "memory_gb": 37.0, "training_min": 135.7, "datasets": ["fancyzhx/dbpedia_14", "yahoo_answers_topics", "sentence-transformers/natural-questions", "ag_news", "sentence-transformers/reddit-title-body", "ms_marco", "stanfordnlp/snli", "sentence-transformers/stackexchange-duplicates", "glue"], "status": "discard", "description": "exp-17: extend to 60min (contrastive+finetune) + 16K mining set (was 8K); target primary>42", "task_scores": {"sts_bench": 60.3, "sick_r": 58.49, "twitter_url": 72.19, "sprint_dup": 66.88, "20news": 10.8, "reddit_clust": 9.41, "scifact": 10.41, "nfcorpus": 6.25}, "timestamp": "2026-03-12T10:20:43.469803+00:00", "config": {"base_model": "answerdotai/ModernBERT-base", "embedding_dim": 768, "projection_dim": 768, "pooling": "mean", "max_seq_length": 512, "normalize_embeddings": true, "stages": {"warmup": {"duration_minutes": 15, "data": "qqp_se_paraphrase", "loss": "infonce", "temperature": 0.1, "learning_rate": 0.0001, "lr_schedule": "linear_warmup_constant", "warmup_ratio": 0.1, "batch_size": 64, "negatives": "in_batch_only", "freeze_encoder_layers": 0}, "contrastive": {"duration_minutes": 60, "data": "all_curated", "loss": "infonce", "temperature": 0.05, "learning_rate": 5e-05, "lr_schedule": "cosine_decay", "warmup_ratio": 0.05, "batch_size": 64, "negatives": "in_batch_plus_explicit", "source_stratification": true}, "hard_neg_mining": {"duration_minutes": 5, "top_k": 7, "batch_size": 128, "min_similarity": 0.3}, "fine_tuning": {"duration_minutes": 60, "data": "all_curated_with_hard_negs", "loss": "infonce", "temperature": 0.05, "learning_rate": 1e-05, "lr_schedule": "cosine_decay", "warmup_ratio": 0.0, "batch_size": 32, "hard_neg_weight": 2.0}}, "optimizer": {"type": "adamw", "betas": [0.9, 0.999], "eps": 1e-08, "weight_decay": 0.01}, "memory": {"max_peak_gb": 55, "gradient_accumulation_steps": 4}}, "num_params_M": 149.0, "decontam_removed": 0, "wandb_run_id": "wpbrzbuf"}
