{"commit": "bb845eb", "primary_score": 42.0529, "memory_gb": 37.0, "training_min": 105.3, "datasets": ["sentence-transformers/reddit-title-body", "yahoo_answers_topics", "glue", "ag_news", "fancyzhx/dbpedia_14", "sentence-transformers/stackexchange-duplicates", "stanfordnlp/snli", "ms_marco", "sentence-transformers/natural-questions"], "status": "keep", "description": "exp-18: CLS pooling instead of mean pooling; 45+45min; exp-14 data; target SciFact+STS improvement", "task_scores": {"sts_bench": 64.25, "sick_r": 64.83, "twitter_url": 61.6, "sprint_dup": 59.68, "20news": 20.29, "reddit_clust": 20.15, "scifact": 29.29, "nfcorpus": 14.17}, "timestamp": "2026-03-12T14:02:15.073813+00:00", "config": {"base_model": "answerdotai/ModernBERT-base", "embedding_dim": 768, "projection_dim": 768, "pooling": "cls", "max_seq_length": 512, "normalize_embeddings": true, "stages": {"warmup": {"duration_minutes": 15, "data": "qqp_se_paraphrase", "loss": "infonce", "temperature": 0.1, "learning_rate": 0.0001, "lr_schedule": "linear_warmup_constant", "warmup_ratio": 0.1, "batch_size": 64, "negatives": "in_batch_only", "freeze_encoder_layers": 0}, "contrastive": {"duration_minutes": 45, "data": "all_curated", "loss": "infonce", "temperature": 0.05, "learning_rate": 5e-05, "lr_schedule": "cosine_decay", "warmup_ratio": 0.05, "batch_size": 64, "negatives": "in_batch_plus_explicit", "source_stratification": true}, "hard_neg_mining": {"duration_minutes": 5, "top_k": 7, "batch_size": 128, "min_similarity": 0.3}, "fine_tuning": {"duration_minutes": 45, "data": "all_curated_with_hard_negs", "loss": "infonce", "temperature": 0.05, "learning_rate": 1e-05, "lr_schedule": "cosine_decay", "warmup_ratio": 0.0, "batch_size": 32, "hard_neg_weight": 2.0}}, "optimizer": {"type": "adamw", "betas": [0.9, 0.999], "eps": 1e-08, "weight_decay": 0.01}, "memory": {"max_peak_gb": 55, "gradient_accumulation_steps": 4}}, "num_params_M": 149.0, "decontam_removed": 0, "wandb_run_id": "1doc12rj"}
{"commit": "29710c9", "primary_score": 28.1106, "memory_gb": 37.2, "training_min": 105.3, "datasets": ["yahoo_answers_topics", "ms_marco", "sentence-transformers/natural-questions", "sentence-transformers/stackexchange-duplicates", "ag_news", "stanfordnlp/snli", "glue", "sentence-transformers/reddit-title-body", "fancyzhx/dbpedia_14"], "status": "discard", "description": "exp-19: cls_mean pooling (CLS+mean concat\u2192project) for best of both; 45+45min; target SprintDup recovery + STS/clustering retention", "task_scores": {"sts_bench": 45.79, "sick_r": 50.72, "twitter_url": 62.65, "sprint_dup": 49.3, "20news": 9.36, "reddit_clust": 7.16, "scifact": 2.86, "nfcorpus": 2.39}, "timestamp": "2026-03-12T16:40:00.598609+00:00", "config": {"base_model": "answerdotai/ModernBERT-base", "embedding_dim": 768, "projection_dim": 768, "pooling": "cls_mean", "max_seq_length": 512, "normalize_embeddings": true, "stages": {"warmup": {"duration_minutes": 15, "data": "qqp_se_paraphrase", "loss": "infonce", "temperature": 0.1, "learning_rate": 0.0001, "lr_schedule": "linear_warmup_constant", "warmup_ratio": 0.1, "batch_size": 64, "negatives": "in_batch_only", "freeze_encoder_layers": 0}, "contrastive": {"duration_minutes": 45, "data": "all_curated", "loss": "infonce", "temperature": 0.05, "learning_rate": 5e-05, "lr_schedule": "cosine_decay", "warmup_ratio": 0.05, "batch_size": 64, "negatives": "in_batch_plus_explicit", "source_stratification": true}, "hard_neg_mining": {"duration_minutes": 5, "top_k": 7, "batch_size": 128, "min_similarity": 0.3}, "fine_tuning": {"duration_minutes": 45, "data": "all_curated_with_hard_negs", "loss": "infonce", "temperature": 0.05, "learning_rate": 1e-05, "lr_schedule": "cosine_decay", "warmup_ratio": 0.0, "batch_size": 32, "hard_neg_weight": 2.0}}, "optimizer": {"type": "adamw", "betas": [0.9, 0.999], "eps": 1e-08, "weight_decay": 0.01}, "memory": {"max_peak_gb": 55, "gradient_accumulation_steps": 4}}, "num_params_M": 150.2, "decontam_removed": 0, "wandb_run_id": "72mb29gm"}
{"commit": "2ffcdff", "primary_score": 38.1886, "memory_gb": 39.7, "training_min": 105.3, "datasets": ["stanfordnlp/snli", "sentence-transformers/natural-questions", "google-research-datasets/paws", "glue", "ag_news", "sentence-transformers/stackexchange-duplicates", "yahoo_answers_topics", "ms_marco", "sentence-transformers/reddit-title-body", "fancyzhx/dbpedia_14"], "status": "discard", "description": "exp-20: CLS pooling + PAWS paraphrase pairs for SprintDup/Twitter recovery; 45+45min; target primary>43", "task_scores": {"sts_bench": 54.04, "sick_r": 59.91, "twitter_url": 72.37, "sprint_dup": 65.18, "20news": 16.25, "reddit_clust": 14.56, "scifact": 18.38, "nfcorpus": 10.03}, "timestamp": "2026-03-12T19:08:13.158733+00:00", "config": {"base_model": "answerdotai/ModernBERT-base", "embedding_dim": 768, "projection_dim": 768, "pooling": "cls", "max_seq_length": 512, "normalize_embeddings": true, "stages": {"warmup": {"duration_minutes": 15, "data": "qqp_se_paraphrase", "loss": "infonce", "temperature": 0.1, "learning_rate": 0.0001, "lr_schedule": "linear_warmup_constant", "warmup_ratio": 0.1, "batch_size": 64, "negatives": "in_batch_only", "freeze_encoder_layers": 0}, "contrastive": {"duration_minutes": 45, "data": "all_curated", "loss": "infonce", "temperature": 0.05, "learning_rate": 5e-05, "lr_schedule": "cosine_decay", "warmup_ratio": 0.05, "batch_size": 64, "negatives": "in_batch_plus_explicit", "source_stratification": true}, "hard_neg_mining": {"duration_minutes": 5, "top_k": 7, "batch_size": 128, "min_similarity": 0.3}, "fine_tuning": {"duration_minutes": 45, "data": "all_curated_with_hard_negs", "loss": "infonce", "temperature": 0.05, "learning_rate": 1e-05, "lr_schedule": "cosine_decay", "warmup_ratio": 0.0, "batch_size": 32, "hard_neg_weight": 2.0}}, "optimizer": {"type": "adamw", "betas": [0.9, 0.999], "eps": 1e-08, "weight_decay": 0.01}, "memory": {"max_peak_gb": 55, "gradient_accumulation_steps": 4}}, "num_params_M": 149.0, "decontam_removed": 170, "wandb_run_id": "3ziuzpwe"}
{"commit": "cf430a0", "primary_score": 41.1045, "memory_gb": 37.0, "training_min": 120.3, "datasets": ["fancyzhx/dbpedia_14", "ms_marco", "ag_news", "sentence-transformers/reddit-title-body", "sentence-transformers/stackexchange-duplicates", "stanfordnlp/snli", "yahoo_answers_topics", "glue", "sentence-transformers/natural-questions"], "status": "discard", "description": "exp-21: CLS pooling + 30min warmup (vs 15min); 45+45min contrastive/fine-tune; better CLS init; target primary>43", "task_scores": {"sts_bench": 66.59, "sick_r": 66.05, "twitter_url": 62.02, "sprint_dup": 65.52, "20news": 16.08, "reddit_clust": 14.27, "scifact": 26.4, "nfcorpus": 9.72}, "timestamp": "2026-03-12T22:02:32.679114+00:00", "config": {"base_model": "answerdotai/ModernBERT-base", "embedding_dim": 768, "projection_dim": 768, "pooling": "cls", "max_seq_length": 512, "normalize_embeddings": true, "stages": {"warmup": {"duration_minutes": 30, "data": "qqp_se_paraphrase", "loss": "infonce", "temperature": 0.1, "learning_rate": 0.0001, "lr_schedule": "linear_warmup_constant", "warmup_ratio": 0.1, "batch_size": 64, "negatives": "in_batch_only", "freeze_encoder_layers": 0}, "contrastive": {"duration_minutes": 45, "data": "all_curated", "loss": "infonce", "temperature": 0.05, "learning_rate": 5e-05, "lr_schedule": "cosine_decay", "warmup_ratio": 0.05, "batch_size": 64, "negatives": "in_batch_plus_explicit", "source_stratification": true}, "hard_neg_mining": {"duration_minutes": 5, "top_k": 7, "batch_size": 128, "min_similarity": 0.3}, "fine_tuning": {"duration_minutes": 45, "data": "all_curated_with_hard_negs", "loss": "infonce", "temperature": 0.05, "learning_rate": 1e-05, "lr_schedule": "cosine_decay", "warmup_ratio": 0.0, "batch_size": 32, "hard_neg_weight": 2.0}}, "optimizer": {"type": "adamw", "betas": [0.9, 0.999], "eps": 1e-08, "weight_decay": 0.01}, "memory": {"max_peak_gb": 55, "gradient_accumulation_steps": 4}}, "num_params_M": 149.0, "decontam_removed": 0, "wandb_run_id": "yrv3u3h5"}
{"commit": "3e019c1", "primary_score": 40.519, "memory_gb": 37.0, "training_min": 105.3, "datasets": ["yahoo_answers_topics", "ms_marco", "ag_news", "glue", "fancyzhx/dbpedia_14", "stanfordnlp/snli", "sentence-transformers/natural-questions", "sentence-transformers/reddit-title-body", "sentence-transformers/stackexchange-duplicates"], "status": "discard", "description": "exp-22: CLS pooling + lower finetune temp 0.05\u21920.03 (harder retrieval training); 15+45+45min; target SciFact>30 NFCorpus>15", "task_scores": {"sts_bench": 58.14, "sick_r": 59.16, "twitter_url": 69.11, "sprint_dup": 65.15, "20news": 18.14, "reddit_clust": 16.74, "scifact": 27.15, "nfcorpus": 12.92}, "timestamp": "2026-03-13T00:13:13.008229+00:00", "config": {"base_model": "answerdotai/ModernBERT-base", "embedding_dim": 768, "projection_dim": 768, "pooling": "cls", "max_seq_length": 512, "normalize_embeddings": true, "stages": {"warmup": {"duration_minutes": 15, "data": "qqp_se_paraphrase", "loss": "infonce", "temperature": 0.1, "learning_rate": 0.0001, "lr_schedule": "linear_warmup_constant", "warmup_ratio": 0.1, "batch_size": 64, "negatives": "in_batch_only", "freeze_encoder_layers": 0}, "contrastive": {"duration_minutes": 45, "data": "all_curated", "loss": "infonce", "temperature": 0.05, "learning_rate": 5e-05, "lr_schedule": "cosine_decay", "warmup_ratio": 0.05, "batch_size": 64, "negatives": "in_batch_plus_explicit", "source_stratification": true}, "hard_neg_mining": {"duration_minutes": 5, "top_k": 7, "batch_size": 128, "min_similarity": 0.3}, "fine_tuning": {"duration_minutes": 45, "data": "all_curated_with_hard_negs", "loss": "infonce", "temperature": 0.03, "learning_rate": 1e-05, "lr_schedule": "cosine_decay", "warmup_ratio": 0.0, "batch_size": 32, "hard_neg_weight": 2.0}}, "optimizer": {"type": "adamw", "betas": [0.9, 0.999], "eps": 1e-08, "weight_decay": 0.01}, "memory": {"max_peak_gb": 55, "gradient_accumulation_steps": 4}}, "num_params_M": 149.0, "decontam_removed": 0, "wandb_run_id": "mfnq2prs"}
{"commit": "bff05d5", "primary_score": 41.3063, "memory_gb": 37.0, "training_min": 105.3, "datasets": ["sentence-transformers/stackexchange-duplicates", "ag_news", "ms_marco", "sentence-transformers/natural-questions", "fancyzhx/dbpedia_14", "stanfordnlp/snli", "sentence-transformers/reddit-title-body", "yahoo_answers_topics", "glue"], "status": "discard", "description": "exp-24: symmetric InfoNCE clean test (temp=0.05 all stages) + CLS pooling; 15+45+45min; target primary>42.05 vs exp-18", "task_scores": {"sts_bench": 63.48, "sick_r": 63.26, "twitter_url": 68.06, "sprint_dup": 69.18, "20news": 14.62, "reddit_clust": 13.44, "scifact": 26.52, "nfcorpus": 11.92}, "timestamp": "2026-03-13T03:01:00.781136+00:00", "config": {"base_model": "answerdotai/ModernBERT-base", "embedding_dim": 768, "projection_dim": 768, "pooling": "cls", "max_seq_length": 512, "normalize_embeddings": true, "stages": {"warmup": {"duration_minutes": 15, "data": "qqp_se_paraphrase", "loss": "infonce", "temperature": 0.1, "learning_rate": 0.0001, "lr_schedule": "linear_warmup_constant", "warmup_ratio": 0.1, "batch_size": 64, "negatives": "in_batch_only", "freeze_encoder_layers": 0}, "contrastive": {"duration_minutes": 45, "data": "all_curated", "loss": "infonce", "temperature": 0.05, "learning_rate": 5e-05, "lr_schedule": "cosine_decay", "warmup_ratio": 0.05, "batch_size": 64, "negatives": "in_batch_plus_explicit", "source_stratification": true}, "hard_neg_mining": {"duration_minutes": 5, "top_k": 7, "batch_size": 128, "min_similarity": 0.3}, "fine_tuning": {"duration_minutes": 45, "data": "all_curated_with_hard_negs", "loss": "infonce", "temperature": 0.05, "learning_rate": 1e-05, "lr_schedule": "cosine_decay", "warmup_ratio": 0.0, "batch_size": 32, "hard_neg_weight": 2.0}}, "optimizer": {"type": "adamw", "betas": [0.9, 0.999], "eps": 1e-08, "weight_decay": 0.01}, "memory": {"max_peak_gb": 55, "gradient_accumulation_steps": 4}}, "num_params_M": 149.0, "decontam_removed": 0, "wandb_run_id": "5cdp8qgj"}
{"commit": "1655705", "primary_score": 38.9834, "memory_gb": 36.4, "training_min": 105.5, "datasets": ["ag_news", "stanfordnlp/snli", "hotpot_qa", "yahoo_answers_topics", "ms_marco", "sentence-transformers/stackexchange-duplicates", "sentence-transformers/natural-questions", "glue", "sentence-transformers/reddit-title-body", "fancyzhx/dbpedia_14"], "status": "discard", "description": "exp-25: add HotpotQA retrieval pairs + 12K mining (vs 8K); CLS pooling; std InfoNCE; target SciFact>30 NFCorpus>15", "task_scores": {"sts_bench": 61.53, "sick_r": 59.86, "twitter_url": 72.23, "sprint_dup": 72.88, "20news": 12.19, "reddit_clust": 13.48, "scifact": 17.38, "nfcorpus": 7.27}, "timestamp": "2026-03-13T05:23:14.797505+00:00", "config": {"base_model": "answerdotai/ModernBERT-base", "embedding_dim": 768, "projection_dim": 768, "pooling": "cls", "max_seq_length": 512, "normalize_embeddings": true, "stages": {"warmup": {"duration_minutes": 15, "data": "qqp_se_paraphrase", "loss": "infonce", "temperature": 0.1, "learning_rate": 0.0001, "lr_schedule": "linear_warmup_constant", "warmup_ratio": 0.1, "batch_size": 64, "negatives": "in_batch_only", "freeze_encoder_layers": 0}, "contrastive": {"duration_minutes": 45, "data": "all_curated", "loss": "infonce", "temperature": 0.05, "learning_rate": 5e-05, "lr_schedule": "cosine_decay", "warmup_ratio": 0.05, "batch_size": 64, "negatives": "in_batch_plus_explicit", "source_stratification": true}, "hard_neg_mining": {"duration_minutes": 5, "top_k": 7, "batch_size": 128, "min_similarity": 0.3}, "fine_tuning": {"duration_minutes": 45, "data": "all_curated_with_hard_negs", "loss": "infonce", "temperature": 0.05, "learning_rate": 1e-05, "lr_schedule": "cosine_decay", "warmup_ratio": 0.0, "batch_size": 32, "hard_neg_weight": 2.0}}, "optimizer": {"type": "adamw", "betas": [0.9, 0.999], "eps": 1e-08, "weight_decay": 0.01}, "memory": {"max_peak_gb": 55, "gradient_accumulation_steps": 4}}, "num_params_M": 149.0, "decontam_removed": 170, "wandb_run_id": "shwndo4x"}
{"commit": "f4dfb5d", "primary_score": 26.0743, "memory_gb": 38.1, "training_min": 105.3, "datasets": ["yahoo_answers_topics", "sentence-transformers/quora-duplicates", "sentence-transformers/stackexchange-duplicates", "sentence-transformers/natural-questions", "ms_marco", "fancyzhx/dbpedia_14", "sentence-transformers/reddit-title-body", "ag_news", "glue", "stanfordnlp/snli"], "status": "discard", "description": "exp-26: add Quora duplicate question pairs (30K); CLS pooling; std InfoNCE; target pair classification Sprint>65 Twitter>65", "task_scores": {"sts_bench": 42.63, "sick_r": 50.47, "twitter_url": 67.15, "sprint_dup": 14.35, "20news": 16.08, "reddit_clust": 14.1, "scifact": 4.03, "nfcorpus": 2.25}, "timestamp": "2026-03-13T07:39:22.912350+00:00", "config": {"base_model": "answerdotai/ModernBERT-base", "embedding_dim": 768, "projection_dim": 768, "pooling": "cls", "max_seq_length": 512, "normalize_embeddings": true, "stages": {"warmup": {"duration_minutes": 15, "data": "qqp_se_paraphrase", "loss": "infonce", "temperature": 0.1, "learning_rate": 0.0001, "lr_schedule": "linear_warmup_constant", "warmup_ratio": 0.1, "batch_size": 64, "negatives": "in_batch_only", "freeze_encoder_layers": 0}, "contrastive": {"duration_minutes": 45, "data": "all_curated", "loss": "infonce", "temperature": 0.05, "learning_rate": 5e-05, "lr_schedule": "cosine_decay", "warmup_ratio": 0.05, "batch_size": 64, "negatives": "in_batch_plus_explicit", "source_stratification": true}, "hard_neg_mining": {"duration_minutes": 5, "top_k": 7, "batch_size": 128, "min_similarity": 0.3}, "fine_tuning": {"duration_minutes": 45, "data": "all_curated_with_hard_negs", "loss": "infonce", "temperature": 0.05, "learning_rate": 1e-05, "lr_schedule": "cosine_decay", "warmup_ratio": 0.0, "batch_size": 32, "hard_neg_weight": 2.0}}, "optimizer": {"type": "adamw", "betas": [0.9, 0.999], "eps": 1e-08, "weight_decay": 0.01}, "memory": {"max_peak_gb": 55, "gradient_accumulation_steps": 4}}, "num_params_M": 149.0, "decontam_removed": 170, "wandb_run_id": "o8nklks8"}
{"commit": "3413b89", "primary_score": 34.7271, "memory_gb": 37.0, "training_min": 105.3, "datasets": ["sentence-transformers/stackexchange-duplicates", "ag_news", "stanfordnlp/snli", "ms_marco", "yahoo_answers_topics", "sentence-transformers/reddit-title-body", "fancyzhx/dbpedia_14", "glue", "sentence-transformers/natural-questions"], "status": "discard", "description": "exp-27: increase hard_neg_weight 2.0\u21923.0 in fine-tuning; CLS pooling; std InfoNCE; 8K mining; target SciFact>32 NFCorpus>15", "task_scores": {"sts_bench": 50.99, "sick_r": 55.32, "twitter_url": 61.97, "sprint_dup": 60.21, "20news": 13.76, "reddit_clust": 11.52, "scifact": 18.88, "nfcorpus": 8.02}, "timestamp": "2026-03-13T09:51:40.710195+00:00", "config": {"base_model": "answerdotai/ModernBERT-base", "embedding_dim": 768, "projection_dim": 768, "pooling": "cls", "max_seq_length": 512, "normalize_embeddings": true, "stages": {"warmup": {"duration_minutes": 15, "data": "qqp_se_paraphrase", "loss": "infonce", "temperature": 0.1, "learning_rate": 0.0001, "lr_schedule": "linear_warmup_constant", "warmup_ratio": 0.1, "batch_size": 64, "negatives": "in_batch_only", "freeze_encoder_layers": 0}, "contrastive": {"duration_minutes": 45, "data": "all_curated", "loss": "infonce", "temperature": 0.05, "learning_rate": 5e-05, "lr_schedule": "cosine_decay", "warmup_ratio": 0.05, "batch_size": 64, "negatives": "in_batch_plus_explicit", "source_stratification": true}, "hard_neg_mining": {"duration_minutes": 5, "top_k": 7, "batch_size": 128, "min_similarity": 0.3}, "fine_tuning": {"duration_minutes": 45, "data": "all_curated_with_hard_negs", "loss": "infonce", "temperature": 0.05, "learning_rate": 1e-05, "lr_schedule": "cosine_decay", "warmup_ratio": 0.0, "batch_size": 32, "hard_neg_weight": 3.0}}, "optimizer": {"type": "adamw", "betas": [0.9, 0.999], "eps": 1e-08, "weight_decay": 0.01}, "memory": {"max_peak_gb": 55, "gradient_accumulation_steps": 4}}, "num_params_M": 149.0, "decontam_removed": 0, "wandb_run_id": "ix0z0njy"}
{"commit": "512e72b", "primary_score": 21.5197, "memory_gb": 42.0, "training_min": 105.6, "datasets": ["fancyzhx/dbpedia_14", "ag_news", "sentence-transformers/reddit-title-body", "sentence-transformers/natural-questions", "glue", "stanfordnlp/snli", "sentence-transformers/stackexchange-duplicates", "ms_marco", "yahoo_answers_topics"], "status": "discard", "description": "exp-28: ModernBERT-large (1024-dim, 28 layers, 395M params); CLS pooling; std InfoNCE; batch 32/32/16; target primary>45", "task_scores": {"sts_bench": 36.69, "sick_r": 38.71, "twitter_url": 52.99, "sprint_dup": 9.56, "20news": 20.57, "reddit_clust": 15.97, "scifact": 0.78, "nfcorpus": 1.23}, "timestamp": "2026-03-13T12:20:18.240406+00:00", "config": {"base_model": "answerdotai/ModernBERT-large", "embedding_dim": 1024, "projection_dim": 1024, "pooling": "cls", "max_seq_length": 512, "normalize_embeddings": true, "stages": {"warmup": {"duration_minutes": 15, "data": "qqp_se_paraphrase", "loss": "infonce", "temperature": 0.1, "learning_rate": 0.0001, "lr_schedule": "linear_warmup_constant", "warmup_ratio": 0.1, "batch_size": 32, "negatives": "in_batch_only", "freeze_encoder_layers": 0}, "contrastive": {"duration_minutes": 45, "data": "all_curated", "loss": "infonce", "temperature": 0.05, "learning_rate": 5e-05, "lr_schedule": "cosine_decay", "warmup_ratio": 0.05, "batch_size": 32, "negatives": "in_batch_plus_explicit", "source_stratification": true}, "hard_neg_mining": {"duration_minutes": 5, "top_k": 7, "batch_size": 64, "min_similarity": 0.3}, "fine_tuning": {"duration_minutes": 45, "data": "all_curated_with_hard_negs", "loss": "infonce", "temperature": 0.05, "learning_rate": 1e-05, "lr_schedule": "cosine_decay", "warmup_ratio": 0.0, "batch_size": 16, "hard_neg_weight": 2.0}}, "optimizer": {"type": "adamw", "betas": [0.9, 0.999], "eps": 1e-08, "weight_decay": 0.01}, "memory": {"max_peak_gb": 60, "gradient_accumulation_steps": 4}}, "num_params_M": 394.8, "decontam_removed": 0, "wandb_run_id": "6ugt8ih0"}
