{"commit": "85503c3", "primary_score": 55.7137, "memory_gb": 37.0, "training_min": 65.3, "datasets": ["stanfordnlp/snli", "glue", "ag_news", "yahoo_answers_topics", "fancyzhx/dbpedia_14", "sentence-transformers/natural-questions", "sentence-transformers/reddit-title-body", "ms_marco", "sentence-transformers/stackexchange-duplicates"], "status": "discard", "description": "exp-50: ablation remove HotpotQA, keep 5-min FT; isolate whether improvement in exp-49 (55.76) came from HotpotQA data vs short FT; baseline exp-33 primary=55.16 (no HotpotQA, 5-min FT same)", "task_scores": {"sts_bench": 75.67, "sick_r": 74.27, "twitter_url": 77.68, "sprint_dup": 78.04, "20news": 36.63, "reddit_clust": 40.87, "scifact": 47.08, "nfcorpus": 18.93}, "timestamp": "2026-03-15T04:26:17.159520+00:00", "config": {"base_model": "answerdotai/ModernBERT-base", "embedding_dim": 768, "projection_dim": 768, "pooling": "cls", "max_seq_length": 512, "normalize_embeddings": true, "stages": {"warmup": {"duration_minutes": 15, "data": "qqp_se_paraphrase", "loss": "infonce", "temperature": 0.1, "learning_rate": 0.0001, "lr_schedule": "linear_warmup_constant", "warmup_ratio": 0.1, "batch_size": 64, "negatives": "in_batch_only", "freeze_encoder_layers": 0}, "contrastive": {"duration_minutes": 45, "data": "all_curated", "loss": "infonce", "temperature": 0.05, "learning_rate": 5e-05, "lr_schedule": "cosine_decay", "warmup_ratio": 0.05, "batch_size": 64, "negatives": "in_batch_plus_explicit", "source_stratification": true}, "hard_neg_mining": {"duration_minutes": 5, "top_k": 7, "batch_size": 128, "min_similarity": 0.3}, "fine_tuning": {"duration_minutes": 5, "data": "all_curated_with_hard_negs", "loss": "infonce", "temperature": 0.05, "learning_rate": 1e-05, "lr_schedule": "cosine_decay", "warmup_ratio": 0.0, "batch_size": 32, "hard_neg_weight": 1.0}}, "optimizer": {"type": "adamw", "betas": [0.9, 0.999], "eps": 1e-08, "weight_decay": 0.01}, "memory": {"max_peak_gb": 55, "gradient_accumulation_steps": 4}}, "num_params_M": 149.0, "decontam_removed": 0, "wandb_run_id": "sdodl6ij"}
{"commit": "75c2f5e", "primary_score": 56.8078, "memory_gb": 36.4, "training_min": 80.3, "datasets": ["sentence-transformers/reddit-title-body", "ms_marco", "sentence-transformers/natural-questions", "ag_news", "yahoo_answers_topics", "glue", "hotpot_qa", "stanfordnlp/snli", "fancyzhx/dbpedia_14", "sentence-transformers/stackexchange-duplicates"], "status": "keep", "description": "exp-51: extend contrastive to 60min (was 45min); HotpotQA included; 5-min FT; hypothesis: model not fully converging at 45min; baseline exp-49 primary=55.76", "task_scores": {"sts_bench": 76.47, "sick_r": 71.11, "twitter_url": 76.45, "sprint_dup": 83.62, "20news": 38.72, "reddit_clust": 42.14, "scifact": 49.83, "nfcorpus": 20.69}, "timestamp": "2026-03-15T06:03:54.901718+00:00", "config": {"base_model": "answerdotai/ModernBERT-base", "embedding_dim": 768, "projection_dim": 768, "pooling": "cls", "max_seq_length": 512, "normalize_embeddings": true, "stages": {"warmup": {"duration_minutes": 15, "data": "qqp_se_paraphrase", "loss": "infonce", "temperature": 0.1, "learning_rate": 0.0001, "lr_schedule": "linear_warmup_constant", "warmup_ratio": 0.1, "batch_size": 64, "negatives": "in_batch_only", "freeze_encoder_layers": 0}, "contrastive": {"duration_minutes": 60, "data": "all_curated", "loss": "infonce", "temperature": 0.05, "learning_rate": 5e-05, "lr_schedule": "cosine_decay", "warmup_ratio": 0.05, "batch_size": 64, "negatives": "in_batch_plus_explicit", "source_stratification": true}, "hard_neg_mining": {"duration_minutes": 5, "top_k": 7, "batch_size": 128, "min_similarity": 0.3}, "fine_tuning": {"duration_minutes": 5, "data": "all_curated_with_hard_negs", "loss": "infonce", "temperature": 0.05, "learning_rate": 1e-05, "lr_schedule": "cosine_decay", "warmup_ratio": 0.0, "batch_size": 32, "hard_neg_weight": 1.0}}, "optimizer": {"type": "adamw", "betas": [0.9, 0.999], "eps": 1e-08, "weight_decay": 0.01}, "memory": {"max_peak_gb": 55, "gradient_accumulation_steps": 4}}, "num_params_M": 149.0, "decontam_removed": 0, "wandb_run_id": "82ax2m3j"}
{"commit": "d6ca110", "primary_score": 56.4491, "memory_gb": 36.4, "training_min": 110.3, "datasets": ["hotpot_qa", "glue", "sentence-transformers/natural-questions", "fancyzhx/dbpedia_14", "stanfordnlp/snli", "sentence-transformers/stackexchange-duplicates", "yahoo_answers_topics", "sentence-transformers/reddit-title-body", "ms_marco", "ag_news"], "status": "discard", "description": "exp-52: extend contrastive to 90min (was 60min); HotpotQA included; 5-min FT; hypothesis: more training = better; baseline exp-51 primary=56.81", "task_scores": {"sts_bench": 75.49, "sick_r": 71.95, "twitter_url": 76.86, "sprint_dup": 84.35, "20news": 39.11, "reddit_clust": 42.16, "scifact": 48.04, "nfcorpus": 19.19}, "timestamp": "2026-03-15T08:10:52.693569+00:00", "config": {"base_model": "answerdotai/ModernBERT-base", "embedding_dim": 768, "projection_dim": 768, "pooling": "cls", "max_seq_length": 512, "normalize_embeddings": true, "stages": {"warmup": {"duration_minutes": 15, "data": "qqp_se_paraphrase", "loss": "infonce", "temperature": 0.1, "learning_rate": 0.0001, "lr_schedule": "linear_warmup_constant", "warmup_ratio": 0.1, "batch_size": 64, "negatives": "in_batch_only", "freeze_encoder_layers": 0}, "contrastive": {"duration_minutes": 90, "data": "all_curated", "loss": "infonce", "temperature": 0.05, "learning_rate": 5e-05, "lr_schedule": "cosine_decay", "warmup_ratio": 0.05, "batch_size": 64, "negatives": "in_batch_plus_explicit", "source_stratification": true}, "hard_neg_mining": {"duration_minutes": 5, "top_k": 7, "batch_size": 128, "min_similarity": 0.3}, "fine_tuning": {"duration_minutes": 5, "data": "all_curated_with_hard_negs", "loss": "infonce", "temperature": 0.05, "learning_rate": 1e-05, "lr_schedule": "cosine_decay", "warmup_ratio": 0.0, "batch_size": 32, "hard_neg_weight": 1.0}}, "optimizer": {"type": "adamw", "betas": [0.9, 0.999], "eps": 1e-08, "weight_decay": 0.01}, "memory": {"max_peak_gb": 55, "gradient_accumulation_steps": 4}}, "num_params_M": 149.0, "decontam_removed": 0, "wandb_run_id": "8jscl1tg"}
{"commit": "2307c46", "primary_score": 56.1687, "memory_gb": 41.4, "training_min": 80.3, "datasets": ["fancyzhx/dbpedia_14", "sentence-transformers/stackexchange-duplicates", "sentence-transformers/natural-questions", "yahoo_answers_topics", "stanfordnlp/snli", "trivia_qa", "glue", "ms_marco", "hotpot_qa", "sentence-transformers/reddit-title-body", "ag_news"], "status": "discard", "description": "exp-53: add TriviaQA retrieval pairs (question\u2192answer+context); 60-min contrastive; HotpotQA included; baseline exp-51 primary=56.81", "task_scores": {"sts_bench": 76.81, "sick_r": 74.53, "twitter_url": 78.81, "sprint_dup": 78.84, "20news": 35.71, "reddit_clust": 40.16, "scifact": 48.03, "nfcorpus": 19.41}, "timestamp": "2026-03-15T10:00:03.398672+00:00", "config": {"base_model": "answerdotai/ModernBERT-base", "embedding_dim": 768, "projection_dim": 768, "pooling": "cls", "max_seq_length": 512, "normalize_embeddings": true, "stages": {"warmup": {"duration_minutes": 15, "data": "qqp_se_paraphrase", "loss": "infonce", "temperature": 0.1, "learning_rate": 0.0001, "lr_schedule": "linear_warmup_constant", "warmup_ratio": 0.1, "batch_size": 64, "negatives": "in_batch_only", "freeze_encoder_layers": 0}, "contrastive": {"duration_minutes": 60, "data": "all_curated", "loss": "infonce", "temperature": 0.05, "learning_rate": 5e-05, "lr_schedule": "cosine_decay", "warmup_ratio": 0.05, "batch_size": 64, "negatives": "in_batch_plus_explicit", "source_stratification": true}, "hard_neg_mining": {"duration_minutes": 5, "top_k": 7, "batch_size": 128, "min_similarity": 0.3}, "fine_tuning": {"duration_minutes": 5, "data": "all_curated_with_hard_negs", "loss": "infonce", "temperature": 0.05, "learning_rate": 1e-05, "lr_schedule": "cosine_decay", "warmup_ratio": 0.0, "batch_size": 32, "hard_neg_weight": 1.0}}, "optimizer": {"type": "adamw", "betas": [0.9, 0.999], "eps": 1e-08, "weight_decay": 0.01}, "memory": {"max_peak_gb": 55, "gradient_accumulation_steps": 4}}, "num_params_M": 149.0, "decontam_removed": 170, "wandb_run_id": "bt5j1lev"}
{"commit": "b8ff765", "primary_score": 56.2135, "memory_gb": 69.3, "training_min": 80.3, "datasets": ["sentence-transformers/natural-questions", "sentence-transformers/reddit-title-body", "yahoo_answers_topics", "hotpot_qa", "ms_marco", "fancyzhx/dbpedia_14", "glue", "sentence-transformers/stackexchange-duplicates", "ag_news", "stanfordnlp/snli"], "status": "discard", "description": "exp-54: larger contrastive batch_size=128 (was 64); more in-batch negatives per InfoNCE step; 60-min contrastive; HotpotQA; baseline exp-51 primary=56.81", "task_scores": {"sts_bench": 76.63, "sick_r": 74.42, "twitter_url": 77.92, "sprint_dup": 81.04, "20news": 37.88, "reddit_clust": 42.74, "scifact": 45.49, "nfcorpus": 18.49}, "timestamp": "2026-03-15T11:37:39.171811+00:00", "config": {"base_model": "answerdotai/ModernBERT-base", "embedding_dim": 768, "projection_dim": 768, "pooling": "cls", "max_seq_length": 512, "normalize_embeddings": true, "stages": {"warmup": {"duration_minutes": 15, "data": "qqp_se_paraphrase", "loss": "infonce", "temperature": 0.1, "learning_rate": 0.0001, "lr_schedule": "linear_warmup_constant", "warmup_ratio": 0.1, "batch_size": 64, "negatives": "in_batch_only", "freeze_encoder_layers": 0}, "contrastive": {"duration_minutes": 60, "data": "all_curated", "loss": "infonce", "temperature": 0.05, "learning_rate": 5e-05, "lr_schedule": "cosine_decay", "warmup_ratio": 0.05, "batch_size": 128, "negatives": "in_batch_plus_explicit", "source_stratification": true}, "hard_neg_mining": {"duration_minutes": 5, "top_k": 7, "batch_size": 128, "min_similarity": 0.3}, "fine_tuning": {"duration_minutes": 5, "data": "all_curated_with_hard_negs", "loss": "infonce", "temperature": 0.05, "learning_rate": 1e-05, "lr_schedule": "cosine_decay", "warmup_ratio": 0.0, "batch_size": 32, "hard_neg_weight": 1.0}}, "optimizer": {"type": "adamw", "betas": [0.9, 0.999], "eps": 1e-08, "weight_decay": 0.01}, "memory": {"max_peak_gb": 55, "gradient_accumulation_steps": 4}}, "num_params_M": 149.0, "decontam_removed": 0, "wandb_run_id": "hkngfdso"}
{"commit": "fa652df", "primary_score": 56.1077, "memory_gb": 36.4, "training_min": 80.3, "datasets": ["fancyzhx/dbpedia_14", "stanfordnlp/snli", "ms_marco", "yahoo_answers_topics", "sentence-transformers/natural-questions", "hotpot_qa", "sentence-transformers/stackexchange-duplicates", "sentence-transformers/reddit-title-body", "ag_news", "glue"], "status": "discard", "description": "exp-55: lower temperature 0.04 (was 0.05) for contrastive+FT; 60-min contrastive; batch=64; HotpotQA; hypothesis: harder discrimination = better embeddings; baseline exp-51 primary=56.81", "task_scores": {"sts_bench": 77.66, "sick_r": 71.51, "twitter_url": 78.44, "sprint_dup": 79.32, "20news": 38.21, "reddit_clust": 42.52, "scifact": 46.66, "nfcorpus": 19.23}, "timestamp": "2026-03-15T13:14:37.607347+00:00", "config": {"base_model": "answerdotai/ModernBERT-base", "embedding_dim": 768, "projection_dim": 768, "pooling": "cls", "max_seq_length": 512, "normalize_embeddings": true, "stages": {"warmup": {"duration_minutes": 15, "data": "qqp_se_paraphrase", "loss": "infonce", "temperature": 0.1, "learning_rate": 0.0001, "lr_schedule": "linear_warmup_constant", "warmup_ratio": 0.1, "batch_size": 64, "negatives": "in_batch_only", "freeze_encoder_layers": 0}, "contrastive": {"duration_minutes": 60, "data": "all_curated", "loss": "infonce", "temperature": 0.04, "learning_rate": 5e-05, "lr_schedule": "cosine_decay", "warmup_ratio": 0.05, "batch_size": 64, "negatives": "in_batch_plus_explicit", "source_stratification": true}, "hard_neg_mining": {"duration_minutes": 5, "top_k": 7, "batch_size": 128, "min_similarity": 0.3}, "fine_tuning": {"duration_minutes": 5, "data": "all_curated_with_hard_negs", "loss": "infonce", "temperature": 0.04, "learning_rate": 1e-05, "lr_schedule": "cosine_decay", "warmup_ratio": 0.0, "batch_size": 32, "hard_neg_weight": 1.0}}, "optimizer": {"type": "adamw", "betas": [0.9, 0.999], "eps": 1e-08, "weight_decay": 0.01}, "memory": {"max_peak_gb": 55, "gradient_accumulation_steps": 4}}, "num_params_M": 149.0, "decontam_removed": 0, "wandb_run_id": "bmxilfbl"}
{"commit": "3b285aa", "primary_score": 54.7955, "memory_gb": 38.8, "training_min": 80.3, "datasets": ["sentence-transformers/reddit-title-body", "yahoo_answers_topics", "sentence-transformers/stackexchange-duplicates", "ag_news", "glue", "stanfordnlp/snli", "fancyzhx/dbpedia_14", "hotpot_qa", "sentence-transformers/natural-questions", "ms_marco", "google-research-datasets/paws"], "status": "discard", "description": "exp-56: add PAWS paraphrase pairs (adversarial) to fix SICK-R regression from HotpotQA; 60-min contrastive; temp=0.05; batch=64; baseline exp-51 primary=56.81", "task_scores": {"sts_bench": 75.16, "sick_r": 71.26, "twitter_url": 75.13, "sprint_dup": 74.64, "20news": 38.24, "reddit_clust": 40.26, "scifact": 47.6, "nfcorpus": 19.1}, "timestamp": "2026-03-15T15:02:29.522865+00:00", "config": {"base_model": "answerdotai/ModernBERT-base", "embedding_dim": 768, "projection_dim": 768, "pooling": "cls", "max_seq_length": 512, "normalize_embeddings": true, "stages": {"warmup": {"duration_minutes": 15, "data": "qqp_se_paraphrase", "loss": "infonce", "temperature": 0.1, "learning_rate": 0.0001, "lr_schedule": "linear_warmup_constant", "warmup_ratio": 0.1, "batch_size": 64, "negatives": "in_batch_only", "freeze_encoder_layers": 0}, "contrastive": {"duration_minutes": 60, "data": "all_curated", "loss": "infonce", "temperature": 0.05, "learning_rate": 5e-05, "lr_schedule": "cosine_decay", "warmup_ratio": 0.05, "batch_size": 64, "negatives": "in_batch_plus_explicit", "source_stratification": true}, "hard_neg_mining": {"duration_minutes": 5, "top_k": 7, "batch_size": 128, "min_similarity": 0.3}, "fine_tuning": {"duration_minutes": 5, "data": "all_curated_with_hard_negs", "loss": "infonce", "temperature": 0.05, "learning_rate": 1e-05, "lr_schedule": "cosine_decay", "warmup_ratio": 0.0, "batch_size": 32, "hard_neg_weight": 1.0}}, "optimizer": {"type": "adamw", "betas": [0.9, 0.999], "eps": 1e-08, "weight_decay": 0.01}, "memory": {"max_peak_gb": 55, "gradient_accumulation_steps": 4}}, "num_params_M": 149.0, "decontam_removed": 170, "wandb_run_id": "ve41seqy"}
{"commit": "7453ea8", "primary_score": 47.2621, "memory_gb": 36.4, "training_min": 80.3, "datasets": ["sentence-transformers/reddit-title-body", "stanfordnlp/snli", "fancyzhx/dbpedia_14", "hotpot_qa", "glue", "ag_news", "yahoo_answers_topics", "sentence-transformers/natural-questions", "sentence-transformers/stackexchange-duplicates", "ms_marco"], "status": "discard", "description": "exp-57: symmetric InfoNCE (bidirectional query\u2192pos + pos\u2192query); 60-min contrastive; HotpotQA; hypothesis: 2x training signal improves representations; baseline exp-51 primary=56.81", "task_scores": {"sts_bench": 72.28, "sick_r": 68.14, "twitter_url": 74.55, "sprint_dup": 69.72, "20news": 33.78, "reddit_clust": 36.2, "scifact": 21.24, "nfcorpus": 10.6}, "timestamp": "2026-03-15T16:40:47.023100+00:00", "config": {"base_model": "answerdotai/ModernBERT-base", "embedding_dim": 768, "projection_dim": 768, "pooling": "cls", "max_seq_length": 512, "normalize_embeddings": true, "stages": {"warmup": {"duration_minutes": 15, "data": "qqp_se_paraphrase", "loss": "infonce", "temperature": 0.1, "learning_rate": 0.0001, "lr_schedule": "linear_warmup_constant", "warmup_ratio": 0.1, "batch_size": 64, "negatives": "in_batch_only", "freeze_encoder_layers": 0}, "contrastive": {"duration_minutes": 60, "data": "all_curated", "loss": "infonce", "temperature": 0.05, "learning_rate": 5e-05, "lr_schedule": "cosine_decay", "warmup_ratio": 0.05, "batch_size": 64, "negatives": "in_batch_plus_explicit", "source_stratification": true, "symmetric": true}, "hard_neg_mining": {"duration_minutes": 5, "top_k": 7, "batch_size": 128, "min_similarity": 0.3}, "fine_tuning": {"duration_minutes": 5, "data": "all_curated_with_hard_negs", "loss": "infonce", "temperature": 0.05, "learning_rate": 1e-05, "lr_schedule": "cosine_decay", "warmup_ratio": 0.0, "batch_size": 32, "hard_neg_weight": 1.0}}, "optimizer": {"type": "adamw", "betas": [0.9, 0.999], "eps": 1e-08, "weight_decay": 0.01}, "memory": {"max_peak_gb": 55, "gradient_accumulation_steps": 4}}, "num_params_M": 149.0, "decontam_removed": 0, "wandb_run_id": "pmrbneay"}
{"commit": "e4f9140", "primary_score": 56.3063, "memory_gb": 36.4, "training_min": 80.3, "datasets": ["fancyzhx/dbpedia_14", "sentence-transformers/stackexchange-duplicates", "sentence-transformers/natural-questions", "sentence-transformers/reddit-title-body", "stanfordnlp/snli", "yahoo_answers_topics", "glue", "hotpot_qa", "ms_marco", "ag_news"], "status": "discard", "description": "exp-58: Matryoshka Representation Learning (MRL) - InfoNCE at dims [768,512,256,128,64] averaged; 60-min contrastive; HotpotQA; hypothesis: MRL forces better info packing in early dims; baseline exp-51 primary=56.81", "task_scores": {"sts_bench": 76.87, "sick_r": 71.26, "twitter_url": 77.73, "sprint_dup": 83.57, "20news": 36.53, "reddit_clust": 41.86, "scifact": 48.76, "nfcorpus": 18.7}, "timestamp": "2026-03-15T18:19:07.453965+00:00", "config": {"base_model": "answerdotai/ModernBERT-base", "embedding_dim": 768, "projection_dim": 768, "pooling": "cls", "max_seq_length": 512, "normalize_embeddings": true, "stages": {"warmup": {"duration_minutes": 15, "data": "qqp_se_paraphrase", "loss": "infonce", "temperature": 0.1, "learning_rate": 0.0001, "lr_schedule": "linear_warmup_constant", "warmup_ratio": 0.1, "batch_size": 64, "negatives": "in_batch_only", "freeze_encoder_layers": 0}, "contrastive": {"duration_minutes": 60, "data": "all_curated", "loss": "infonce", "temperature": 0.05, "learning_rate": 5e-05, "lr_schedule": "cosine_decay", "warmup_ratio": 0.05, "batch_size": 64, "negatives": "in_batch_plus_explicit", "source_stratification": true, "matryoshka": true}, "hard_neg_mining": {"duration_minutes": 5, "top_k": 7, "batch_size": 128, "min_similarity": 0.3}, "fine_tuning": {"duration_minutes": 5, "data": "all_curated_with_hard_negs", "loss": "infonce", "temperature": 0.05, "learning_rate": 1e-05, "lr_schedule": "cosine_decay", "warmup_ratio": 0.0, "batch_size": 32, "hard_neg_weight": 1.0}}, "optimizer": {"type": "adamw", "betas": [0.9, 0.999], "eps": 1e-08, "weight_decay": 0.01}, "memory": {"max_peak_gb": 55, "gradient_accumulation_steps": 4}}, "num_params_M": 149.0, "decontam_removed": 0, "wandb_run_id": "c9m9lj2w"}
{"commit": "0adc323", "primary_score": 55.2584, "memory_gb": 37.3, "training_min": 85.3, "datasets": ["yahoo_answers_topics", "glue", "sentence-transformers/stackexchange-duplicates", "stanfordnlp/snli", "hotpot_qa", "sentence-transformers/natural-questions", "ms_marco", "fancyzhx/dbpedia_14", "ag_news", "sentence-transformers/reddit-title-body"], "status": "discard", "description": "exp-59: extend warmup to 20min (was 15min); 60-min contrastive; HotpotQA; hypothesis: more paraphrase warmup fixes SICK-R regression; baseline exp-51 primary=56.81", "task_scores": {"sts_bench": 77.12, "sick_r": 73.84, "twitter_url": 78.13, "sprint_dup": 81.59, "20news": 36.08, "reddit_clust": 39.26, "scifact": 43.43, "nfcorpus": 17.29}, "timestamp": "2026-03-15T20:01:34.097958+00:00", "config": {"base_model": "answerdotai/ModernBERT-base", "embedding_dim": 768, "projection_dim": 768, "pooling": "cls", "max_seq_length": 512, "normalize_embeddings": true, "stages": {"warmup": {"duration_minutes": 20, "data": "qqp_se_paraphrase", "loss": "infonce", "temperature": 0.1, "learning_rate": 0.0001, "lr_schedule": "linear_warmup_constant", "warmup_ratio": 0.1, "batch_size": 64, "negatives": "in_batch_only", "freeze_encoder_layers": 0}, "contrastive": {"duration_minutes": 60, "data": "all_curated", "loss": "infonce", "temperature": 0.05, "learning_rate": 5e-05, "lr_schedule": "cosine_decay", "warmup_ratio": 0.05, "batch_size": 64, "negatives": "in_batch_plus_explicit", "source_stratification": true}, "hard_neg_mining": {"duration_minutes": 5, "top_k": 7, "batch_size": 128, "min_similarity": 0.3}, "fine_tuning": {"duration_minutes": 5, "data": "all_curated_with_hard_negs", "loss": "infonce", "temperature": 0.05, "learning_rate": 1e-05, "lr_schedule": "cosine_decay", "warmup_ratio": 0.0, "batch_size": 32, "hard_neg_weight": 1.0}}, "optimizer": {"type": "adamw", "betas": [0.9, 0.999], "eps": 1e-08, "weight_decay": 0.01}, "memory": {"max_peak_gb": 55, "gradient_accumulation_steps": 4}}, "num_params_M": 149.0, "decontam_removed": 0, "wandb_run_id": "ksvxb6bg"}
