commit	primary_score	memory_gb	training_min	datasets	status	description
6cf8de5	56.71	53.4	261.8	sentence-transformers/natural-questions;glue;stanfordnlp/snli;qiaojin/PubMedQA;sentence-transformers/stackexchange-duplicates;sentence-transformers/reddit-title-body;fancyzhx/dbpedia_14;yahoo_answers_topics;sentence-transformers/s2orc;ag_news;ms_marco;hotpot_qa	discard	exp-131: revert contrastive temp to 0.05 (was 0.03); exp-107 temp=0.05 is actual best at 65.16 vs exp-128 temp=0.03 at 63.53; temp=0.03 improved STS/PairClass (+0.68/+0.95) but hurt Class+Clust+Rerank+Retrieval by -2.86 avg; hard_neg_weight reverted to 0.0 (exp-130 weight=0.5 catastrophic -4.63); exp-107 had LR=5e-5+100K+180min — now testing temp=0.05 with improved LR=3e-5+200K+240min; hypothesis: combining best temperature with best training recipe beats 65.16
c191c7a	57.94	40.9	262.2	sentence-transformers/natural-questions;sentence-transformers/reddit-title-body;qiaojin/PubMedQA;ag_news;sentence-transformers/stackexchange-duplicates;yahoo_answers_topics;sentence-transformers/s2orc;glue;stanfordnlp/snli;ms_marco;fancyzhx/dbpedia_14;hotpot_qa	discard	exp-132: temp=0.05+LR=5e-5+200K+240min — match exp-107 best combo (65.16) with more data and training; exp-107 used temp=0.05+LR=5e-5+100K+180min; exp-131 proved temp=0.05+LR=3e-5 catastrophic (56.71) — LR must match temperature; at temp=0.05 softer gradients need higher LR; exp-105/106 showed 200K regressed at LR=5e-5+temp=0.05 but those were 140-200min — 240min gives enough time; hypothesis: 200K data+240min prevents overfitting while improving diversity coverage beyond exp-107
0179bad	58.57	53.4	261.8	ms_marco;sentence-transformers/reddit-title-body;qiaojin/PubMedQA;sentence-transformers/s2orc;sentence-transformers/natural-questions;ag_news;yahoo_answers_topics;stanfordnlp/snli;glue;sentence-transformers/stackexchange-duplicates;hotpot_qa;fancyzhx/dbpedia_14	discard	exp-133: increase weight_decay to 0.03 (was 0.01); stronger regularization for better generalization; all other settings match exp-128 best (temp=0.03, LR=3e-5, 200K, 240min, B=64, symmetric); standard value in many transformer training recipes is 0.01-0.1; hypothesis: higher weight decay reduces overfitting on large sources and improves OOD generalization
4fba2b4	48.16	39.2	201.8	qiaojin/PubMedQA;stanfordnlp/snli;ms_marco;sentence-transformers/stackexchange-duplicates;yahoo_answers_topics;fancyzhx/dbpedia_14;glue;hotpot_qa;ag_news;sentence-transformers/natural-questions;sentence-transformers/s2orc;sentence-transformers/reddit-title-body	discard	exp-134: gentle LLRD (decay=0.99) on exp-107 best recipe (temp=0.05, LR=5e-5, 100K, 180min); exp-92 LLRD=0.95 was catastrophic (39.21) but 0.99 is much milder — bottom layer gets 0.81x LR vs 0.34x; preserves lower-layer pretrained features while adapting upper layers more aggressively; standard technique in NV-Embed/GTE/Arctic-Embed; all other settings match exp-107 exactly; weight_decay reverted to 0.01 (exp-133 proved 0.03 catastrophic at -4.96); baseline exp-107 primary=65.16; hypothesis: LLRD improves generalization by preventing lower-layer forgetting
eac5e7c	57.98	39.3	201.9	ms_marco;qiaojin/PubMedQA;glue;yahoo_answers_topics;stanfordnlp/snli;hotpot_qa;sentence-transformers/reddit-title-body;sentence-transformers/s2orc;fancyzhx/dbpedia_14;sentence-transformers/natural-questions;ag_news;sentence-transformers/stackexchange-duplicates	discard	exp-135: reproduce exp-107 exactly (temp=0.05, LR=5e-5, 100K, 180min); LLRD reverted to 1.0 (exp-134 LLRD=0.99 was catastrophic at 48.16, -17 from baseline); need to verify exp-107's 65.16 is reproducible and not seed variance; all settings match exp-107 exactly; if confirmed, this becomes the stable foundation for methodology experiments
957b3f6	57.29	37.7	202.0	sentence-transformers/stackexchange-duplicates;sentence-transformers/reddit-title-body;ag_news;qiaojin/PubMedQA;yahoo_answers_topics;hotpot_qa;ms_marco;glue;sentence-transformers/s2orc;fancyzhx/dbpedia_14;stanfordnlp/snli;sentence-transformers/natural-questions	discard	exp-136: re-enable source_stratification=true to match exp-107 exactly; exp-135 showed stratification=false regressed -4.31 (57.98 vs exp-107 corrected 62.29); stratification was the ONLY config difference; exp-129 tested stratification at temp=0.03 recipe and regressed -0.59, but exp-107 best was temp=0.05+stratification=true; all other settings match exp-107/135 (temp=0.05, LR=5e-5, 100K, 180min, weight_decay=0.01, no LLRD); hypothesis: source stratification is critical at temp=0.05 to prevent large-source dominance
5d92069	54.00	38.2	262.3	sentence-transformers/natural-questions;ms_marco;hotpot_qa;sentence-transformers/stackexchange-duplicates;yahoo_answers_topics;sentence-transformers/reddit-title-body;ag_news;sentence-transformers/s2orc;fancyzhx/dbpedia_14;stanfordnlp/snli;qiaojin/PubMedQA;glue	discard	exp-137: cross-dataset MinHash dedup on exp-128 best recipe (temp=0.03+LR=3e-5+200K+240min); dedup removes near-duplicate pairs across 12 sources (Jaccard>0.8 on query+positive); hypothesis: reducing redundancy improves diversity per training step → better generalization; exp-128 baseline primary=63.53 (21-task); all other settings match exp-128 exactly (strat=false in practice, symmetric, B=64, FT temp=0.05, hard_neg_weight=0.0); new code: dedup_triplets_minhash() added to pipeline, controlled by data.cross_dedup config flag
3e3c31a	52.19	38.5	262.0	sentence-transformers/reddit-title-body;sentence-transformers/stackexchange-duplicates;stanfordnlp/snli;ms_marco;hotpot_qa;sentence-transformers/s2orc;sentence-transformers/natural-questions;glue;fancyzhx/dbpedia_14;qiaojin/PubMedQA;yahoo_answers_topics;ag_news	discard	exp-138: reproduce exp-128 on current codebase WITHOUT dedup to isolate regression; exp-137 added cross-dataset dedup and collapsed to 54.0 (-9.5 vs exp-128's 63.53); need to determine if regression is from dedup or from code changes since exp-128 (source-diverse mining pool, stratification code path); all settings match exp-128 exactly (temp=0.03, LR=3e-5, 200K, 240min, strat=false, symmetric, B=64, FT temp=0.05, hard_neg_weight=0.0, WD=0.01); baseline exp-128 primary=63.53
c14e2cc	62.86	38.5	260.5	sentence-transformers/reddit-title-body;glue;ms_marco;yahoo_answers_topics;fancyzhx/dbpedia_14;sentence-transformers/s2orc;ag_news;qiaojin/PubMedQA;sentence-transformers/stackexchange-duplicates;hotpot_qa;stanfordnlp/snli;sentence-transformers/natural-questions	discard	exp-139: revert source-diverse mining pool to triplets[:8000] (matching exp-128 exactly); exp-138 showed -11.3 regression (52.19 vs 63.53) from code drift; the only functional change was mining pool diversification (20K source-balanced vs 8K sequential); even with hard_neg_weight=0.0 the FT stage trains on different subsets; reverting to isolate if this caused AskUbuntuDupQuestions collapse (23→54); all settings match exp-128 (temp=0.03, LR=3e-5, 200K, 240min, no dedup)
76db2c8	15.16	14.4	0.0		discard	exp-140: data scaling 200K→400K (max_rows_per_dataset=400000); exp-139 confirmed mining pool revert recovered 62.86 (vs exp-128's 63.53); program.md says data scaling is highest ROI and explicitly recommends 200K vs 400K vs 800K; 4 datasets (stackexchange, reddit, s2orc, PubMedQA) were hitting 200K cap — scaling to 400K doubles their contribution (~3M total triplets vs 1.5M); more diverse training signal should improve generalization; all other settings match exp-128/139 recipe (temp=0.03, LR=3e-5, 240min, strat=false, symmetric, mining=triplets[:8000], hard_neg_weight=0.0); baseline exp-139 primary=62.86
4c7e2b0	0.00	0.0	0.0		crash	exp-141: RETRY data scaling 200K→400K (max_rows_per_dataset=400000); exp-140 failed (15.16) because empty data was cached — deleted poisoned cache file + added guard to prevent caching empty results; hypothesis same as exp-140: 4 datasets hit 200K cap, scaling to 400K doubles their contribution; all settings match exp-128/139 recipe (temp=0.03, LR=3e-5, 240min, strat=false, symmetric, mining=triplets[:8000], hard_neg_weight=0.0); baseline exp-139 primary=62.86
caf767c	62.77	39.7	260.4	sentence-transformers/s2orc;sentence-transformers/natural-questions;ms_marco;sentence-transformers/reddit-title-body;yahoo_answers_topics;fancyzhx/dbpedia_14;glue;hotpot_qa;sentence-transformers/stackexchange-duplicates;qiaojin/PubMedQA;stanfordnlp/snli;ag_news	discard	exp-143: data scaling 200K→400K (max_rows_per_dataset=400000); RETRY after exp-140/141/142 all failed on infrastructure (offline mode, empty cache); data cache is now populated and verified (2.45M raw triplets from 12 sources); 4 datasets scaled significantly: s2orc 200K→400K, reddit 200K→400K, stackexchange 200K→305K, pubmedqa 200K→211K; all settings match exp-128/139 recipe (temp=0.03, LR=3e-5, 240min, strat=false, symmetric, mining=triplets[:8000], hard_neg_weight=0.0); baseline exp-139 primary=62.86
e9afb53	62.90	40.0	260.4	qiaojin/PubMedQA;ag_news;yahoo_answers_topics;sentence-transformers/reddit-title-body;sentence-transformers/natural-questions;sentence-transformers/stackexchange-duplicates;sentence-transformers/s2orc;ms_marco;glue;hotpot_qa;stanfordnlp/snli;fancyzhx/dbpedia_14	discard	exp-144: latent attention pooling (pooling=latent_attn, K=4 latent queries); NV-Embed-v2 (#1 MTEB) uses this; program.md says it was fixed and ready to re-test; exp-143 showed 400K data scaling didn't help (62.77 vs 62.86 baseline) — model isn't data-limited; trying architecture improvement instead; all other settings match exp-128/139 recipe (temp=0.03, LR=3e-5, 200K, 240min, strat=false, symmetric, mining=triplets[:8000], hard_neg_weight=0.0); baseline exp-139 primary=62.86
503d49d	63.44	53.4	380.4	qiaojin/PubMedQA;fancyzhx/dbpedia_14;ms_marco;glue;hotpot_qa;sentence-transformers/s2orc;ag_news;stanfordnlp/snli;yahoo_answers_topics;sentence-transformers/natural-questions;sentence-transformers/reddit-title-body;sentence-transformers/stackexchange-duplicates	discard	exp-145: longer contrastive 240min→360min; exp-143 (400K data) and exp-144 (latent_attn) both flat vs baseline (~62.8-62.9 vs 62.86); contrastive saturation was only 16% (CLS) / 24% (latent) at 240min end — model wasn't saturated, may benefit from 50% longer training; all other settings match exp-128/139 recipe (CLS pooling, temp=0.03, LR=3e-5, 200K, strat=false, symmetric, mining=triplets[:8000], hard_neg_weight=0.0); baseline exp-139 primary=62.86
28e27a2	63.69	53.4	500.4	ag_news;qiaojin/PubMedQA;sentence-transformers/reddit-title-body;stanfordnlp/snli;sentence-transformers/natural-questions;yahoo_answers_topics;sentence-transformers/s2orc;ms_marco;sentence-transformers/stackexchange-duplicates;hotpot_qa;glue;fancyzhx/dbpedia_14	discard	exp-146: longer contrastive 480min (2x baseline); exp-145 showed 360min=63.44 (+0.58 vs 240min=62.86), still only 32% saturated at end — more training should help; loss was 0.213 and declining at 360min end; all settings match exp-128/139 recipe (CLS pooling, temp=0.03, LR=3e-5, 200K, strat=false, symmetric, mining=triplets[:8000], hard_neg_weight=0.0); baseline exp-139 primary=62.86, exp-128 best=63.53
a62ab5c	63.54	53.3	500.4	sentence-transformers/natural-questions;sentence-transformers/reddit-title-body;sentence-transformers/stackexchange-duplicates;qiaojin/PubMedQA;glue;ag_news;sentence-transformers/s2orc;hotpot_qa;fancyzhx/dbpedia_14;yahoo_answers_topics;ms_marco;stanfordnlp/snli	discard	exp-147: cosine LR with min_lr floor (3e-6 = 10% of base); exp-146 showed 480min=63.69 NEW BEST but cosine decays LR to ~0 in final 20% — model stops learning; min_lr floor keeps LR at 3e-6 so model continues improving through end; all other settings match exp-146 (480min, CLS, temp=0.03, LR=3e-5, 200K, strat=false, symmetric); baseline exp-146=63.69
8b483bf	62.60	53.4	500.3	sentence-transformers/natural-questions;ag_news;hotpot_qa;stanfordnlp/snli;sentence-transformers/s2orc;yahoo_answers_topics;ms_marco;glue;qiaojin/PubMedQA;fancyzhx/dbpedia_14;sentence-transformers/reddit-title-body;sentence-transformers/stackexchange-duplicates	discard	exp-148: sharper temperature 0.02 (was 0.03); exp-147 min_lr floor was flat (63.54 vs 63.69); temp=0.03 was optimized at 240min but 480min model may benefit from sharper contrastive signal — lower temp makes similarity matrix more peaked, forcing harder discrimination; LR stays at 3e-5 to isolate temp effect; all other settings match exp-146 best (480min, CLS, LR=3e-5, 200K, strat=false, symmetric); baseline exp-146=63.69
51c9cb1	59.46	53.4	495.6	sentence-transformers/s2orc;hotpot_qa;stanfordnlp/snli;ag_news;sentence-transformers/natural-questions;fancyzhx/dbpedia_14;qiaojin/PubMedQA;yahoo_answers_topics;glue;ms_marco;sentence-transformers/reddit-title-body;sentence-transformers/stackexchange-duplicates	discard	exp-149: skip FT stage (duration=0); FT with hard_neg_weight=0.0 is just contrastive at suboptimal hyperparams (temp=0.05 vs 0.03, LR=1e-5 vs 3e-5); may be shifting model away from optimal endpoint; all other settings match exp-146 best (480min contrastive, temp=0.03, LR=3e-5, CLS, 200K, strat=false, symmetric); baseline exp-146=63.69
b6bf217	0.00	0.0	0.0		crash	exp-150: FT temp=0.03 (was 0.05); exp-149 proved FT is essential (-4.23 without it); matching contrastive temp through FT for consistency; exp-114 showed FT temp=0.03 hurt retrieval at weaker baseline but 480min foundation may handle it; all other settings match exp-146 best (480min contrastive, temp=0.03, LR=3e-5, CLS, 200K, FT=60min LR=1e-5); baseline exp-146=63.69
