{"commit": "eba94d4", "primary_score": 62.2547, "memory_gb": 38.1, "training_min": 200.7, "datasets": ["sentence-transformers/reddit-title-body", "yahoo_answers_topics", "ms_marco", "fancyzhx/dbpedia_14", "ag_news", "qiaojin/PubMedQA", "sentence-transformers/natural-questions", "glue", "hotpot_qa", "sentence-transformers/s2orc", "stanfordnlp/snli", "sentence-transformers/stackexchange-duplicates"], "status": "discard", "description": "exp-114: align fine-tuning temperature to 0.03 (matching contrastive); was 0.05 creating a distribution mismatch between stages — model trains at sharp 0.03 distribution then fine-tunes at softer 0.05; revert AllNLI→SNLI (exp-113 showed AllNLI hurt retrieval -2.92); same 12 datasets, 180min contrastive, CLS pooling; baseline exp-111 primary=62.41; hypothesis: consistent temperature across stages prevents fine-tuning from undoing contrastive gains", "task_scores": {"sts_bench": 80.55, "sick_r": 76.41, "twitter_url": 82.36, "sprint_dup": 84.59}, "timestamp": "2026-03-22T01:07:41.244111+00:00", "config": {"base_model": "answerdotai/ModernBERT-base", "projection_dim": 768, "pooling": "cls", "max_seq_length": 256, "normalize_embeddings": true, "simclr_head": false, "stages": {"warmup": {"duration_minutes": 15, "data": "qqp_se_paraphrase", "loss": "infonce", "temperature": 0.1, "learning_rate": 0.0001, "lr_schedule": "linear_warmup_constant", "warmup_ratio": 0.1, "batch_size": 64, "negatives": "in_batch_only", "freeze_encoder_layers": 0, "false_neg_threshold": 0.0}, "contrastive": {"duration_minutes": 180, "data": "all_curated", "loss": "infonce", "temperature": 0.03, "temperature_end": 0.0, "learning_rate": 5e-05, "lr_schedule": "cosine_decay", "warmup_ratio": 0.05, "batch_size": 64, "negatives": "in_batch_plus_explicit", "source_stratification": true, "symmetric": true, "false_neg_threshold": 0.0}, "hard_neg_mining": {"duration_minutes": 5, "top_k": 7, "batch_size": 128, "min_similarity": 0.3}, "fine_tuning": {"duration_minutes": 5, "data": "all_curated_with_hard_negs", "loss": "infonce", "temperature": 0.03, "learning_rate": 1e-05, "lr_schedule": "cosine_decay", "warmup_ratio": 0.0, "batch_size": 64, "hard_neg_weight": 0.0, "false_neg_threshold": 0.0}}, "optimizer": {"type": "adamw", "betas": [0.9, 0.999], "eps": 1e-08, "weight_decay": 0.01, "llrd_decay": 1.0, "ema_decay": 0.0}, "data": {"max_rows_per_dataset": 100000}, "memory": {"max_peak_gb": 55, "gradient_accumulation_steps": 1, "gradient_checkpointing": false}}, "num_params_M": 149.0, "decontam_removed": 0, "wandb_run_id": "27e6qoeo"}
{"commit": "c739324", "primary_score": 0.0, "memory_gb": 0.0, "training_min": 0.0, "datasets": [], "status": "crash", "description": "exp-115: double warmup duration to 30min (was 15); longer warmup gives model more time to build initial representations with easy paraphrase data before the harder contrastive stage; all other settings match exp-111 best config (temp=0.03, CLS, 180min contrastive, FT temp=0.05, 12 datasets); baseline exp-111 primary=62.41; hypothesis: better initialization from longer warmup improves all downstream categories", "task_scores": {}, "timestamp": "2026-03-22T01:13:19.658349+00:00", "config": {"base_model": "answerdotai/ModernBERT-base", "projection_dim": 768, "pooling": "cls", "max_seq_length": 256, "normalize_embeddings": true, "simclr_head": false, "stages": {"warmup": {"duration_minutes": 30, "data": "qqp_se_paraphrase", "loss": "infonce", "temperature": 0.1, "learning_rate": 0.0001, "lr_schedule": "linear_warmup_constant", "warmup_ratio": 0.1, "batch_size": 64, "negatives": "in_batch_only", "freeze_encoder_layers": 0, "false_neg_threshold": 0.0}, "contrastive": {"duration_minutes": 180, "data": "all_curated", "loss": "infonce", "temperature": 0.03, "temperature_end": 0.0, "learning_rate": 5e-05, "lr_schedule": "cosine_decay", "warmup_ratio": 0.05, "batch_size": 64, "negatives": "in_batch_plus_explicit", "source_stratification": true, "symmetric": true, "false_neg_threshold": 0.0}, "hard_neg_mining": {"duration_minutes": 5, "top_k": 7, "batch_size": 128, "min_similarity": 0.3}, "fine_tuning": {"duration_minutes": 5, "data": "all_curated_with_hard_negs", "loss": "infonce", "temperature": 0.05, "learning_rate": 1e-05, "lr_schedule": "cosine_decay", "warmup_ratio": 0.0, "batch_size": 64, "hard_neg_weight": 0.0, "false_neg_threshold": 0.0}}, "optimizer": {"type": "adamw", "betas": [0.9, 0.999], "eps": 1e-08, "weight_decay": 0.01, "llrd_decay": 1.0, "ema_decay": 0.0}, "data": {"max_rows_per_dataset": 100000}, "memory": {"max_peak_gb": 55, "gradient_accumulation_steps": 1, "gradient_checkpointing": false}}, "num_params_M": null, "decontam_removed": 0}
{"commit": "069179b", "primary_score": 0.0, "memory_gb": 0.0, "training_min": 0.0, "datasets": [], "status": "crash", "description": "exp-115: retry — double warmup duration to 30min (was 15); previous run failed on network proxy error during model download; longer warmup gives model more time to build initial representations with easy paraphrase data before harder contrastive stage; all settings match exp-111 best config (temp=0.03, CLS, 180min contrastive, FT temp=0.05, 12 datasets); baseline exp-111 primary=62.41; hypothesis: better initialization from longer warmup improves all downstream categories", "task_scores": {}, "timestamp": "2026-03-22T01:14:25.267851+00:00", "config": {"base_model": "answerdotai/ModernBERT-base", "projection_dim": 768, "pooling": "cls", "max_seq_length": 256, "normalize_embeddings": true, "simclr_head": false, "stages": {"warmup": {"duration_minutes": 30, "data": "qqp_se_paraphrase", "loss": "infonce", "temperature": 0.1, "learning_rate": 0.0001, "lr_schedule": "linear_warmup_constant", "warmup_ratio": 0.1, "batch_size": 64, "negatives": "in_batch_only", "freeze_encoder_layers": 0, "false_neg_threshold": 0.0}, "contrastive": {"duration_minutes": 180, "data": "all_curated", "loss": "infonce", "temperature": 0.03, "temperature_end": 0.0, "learning_rate": 5e-05, "lr_schedule": "cosine_decay", "warmup_ratio": 0.05, "batch_size": 64, "negatives": "in_batch_plus_explicit", "source_stratification": true, "symmetric": true, "false_neg_threshold": 0.0}, "hard_neg_mining": {"duration_minutes": 5, "top_k": 7, "batch_size": 128, "min_similarity": 0.3}, "fine_tuning": {"duration_minutes": 5, "data": "all_curated_with_hard_negs", "loss": "infonce", "temperature": 0.05, "learning_rate": 1e-05, "lr_schedule": "cosine_decay", "warmup_ratio": 0.0, "batch_size": 64, "hard_neg_weight": 0.0, "false_neg_threshold": 0.0}}, "optimizer": {"type": "adamw", "betas": [0.9, 0.999], "eps": 1e-08, "weight_decay": 0.01, "llrd_decay": 1.0, "ema_decay": 0.0}, "data": {"max_rows_per_dataset": 100000}, "memory": {"max_peak_gb": 55, "gradient_accumulation_steps": 1, "gradient_checkpointing": false}}, "num_params_M": null, "decontam_removed": 0}
{"commit": "2adc5a0", "primary_score": 57.5347, "memory_gb": 39.0, "training_min": 215.8, "datasets": ["stanfordnlp/snli", "fancyzhx/dbpedia_14", "ag_news", "sentence-transformers/natural-questions", "sentence-transformers/reddit-title-body", "hotpot_qa", "sentence-transformers/s2orc", "glue", "sentence-transformers/stackexchange-duplicates", "ms_marco", "qiaojin/PubMedQA", "yahoo_answers_topics"], "status": "discard", "description": "exp-115: retry2 — double warmup to 30min (was 15); fix HF offline mode for proxy errors; longer warmup gives more time to build initial representations before harder contrastive; all settings match exp-111 best config (temp=0.03, CLS, 180min contrastive, FT temp=0.05, 12 datasets); baseline exp-111 primary=62.41; hypothesis: better initialization from longer warmup improves all categories", "task_scores": {"sts_bench": 78.0, "sick_r": 72.35, "twitter_url": 79.6, "sprint_dup": 85.82}, "timestamp": "2026-03-22T05:09:46.628845+00:00", "config": {"base_model": "answerdotai/ModernBERT-base", "projection_dim": 768, "pooling": "cls", "max_seq_length": 256, "normalize_embeddings": true, "simclr_head": false, "stages": {"warmup": {"duration_minutes": 30, "data": "qqp_se_paraphrase", "loss": "infonce", "temperature": 0.1, "learning_rate": 0.0001, "lr_schedule": "linear_warmup_constant", "warmup_ratio": 0.1, "batch_size": 64, "negatives": "in_batch_only", "freeze_encoder_layers": 0, "false_neg_threshold": 0.0}, "contrastive": {"duration_minutes": 180, "data": "all_curated", "loss": "infonce", "temperature": 0.03, "temperature_end": 0.0, "learning_rate": 5e-05, "lr_schedule": "cosine_decay", "warmup_ratio": 0.05, "batch_size": 64, "negatives": "in_batch_plus_explicit", "source_stratification": true, "symmetric": true, "false_neg_threshold": 0.0}, "hard_neg_mining": {"duration_minutes": 5, "top_k": 7, "batch_size": 128, "min_similarity": 0.3}, "fine_tuning": {"duration_minutes": 5, "data": "all_curated_with_hard_negs", "loss": "infonce", "temperature": 0.05, "learning_rate": 1e-05, "lr_schedule": "cosine_decay", "warmup_ratio": 0.0, "batch_size": 64, "hard_neg_weight": 0.0, "false_neg_threshold": 0.0}}, "optimizer": {"type": "adamw", "betas": [0.9, 0.999], "eps": 1e-08, "weight_decay": 0.01, "llrd_decay": 1.0, "ema_decay": 0.0}, "data": {"max_rows_per_dataset": 100000}, "memory": {"max_peak_gb": 55, "gradient_accumulation_steps": 1, "gradient_checkpointing": false}}, "num_params_M": 149.0, "decontam_removed": 0, "wandb_run_id": "n9bzqu25"}
{"commit": "4c976b5", "primary_score": 0.0, "memory_gb": 38.7, "training_min": 200.4, "datasets": ["glue", "yahoo_answers_topics", "sentence-transformers/natural-questions", "stanfordnlp/snli", "hotpot_qa", "sentence-transformers/s2orc", "sentence-transformers/reddit-title-body", "ms_marco", "fancyzhx/dbpedia_14", "qiaojin/PubMedQA", "sentence-transformers/stackexchange-duplicates", "ag_news"], "status": "discard", "description": "exp-117: enable EMA (decay=0.999) + swap EMA weights before save/eval; EMA averages weights across training steps reducing noise for better generalization; literature suggests +0.5-1.0 free points; code already does mx.eval every step (NaN was from attention masks, not EMA); added weight swap before checkpoint save and eval; all other settings match exp-111 best config (temp=0.03, CLS, 180min contrastive, LR=5e-5, FT temp=0.05, 12 datasets); baseline exp-111 primary=62.41 (4-task); hypothesis: EMA smoothing improves all categories, especially retrieval where noise hurts discrimination", "task_scores": {}, "timestamp": "2026-04-07T19:56:51.313056+00:00", "config": {"base_model": "answerdotai/ModernBERT-base", "projection_dim": 768, "pooling": "cls", "max_seq_length": 256, "normalize_embeddings": true, "simclr_head": false, "stages": {"warmup": {"duration_minutes": 15, "data": "qqp_se_paraphrase", "loss": "infonce", "temperature": 0.1, "learning_rate": 0.0001, "lr_schedule": "linear_warmup_constant", "warmup_ratio": 0.1, "batch_size": 64, "negatives": "in_batch_only", "freeze_encoder_layers": 0, "false_neg_threshold": 0.0}, "contrastive": {"duration_minutes": 180, "data": "all_curated", "loss": "infonce", "temperature": 0.03, "temperature_end": 0.0, "learning_rate": 5e-05, "lr_schedule": "cosine_decay", "warmup_ratio": 0.05, "batch_size": 64, "negatives": "in_batch_plus_explicit", "source_stratification": true, "symmetric": true, "false_neg_threshold": 0.0}, "hard_neg_mining": {"duration_minutes": 5, "top_k": 7, "batch_size": 128, "min_similarity": 0.3}, "fine_tuning": {"duration_minutes": 5, "data": "all_curated_with_hard_negs", "loss": "infonce", "temperature": 0.05, "learning_rate": 1e-05, "lr_schedule": "cosine_decay", "warmup_ratio": 0.0, "batch_size": 64, "hard_neg_weight": 0.0, "false_neg_threshold": 0.0}}, "optimizer": {"type": "adamw", "betas": [0.9, 0.999], "eps": 1e-08, "weight_decay": 0.01, "llrd_decay": 1.0, "ema_decay": 0.999}, "data": {"max_rows_per_dataset": 100000}, "memory": {"max_peak_gb": 55, "gradient_accumulation_steps": 1, "gradient_checkpointing": false}}, "num_params_M": 149.0, "decontam_removed": 0, "wandb_run_id": "9rjci9ak"}
{"commit": "ee3e558", "primary_score": 0.0, "memory_gb": 1.1, "training_min": 0.0, "datasets": ["sentence-transformers/reddit-title-body", "glue", "sentence-transformers/natural-questions", "ms_marco", "hotpot_qa", "yahoo_answers_topics", "ag_news", "fancyzhx/dbpedia_14", "sentence-transformers/s2orc", "stanfordnlp/snli", "qiaojin/PubMedQA", "sentence-transformers/stackexchange-duplicates"], "status": "discard", "description": "exp-117: retry — fix HF_HUB_OFFLINE blocking eval; re-eval existing EMA checkpoint (training completed, all sources healthy, 14% saturation); EMA decay=0.999 + weight swap before save/eval; all settings match exp-111 (temp=0.03, CLS, 180min, LR=5e-5, 12 datasets); baseline exp-111 primary=62.41 (4-task)", "task_scores": {}, "timestamp": "2026-04-07T20:03:53.415619+00:00", "config": {"base_model": "answerdotai/ModernBERT-base", "projection_dim": 768, "pooling": "cls", "max_seq_length": 256, "normalize_embeddings": true, "simclr_head": false, "stages": {"warmup": {"duration_minutes": 15, "data": "qqp_se_paraphrase", "loss": "infonce", "temperature": 0.1, "learning_rate": 0.0001, "lr_schedule": "linear_warmup_constant", "warmup_ratio": 0.1, "batch_size": 64, "negatives": "in_batch_only", "freeze_encoder_layers": 0, "false_neg_threshold": 0.0}, "contrastive": {"duration_minutes": 180, "data": "all_curated", "loss": "infonce", "temperature": 0.03, "temperature_end": 0.0, "learning_rate": 5e-05, "lr_schedule": "cosine_decay", "warmup_ratio": 0.05, "batch_size": 64, "negatives": "in_batch_plus_explicit", "source_stratification": true, "symmetric": true, "false_neg_threshold": 0.0}, "hard_neg_mining": {"duration_minutes": 5, "top_k": 7, "batch_size": 128, "min_similarity": 0.3}, "fine_tuning": {"duration_minutes": 5, "data": "all_curated_with_hard_negs", "loss": "infonce", "temperature": 0.05, "learning_rate": 1e-05, "lr_schedule": "cosine_decay", "warmup_ratio": 0.0, "batch_size": 64, "hard_neg_weight": 0.0, "false_neg_threshold": 0.0}}, "optimizer": {"type": "adamw", "betas": [0.9, 0.999], "eps": 1e-08, "weight_decay": 0.01, "llrd_decay": 1.0, "ema_decay": 0.999}, "data": {"max_rows_per_dataset": 100000}, "memory": {"max_peak_gb": 55, "gradient_accumulation_steps": 1, "gradient_checkpointing": false}}, "num_params_M": 149.0, "decontam_removed": 0, "wandb_run_id": "dceam1ql"}
{"commit": "7412dc1", "primary_score": 21.5575, "memory_gb": 15.0, "training_min": 0.0, "datasets": ["sentence-transformers/s2orc", "stanfordnlp/snli", "ag_news", "glue", "ms_marco", "yahoo_answers_topics", "hotpot_qa", "fancyzhx/dbpedia_14", "sentence-transformers/natural-questions", "sentence-transformers/reddit-title-body", "qiaojin/PubMedQA", "sentence-transformers/stackexchange-duplicates"], "status": "discard", "description": "exp-117: retry2 — fix HF offline module reload for eval; re-eval EMA checkpoint; EMA decay=0.999 + weight swap; settings match exp-111 (temp=0.03, CLS, 180min, LR=5e-5, 12 datasets); baseline exp-111 primary=62.41 (4-task)", "task_scores": {"sts_bench": 15.2, "sick_r": 23.15, "twitter_url": 44.57, "sprint_dup": 2.45}, "timestamp": "2026-04-07T20:33:54.705761+00:00", "config": {"base_model": "answerdotai/ModernBERT-base", "projection_dim": 768, "pooling": "cls", "max_seq_length": 256, "normalize_embeddings": true, "simclr_head": false, "stages": {"warmup": {"duration_minutes": 15, "data": "qqp_se_paraphrase", "loss": "infonce", "temperature": 0.1, "learning_rate": 0.0001, "lr_schedule": "linear_warmup_constant", "warmup_ratio": 0.1, "batch_size": 64, "negatives": "in_batch_only", "freeze_encoder_layers": 0, "false_neg_threshold": 0.0}, "contrastive": {"duration_minutes": 180, "data": "all_curated", "loss": "infonce", "temperature": 0.03, "temperature_end": 0.0, "learning_rate": 5e-05, "lr_schedule": "cosine_decay", "warmup_ratio": 0.05, "batch_size": 64, "negatives": "in_batch_plus_explicit", "source_stratification": true, "symmetric": true, "false_neg_threshold": 0.0}, "hard_neg_mining": {"duration_minutes": 5, "top_k": 7, "batch_size": 128, "min_similarity": 0.3}, "fine_tuning": {"duration_minutes": 5, "data": "all_curated_with_hard_negs", "loss": "infonce", "temperature": 0.05, "learning_rate": 1e-05, "lr_schedule": "cosine_decay", "warmup_ratio": 0.0, "batch_size": 64, "hard_neg_weight": 0.0, "false_neg_threshold": 0.0}}, "optimizer": {"type": "adamw", "betas": [0.9, 0.999], "eps": 1e-08, "weight_decay": 0.01, "llrd_decay": 1.0, "ema_decay": 0.999}, "data": {"max_rows_per_dataset": 100000}, "memory": {"max_peak_gb": 55, "gradient_accumulation_steps": 1, "gradient_checkpointing": false}}, "num_params_M": 149.0, "decontam_removed": 0, "wandb_run_id": "7ovreodo"}
{"commit": "d43f6a4", "primary_score": 62.3363, "memory_gb": 15.0, "training_min": 0.0, "datasets": ["yahoo_answers_topics", "fancyzhx/dbpedia_14", "ms_marco", "sentence-transformers/s2orc", "sentence-transformers/natural-questions", "ag_news", "hotpot_qa", "stanfordnlp/snli", "qiaojin/PubMedQA", "sentence-transformers/reddit-title-body", "glue", "sentence-transformers/stackexchange-duplicates"], "status": "discard", "description": "exp-117: retry3 — eval non-EMA trained weights from finetune checkpoint; fix HF offline + skip EMA swap on resume; this gives baseline score for comparison with full EMA run; settings match exp-111 (temp=0.03, CLS, 180min, LR=5e-5, 12 datasets); baseline exp-111 primary=62.41 (4-task)", "task_scores": {"sts_bench": 78.77, "sick_r": 74.56, "twitter_url": 80.59, "sprint_dup": 85.52}, "timestamp": "2026-04-07T21:05:34.967701+00:00", "config": {"base_model": "answerdotai/ModernBERT-base", "projection_dim": 768, "pooling": "cls", "max_seq_length": 256, "normalize_embeddings": true, "simclr_head": false, "stages": {"warmup": {"duration_minutes": 15, "data": "qqp_se_paraphrase", "loss": "infonce", "temperature": 0.1, "learning_rate": 0.0001, "lr_schedule": "linear_warmup_constant", "warmup_ratio": 0.1, "batch_size": 64, "negatives": "in_batch_only", "freeze_encoder_layers": 0, "false_neg_threshold": 0.0}, "contrastive": {"duration_minutes": 180, "data": "all_curated", "loss": "infonce", "temperature": 0.03, "temperature_end": 0.0, "learning_rate": 5e-05, "lr_schedule": "cosine_decay", "warmup_ratio": 0.05, "batch_size": 64, "negatives": "in_batch_plus_explicit", "source_stratification": true, "symmetric": true, "false_neg_threshold": 0.0}, "hard_neg_mining": {"duration_minutes": 5, "top_k": 7, "batch_size": 128, "min_similarity": 0.3}, "fine_tuning": {"duration_minutes": 5, "data": "all_curated_with_hard_negs", "loss": "infonce", "temperature": 0.05, "learning_rate": 1e-05, "lr_schedule": "cosine_decay", "warmup_ratio": 0.0, "batch_size": 64, "hard_neg_weight": 0.0, "false_neg_threshold": 0.0}}, "optimizer": {"type": "adamw", "betas": [0.9, 0.999], "eps": 1e-08, "weight_decay": 0.01, "llrd_decay": 1.0, "ema_decay": 0.999}, "data": {"max_rows_per_dataset": 100000}, "memory": {"max_peak_gb": 55, "gradient_accumulation_steps": 1, "gradient_checkpointing": false}}, "num_params_M": 149.0, "decontam_removed": 0, "wandb_run_id": "tft1u8z5"}
{"commit": "c489afc", "primary_score": 61.6581, "memory_gb": 38.1, "training_min": 261.2, "datasets": ["qiaojin/PubMedQA", "stanfordnlp/snli", "ag_news", "sentence-transformers/stackexchange-duplicates", "ms_marco", "sentence-transformers/reddit-title-body", "sentence-transformers/natural-questions", "hotpot_qa", "fancyzhx/dbpedia_14", "sentence-transformers/s2orc", "yahoo_answers_topics", "glue"], "status": "discard", "description": "exp-118: extend contrastive to 240min (was 180); at 180min only 14% saturated with 855K pairs seen 0.22x each — clearly undertrained; 240min gives 33% more training with same data/config; all sources healthy at 180min (max PubMedQA 21% sat); expect retrieval and clustering improvements from longer training; all other settings match exp-117 baseline (temp=0.03, CLS, LR=5e-5, FT temp=0.05, 12 datasets); baseline exp-117 primary=62.34 (21-task); hypothesis: longer contrastive improves retrieval avg from 48.26 and cluster from 37.90", "task_scores": {"sts_bench": 78.7, "sick_r": 73.18, "twitter_url": 81.07, "sprint_dup": 81.94}, "timestamp": "2026-04-08T02:01:29.235361+00:00", "config": {"base_model": "answerdotai/ModernBERT-base", "projection_dim": 768, "pooling": "cls", "max_seq_length": 256, "normalize_embeddings": true, "simclr_head": false, "stages": {"warmup": {"duration_minutes": 15, "data": "qqp_se_paraphrase", "loss": "infonce", "temperature": 0.1, "learning_rate": 0.0001, "lr_schedule": "linear_warmup_constant", "warmup_ratio": 0.1, "batch_size": 64, "negatives": "in_batch_only", "freeze_encoder_layers": 0, "false_neg_threshold": 0.0}, "contrastive": {"duration_minutes": 240, "data": "all_curated", "loss": "infonce", "temperature": 0.03, "temperature_end": 0.0, "learning_rate": 5e-05, "lr_schedule": "cosine_decay", "warmup_ratio": 0.05, "batch_size": 64, "negatives": "in_batch_plus_explicit", "source_stratification": true, "symmetric": true, "false_neg_threshold": 0.0}, "hard_neg_mining": {"duration_minutes": 5, "top_k": 7, "batch_size": 128, "min_similarity": 0.3}, "fine_tuning": {"duration_minutes": 5, "data": "all_curated_with_hard_negs", "loss": "infonce", "temperature": 0.05, "learning_rate": 1e-05, "lr_schedule": "cosine_decay", "warmup_ratio": 0.0, "batch_size": 64, "hard_neg_weight": 0.0, "false_neg_threshold": 0.0}}, "optimizer": {"type": "adamw", "betas": [0.9, 0.999], "eps": 1e-08, "weight_decay": 0.01, "llrd_decay": 1.0, "ema_decay": 0.0}, "data": {"max_rows_per_dataset": 100000}, "memory": {"max_peak_gb": 55, "gradient_accumulation_steps": 1, "gradient_checkpointing": false}}, "num_params_M": 149.0, "decontam_removed": 0, "wandb_run_id": "xxdtkd95"}
